bill_id,date,chamber,sequence,action
1914825,2025-01-13,House,1,"Resolution filed, laid over under Rule 25. H.J. 10."
1914825,2025-01-13,House,2,"Asked and received unanimous consent for immediate consideration. H.J. 10."
1914825,2025-01-13,House,3,"Resolution adopted. H.J. 11."
1914825,2025-01-13,House,4,"Immediate message. H.J. 12."
1914825,2025-01-13,Senate,5,"Message from House. S.J. 14."
1914825,2025-01-13,Senate,6,"Read first time, placed on calendar. S.J. 14."
1914825,2025-01-13,Senate,7,"Resolution adopted. S.J. 14."
1914825,2025-01-13,Senate,8,"Immediate message. S.J. 15."
1914825,2025-01-13,House,9,"Message from Senate. H.J. 17."
1914891,2025-01-13,House,1,"Resolution filed, laid over under Rule 25. H.J. 14."
1914891,2025-01-13,House,2,"Asked and received unanimous consent for immediate consideration. H.J. 14."
1914891,2025-01-13,House,3,"Resolution adopted. H.J. 14."
1914962,2025-01-13,House,1,"Resolution filed, laid over under Rule 25. H.J. 14."
1914962,2025-01-13,House,2,"Asked and received unanimous consent for immediate consideration. H.J. 14."
1914962,2025-01-13,House,3,"Resolution adopted. H.J. 14."
1915030,2025-01-13,House,1,"Resolution filed, laid over under Rule 25. H.J. 11."
1915030,2025-01-13,House,2,"Asked and received unanimous consent for immediate consideration. H.J. 11."
1915030,2025-01-13,House,3,"Resolution adopted. H.J. 11."
1915030,2025-01-13,House,4,"Immediate message. H.J. 12."
1915030,2025-01-13,Senate,5,"Message from House. S.J. 14."
1915030,2025-01-13,Senate,6,"Read first time, placed on calendar. S.J. 14."
1915030,2025-01-13,Senate,7,"Resolution adopted. S.J. 15."
1915030,2025-01-13,Senate,8,"Immediate message. S.J. 15."
1915030,2025-01-13,House,9,"Message from Senate. H.J. 17."
1915261,2025-01-13,Senate,1,"Introduced, referred to Transportation. S.J. 35."
1915261,2025-01-14,Senate,2,"Subcommittee: Shipley, Pike, and Winckler. S.J. 71."
1915261,2025-01-16,Senate,3,"Subcommittee Meeting: 01/22/2025 2:10PM Room 217 Conference Room."
1915261,2025-01-22,Senate,4,"Subcommittee recommends indefinite postponement. []."
1915577,2025-01-13,House,1,"Resolution filed, laid over under Rule 25. H.J. 11."
1915577,2025-01-13,House,2,"Asked and received unanimous consent for immediate consideration. H.J. 11."
1915577,2025-01-13,House,3,"Resolution adopted. H.J. 12."
1915577,2025-01-13,House,4,"Immediate message. H.J. 12."
1915577,2025-01-13,Senate,5,"Message from House. S.J. 14."
1915577,2025-01-13,Senate,6,"Read first time, placed on calendar. S.J. 14."
1915577,2025-01-13,Senate,7,"Resolution adopted. S.J. 15."
1915577,2025-01-13,Senate,8,"Immediate message. S.J. 15."
1915577,2025-01-13,House,9,"Message from Senate. H.J. 17."
1915951,2025-01-13,Senate,1,"Introduced, referred to Education. S.J. 37."
1915951,2025-01-27,Senate,2,"Subcommittee: Taylor, Garrett, and Winckler. S.J. 142."
1915951,2025-02-03,Senate,3,"Subcommittee Meeting: 02/06/2025 12:00PM Room 217 Conference Room."
1915951,2025-02-06,Senate,4,"Subcommittee recommends amendment and passage."
1915951,2025-02-12,Senate,5,"Committee report approving bill, renumbered as SF 288. S.J. 258."
1916002,2025-01-13,Senate,1,"Introduced, referred to State Government. S.J. 35."
1916002,2025-01-16,Senate,2,"Subcommittee: Alons, Campbell, and Staed. S.J. 107."
1916002,2025-01-22,Senate,3,"Subcommittee Meeting: 01/23/2025 9:30AM Room 217 Conference Room."
1916002,2025-01-23,Senate,4,"Subcommittee recommends passage."
1916051,2025-01-13,Senate,1,"Introduced, referred to Judiciary. S.J. 35."
1916051,2025-01-14,Senate,2,"Subcommittee: Schultz, Bousselot, and Petersen. S.J. 71."
1916102,2025-01-13,Senate,1,"Introduced, referred to Agriculture. S.J. 36."
1916102,2025-01-15,Senate,2,"Subcommittee: Green, Knox, and Sires. S.J. 90."
1916102,2025-01-23,Senate,3,"Subcommittee Meeting: 01/28/2025 10:00AM Room 217 Conference Room."
1916102,2025-01-28,Senate,4,"Subcommittee recommends amendment and passage."
1916151,2025-01-13,Senate,1,"Introduced, referred to Health and Human Services. S.J. 35."
1916151,2025-01-16,Senate,2,"Subcommittee: Guth, Donahue, and Pike. S.J. 107."
1916151,2025-01-20,Senate,3,"Subcommittee Meeting: 01/22/2025 12:30PM Senate Lounge."
1916151,2025-01-22,Senate,4,"Subcommittee recommends passage."
1916151,2025-03-06,Senate,5,"Committee report, recommending passage. S.J. 435."
1916151,2025-03-06,Senate,6,"Placed on calendar."
1916151,2025-03-10,Senate,7,"Attached to HF 299. S.J. 457."
1916151,2025-04-03,Senate,8,"Placed on calendar under unfinished business. S.J. 688."
1916151,2025-04-29,Senate,9,"HF 299 substituted. S.J. 920."
1916151,2025-04-29,Senate,10,"Withdrawn. S.J. 921."
1916200,2025-01-13,Senate,1,"Introduced, referred to Transportation. S.J. 36."
1916200,2025-01-14,Senate,2,"Subcommittee: Lofgren, Bisignano, and Shipley. S.J. 71."
1916200,2025-01-14,Senate,3,"Subcommittee Meeting: 01/15/2025 8:30AM Senate Lounge."
1916200,2025-01-15,Senate,4,"Subcommittee recommends indefinite postponement. []."
1916256,2025-01-13,Senate,1,"Introduced, referred to Judiciary. S.J. 35."
1916256,2025-01-14,Senate,2,"Subcommittee: Green, Blake, and Taylor. S.J. 71."
1916256,2025-01-16,Senate,3,"Subcommittee Meeting: 01/22/2025 2:45PM Room 217 Conference Room."
1916256,2025-01-22,Senate,4,"Subcommittee recommends amendment and passage."
1916256,2025-02-12,Senate,5,"Committee report approving bill, renumbered as SF 289. S.J. 260."
1916305,2025-01-13,Senate,1,"Introduced, referred to Education. S.J. 36."
1916305,2025-01-27,Senate,2,"Subcommittee: Green, Donahue, and Pike. S.J. 142."
1916305,2025-01-28,Senate,3,"Subcommittee Meeting: 01/30/2025 11:00AM Room 315."
1916305,2025-01-30,Senate,4,"Subcommittee recommends passage."
1916305,2025-02-27,Senate,5,"Committee report, recommending passage. S.J. 383."
1916305,2025-02-25,Senate,6,"Placed on calendar."
1916305,2025-06-16,Senate,7,"Referred to Education. S.J. 1057."
1916354,2025-01-13,Senate,1,"Introduced, referred to Education. S.J. 37."
1916354,2025-01-28,Senate,2,"Subcommittee: Taylor, Gruenhagen, and Quirmbach. S.J. 151."
1916354,2025-02-04,Senate,3,"Subcommittee Meeting: 02/06/2025 10:30AM Room 217 Conference Room."
1916354,2025-02-06,Senate,4,"Subcommittee recommends passage."
1916354,2025-02-12,Senate,5,"Committee report approving bill, renumbered as SF 283. S.J. 257."
1916403,2025-01-13,Senate,1,"Introduced, referred to Local Government. S.J. 35."
1916403,2025-01-14,Senate,2,"Subcommittee: Taylor, Lofgren, and Quirmbach. S.J. 71."
1916403,2025-01-17,Senate,3,"Subcommittee Meeting: 01/22/2025 11:00AM Senate Lounge."
1916403,2025-01-22,Senate,4,"Subcommittee recommends passage."
1916454,2025-01-13,Senate,1,"Introduced, referred to State Government. S.J. 37."
1916454,2025-01-16,Senate,2,"Subcommittee: Webster, Blake, and Driscoll. S.J. 107."
1916454,2025-02-04,Senate,3,"Subcommittee Meeting: 02/06/2025 9:30AM Room 217 Conference Room."
1916454,2025-02-06,Senate,4,"Subcommittee recommends amendment and passage."
1916454,2025-02-13,Senate,5,"Committee report approving bill, renumbered as SF 314. S.J. 274."
1916503,2025-01-13,Senate,1,"Introduced, referred to Veterans Affairs. S.J. 36."
1916503,2025-01-15,Senate,2,"Subcommittee: Alons, Pike, and Townsend. S.J. 90."
1916503,2025-01-15,Senate,3,"Subcommittee Meeting: 01/16/2025 11:30AM Senate Lounge."
1916503,2025-01-16,Senate,4,"Subcommittee recommends amendment and passage. []."
1916554,2025-01-13,Senate,1,"Introduced, referred to Commerce. S.J. 37."
1916554,2025-01-15,Senate,2,"Subcommittee: Webster, Dickey, and Petersen. S.J. 90."
1916599,2025-01-13,Senate,1,"Introduced, referred to Natural Resources and Environment. S.J. 36."
1916599,2025-01-14,Senate,2,"Subcommittee: Shipley, De Witt, and Trone Garriott. S.J. 71."
1916599,2025-01-15,Senate,3,"Subcommittee Meeting: 01/16/2025 11:45AM Room 217 Conference Room."
1916599,2025-01-16,Senate,4,"Subcommittee recommends amendment and passage. []."
1916599,2025-01-29,Senate,5,"Committee report approving bill, renumbered as SF 148. S.J. 163."
1917017,2025-01-14,House,1,"Introduced, referred to Public Safety. H.J. 39."
1917017,2025-01-15,House,2,"Subcommittee: Gustoff, Gosa and Hermanson. H.J. 80."
1917017,2025-01-16,House,3,"Subcommittee Meeting: 01/21/2025 11:30AM RM 19."
1917017,2025-01-21,House,4,"Subcommittee recommends passage."
1917017,2025-02-26,House,5,"Committee report, recommending passage. H.J. 443."
1917017,2025-02-26,House,6,"Committee vote: Yeas, 15. Nays, 7. Excused, 1. H.J. 443."
1917017,2025-03-05,House,7,"Committee report approving bill, renumbered as HF 764."
1917031,2025-01-14,House,1,"Introduced, referred to Judiciary. H.J. 41."
1917031,2025-01-16,House,2,"Subcommittee: Wheeler, Fett and Olson. H.J. 98."
1917031,2025-01-27,House,3,"Subcommittee Meeting: 01/28/2025 12:30PM RM 304."
1917031,2025-01-28,House,4,"Tabled until future meeting."
1917047,2025-01-14,Senate,1,"By COMMITTEE ON JUDICIARY"
1917047,2025-01-14,Senate,2,"Introduced, referred to Judiciary."
1917047,2025-01-14,Senate,3,"Subcommittee: Taylor, Quirmbach, and Rowley."
1917047,2025-01-21,Senate,4,"Subcommittee Meeting: 01/22/2025 11:30AM Senate Lounge."
1917047,2025-01-22,Senate,5,"Subcommittee recommends passage."
1917047,2025-01-28,Senate,6,"Committee report approving bill, renumbered as SF 149."
1917062,2025-01-14,House,1,"Introduced, referred to Natural Resources. H.J. 38."
1917062,2025-01-21,House,2,"Subcommittee: Fisher, Gjerde and Wulf. H.J. 105."
1917062,2025-01-21,House,3,"Subcommittee Meeting: 01/22/2025 12:30PM RM 304."
1917062,2025-01-22,House,4,"Subcommittee recommends passage."
1917062,2025-02-11,House,5,"Committee report, recommending amendment and passage. H.J. 298."
1917062,2025-02-11,House,6,"Committee vote: Yeas, 13. Nays, 8. H.J. 298."
1917062,2025-02-13,House,7,"Committee report approving bill, renumbered as HJR 7."
1917080,2025-01-14,House,1,"Introduced, referred to Labor and Workforce. H.J. 41."
1917095,2025-01-14,House,1,"Introduced, referred to Ways and Means. H.J. 42."
1917109,2025-01-14,House,1,"Introduced, referred to Commerce. H.J. 39."
1917109,2025-01-22,House,2,"Subcommittee: Determann, Bagniewski and Thomson, C. H.J. 115."
1917109,2025-01-27,House,3,"Subcommittee Meeting: 01/29/2025 3:30PM House Lounge."
1917109,2025-01-29,House,4,"Subcommittee recommends passage."
1917127,2025-01-14,House,1,"Introduced, referred to Ways and Means. H.J. 42."
1917140,2025-01-14,House,1,"Introduced, referred to Judiciary. H.J. 40."
1917140,2025-01-16,House,2,"Subcommittee: Lohse, Croken and Williams. H.J. 98."
1917140,2025-01-21,House,3,"Subcommittee Meeting: 01/22/2025 12:30PM RM 19."
1917140,2025-01-22,House,4,"Subcommittee recommends passage."
1917140,2025-01-30,House,5,"Committee report, recommending amendment and passage. H.J. 174."
1917140,2025-01-30,House,6,"Committee vote: Yeas, 21. Nays, 0. H.J. 174."
1917140,2025-02-06,House,7,"Committee report approving bill, renumbered as HF 209."
1917140,2025-04-28,House,8,"Withdrawn. H.J. 1073."
1917157,2025-01-14,House,1,"Introduced, referred to Judiciary. H.J. 40."
1917179,2025-01-14,Senate,1,"By COMMITTEE ON JUDICIARY"
1917179,2025-01-14,Senate,2,"Introduced, referred to Judiciary."
1917179,2025-01-14,Senate,3,"Subcommittee: Shipley, Blake, and Green."
1917179,2025-01-28,Senate,4,"Subcommittee Meeting: 01/29/2025 11:00AM Room 315."
1917179,2025-01-29,Senate,5,"Subcommittee recommends passage."
1917179,2025-02-11,Senate,6,"Committee report approving bill, renumbered as SF 284."
1917199,2025-01-14,House,1,"Introduced, referred to Health and Human Services. H.J. 40."
1917199,2025-01-22,House,2,"Subcommittee: Barker, Bergan and Turek. H.J. 116."
1917199,2025-02-03,House,3,"Subcommittee Meeting: 02/06/2025 12:00PM RM 304."
1917199,2025-02-06,House,4,"Subcommittee recommends passage."
1917199,2025-02-11,House,5,"Committee report, recommending passage. H.J. 296."
1917199,2025-02-11,House,6,"Committee vote: Yeas, 20. Nays, 0. Excused, 1. H.J. 296."
1917199,2025-02-13,House,7,"Committee report approving bill, renumbered as HF 383."
1917199,2025-02-24,House,8,"Withdrawn. H.J. 418."
1917213,2025-01-14,House,1,"Introduced, referred to Education. H.J. 40."
1917213,2025-01-21,House,2,"Subcommittee: Moore, T., Johnson, C. and Madison. H.J. 105."
1917213,2025-01-22,House,3,"Subcommittee Meeting: 01/23/2025 12:15PM House Lounge."
1917213,2025-01-23,House,4,"Subcommittee recommends passage."
1917213,2025-01-28,House,5,"Committee report, recommending amendment and passage. H.J. 142."
1917213,2025-01-28,House,6,"Committee vote: Yeas, 22. Nays, 0. Excused, 1. H.J. 142."
1917213,2025-01-30,House,7,"Committee report approving bill, renumbered as HF 174."
1917213,2025-02-24,House,8,"Withdrawn. H.J. 418."
1917235,2025-01-14,House,1,"Introduced, referred to Public Safety. H.J. 42."
1917235,2025-01-15,House,2,"Subcommittee: Holt, Amos Jr. and Gustoff. H.J. 81."
1917235,2025-01-22,House,3,"Subcommittee Meeting: 01/27/2025 12:00PM RM 103."
1917235,2025-01-27,House,4,"Subcommittee recommends passage."
1917250,2025-01-14,House,1,"Introduced, referred to Ways and Means. H.J. 42."
1917250,2025-01-23,House,2,"Subcommittee: Nordman, Wichtendahl and Wills, J. H.J. 122."
1917250,2025-01-27,House,3,"Subcommittee Meeting: 01/29/2025 12:00PM RM 304."
1917250,2025-01-29,House,4,"Subcommittee recommends passage."
1917250,2025-04-09,House,5,"Committee report, recommending passage. H.J. 922."
1917250,2025-04-09,House,6,"Committee vote: Yeas, 24. Nays, 0. Excused, 1. H.J. 922."
1917250,2025-04-14,House,7,"Committee report approving bill, renumbered as HF 1008."
1917250,2025-04-17,House,8,"Withdrawn. H.J. 988."
1917267,2025-01-14,House,1,"Introduced, referred to Commerce. H.J. 39."
1917267,2025-01-22,House,2,"Subcommittee: Wills, J., Barker and Wilson. H.J. 115."
1917267,2025-01-27,House,3,"Subcommittee Meeting: 01/28/2025 7:30AM House Lounge."
1917267,2025-01-29,House,4,"Subcommittee recommends passage."
1917286,2025-01-14,House,1,"Introduced, referred to Education. H.J. 38."
1917286,2025-01-21,House,2,"Subcommittee: Stone, Behn and Matson. H.J. 105."
1917286,2025-01-21,House,3,"Subcommittee Meeting: 01/22/2025 3:00PM RM 304."
1917286,2025-01-22,House,4,"Subcommittee recommends passage."
1917286,2025-01-29,House,5,"Committee report, recommending passage. H.J. 141."
1917286,2025-01-29,House,6,"Committee vote: Yeas, 15. Nays, 8. H.J. 142."
1917286,2025-01-30,House,7,"Committee report approving bill, renumbered as HF 189."
1917286,2025-03-21,House,8,"Withdrawn. H.J. 772."
1917306,2025-01-14,House,1,"Introduced, referred to Education. H.J. 40."
1917320,2025-01-14,House,1,"Introduced, referred to Commerce. H.J. 39."
1917320,2025-01-22,House,2,"Subcommittee: Latham, Bossman and Scheetz. H.J. 116."
1917320,2025-02-03,House,3,"Subcommittee Meeting: 02/05/2025 12:30PM RM 19."
1917320,2025-02-05,House,4,"Subcommittee recommends passage."
1917320,2025-02-18,House,5,"Committee report, recommending amendment and passage. H.J. 351."
1917320,2025-02-18,House,6,"Committee vote: Yeas, 20. Nays, 2. Excused, 1. H.J. 351."
1917320,2025-02-20,House,7,"Committee report approving bill, renumbered as HF 545."
1917343,2025-01-14,House,1,"Introduced, referred to Ways and Means. H.J. 42."
1917343,2025-02-20,House,2,"Subcommittee: Jones, Gjerde and Vondran. H.J. 405."
1917343,2025-04-02,House,3,"Subcommittee Meeting: 04/03/2025 8:15AM House Lounge."
1917343,2025-04-03,House,4,"Subcommittee recommends passage."
1917360,2025-01-14,House,1,"Introduced, referred to Public Safety. H.J. 41."
1917360,2025-01-15,House,2,"Subcommittee: Dieken, Fisher and Kressig. H.J. 81."
1917360,2025-02-05,House,3,"Subcommittee Meeting: 02/11/2025 8:30AM House Lounge 2."
1917360,2025-02-11,House,4,"Subcommittee recommends passage."
1917378,2025-01-14,House,1,"Introduced, referred to State Government. H.J. 42."
1917378,2025-01-23,House,2,"Subcommittee: Smith, Siegrist and Srinivas. H.J. 122."
1917378,2025-01-23,House,3,"Subcommittee Meeting: 01/28/2025 12:30PM RM 19."
1917378,2025-01-28,House,4,"Subcommittee recommends passage."
1917378,2025-02-05,House,5,"Committee report, recommending passage. H.J. 185."
1917378,2025-02-05,House,6,"Committee vote: Yeas, 23. Nays, 0. H.J. 185."
1917378,2025-02-06,House,7,"Committee report approving bill, renumbered as HF 248."
1917378,2025-03-14,House,8,"Withdrawn. H.J. 660."
1917398,2025-01-14,House,1,"Introduced, referred to Education. H.J. 39."
1917414,2025-01-14,House,1,"Introduced, referred to Local Government. H.J. 41."
1917414,2025-01-15,House,2,"Subcommittee: Wheeler, Determann and Gosa. H.J. 81."
1917414,2025-01-23,House,3,"Subcommittee Meeting: 01/27/2025 4:00PM House Lounge."
1917414,2025-01-28,House,4,"Subcommittee recommends passage."
1917414,2025-02-06,House,5,"Committee report, recommending passage. H.J. 270."
1917414,2025-02-06,House,6,"Committee vote: Yeas, 18. Nays, 0. Excused, 2. H.J. 270."
1917414,2025-02-10,House,7,"Committee report approving bill, renumbered as HF 307."
1917414,2025-03-14,House,8,"Withdrawn. H.J. 660."
1917428,2025-01-14,House,1,"Introduced, referred to Health and Human Services. H.J. 40."
1917428,2025-01-14,House,2,"Subcommittee: Meyer, A., Baeth and Gehlbach. H.J. 60."
1917428,2025-01-15,House,3,"Subcommittee Meeting: 01/22/2025 8:00AM House Lounge."
1917428,2025-01-22,House,4,"Subcommittee recommends passage."
1917428,2025-02-11,House,5,"Committee report, recommending amendment and passage. H.J. 295."
1917428,2025-02-11,House,6,"Committee vote: Yeas, 15. Nays, 5. Excused, 1. H.J. 295."
1917428,2025-02-13,House,7,"Committee report approving bill, renumbered as HF 379."
1917448,2025-01-14,House,1,"Introduced, referred to Commerce. H.J. 39."
1917448,2025-01-22,House,2,"Subcommittee: Young, Vondran and Zabner. H.J. 115."
1917448,2025-01-27,House,3,"Subcommittee Meeting: 01/28/2025 3:30PM RM 102."
1917448,2025-01-28,House,4,"Subcommittee recommends passage."
1917448,2025-02-06,House,5,"Committee report, recommending amendment and passage. H.J. 266."
1917448,2025-02-06,House,6,"Committee vote: Yeas, 23. Nays, 0. H.J. 266."
1917448,2025-02-11,House,7,"Committee report approving bill, renumbered as HF 330."
1917448,2025-02-24,House,8,"Withdrawn. H.J. 418."
1917467,2025-01-14,House,1,"Introduced, referred to Public Safety. H.J. 41."
1917467,2025-01-15,House,2,"Subcommittee: Wills, J., Fisher and Wessel-Kroeschell. H.J. 81."
1917467,2025-01-15,House,3,"Subcommittee Meeting: 01/16/2025 11:30AM House Lounge."
1917467,2025-01-16,House,4,"Tabled until future meeting."
1917483,2025-01-14,House,1,"Introduced, referred to Ways and Means. H.J. 42."
1917483,2025-01-23,House,2,"Subcommittee: Young, James and Jones. H.J. 122."
1917483,2025-01-29,House,3,"Subcommittee Meeting: 01/29/2025 3:00PM House Lounge."
1917483,2025-01-29,House,4,"Subcommittee recommends passage."
1917505,2025-01-14,House,1,"Introduced, referred to Local Government. H.J. 41."
1917505,2025-01-15,House,2,"Subcommittee: Determann, Bloomingdale and McBurney. H.J. 81."
1917505,2025-01-22,House,3,"Subcommittee Meeting: 01/23/2025 12:00PM RM 103."
1917505,2025-01-23,House,4,"Subcommittee recommends passage."
1917505,2025-02-11,House,5,"Committee report, recommending passage. H.J. 298."
1917505,2025-02-11,House,6,"Committee vote: Yeas, 20. Nays, 0. H.J. 298."
1917505,2025-02-13,House,7,"Committee report approving bill, renumbered as HF 380."
1917505,2025-03-14,House,8,"Withdrawn. H.J. 660."
1917521,2025-01-14,House,1,"Introduced, referred to Natural Resources. H.J. 41."
1917521,2025-01-21,House,2,"Subcommittee: Collins, Harris and Scholten. H.J. 105."
1917521,2025-01-21,House,3,"Subcommittee Meeting: 01/23/2025 8:00AM House Lounge 2."
1917521,2025-01-23,House,4,"Subcommittee recommends passage."
1917521,2025-02-11,House,5,"Committee report, recommending amendment and passage. H.J. 299."
1917521,2025-02-11,House,6,"Committee vote: Yeas, 13. Nays, 8. H.J. 299."
1917521,2025-02-13,House,7,"Committee report approving bill, renumbered as HF 388."
1917538,2025-01-14,House,1,"Introduced, referred to Health and Human Services. H.J. 40."
1917559,2025-01-14,House,1,"Introduced, referred to Education. H.J. 39."
1917571,2025-01-14,House,1,"Introduced, referred to Health and Human Services. H.J. 38."
1917571,2025-01-14,House,2,"Subcommittee: Ingels, Matson and Meyer, A. H.J. 60."
1917571,2025-01-21,House,3,"Subcommittee Meeting: 01/23/2025 12:00PM RM 102."
1917571,2025-01-23,House,4,"Subcommittee recommends passage."
1917571,2025-02-06,House,5,"Committee report, recommending passage. H.J. 281."
1917571,2025-02-06,House,6,"Committee vote: Yeas, 20. Nays, 0. Excused, 1. H.J. 281."
1917571,2025-02-10,House,7,"Committee report approving bill, renumbered as HF 305."
1917571,2025-02-24,House,8,"Withdrawn. H.J. 418."
1917587,2025-01-14,Senate,1,"By COMMITTEE ON JUDICIARY"
1917587,2025-01-14,Senate,2,"Introduced, referred to Judiciary."
1917587,2025-01-14,Senate,3,"Subcommittee: Westrich, Bisignano, and Dickey."
1917587,2025-01-27,Senate,4,"Subcommittee Meeting: 01/29/2025 2:00PM Room 217 Conference Room."
1917587,2025-01-29,Senate,5,"Subcommittee recommends amendment and passage."
1917605,2025-01-14,Senate,1,"By COMMITTEE ON JUDICIARY"
1917605,2025-01-14,Senate,2,"Introduced, referred to Judiciary."
1917605,2025-01-14,Senate,3,"Subcommittee: Webster, Blake, and Dickey."
1917605,2025-01-15,Senate,4,"Subcommittee Meeting: 01/21/2025 9:30AM Room 217 Conference Room."
1917605,2025-01-21,Senate,5,"Subcommittee recommends passage. []."
1917605,2025-02-11,Senate,6,"Committee report approving bill, renumbered as SF 285."
1917622,2025-01-14,House,1,"Introduced, referred to Natural Resources. H.J. 41."
1917622,2025-01-21,House,2,"Subcommittee: Gearhart, Andrews and Turek. H.J. 105."
1917622,2025-01-22,House,3,"Subcommittee Meeting: 01/23/2025 1:00PM RM 19."
1917622,2025-01-23,House,4,"Subcommittee recommends passage."
1917622,2025-02-11,House,5,"Committee report, recommending amendment and passage. H.J. 298."
1917622,2025-02-11,House,6,"Committee vote: Yeas, 21. Nays, 0. H.J. 298."
1917622,2025-02-13,House,7,"Committee report approving bill, renumbered as HF 387."
1917622,2025-05-14,House,8,"Withdrawn. H.J. 1219."
1917649,2025-01-14,Senate,1,"By COMMITTEE ON HEALTH AND HUMAN SERVICES"
1917649,2025-01-14,Senate,2,"Introduced, referred to Health and Human Services."
1917649,2025-01-16,Senate,3,"Subcommittee: Klimesh, Lofgren, and Trone Garriott."
1917649,2025-01-16,Senate,4,"Subcommittee Meeting: 01/22/2025 2:00PM Senate Lounge."
1917649,2025-01-22,Senate,5,"Subcommittee recommends passage."
1917649,2025-02-06,Senate,6,"Committee report approving bill, renumbered as SF 232."
1917739,2025-01-14,Senate,1,"By COMMITTEE ON JUDICIARY"
1917739,2025-01-14,Senate,2,"Introduced, referred to Judiciary."
1917739,2025-01-14,Senate,3,"Subcommittee: Bousselot, Knox, and Taylor."
1917739,2025-02-03,Senate,4,"Subcommittee Meeting: 02/05/2025 2:00PM Room 217 Conference Room."
1917739,2025-02-05,Senate,5,"Subcommittee recommends passage."
1917739,2025-02-11,Senate,6,"Committee report approving bill, renumbered as SF 287."
1917833,2025-01-14,Senate,1,"By COMMITTEE ON JUDICIARY"
1917833,2025-01-14,Senate,2,"Introduced, referred to Judiciary."
1917833,2025-01-14,Senate,3,"Subcommittee: Dawson, Blake, and Schultz."
1917833,2025-01-16,Senate,4,"Subcommittee Meeting: 01/22/2025 10:00AM Room 217 Conference Room."
1917833,2025-01-22,Senate,5,"Subcommittee recommends passage."
1917833,2025-02-19,Senate,6,"Committee report approving bill, renumbered as SF 393."
1917926,2025-01-14,Senate,1,"By COMMITTEE ON JUDICIARY"
1917926,2025-01-14,Senate,2,"Introduced, referred to Judiciary."
1917926,2025-01-14,Senate,3,"Subcommittee: Taylor, Evans, and Petersen."
1917926,2025-01-21,Senate,4,"Subcommittee Meeting: 01/22/2025 2:00PM Room 315."
1917926,2025-01-22,Senate,5,"Subcommittee recommends passage."
1917926,2025-01-28,Senate,6,"Committee report approving bill, renumbered as SF 154."
1918021,2025-01-14,Senate,1,"By COMMITTEE ON LOCAL GOVERNMENT"
1918021,2025-01-14,Senate,2,"Introduced, referred to Local Government."
1918021,2025-01-14,Senate,3,"Subcommittee: Webster, Driscoll, and Weiner."
1918021,2025-01-21,Senate,4,"Subcommittee Meeting: 01/21/2025 2:00PM Room 217 Conference Room."
1918021,2025-01-21,Senate,5,"Subcommittee recommends passage."
1918021,2025-02-12,Senate,6,"Committee report approving bill, renumbered as []."
1918115,2025-01-14,Senate,1,"By COMMITTEE ON JUDICIARY"
1918115,2025-01-14,Senate,2,"Introduced, referred to Judiciary."
1918115,2025-01-14,Senate,3,"Subcommittee: Taylor, Bousselot, and Knox."
1918115,2025-01-16,Senate,4,"Subcommittee Meeting: 01/23/2025 10:30AM Room 217 Conference Room."
1918115,2025-01-23,Senate,5,"Subcommittee recommends passage."
1918115,2025-01-28,Senate,6,"Committee report approving bill, renumbered as SF 174."
1918208,2025-01-14,Senate,1,"By COMMITTEE ON LOCAL GOVERNMENT"
1918208,2025-01-14,Senate,2,"Introduced, referred to Local Government."
1918208,2025-01-14,Senate,3,"Subcommittee: Sires, Driscoll, and Wahls."
1918208,2025-01-27,Senate,4,"Subcommittee Meeting: 01/30/2025 10:00AM Room 217 Conference Room."
1918208,2025-01-30,Senate,5,"Subcommittee recommends passage."
1918301,2025-01-14,Senate,1,"By COMMITTEE ON JUDICIARY"
1918301,2025-01-14,Senate,2,"Introduced, referred to Judiciary."
1918301,2025-01-14,Senate,3,"Subcommittee: Lofgren, Bisignano, and Reichman."
1918301,2025-01-14,Senate,4,"Subcommittee Meeting: 01/15/2025 9:30AM Senate Lounge."
1918301,2025-01-15,Senate,5,"Subcommittee recommends amendment and passage. []."
1918301,2025-03-04,Senate,6,"Committee report approving bill, renumbered as SF 524."
1918395,2025-01-14,Senate,1,"By COMMITTEE ON LOCAL GOVERNMENT"
1918395,2025-01-14,Senate,2,"Introduced, referred to Local Government."
1918395,2025-01-14,Senate,3,"Subcommittee: Westrich, Driscoll, and Knox."
1918505,2025-01-14,House,1,"Introduced, referred to Local Government. H.J. 44."
1918505,2025-01-15,House,2,"Subcommittee: Latham, Croken and Kniff McCulla. H.J. 81."
1918505,2025-01-16,House,3,"Subcommittee Meeting: 01/21/2025 12:30PM House Lounge 2."
1918505,2025-01-21,House,4,"Subcommittee recommends passage."
1918505,2025-02-11,House,5,"Committee report, recommending passage. H.J. 298."
1918505,2025-02-11,House,6,"Committee vote: Yeas, 16. Nays, 4. H.J. 298."
1918505,2025-03-05,House,7,"Committee report approving bill, renumbered as HF 760."
1918514,2025-01-14,Senate,1,"Introduced, referred to Veterans Affairs. S.J. 68."
1918514,2025-01-15,Senate,2,"Subcommittee: Salmon, Dotzler, and Warme. S.J. 91."
1918514,2025-01-21,Senate,3,"Subcommittee Meeting: 01/22/2025 2:30PM Room 217 Conference Room."
1918514,2025-01-22,Senate,4,"Subcommittee recommends passage."
1918514,2025-01-29,Senate,5,"Committee report approving bill, renumbered as SF 151. S.J. 164."
1918524,2025-01-14,Senate,1,"Introduced, referred to Judiciary. S.J. 67."
1918524,2025-01-15,Senate,2,"Subcommittee: Westrich, Reichman, and Weiner. S.J. 90."
1918524,2025-01-16,Senate,3,"Subcommittee Meeting: 01/22/2025 3:30PM Room 217 Conference Room."
1918524,2025-01-23,Senate,4,"Subcommittee recommends passage."
1918524,2025-01-29,Senate,5,"Committee report approving bill, renumbered as SF 150. S.J. 163."
1918532,2025-01-14,House,1,"By COMMITTEE ON VETERANS AFFAIRS"
1918532,2025-01-14,House,2,"Introduced, referred to Veterans Affairs. H.J. 60."
1918532,2025-01-14,House,3,"Subcommittee: Ingels, Hayes and Levin. H.J. 60."
1918532,2025-01-17,House,4,"Subcommittee Meeting: 01/21/2025 12:30PM RM 304.1."
1918532,2025-01-21,House,5,"Subcommittee recommends passage."
1918532,2025-01-29,House,6,"Committee report, recommending passage. H.J. 147."
1918532,2025-01-29,House,7,"Committee vote: Yeas, 17. Nays, 0. H.J. 147."
1918532,2025-01-30,House,8,"Committee report approving bill, renumbered as HF 175."
1918542,2025-01-14,Senate,1,"Introduced, referred to Judiciary. S.J. 67."
1918542,2025-01-15,Senate,2,"Subcommittee: Westrich, Knox, and Shipley. S.J. 90."
1918542,2025-01-16,Senate,3,"Subcommittee Meeting: 01/22/2025 2:30PM Senate Lounge."
1918542,2025-01-22,Senate,4,"Subcommittee recommends passage."
1918542,2025-02-12,Senate,5,"Committee report approving bill, renumbered as SF 296. S.J. 261."
1918552,2025-01-14,Senate,1,"Introduced, referred to Judiciary. S.J. 66."
1918552,2025-01-16,Senate,2,"Subcommittee: Webster, Lofgren, and Petersen. S.J. 107."
1918552,2025-01-17,Senate,3,"Subcommittee reassigned: Lofgren, Petersen, and Webster. S.J. 110."
1918552,2025-01-18,Senate,4,"Subcommittee Meeting: 01/22/2025 2:30PM Room 315."
1918552,2025-01-22,Senate,5,"Subcommittee recommends passage."
1918552,2025-02-12,Senate,6,"Committee report, recommending passage. S.J. 258."
1918552,2025-02-12,Senate,7,"Placed on calendar."
1918552,2025-03-18,Senate,8,"Amendment S-3027 filed, lost. S.J. 557."
1918552,2025-03-18,Senate,9,"Passed Senate, yeas 47, nays 1. S.J. 558."
1918552,2025-03-18,Senate,10,"Immediate message. S.J. 559."
1918552,2025-03-18,House,11,"Message from Senate. H.J. 680."
1918552,2025-03-18,House,12,"Read first time, passed on file. H.J. 681."
1918552,2025-03-18,House,13,"Placed on calendar under unfinished business. H.J. 682."
1918552,2025-03-26,House,14,"Substituted for HF 827. H.J. 820."
1918552,2025-03-26,House,15,"Passed House, yeas 84, nays 11. H.J. 820."
1918552,2025-04-22,House,16,"Explanation of vote. H.J. 1034."
1918552,2025-03-26,House,17,"Immediate message. H.J. 850."
1918552,2025-03-27,Senate,18,"Message from House. S.J. 656."
1918552,2025-03-31,Senate,19,"Reported correctly enrolled, signed by President and Speaker, and sent to Governor. S.J. 675."
1918552,2025-04-02,Senate,20,"Signed by Governor. S.J. 683."
1918561,2025-01-14,House,1,"Introduced, referred to Education. H.J. 43."
1918561,2025-01-30,House,2,"Subcommittee: Ingels, Hora and Levin. H.J. 170."
1918561,2025-02-03,House,3,"Subcommittee Meeting: 02/05/2025 2:00PM House Lounge."
1918561,2025-02-05,House,4,"Subcommittee recommends passage."
1918561,2025-02-11,House,5,"Committee report, recommending passage. H.J. 294."
1918561,2025-02-11,House,6,"Committee vote: Yeas, 23. Nays, 0. H.J. 294."
1918561,2025-02-13,House,7,"Committee report approving bill, renumbered as HF 369."
1918571,2025-01-14,House,1,"By COMMITTEE ON EDUCATION"
1918571,2025-01-14,House,2,"Introduced, referred to Education. H.J. 59."
1918571,2025-01-14,House,3,"Subcommittee: Hayes, Gjerde and Weldon. H.J. 60."
1918571,2025-01-21,House,4,"Subcommittee Meeting: 01/22/2025 12:00PM House Lounge 2."
1918571,2025-01-22,House,5,"Subcommittee recommends passage."
1918571,2025-03-05,House,6,"Committee report, recommending passage. H.J. 528."
1918571,2025-03-05,House,7,"Committee vote: Yeas, 23. Nays, 0. H.J. 528."
1918571,2025-03-10,House,8,"Committee report approving bill, renumbered as HF 898."
1918576,2025-01-14,House,1,"Introduced, referred to Local Government. H.J. 44."
1918576,2025-01-15,House,2,"Subcommittee: Thompson, M., Bloomingdale and Wichtendahl. H.J. 81."
1918576,2025-01-16,House,3,"Subcommittee Meeting: 01/21/2025 12:00PM House Lounge."
1918576,2025-01-21,House,4,"Tabled until future meeting."
1918592,2025-01-14,Senate,1,"Introduced, referred to Workforce. S.J. 65."
1918592,2025-01-16,Senate,2,"Subcommittee: Alons, Taylor, and Townsend. S.J. 107."
1918592,2025-01-16,Senate,3,"Subcommittee Meeting: 01/22/2025 1:00PM Room 217 Conference Room."
1918592,2025-01-22,Senate,4,"Subcommittee recommends passage."
1918592,2025-02-13,Senate,5,"Committee report approving bill, renumbered as SF 308. S.J. 274."
1918601,2025-01-14,Senate,1,"Introduced, referred to Ways and Means. S.J. 65."
1918601,2025-01-22,Senate,2,"Subcommittee: Dawson, Dotzler, and Rowley. S.J. 125."
1918614,2025-01-14,Senate,1,"Introduced, referred to Local Government. S.J. 69."
1918614,2025-01-15,Senate,2,"Subcommittee: Lofgren, Klimesh, and Wahls. S.J. 91."
1918614,2025-01-15,Senate,3,"Subcommittee Meeting: 01/16/2025 9:30AM Room 217 Conference Room."
1918614,2025-01-16,Senate,4,"Subcommittee recommends passage. []."
1918614,2025-02-17,Senate,5,"Committee report, recommending passage. S.J. 282."
1918614,2025-02-17,Senate,6,"Placed on calendar."
1918614,2025-03-10,Senate,7,"Passed Senate, yeas 47, nays 0. S.J. 444."
1918614,2025-03-10,Senate,8,"Immediate message. S.J. 445."
1918614,2025-03-10,House,9,"Message from Senate. H.J. 573."
1918614,2025-03-10,House,10,"Read first time, passed on file. H.J. 573."
1918614,2025-03-10,House,11,"Substituted for HF 307. H.J. 583."
1918614,2025-03-10,House,12,"Passed House, yeas 89, nays 0. H.J. 583."
1918614,2025-03-18,House,13,"Explanation of vote. H.J. 718."
1918614,2025-03-10,House,14,"Immediate message. H.J. 590."
1918614,2025-03-10,Senate,15,"Message from House. S.J. 456."
1918614,2025-03-28,Senate,16,"Reported correctly enrolled, signed by President and Speaker, and sent to Governor. S.J. 667."
1918614,2025-03-28,Senate,17,"Signed by Governor. S.J. 668."
1918619,2025-01-14,House,1,"By COMMITTEE ON EDUCATION"
1918619,2025-01-14,House,2,"Introduced, referred to Education. H.J. 60."
1918619,2025-01-14,House,3,"Subcommittee: Shipley, Boden and Matson. H.J. 60."
1918619,2025-01-17,House,4,"Subcommittee Meeting: 01/22/2025 12:30PM RM 102."
1918619,2025-01-22,House,5,"Subcommittee recommends amendment and passage."
1918619,2025-01-29,House,6,"Committee report, recommending amendment and passage. H.J. 142."
1918619,2025-01-29,House,7,"Committee vote: Yeas, 20. Nays, 3. H.J. 142."
1918619,2025-02-06,House,8,"Committee report approving bill, renumbered as HF 212."
1918633,2025-01-14,Senate,1,"Introduced, referred to Local Government. S.J. 66."
1918633,2025-01-15,Senate,2,"Subcommittee: Klimesh, Knox, and Shipley. S.J. 90."
1918633,2025-01-22,Senate,3,"Subcommittee Meeting: 01/23/2025 2:00PM Senate Lounge."
1918633,2025-01-23,Senate,4,"Subcommittee recommends amendment and passage."
1918633,2025-03-10,Senate,5,"Committee report approving bill, renumbered as SF 596. S.J. 477."
1918641,2025-01-14,Senate,1,"Introduced, referred to Judiciary. S.J. 68."
1918641,2025-01-15,Senate,2,"Subcommittee: Evans, Bisignano, and Dickey. S.J. 91."
1918641,2025-01-23,Senate,3,"Subcommittee Meeting: 01/27/2025 3:00PM Senate Lounge."
1918641,2025-01-27,Senate,4,"Subcommittee recommends passage."
1918641,2025-03-06,Senate,5,"Committee report, recommending passage. S.J. 437."
1918641,2025-03-06,Senate,6,"Placed on calendar."
1918641,2025-03-11,Senate,7,"Fiscal note."
1918641,2025-04-03,Senate,8,"Placed on calendar under unfinished business. S.J. 688."
1918641,2025-04-07,Senate,9,"Passed Senate, yeas 47, nays 0. S.J. 703."
1918641,2025-04-07,Senate,10,"Immediate message. S.J. 706."
1918641,2025-04-08,House,11,"Message from Senate. H.J. 905."
1918641,2025-04-08,House,12,"Read first time, passed on file. H.J. 906."
1918641,2025-05-15,House,13,"Rereferred to Public Safety. H.J. 1221."
1918650,2025-01-14,House,1,"Introduced, referred to Public Safety. H.J. 45."
1918650,2025-01-15,House,2,"Subcommittee: Gustoff, Gearhart and Gjerde. H.J. 82."
1918650,2025-01-21,House,3,"Subcommittee Meeting: 01/23/2025 12:30PM RM 19."
1918650,2025-01-23,House,4,"Subcommittee recommends passage."
1918650,2025-02-26,House,5,"Committee report, recommending amendment and passage. H.J. 444."
1918650,2025-02-26,House,6,"Committee vote: Yeas, 13. Nays, 9. Excused, 1. H.J. 444."
1918650,2025-02-28,House,7,"Committee report approving bill, renumbered as HF 702."
1918650,2025-05-14,House,8,"Withdrawn. H.J. 1219."
1918657,2025-01-14,Senate,1,"Introduced, referred to Transportation. S.J. 66."
1918657,2025-01-15,Senate,2,"Subcommittee: Shipley, De Witt, and Winckler. S.J. 90."
1918657,2025-01-22,Senate,3,"Subcommittee Meeting: 01/23/2025 12:00PM Room 217 Conference Room."
1918657,2025-01-23,Senate,4,"Subcommittee recommends passage."
1918657,2025-02-20,Senate,5,"Committee report approving bill, renumbered as SF 384. S.J. 334."
1918669,2025-01-14,House,1,"Introduced, referred to Public Safety. H.J. 44."
1918669,2025-01-15,House,2,"Subcommittee: Meggers, Fisher and Gjerde. H.J. 81."
1918669,2025-01-29,House,3,"Subcommittee Meeting: 01/30/2025 8:30AM RM 102."
1918669,2025-01-30,House,4,"Subcommittee recommends passage."
1918669,2025-02-19,House,5,"Committee report, recommending passage. H.J. 367."
1918669,2025-02-19,House,6,"Committee vote: Yeas, 20. Nays, 0. Excused, 3. H.J. 367."
1918669,2025-02-24,House,7,"Committee report approving bill, renumbered as HF 569."
1918679,2025-01-14,Senate,1,"Introduced, referred to Ways and Means. S.J. 65."
1918679,2025-01-22,Senate,2,"Subcommittee: Dawson, Driscoll, and Petersen. S.J. 125."
1918679,2025-03-17,Senate,3,"Subcommittee reassigned: Dawson, Driscoll, and Quirmbach. S.J. 551."
1918679,2025-03-18,Senate,4,"Subcommittee Meeting: 03/19/2025 12:00PM Room 315."
1918679,2025-03-19,Senate,5,"Subcommittee recommends passage."
1918692,2025-01-14,House,1,"Introduced, referred to Health and Human Services. H.J. 43."
1918692,2025-01-15,House,2,"Subcommittee: Bradley, Brown-Powers and Nordman. H.J. 81."
1918692,2025-01-21,House,3,"Subcommittee Meeting: 01/23/2025 12:00PM RM 304."
1918692,2025-01-23,House,4,"Subcommittee recommends passage."
1918701,2025-01-14,House,1,"Introduced, referred to Public Safety. H.J. 44."
1918701,2025-01-15,House,2,"Subcommittee: Meggers, Brown-Powers and Dieken. H.J. 81."
1918701,2025-01-22,House,3,"Subcommittee Meeting: 01/23/2025 8:30AM RM 304.1."
1918701,2025-01-23,House,4,"Subcommittee recommends passage."
1918701,2025-01-29,House,5,"Committee report, recommending passage. H.J. 145."
1918701,2025-01-29,House,6,"Committee vote: Yeas, 23. Nays, 0. H.J. 145."
1918701,2025-01-30,House,7,"Committee report approving bill, renumbered as HF 173."
1918701,2025-02-24,House,8,"Withdrawn. H.J. 418."
1918708,2025-01-14,Senate,1,"Introduced, referred to Transportation. S.J. 67."
1918708,2025-01-15,Senate,2,"Subcommittee: Klimesh, Bennett, and Warme. S.J. 90."
1918708,2025-01-16,Senate,3,"Subcommittee Meeting: 01/21/2025 1:30PM Senate Lounge."
1918708,2025-01-21,Senate,4,"Subcommittee recommends passage."
1918708,2025-02-04,Senate,5,"Committee report, recommending passage. S.J. 198."
1918708,2025-02-04,Senate,6,"Placed on calendar."
1918708,2025-03-19,Senate,7,"Passed Senate, yeas 47, nays 0. S.J. 573."
1918708,2025-03-19,Senate,8,"Immediate message. S.J. 577."
1918708,2025-03-19,House,9,"Message from Senate. H.J. 722."
1918708,2025-03-19,House,10,"Read first time, referred to Transportation. H.J. 749."
1918708,2025-03-26,House,11,"Subcommittee: Jeneary, Kressig and Meggers. H.J. 852."
1918708,2025-03-26,House,12,"Subcommittee Meeting: 03/31/2025 12:45PM House Lounge."
1918708,2025-03-31,House,13,"Subcommittee recommends passage."
1918708,2025-03-31,House,14,"Committee report, recommending passage. H.J. 879."
1918708,2025-03-31,House,15,"Committee vote: Yeas, 19. Nays, 0. Excused, 2. H.J. 879."
1918708,2025-04-01,House,16,"Placed on calendar. H.J. 879."
1918708,2025-04-10,House,17,"Placed on calendar under unfinished business. H.J. 928."
1918708,2025-05-15,House,18,"Rereferred to Transportation. H.J. 1222."
1918719,2025-01-14,House,1,"Introduced, referred to Health and Human Services. H.J. 43."
1918719,2025-01-15,House,2,"Subcommittee: Gehlbach, Andrews and Ehlert. H.J. 81."
1918719,2025-01-16,House,3,"Subcommittee Meeting: 01/22/2025 12:00PM RM 19."
1918719,2025-01-22,House,4,"Subcommittee recommends passage."
1918719,2025-02-06,House,5,"Committee report, recommending passage. H.J. 281."
1918719,2025-02-06,House,6,"Committee vote: Yeas, 13. Nays, 7. Excused, 1. H.J. 281."
1918719,2025-02-10,House,7,"Committee report approving bill, renumbered as HF 299."
1918719,2025-03-14,House,8,"Withdrawn. H.J. 660."
1918732,2025-01-14,Senate,1,"Introduced, referred to Judiciary. S.J. 65."
1918732,2025-01-15,Senate,2,"Subcommittee: Shipley, Quirmbach, and Rowley. S.J. 90."
1918732,2025-01-16,Senate,3,"Subcommittee Meeting: 01/22/2025 12:30PM Room 217 Conference Room."
1918732,2025-01-22,Senate,4,"Subcommittee recommends passage."
1918737,2025-01-14,House,1,"Introduced, referred to Public Safety. H.J. 45."
1918737,2025-01-15,House,2,"Subcommittee: Meggers, Amos Jr. and Wengryn. H.J. 82."
1918737,2025-01-22,House,3,"Subcommittee Meeting: 01/23/2025 1:00PM RM 304.1."
1918737,2025-01-23,House,4,"Subcommittee recommends passage."
1918747,2025-01-14,House,1,"Introduced, referred to Transportation. H.J. 45."
1918747,2025-01-29,House,2,"Subcommittee: Golding, Behn and Cooling. H.J. 139."
1918747,2025-02-05,House,3,"Subcommittee Meeting: 02/06/2025 12:00PM RM 304.1."
1918747,2025-02-06,House,4,"Subcommittee recommends passage."
1918759,2025-01-14,House,1,"Introduced, referred to Local Government. H.J. 44."
1918759,2025-01-15,House,2,"Subcommittee: Graber, Wengryn and Wichtendahl. H.J. 81."
1918759,2025-01-15,House,3,"Subcommittee Meeting: 01/16/2025 12:45PM House Lounge."
1918759,2025-01-16,House,4,"Subcommittee recommends passage."
1918759,2025-01-28,House,5,"Committee report, recommending passage. H.J. 137."
1918759,2025-01-28,House,6,"Committee vote: Yeas, 17. Nays, 0. Rule 76, 1. H.J. 137."
1918759,2025-03-05,House,7,"Committee report approving bill, renumbered as HF 774."
1918768,2025-01-14,House,1,"Introduced, referred to State Government. H.J. 45."
1918768,2025-01-30,House,2,"Subcommittee: Harris, Lundgren and Wilburn. H.J. 170."
1918768,2025-03-03,House,3,"Subcommittee Meeting: 03/04/2025 8:00AM RM 19."
1918768,2025-03-04,House,4,"Subcommittee recommends passage."
1918784,2025-01-14,Senate,1,"Introduced, referred to Local Government. S.J. 67."
1918784,2025-01-15,Senate,2,"Subcommittee: Webster, Driscoll, and Quirmbach. S.J. 90."
1918784,2025-01-23,Senate,3,"Subcommittee Meeting: 01/27/2025 12:00PM Room 217 Conference Room."
1918784,2025-01-27,Senate,4,"Subcommittee recommends passage."
1918790,2025-01-14,House,1,"By COMMITTEE ON EDUCATION"
1918790,2025-01-14,House,2,"Introduced, referred to Education. H.J. 59."
1918790,2025-01-14,House,3,"Subcommittee: Hora, Behn and Levin. H.J. 60."
1918790,2025-01-16,House,4,"Subcommittee Meeting: 01/21/2025 1:00PM House Lounge."
1918790,2025-01-21,House,5,"Subcommittee recommends passage."
1918790,2025-01-21,House,6,"Committee report, recommending passage. H.J. 118."
1918790,2025-01-21,House,7,"Committee vote: Yeas, 23. Nays, 0. H.J. 118."
1918790,2025-01-23,House,8,"Committee report approving bill, renumbered as HF 117."
1918799,2025-01-14,House,1,"Introduced, referred to Judiciary. H.J. 46."
1918811,2025-01-14,Senate,1,"Introduced, referred to Education. S.J. 65."
1918811,2025-01-27,Senate,2,"Subcommittee: Evans, Shipley, and Staed. S.J. 142."
1918811,2025-01-27,Senate,3,"Subcommittee Meeting: 01/28/2025 3:00PM Room 217 Conference Room."
1918811,2025-01-28,Senate,4,"Subcommittee recommends passage."
1918811,2025-01-30,Senate,5,"Committee report approving bill, renumbered as SF 171. S.J. 171."
1918820,2025-01-14,House,1,"Introduced, referred to Public Safety. H.J. 46."
1918820,2025-01-15,House,2,"Subcommittee: Rinker, Gustoff and Levin. H.J. 82."
1918820,2025-01-15,House,3,"Subcommittee Meeting: 01/22/2025 8:00AM House Lounge 2."
1918820,2025-01-22,House,4,"Subcommittee recommends passage."
1918825,2025-01-14,Senate,1,"Introduced, referred to Workforce. S.J. 68."
1918825,2025-01-15,Senate,2,"Subcommittee: McClintock, Donahue, and Sires. S.J. 91."
1918825,2025-01-21,Senate,3,"Subcommittee Meeting: 01/22/2025 1:00PM Senate Lounge."
1918825,2025-01-22,Senate,4,"Subcommittee recommends passage."
1918838,2025-01-14,House,1,"Introduced, referred to Transportation. H.J. 46."
1918849,2025-01-14,House,1,"By COMMITTEE ON EDUCATION"
1918849,2025-01-14,House,2,"Introduced, referred to Education. H.J. 59."
1918849,2025-01-14,House,3,"Subcommittee: Stone, Fett and Levin. H.J. 60."
1918849,2025-01-16,House,4,"Subcommittee Meeting: 01/21/2025 12:15PM House Lounge 2."
1918849,2025-01-21,House,5,"Subcommittee recommends passage."
1918849,2025-01-21,House,6,"Committee report, recommending passage. H.J. 118."
1918849,2025-01-21,House,7,"Committee vote: Yeas, 22. Nays, 1. H.J. 118."
1918849,2025-01-23,House,8,"Committee report approving bill, renumbered as HF 118."
1918860,2025-01-14,Senate,1,"Introduced, referred to Transportation. S.J. 68."
1918860,2025-01-15,Senate,2,"Subcommittee: Shipley, Dickey, and Winckler. S.J. 91."
1918860,2025-01-27,Senate,3,"Subcommittee Meeting: 01/28/2025 12:00PM Senate Lounge."
1918860,2025-01-28,Senate,4,"Subcommittee recommends amendment and passage."
1918865,2025-01-14,Senate,1,"Introduced, referred to Workforce. S.J. 67."
1918865,2025-01-16,Senate,2,"Subcommittee: Driscoll, Schultz, and Wahls. S.J. 107."
1918878,2025-01-14,Senate,1,"Introduced, referred to State Government. S.J. 69."
1918878,2025-01-16,Senate,2,"Subcommittee: Schultz, Rozenboom, and Winckler. S.J. 107."
1918888,2025-01-14,Senate,1,"Introduced, referred to Transportation. S.J. 66."
1918888,2025-01-15,Senate,2,"Subcommittee: Shipley, Webster, and Winckler. S.J. 90."
1918888,2025-01-23,Senate,3,"Subcommittee Meeting: 01/27/2025 2:30PM Senate Lounge."
1918888,2025-01-27,Senate,4,"Subcommittee recommends amendment and passage."
1918900,2025-01-14,Senate,1,"Introduced, referred to Transportation. S.J. 68."
1918900,2025-01-15,Senate,2,"Subcommittee: Shipley, Klimesh, and Winckler. S.J. 91."
1918900,2025-01-27,Senate,3,"Subcommittee Meeting: 01/29/2025 2:00PM Room 315."
1918900,2025-01-29,Senate,4,"Subcommittee recommends passage."
1918907,2025-01-14,House,1,"Introduced, referred to Public Safety. H.J. 45."
1918907,2025-01-15,House,2,"Subcommittee: Gustoff, Meyer, B. and Wengryn. H.J. 82."
1918907,2025-01-16,House,3,"Subcommittee Meeting: 01/22/2025 3:00PM House Lounge."
1918907,2025-01-22,House,4,"Subcommittee recommends passage."
1918907,2025-03-05,House,5,"Committee report, recommending amendment and passage. H.J. 530."
1918907,2025-03-05,House,6,"Committee vote: Yeas, 21. Nays, 0. Excused, 2. H.J. 530."
1918907,2025-03-10,House,7,"Committee report approving bill, renumbered as HF 899."
1918907,2025-03-31,House,8,"Withdrawn. H.J. 871."
1918916,2025-01-14,Senate,1,"Introduced, referred to Education. S.J. 68."
1918916,2025-01-28,Senate,2,"Subcommittee: Shipley, Garrett, and Trone Garriott. S.J. 151."
1918916,2025-02-11,Senate,3,"Subcommittee Meeting: 02/12/2025 11:30AM Senate Lounge."
1918916,2025-02-12,Senate,4,"Subcommittee recommends passage."
1918927,2025-01-14,Senate,1,"Introduced, referred to Transportation. S.J. 66."
1918927,2025-01-15,Senate,2,"Subcommittee: Shipley, Koelker, and Winckler. S.J. 90."
1918927,2025-01-27,Senate,3,"Subcommittee Meeting: 01/28/2025 12:30PM Senate Lounge."
1918927,2025-01-28,Senate,4,"Subcommittee recommends amendment and passage."
1918938,2025-01-14,House,1,"Introduced, referred to Public Safety. H.J. 44."
1918938,2025-01-15,House,2,"Subcommittee: Meggers, Gjerde and Rinker. H.J. 81."
1918938,2025-01-29,House,3,"Subcommittee Meeting: 01/30/2025 11:15AM House Lounge 2."
1918938,2025-01-30,House,4,"Subcommittee recommends passage."
1918938,2025-02-12,House,5,"Committee report, recommending amendment and passage. H.J. 311."
1918938,2025-02-12,House,6,"Committee vote: Yeas, 21. Nays, 0. Excused, 2. H.J. 311."
1918938,2025-02-20,House,7,"Committee report approving bill, renumbered as HF 549."
1918938,2025-03-14,House,8,"Withdrawn. H.J. 660."
1918943,2025-01-14,Senate,1,"Introduced, referred to Ways and Means. S.J. 66."
1918943,2025-01-22,Senate,2,"Subcommittee: Dickey, Dawson, and Townsend. S.J. 125."
1918943,2025-03-12,Senate,3,"Subcommittee Meeting: 03/13/2025 10:00AM Room 217 Conference Room."
1918943,2025-03-13,Senate,4,"Subcommittee recommends passage."
1918943,2025-03-19,Senate,5,"Committee report approving bill, renumbered as SF 609. S.J. 589."
1918956,2025-01-14,House,1,"Introduced, referred to Public Safety. H.J. 45."
1918956,2025-01-15,House,2,"Subcommittee: Meggers, Hermanson and Levin. H.J. 82."
1918956,2025-01-22,House,3,"Subcommittee Meeting: 01/23/2025 8:00AM RM 304.1."
1918956,2025-01-23,House,4,"Subcommittee recommends passage."
1918956,2025-01-29,House,5,"Committee report, recommending passage. H.J. 145."
1918956,2025-01-29,House,6,"Committee vote: Yeas, 21. Nays, 2. H.J. 145."
1918956,2025-01-30,House,7,"Committee report approving bill, renumbered as HF 178."
1918956,2025-03-07,House,8,"Withdrawn. H.J. 569."
1918965,2025-01-14,House,1,"Introduced, referred to State Government. H.J. 45."
1918965,2025-02-11,House,2,"Subcommittee: Wulf, Harris and Scheetz. H.J. 289."
1918965,2025-02-24,House,3,"Subcommittee Meeting: 02/24/2025 12:30PM RM 304."
1918965,2025-02-24,House,4,"Subcommittee recommends passage."
1918965,2025-02-26,House,5,"Committee report, recommending amendment and passage. H.J. 446."
1918965,2025-02-26,House,6,"Committee vote: Yeas, 15. Nays, 8. H.J. 446."
1918965,2025-03-03,House,7,"Committee report approving bill, renumbered as HF 711."
1918965,2025-03-21,House,8,"Withdrawn. H.J. 772."
1918981,2025-01-14,House,1,"Introduced, referred to Agriculture. H.J. 43."
1918981,2025-01-16,House,2,"Subcommittee: Meggers, Judge and Sitzmann. H.J. 98."
1918981,2025-01-22,House,3,"Subcommittee Meeting: 01/23/2025 12:30PM RM 304.1."
1918981,2025-01-23,House,4,"Subcommittee recommends passage."
1918981,2025-01-28,House,5,"Committee report, recommending passage. H.J. 136."
1918981,2025-01-28,House,6,"Committee vote: Yeas, 23. Nays, 0. H.J. 136."
1918981,2025-01-30,House,7,"Committee report approving bill, renumbered as HF 179."
1918981,2025-04-28,House,8,"Withdrawn. H.J. 1073."
1918986,2025-01-14,House,1,"Introduced, referred to Public Safety. H.J. 46."
1918986,2025-01-15,House,2,"Subcommittee: Rinker, Hermanson and Meyer, B. H.J. 82."
1918986,2025-01-15,House,3,"Subcommittee Meeting: 01/22/2025 8:30AM House Lounge 2."
1918986,2025-01-22,House,4,"Subcommittee recommends passage."
1918986,2025-01-29,House,5,"Committee report, recommending amendment and passage. H.J. 145."
1918986,2025-01-29,House,6,"Committee vote: Yeas, 21. Nays, 2. H.J. 145."
1918986,2025-01-30,House,7,"Committee report approving bill, renumbered as HF 176."
1918997,2025-01-14,House,1,"Introduced, referred to Judiciary. H.J. 44."
1918997,2025-01-16,House,2,"Subcommittee: Gustoff, Shipley and Wilburn. H.J. 98."
1918997,2025-01-21,House,3,"Subcommittee Meeting: 01/22/2025 3:30PM RM 19."
1918997,2025-01-22,House,4,"Subcommittee recommends passage."
1918997,2025-01-30,House,5,"Committee report, recommending passage. H.J. 174."
1918997,2025-01-30,House,6,"Committee vote: Yeas, 15. Nays, 6. H.J. 174."
1918997,2025-03-07,House,7,"Committee report approving bill, renumbered as HF 853."
1919005,2025-01-14,House,1,"Introduced, referred to Ways and Means. H.J. 46."
1919005,2025-01-23,House,2,"Subcommittee: Wulf, James and Jones. H.J. 122."
1919005,2025-01-28,House,3,"Subcommittee Meeting: 01/29/2025 11:45AM House Lounge."
1919005,2025-01-29,House,4,"Subcommittee recommends passage."
1919005,2025-02-25,House,5,"Committee report, recommending passage. H.J. 450."
1919005,2025-02-25,House,6,"Committee vote: Yeas, 24. Nays, 0. Excused, 1. H.J. 450."
1919005,2025-02-27,House,7,"Committee report approving bill, renumbered as HF 624."
1919005,2025-03-21,House,8,"Withdrawn. H.J. 772."
1919015,2025-01-14,House,1,"By COMMITTEE ON HEALTH AND HUMAN SERVICES"
1919015,2025-01-14,House,2,"Introduced, referred to Health and Human Services. H.J. 59."
1919015,2025-01-14,House,3,"Subcommittee: Weldon, Johnson, R. and Moore, T. H.J. 60."
1919015,2025-01-16,House,4,"Subcommittee Meeting: 01/21/2025 12:00PM RM 304."
1919015,2025-01-21,House,5,"Subcommittee recommends passage."
1919015,2025-02-06,House,6,"Committee report, recommending passage. H.J. 282."
1919015,2025-02-06,House,7,"Committee vote: Yeas, 20. Nays, 0. Excused, 1. H.J. 282."
1919015,2025-02-10,House,8,"Committee report approving bill, renumbered as HF 309."
1919025,2025-01-14,House,1,"Introduced, referred to Transportation. H.J. 46."
1919033,2025-01-14,Senate,1,"Introduced, referred to Ways and Means. S.J. 67."
1919033,2025-01-22,Senate,2,"Subcommittee: Rowley, Dawson, and Quirmbach. S.J. 125."
1919043,2025-01-14,Senate,1,"Introduced, referred to Transportation. S.J. 69."
1919043,2025-01-15,Senate,2,"Subcommittee: Shipley, Gruenhagen, and Winckler. S.J. 91."
1919043,2025-01-27,Senate,3,"Subcommittee Meeting: 01/29/2025 2:30PM Room 315."
1919043,2025-01-29,Senate,4,"Subcommittee recommends passage."
1919052,2025-01-14,Senate,1,"Introduced, referred to Transportation. S.J. 68."
1919052,2025-01-15,Senate,2,"Subcommittee: Klimesh, Townsend, and Zumbach. S.J. 91."
1919056,2025-01-14,House,1,"Introduced, referred to Public Safety. H.J. 45."
1919056,2025-01-15,House,2,"Subcommittee: Gustoff, Henderson and Kressig. H.J. 82."
1919056,2025-01-16,House,3,"Subcommittee Meeting: 01/21/2025 12:00PM RM 19."
1919056,2025-01-21,House,4,"Subcommittee recommends passage."
1919056,2025-03-05,House,5,"Committee report, recommending amendment and passage. H.J. 531."
1919056,2025-03-05,House,6,"Committee vote: Yeas, 20. Nays, 1. Excused, 2. H.J. 531."
1919342,2025-01-15,House,1,"By COMMITTEE ON HEALTH AND HUMAN SERVICES"
1919342,2025-01-15,House,2,"Introduced, referred to Health and Human Services. H.J. 77."
1919342,2025-01-15,House,3,"Subcommittee: Wood, Ehlert and Weldon. H.J. 82."
1919342,2025-01-21,House,4,"Subcommittee Meeting: 01/22/2025 8:15AM RM 103."
1919342,2025-01-22,House,5,"Subcommittee recommends passage."
1919342,2025-02-11,House,6,"Committee report, recommending passage. H.J. 297."
1919342,2025-02-11,House,7,"Committee vote: Yeas, 13. Nays, 7. Excused, 1. H.J. 297."
1919342,2025-02-13,House,8,"Committee report approving bill, renumbered as HF 382."
1919359,2025-01-15,House,1,"Introduced, referred to Judiciary. H.J. 62."
1919359,2025-01-16,House,2,"Subcommittee: Stone, Srinivas and Wills, J. H.J. 98."
1919359,2025-01-27,House,3,"Subcommittee Meeting: 01/29/2025 12:30PM RM 19."
1919359,2025-01-29,House,4,"Subcommittee recommends passage."
1919359,2025-02-06,House,5,"Committee report, recommending amendment and passage. H.J. 269."
1919359,2025-02-06,House,6,"Committee vote: Yeas, 16. Nays, 4. Excused, 1. H.J. 269."
1919359,2025-02-10,House,7,"Committee report approving bill, renumbered as HF 306."
1919359,2025-03-14,House,8,"Withdrawn. H.J. 660."
1919380,2025-01-15,House,1,"By COMMITTEE ON HEALTH AND HUMAN SERVICES"
1919380,2025-01-15,House,2,"Introduced, referred to Health and Human Services. H.J. 77."
1919380,2025-01-15,House,3,"Subcommittee: Lundgren, Nordman and Turek. H.J. 82."
1919380,2025-01-16,House,4,"Subcommittee Meeting: 01/22/2025 8:15AM RM 304.1."
1919380,2025-01-22,House,5,"Subcommittee recommends passage."
1919402,2025-01-15,House,1,"By COMMITTEE ON JUDICIARY"
1919402,2025-01-15,House,2,"Introduced, referred to Judiciary. H.J. 78."
1919402,2025-01-15,House,3,"Subcommittee: Dunwell, Nordman and Srinivas. H.J. 83."
1919402,2025-01-16,House,4,"Subcommittee Meeting: 01/21/2025 12:00PM RM 304.1."
1919402,2025-01-21,House,5,"Subcommittee recommends passage."
1919402,2025-01-28,House,6,"Committee report, recommending passage. H.J. 137."
1919402,2025-01-28,House,7,"Committee vote: Yeas, 21. Nays, 0. H.J. 137."
1919402,2025-02-12,House,8,"Committee report approving bill, renumbered as HF 363."
1919425,2025-01-15,House,1,"By COMMITTEE ON JUDICIARY"
1919425,2025-01-15,House,2,"Introduced, referred to Judiciary. H.J. 78."
1919425,2025-01-15,House,3,"Subcommittee: Williams, James and Wheeler. H.J. 83."
1919425,2025-01-18,House,4,"Subcommittee Meeting: 01/21/2025 4:00PM RM 304."
1919425,2025-01-21,House,5,"Subcommittee recommends passage."
1919425,2025-01-28,House,6,"Committee report, recommending amendment and passage. H.J. 136."
1919425,2025-01-28,House,7,"Committee vote: Yeas, 21. Nays, 0. H.J. 136."
1919425,2025-03-05,House,8,"Committee report approving bill, renumbered as HF 773."
1919447,2025-01-15,House,1,"By COMMITTEE ON HEALTH AND HUMAN SERVICES"
1919447,2025-01-15,House,2,"Introduced, referred to Health and Human Services. H.J. 77."
1919447,2025-01-15,House,3,"Subcommittee: Meyer, A., Barker and Brown-Powers. H.J. 82."
1919447,2025-01-16,House,4,"Subcommittee Meeting: 01/23/2025 8:00AM House Lounge."
1919447,2025-01-23,House,5,"Subcommittee recommends amendment and passage."
1919447,2025-02-06,House,6,"Committee report, recommending amendment and passage. H.J. 282."
1919447,2025-02-06,House,7,"Committee vote: Yeas, 19. Nays, 1. Excused, 1. H.J. 282."
1919447,2025-02-10,House,8,"Committee report approving bill, renumbered as HF 310."
1919470,2025-01-15,House,1,"Introduced, referred to Judiciary. H.J. 62."
1919470,2025-01-16,House,2,"Subcommittee: Wheeler, Fett and Srinivas. H.J. 98."
1919470,2025-01-22,House,3,"Subcommittee Meeting: 01/29/2025 12:00PM RM 19."
1919470,2025-01-29,House,4,"Subcommittee recommends passage."
1919470,2025-02-26,House,5,"Sponsor added, Young. H.J. 440."
1919470,2025-03-04,House,6,"Committee report, recommending amendment and passage. H.J. 505."
1919470,2025-03-04,House,7,"Committee vote: Yeas, 20. Nays, 0. Excused, 1. H.J. 505."
1919470,2025-03-07,House,8,"Committee report approving bill, renumbered as HF 864."
1919470,2025-03-21,House,9,"Withdrawn. H.J. 772."
1919491,2025-01-15,House,1,"Introduced, referred to Natural Resources. H.J. 62."
1919491,2025-01-21,House,2,"Subcommittee: Collins, Kurth and Sexton. H.J. 105."
1919491,2025-01-21,House,3,"Subcommittee Meeting: 01/23/2025 12:00PM House Lounge 2."
1919491,2025-01-23,House,4,"Subcommittee recommends passage."
1919491,2025-02-11,House,5,"Committee report, recommending amendment and passage. H.J. 299."
1919491,2025-02-11,House,6,"Committee vote: Yeas, 12. Nays, 9. H.J. 299."
1919491,2025-02-13,House,7,"Committee report approving bill, renumbered as HF 378."
1919517,2025-01-15,House,1,"Introduced, referred to Natural Resources. H.J. 61."
1919517,2025-01-21,House,2,"Subcommittee: Hermanson, Golding and Levin. H.J. 105."
1919517,2025-01-21,House,3,"Subcommittee Meeting: 01/23/2025 8:30AM House Lounge 2."
1919517,2025-01-23,House,4,"Subcommittee recommends passage."
1919540,2025-01-15,House,1,"By COMMITTEE ON LABOR AND WORKFORCE"
1919540,2025-01-15,House,2,"Introduced, referred to Labor and Workforce. H.J. 78."
1919540,2025-01-15,House,3,"Subcommittee: Bradley, Gerhold and Scheetz. H.J. 83."
1919540,2025-01-21,House,4,"Subcommittee Meeting: 01/22/2025 3:30PM House Lounge."
1919540,2025-01-22,House,5,"Subcommittee recommends passage."
1919540,2025-02-13,House,6,"Committee report, recommending passage. H.J. 333."
1919540,2025-02-13,House,7,"Committee vote: Yeas, 16. Nays, 0. Excused, 1. H.J. 333."
1919540,2025-02-17,House,8,"Committee report approving bill, renumbered as HF 441."
1919563,2025-01-15,House,1,"By COMMITTEE ON JUDICIARY"
1919563,2025-01-15,House,2,"Introduced, referred to Judiciary. H.J. 77."
1919563,2025-01-15,House,3,"Subcommittee: Gustoff, Fett and Srinivas. H.J. 82."
1919563,2025-01-16,House,4,"Subcommittee Meeting: 01/21/2025 12:30PM RM 19."
1919563,2025-01-21,House,5,"Subcommittee recommends passage."
1919563,2025-01-28,House,6,"Committee report, recommending passage. H.J. 136."
1919563,2025-01-28,House,7,"Committee vote: Yeas, 21. Nays, 0. H.J. 136."
1919563,2025-03-07,House,8,"Committee report approving bill, renumbered as HF 836."
1919583,2025-01-15,House,1,"By COMMITTEE ON JUDICIARY"
1919583,2025-01-15,House,2,"Introduced, referred to Judiciary. H.J. 78."
1919583,2025-01-15,House,3,"Subcommittee: Lohse, Olson and Thompson, M. H.J. 83."
1919583,2025-01-21,House,4,"Subcommittee Meeting: 01/27/2025 12:00PM House Lounge."
1919583,2025-01-27,House,5,"Subcommittee recommends passage."
1919583,2025-02-06,House,6,"Committee report, recommending amendment and passage. H.J. 270."
1919583,2025-02-06,House,7,"Committee vote: Yeas, 19. Nays, 1. Excused, 1. H.J. 270."
1919583,2025-02-10,House,8,"Committee report approving bill, renumbered as HF 317."
1919610,2025-01-15,House,1,"Introduced, referred to Economic Growth and Technology. H.J. 61."
1919610,2025-01-16,House,2,"Subcommittee: Sexton, Croken and Latham. H.J. 98."
1919610,2025-01-22,House,3,"Subcommittee Meeting: 01/23/2025 12:30PM House Lounge 2."
1919610,2025-01-23,House,4,"Subcommittee recommends passage."
1919610,2025-02-19,House,5,"Committee report, recommending amendment and passage. H.J. 363."
1919610,2025-02-19,House,6,"Committee vote: Yeas, 21. Nays, 0. H.J. 364."
1919610,2025-02-24,House,7,"Committee report approving bill, renumbered as HF 550."
1919610,2025-04-28,House,8,"Withdrawn. H.J. 1073."
1919635,2025-01-15,House,1,"Introduced, referred to Education. H.J. 63."
1919653,2025-01-15,House,1,"By COMMITTEE ON JUDICIARY"
1919653,2025-01-15,House,2,"Introduced, referred to Judiciary. H.J. 78."
1919653,2025-01-15,House,3,"Subcommittee: Holt, James and Wheeler. H.J. 83."
1919653,2025-01-16,House,4,"Subcommittee Meeting: 01/22/2025 12:00PM RM 102."
1919653,2025-01-22,House,5,"Subcommittee recommends passage."
1919653,2025-02-20,House,6,"Committee report, recommending amendment and passage. H.J. 410."
1919653,2025-02-20,House,7,"Committee vote: Yeas, 13. Nays, 4. Excused, 4. H.J. 410."
1919653,2025-02-24,House,8,"Committee report approving bill, renumbered as HF 572."
1919680,2025-01-15,House,1,"By COMMITTEE ON HEALTH AND HUMAN SERVICES"
1919680,2025-01-15,House,2,"Introduced, referred to Health and Human Services. H.J. 77."
1919680,2025-01-15,House,3,"Subcommittee: Nordman, Baeth and Moore, T. H.J. 82."
1919680,2025-01-16,House,4,"Subcommittee Meeting: 01/21/2025 12:30PM RM 304."
1919680,2025-01-21,House,5,"Subcommittee recommends passage."
1919680,2025-02-11,House,6,"Committee report, recommending amendment and passage. H.J. 297."
1919680,2025-02-11,House,7,"Committee vote: Yeas, 20. Nays, 0. Excused, 1. H.J. 297."
1919680,2025-02-13,House,8,"Committee report approving bill, renumbered as HF 390."
1919700,2025-01-15,House,1,"Introduced, referred to Judiciary. H.J. 62."
1919722,2025-01-15,House,1,"Introduced, referred to Education. H.J. 62."
1919722,2025-01-22,House,2,"Subcommittee: Johnson, C., Boden and Ehlert. H.J. 116."
1919722,2025-01-27,House,3,"Subcommittee Meeting: 01/28/2025 12:00PM RM 103."
1919722,2025-01-28,House,4,"Subcommittee recommends amendment and passage."
1919722,2025-02-06,House,5,"Committee report, recommending passage. H.J. 267."
1919722,2025-02-06,House,6,"Committee vote: Yeas, 22. Nays, 0. Excused, 1. H.J. 267."
1919722,2025-02-10,House,7,"Committee report approving bill, renumbered as HF 315."
1919722,2025-03-14,House,8,"Withdrawn. H.J. 660."
1919746,2025-01-15,House,1,"Introduced, referred to State Government. H.J. 62."
1919746,2025-01-23,House,2,"Subcommittee: Bossman, Cooling and Smith. H.J. 122."
1919746,2025-01-27,House,3,"Subcommittee Meeting: 01/29/2025 12:00PM RM 102."
1919746,2025-01-29,House,4,"Subcommittee recommends passage."
1919771,2025-01-15,House,1,"By COMMITTEE ON COMMERCE"
1919771,2025-01-15,House,2,"Introduced, referred to Commerce. H.J. 78."
1919771,2025-01-15,House,3,"Subcommittee: Nordman, Lawler and Srinivas. H.J. 83."
1919771,2025-01-21,House,4,"Subcommittee Meeting: 01/23/2025 12:30PM House Lounge."
1919771,2025-01-23,House,5,"Subcommittee recommends passage."
1919771,2025-02-06,House,6,"Committee report, recommending passage. H.J. 266."
1919771,2025-02-06,House,7,"Committee vote: Yeas, 23. Nays, 0. H.J. 266."
1919771,2025-02-10,House,8,"Committee report approving bill, renumbered as HF 303."
1919792,2025-01-15,House,1,"By COMMITTEE ON JUDICIARY"
1919792,2025-01-15,House,2,"Introduced, referred to Judiciary. H.J. 78."
1919792,2025-01-15,House,3,"Subcommittee: Lawler, Gustoff and Wilburn. H.J. 83."
1919792,2025-01-16,House,4,"Subcommittee Meeting: 01/22/2025 12:30PM House Lounge."
1919792,2025-01-22,House,5,"Subcommittee recommends passage."
1919792,2025-01-30,House,6,"Committee report, recommending passage. H.J. 174."
1919792,2025-01-30,House,7,"Committee vote: Yeas, 19. Nays, 2. H.J. 174."
1919792,2025-02-03,House,8,"Committee report approving bill, renumbered as HF 198."
1919815,2025-01-15,House,1,"By COMMITTEE ON JUDICIARY"
1919815,2025-01-15,House,2,"Introduced, referred to Judiciary. H.J. 78."
1919815,2025-01-15,House,3,"Subcommittee: Lawler, Meyer, B. and Thomson, C. H.J. 83."
1919815,2025-01-21,House,4,"Subcommittee Meeting: 01/22/2025 8:00AM RM 103 (Cancelled)."
1919815,2025-01-21,House,5,"Subcommittee Meeting: 01/23/2025 1:30PM RM 102."
1919815,2025-01-23,House,6,"Subcommittee recommends passage."
1919838,2025-01-15,House,1,"Introduced, referred to Commerce. H.J. 61."
1919861,2025-01-15,House,1,"By COMMITTEE ON JUDICIARY"
1919861,2025-01-15,House,2,"Introduced, referred to Judiciary. H.J. 77."
1919861,2025-01-15,House,3,"Subcommittee: Thomson, C., Lawler and Olson. H.J. 83."
1919861,2025-01-27,House,4,"Subcommittee Meeting: 01/28/2025 3:30PM RM 19."
1919861,2025-01-28,House,5,"Tabled until future meeting."
1919884,2025-01-15,House,1,"Introduced, referred to Health and Human Services. H.J. 62."
1919906,2025-01-15,House,1,"Introduced, referred to State Government. H.J. 61."
1919906,2025-01-23,House,2,"Subcommittee: Jones, Cooling and Wulf. H.J. 122."
1919906,2025-01-23,House,3,"Subcommittee Meeting: 01/28/2025 8:00AM House Lounge."
1919906,2025-01-28,House,4,"Subcommittee recommends passage."
1919906,2025-02-19,House,5,"Committee report, recommending amendment and passage. H.J. 368."
1919906,2025-02-19,House,6,"Committee vote: Yeas, 14. Nays, 8. Excused, 1. H.J. 368."
1919906,2025-02-20,House,7,"Committee report approving bill, renumbered as HF 526."
1920054,2025-01-15,House,1,"By COMMITTEE ON PUBLIC SAFETY"
1920054,2025-01-15,House,2,"Introduced, referred to Public Safety. H.J. 79."
1920054,2025-01-15,House,3,"Subcommittee: Wills, J., Brown-Powers and Wengryn. H.J. 83."
1920054,2025-01-16,House,4,"Subcommittee Meeting: 01/22/2025 7:00AM House Lounge."
1920054,2025-01-22,House,5,"Subcommittee recommends amendment and passage."
1920054,2025-01-29,House,6,"Committee report, recommending amendment and passage. H.J. 146."
1920054,2025-01-29,House,7,"Committee vote: Yeas, 21. Nays, 2. H.J. 146."
1920054,2025-01-30,House,8,"Committee report approving bill, renumbered as HF 177."
1920120,2025-01-15,Senate,1,"Introduced, referred to Local Government. S.J. 87."
1920120,2025-01-15,Senate,2,"Subcommittee: Driscoll, Webster, and Weiner. S.J. 91."
1920190,2025-01-15,House,1,"By COMMITTEE ON PUBLIC SAFETY"
1920190,2025-01-15,House,2,"Introduced, referred to Public Safety. H.J. 79."
1920190,2025-01-15,House,3,"Subcommittee: Holt, Levin and Thomson, C. H.J. 83."
1920190,2025-01-16,House,4,"Subcommittee Meeting: 01/23/2025 12:00PM RM 19."
1920190,2025-01-23,House,5,"Subcommittee recommends passage."
1920190,2025-03-05,House,6,"Committee report, recommending passage. H.J. 532."
1920190,2025-03-05,House,7,"Committee vote: Yeas, 21. Nays, 0. Excused, 2. H.J. 532."
1920190,2025-03-07,House,8,"Committee report approving bill, renumbered as HF 850."
1920266,2025-01-15,Senate,1,"Introduced, referred to Ways and Means. S.J. 88."
1920266,2025-01-22,Senate,2,"Subcommittee: Koelker, Klimesh, and Quirmbach. S.J. 125."
1920266,2025-03-03,Senate,3,"Subcommittee reassigned: Klimesh, Koelker, and Quirmbach. S.J. 392."
1920266,2025-03-26,Senate,4,"Subcommittee Meeting: 03/27/2025 1:30PM Senate Lounge."
1920266,2025-03-27,Senate,5,"Subcommittee recommends amendment and passage."
1920266,2025-05-09,Senate,6,"Committee report approving bill, renumbered as SF 655. S.J. 956."
1920340,2025-01-15,House,1,"By COMMITTEE ON PUBLIC SAFETY"
1920340,2025-01-15,House,2,"Introduced, referred to Public Safety. H.J. 79."
1920340,2025-01-15,House,3,"Subcommittee: Dieken, Wengryn and Wessel-Kroeschell. H.J. 84."
1920340,2025-01-16,House,4,"Subcommittee Meeting: 01/22/2025 8:30AM RM 304."
1920340,2025-01-22,House,5,"Subcommittee recommends passage."
1920340,2025-01-29,House,6,"Committee report, recommending passage. H.J. 146."
1920340,2025-01-29,House,7,"Committee vote: Yeas, 23. Nays, 0. H.J. 146."
1920340,2025-01-30,House,8,"Committee report approving bill, renumbered as HF 182."
1920411,2025-01-15,House,1,"By COMMITTEE ON PUBLIC SAFETY"
1920411,2025-01-15,House,2,"Introduced, referred to Public Safety. H.J. 79."
1920411,2025-01-15,House,3,"Subcommittee: Dieken, Gearhart and Wessel-Kroeschell. H.J. 83."
1920411,2025-01-16,House,4,"Subcommittee Meeting: 01/22/2025 8:00AM RM 304."
1920411,2025-01-22,House,5,"Subcommittee recommends passage."
1920411,2025-01-29,House,6,"Committee report, recommending passage. H.J. 146."
1920411,2025-01-29,House,7,"Committee vote: Yeas, 20. Nays, 3. H.J. 146."
1920411,2025-01-30,House,8,"Committee report approving bill, renumbered as HF 180."
1920479,2025-01-15,House,1,"By COMMITTEE ON PUBLIC SAFETY"
1920479,2025-01-15,House,2,"Introduced, referred to Public Safety. H.J. 79."
1920479,2025-01-15,House,3,"Subcommittee: Henderson, Gearhart and Gosa. H.J. 83."
1920479,2025-01-23,House,4,"Subcommittee Meeting: 01/27/2025 12:30PM House Lounge 2."
1920479,2025-01-27,House,5,"Subcommittee recommends passage."
1920479,2025-02-05,House,6,"Committee report, recommending amendment and passage. H.J. 185."
1920479,2025-02-05,House,7,"Committee vote: Yeas, 23. Nays, 0. H.J. 185."
1920479,2025-02-06,House,8,"Committee report approving bill, renumbered as HF 249."
1920557,2025-01-15,Senate,1,"By COMMITTEE ON WORKFORCE"
1920557,2025-01-15,Senate,2,"Introduced, referred to Workforce."
1920557,2025-01-15,Senate,3,"Subcommittee: Dickey, Dotzler, and Pike."
1920557,2025-01-21,Senate,4,"Subcommittee Meeting: 01/22/2025 10:00AM Room 315."
1920557,2025-01-22,Senate,5,"Subcommittee recommends passage."
1920557,2025-01-22,Senate,6,"Committee report approving bill, renumbered as SF 110."
1920631,2025-01-15,Senate,1,"Introduced, referred to Ways and Means. S.J. 88."
1920631,2025-01-22,Senate,2,"Subcommittee: Dawson, Celsi, and Rowley. S.J. 125."
1920702,2025-01-15,Senate,1,"By COMMITTEE ON TRANSPORTATION"
1920702,2025-01-15,Senate,2,"Introduced, referred to Transportation."
1920702,2025-01-21,Senate,3,"Subcommittee: Warme, Townsend, and Zumbach."
1920702,2025-01-22,Senate,4,"Subcommittee Meeting: 01/22/2025 10:00AM Room G15."
1920702,2025-01-22,Senate,5,"Subcommittee recommends passage."
1920702,2025-01-28,Senate,6,"Committee report approving bill, renumbered as SF 153."
1920770,2025-01-15,House,1,"By COMMITTEE ON LABOR AND WORKFORCE"
1920770,2025-01-15,House,2,"Introduced, referred to Labor and Workforce. H.J. 79."
1920770,2025-01-15,House,3,"Subcommittee: Meggers, Amos Jr. and Rinker. H.J. 84."
1920770,2025-01-28,House,4,"Subcommittee Meeting: 01/29/2025 8:30AM RM 304."
1920770,2025-01-29,House,5,"Subcommittee recommends passage."
1920770,2025-02-13,House,6,"Committee report, recommending passage. H.J. 333."
1920770,2025-02-13,House,7,"Committee vote: Yeas, 10. Nays, 6. Excused, 1. H.J. 333."
1920770,2025-03-05,House,8,"Committee report approving bill, renumbered as HF 767."
1920927,2025-01-15,House,1,"By COMMITTEE ON VETERANS AFFAIRS"
1920927,2025-01-15,House,2,"Introduced, referred to Veterans Affairs. H.J. 79."
1920927,2025-01-15,House,3,"Subcommittee: Thompson, M., Gearhart and Wichtendahl. H.J. 84."
1920927,2025-01-16,House,4,"Subcommittee Meeting: 01/21/2025 12:25PM House Lounge."
1920927,2025-01-21,House,5,"Subcommittee recommends passage."
1920927,2025-02-05,House,6,"Committee report, recommending amendment and passage. H.J. 186."
1920927,2025-02-05,House,7,"Committee vote: Yeas, 16. Nays, 0. Excused, 1. H.J. 186."
1920927,2025-02-06,House,8,"Committee report approving bill, renumbered as HF 250."
1921009,2025-01-15,Senate,1,"Introduced, referred to Technology. S.J. 88."
1921009,2025-01-21,Senate,2,"Subcommittee: Gruenhagen, Bennett, and Taylor. S.J. 114."
1921009,2025-01-22,Senate,3,"Subcommittee Meeting: 01/23/2025 12:00PM Room 315."
1921009,2025-01-23,Senate,4,"Subcommittee recommends passage."
1921009,2025-01-28,Senate,5,"Committee report approving bill, renumbered as SF 146. S.J. 156."
1921090,2025-01-15,House,1,"By COMMITTEE ON EDUCATION"
1921090,2025-01-15,House,2,"Introduced, referred to Education. H.J. 80."
1921090,2025-01-15,House,3,"Subcommittee: Henderson, Kniff McCulla and Levin. H.J. 84."
1921090,2025-01-21,House,4,"Subcommittee Meeting: 01/22/2025 12:30PM RM 304.1."
1921090,2025-01-22,House,5,"Subcommittee recommends passage."
1921090,2025-01-28,House,6,"Committee report, recommending passage. H.J. 143."
1921090,2025-01-28,House,7,"Committee vote: Yeas, 14. Nays, 8. Excused, 1. H.J. 143."
1921090,2025-01-30,House,8,"Committee report approving bill, renumbered as HF 165."
1921175,2025-01-15,Senate,1,"Introduced, referred to Commerce. S.J. 88."
1921175,2025-01-16,Senate,2,"Subcommittee: Webster, Gruenhagen, and Knox. S.J. 107."
1921175,2025-01-22,Senate,3,"Subcommittee Meeting: 01/23/2025 8:30AM Room 217 Conference Room."
1921175,2025-01-23,Senate,4,"Subcommittee recommends amendment and passage."
1921175,2025-02-20,Senate,5,"Committee report approving bill, renumbered as SF 399. S.J. 330."
1921255,2025-01-15,Senate,1,"Introduced, referred to Judiciary. S.J. 89."
1921255,2025-01-16,Senate,2,"Subcommittee: Bousselot, Blake, and Evans. S.J. 108."
1921255,2025-01-22,Senate,3,"Subcommittee Meeting: 01/23/2025 10:00AM Senate Lounge."
1921255,2025-01-23,Senate,4,"Subcommittee recommends passage."
1921335,2025-01-15,Senate,1,"Introduced, referred to Health and Human Services. S.J. 88."
1921335,2025-01-21,Senate,2,"Subcommittee: Lofgren, Campbell, and Trone Garriott. S.J. 114."
1921335,2025-01-23,Senate,3,"Subcommittee Meeting: 01/28/2025 9:30AM Room 315."
1921335,2025-01-28,Senate,4,"Subcommittee recommends amendment and passage."
1921335,2025-03-10,Senate,5,"Committee report approving bill, renumbered as SF 581. S.J. 471."
1921420,2025-01-15,House,1,"By COMMITTEE ON PUBLIC SAFETY"
1921420,2025-01-15,House,2,"Introduced, referred to Public Safety. H.J. 80."
1921420,2025-01-15,House,3,"Subcommittee: Dieken, Amos Jr. and Gearhart. H.J. 84."
1921420,2025-01-21,House,4,"Subcommittee Meeting: 01/23/2025 12:00PM House Lounge."
1921420,2025-01-23,House,5,"Subcommittee recommends passage."
1921420,2025-01-29,House,6,"Committee report, recommending passage. H.J. 146."
1921420,2025-01-29,House,7,"Committee vote: Yeas, 23. Nays, 0. H.J. 146."
1921420,2025-01-30,House,8,"Committee report approving bill, renumbered as HF 181."
1921507,2025-01-15,House,1,"By COMMITTEE ON EDUCATION"
1921507,2025-01-15,House,2,"Introduced, referred to Education. H.J. 80."
1921507,2025-01-15,House,3,"Subcommittee: Gehlbach, Johnson, C. and Kurth. H.J. 84."
1921507,2025-01-22,House,4,"Subcommittee Meeting: 01/28/2025 8:15AM House Lounge."
1921507,2025-01-28,House,5,"Subcommittee recommends passage."
1921507,2025-01-28,House,6,"Committee report, recommending amendment and passage. H.J. 143."
1921507,2025-01-28,House,7,"Committee vote: Yeas, 22. Nays, 0. Excused, 1. H.J. 143."
1921507,2025-01-30,House,8,"Committee report approving bill, renumbered as HF 190."
1921585,2025-01-15,House,1,"By COMMITTEE ON VETERANS AFFAIRS"
1921585,2025-01-15,House,2,"Introduced, referred to Veterans Affairs. H.J. 79."
1921585,2025-01-15,House,3,"Subcommittee: Rinker, Hermanson and McBurney. H.J. 84."
1921585,2025-01-16,House,4,"Subcommittee Meeting: 01/22/2025 12:00PM House Lounge."
1921585,2025-01-22,House,5,"Subcommittee recommends passage."
1921585,2025-02-19,House,6,"Committee report, recommending passage. H.J. 372."
1921585,2025-02-19,House,7,"Committee vote: Yeas, 16. Nays, 0. Excused, 1. H.J. 372."
1921585,2025-02-20,House,8,"Committee report approving bill, renumbered as HF 534."
1921670,2025-01-15,Senate,1,"Introduced, referred to Transportation. S.J. 89."
1921670,2025-01-23,Senate,2,"Subcommittee: Klimesh, Pike, and Townsend. S.J. 135."
1921750,2025-01-15,Senate,1,"Introduced, referred to State Government. S.J. 88."
1921750,2025-01-17,Senate,2,"Rereferred to Judiciary. S.J. 109."
1921750,2025-01-23,Senate,3,"Subcommittee: Reichman, Blake, and Taylor. S.J. 135."
1921750,2025-01-27,Senate,4,"Subcommittee Meeting: 01/28/2025 9:30AM Room 217 Conference Room."
1921750,2025-01-28,Senate,5,"Subcommittee recommends passage."
1921750,2025-02-12,Senate,6,"Committee report, recommending passage. S.J. 259."
1921750,2025-02-12,Senate,7,"Placed on calendar."
1921750,2025-02-26,Senate,8,"Amendment S-3010 filed. S.J. 372."
1921750,2025-03-12,Senate,9,"Attached to HF 472. S.J. 495."
1921750,2025-04-03,Senate,10,"Placed on calendar under unfinished business. S.J. 688."
1921750,2025-04-16,Senate,11,"Amendment S-3010 withdrawn. S.J. 810."
1921750,2025-04-16,Senate,12,"HF 472 substituted. S.J. 810."
1921750,2025-04-16,Senate,13,"Withdrawn. S.J. 811."
1921834,2025-01-15,House,1,"By COMMITTEE ON EDUCATION"
1921834,2025-01-15,House,2,"Introduced, referred to Education. H.J. 80."
1921834,2025-01-15,House,3,"Subcommittee: Ingels, Ehlert and Moore, T. H.J. 84."
1921834,2025-01-21,House,4,"Subcommittee Meeting: 01/22/2025 8:45AM House Lounge."
1921834,2025-01-22,House,5,"Subcommittee recommends passage."
1921834,2025-01-28,House,6,"Committee report, recommending amendment and passage. H.J. 143."
1921834,2025-01-28,House,7,"Committee vote: Yeas, 22. Nays, 0. Excused, 1. H.J. 143."
1921916,2025-01-15,House,1,"By COMMITTEE ON EDUCATION"
1921916,2025-01-15,House,2,"Introduced, referred to Education. H.J. 80."
1921916,2025-01-15,House,3,"Subcommittee: Hayes, Boden and Wessel-Kroeschell. H.J. 84."
1921916,2025-01-29,House,4,"Subcommittee Meeting: 01/30/2025 12:00PM RM 304."
1921916,2025-01-30,House,5,"Subcommittee recommends passage."
1921916,2025-02-11,House,6,"Committee report, recommending passage. H.J. 295."
1921916,2025-02-11,House,7,"Committee vote: Yeas, 16. Nays, 7. H.J. 295."
1921916,2025-02-13,House,8,"Committee report approving bill, renumbered as HF 391."
1921997,2025-01-15,Senate,1,"Introduced, referred to Judiciary. S.J. 89."
1921997,2025-01-16,Senate,2,"Subcommittee: Reichman, Quirmbach, and Webster. S.J. 107."
1921997,2025-01-21,Senate,3,"Subcommittee Meeting: 01/22/2025 3:00PM Senate Lounge."
1921997,2025-01-22,Senate,4,"Subcommittee recommends passage."
1922079,2025-01-15,Senate,1,"Introduced, referred to Transportation. S.J. 89."
1922079,2025-01-23,Senate,2,"Subcommittee: Dickey, Blake, and Webster. S.J. 135."
1922079,2025-01-27,Senate,3,"Subcommittee Meeting: 01/28/2025 3:30PM Room 217 Conference Room."
1922079,2025-01-28,Senate,4,"Subcommittee recommends amendment and passage."
1922079,2025-02-11,Senate,5,"Committee report approving bill, renumbered as SF 259. S.J. 247."
1922155,2025-01-15,House,1,"By COMMITTEE ON EDUCATION"
1922155,2025-01-15,House,2,"Introduced, referred to Education. H.J. 80."
1922155,2025-01-15,House,3,"Subcommittee: Shipley, Hayes and Madison. H.J. 84."
1922155,2025-01-21,House,4,"Subcommittee Meeting: 01/27/2025 12:30PM House Lounge."
1922155,2025-01-27,House,5,"Subcommittee recommends passage."
1922155,2025-01-28,House,6,"Committee report, recommending passage. H.J. 143."
1922155,2025-01-28,House,7,"Committee vote: Yeas, 15. Nays, 7. Excused, 1. H.J. 143."
1922155,2025-01-30,House,8,"Committee report approving bill, renumbered as HF 166."
1922546,2025-01-16,House,1,"Introduced, referred to Education. H.J. 87."
1922546,2025-01-23,House,2,"Subcommittee: Hayes, Matson and Stone. H.J. 123."
1922546,2025-01-27,House,3,"Subcommittee Meeting: 01/28/2025 8:30AM RM 103."
1922546,2025-01-28,House,4,"Subcommittee recommends passage."
1922584,2025-01-16,House,1,"Introduced, referred to Judiciary. H.J. 87."
1922584,2025-01-21,House,2,"Subcommittee: Thomson, C., Fett and Srinivas. H.J. 106."
1922584,2025-01-22,House,3,"Subcommittee Meeting: 01/23/2025 2:00PM RM 102."
1922584,2025-01-23,House,4,"Subcommittee recommends passage."
1922584,2025-03-04,House,5,"Committee report, recommending amendment and passage. H.J. 506."
1922584,2025-03-04,House,6,"Committee vote: Yeas, 20. Nays, 0. Excused, 1. H.J. 506."
1922584,2025-03-06,House,7,"Committee report approving bill, renumbered as HF 826."
1922584,2025-03-31,House,8,"Withdrawn. H.J. 871."
1922623,2025-01-16,House,1,"Introduced, referred to Public Safety. H.J. 87."
1922660,2025-01-16,House,1,"Introduced, referred to Education. H.J. 85."
1922660,2025-01-21,House,2,"Rereferred to State Government. H.J. 104."
1922660,2025-01-30,House,3,"Subcommittee: Harris, Dunwell and Scheetz. H.J. 170."
1922660,2025-02-03,House,4,"Subcommittee Meeting: 02/05/2025 12:00PM House Lounge."
1922660,2025-02-05,House,5,"Subcommittee recommends passage."
1922660,2025-02-12,House,6,"Committee report, recommending amendment and passage. H.J. 311."
1922660,2025-02-12,House,7,"Committee vote: Yeas, 22. Nays, 1. H.J. 311."
1922660,2025-03-05,House,8,"Committee report approving bill, renumbered as HF 769."
1922703,2025-01-16,House,1,"Introduced, referred to Education. H.J. 86."
1922741,2025-01-16,House,1,"Introduced, referred to State Government. H.J. 87."
1922741,2025-01-23,House,2,"Subcommittee: Wilz, H., Harris and Turek. H.J. 123."
1922741,2025-01-23,House,3,"Subcommittee Meeting: 01/28/2025 8:45AM RM 304."
1922741,2025-01-28,House,4,"Subcommittee recommends passage."
1922741,2025-01-29,House,5,"Committee report, recommending passage. H.J. 510."
1922741,2025-01-29,House,6,"Committee vote: Yeas, 22. Nays, 0. Excused, 1. H.J. 510."
1922741,2025-03-04,House,7,"Placed on calendar. H.J. 510."
1922741,2025-04-03,House,8,"Rereferred to State Government. H.J. 895."
1922781,2025-01-16,Senate,1,"By COMMITTEE ON HEALTH AND HUMAN SERVICES"
1922781,2025-01-16,Senate,2,"Introduced, referred to Health and Human Services."
1922781,2025-01-16,Senate,3,"Subcommittee: Klimesh, Alons, and Petersen."
1922781,2025-01-17,Senate,4,"Subcommittee Meeting: 01/22/2025 10:00AM Senate Lounge."
1922781,2025-01-22,Senate,5,"Subcommittee recommends amendment and passage."
1922781,2025-02-12,Senate,6,"Committee report approving bill, renumbered as SF 315."
1922818,2025-01-16,House,1,"Introduced, referred to Transportation. H.J. 87."
1922818,2025-01-29,House,2,"Subcommittee: Young, Sieck and Wilson. H.J. 140."
1922818,2025-02-03,House,3,"Subcommittee Meeting: 02/05/2025 2:30PM House Lounge."
1922818,2025-02-05,House,4,"Tabled until future meeting."
1922864,2025-01-16,House,1,"Introduced, referred to Health and Human Services. H.J. 86."
1922900,2025-01-16,Senate,1,"By COMMITTEE ON HEALTH AND HUMAN SERVICES"
1922900,2025-01-16,Senate,2,"Introduced, referred to Health and Human Services."
1922900,2025-01-16,Senate,3,"Subcommittee: Klimesh, Costello, and Trone Garriott."
1922900,2025-01-22,Senate,4,"Subcommittee Meeting: 01/23/2025 3:30PM Senate Lounge."
1922900,2025-01-23,Senate,5,"Subcommittee recommends passage."
1922900,2025-02-06,Senate,6,"Committee report approving bill, renumbered as SF 231."
1922937,2025-01-16,House,1,"Introduced, referred to Education. H.J. 85."
1922937,2025-02-25,House,2,"Subcommittee: Hora, Stone and Wessel-Kroeschell. H.J. 427."
1922937,2025-02-27,House,3,"Subcommittee Meeting: 03/05/2025 12:00PM RM 304."
1922937,2025-03-05,House,4,"Subcommittee recommends passage."
1922937,2025-03-05,House,5,"Committee report, recommending passage. H.J. 526."
1922937,2025-03-05,House,6,"Committee vote: Yeas, 16. Nays, 7. H.J. 526."
1922937,2025-03-10,House,7,"Committee report approving bill, renumbered as HF 900."
1922980,2025-01-16,House,1,"Introduced, referred to Transportation. H.J. 86."
1922980,2025-01-29,House,2,"Subcommittee: Henderson, Golding and Kressig. H.J. 140."
1922980,2025-02-05,House,3,"Subcommittee reassigned: Henderson, Kressig and Meyer, A. H.J. 183."
1922980,2025-02-05,House,4,"Subcommittee Meeting: 02/06/2025 8:30AM House Lounge 2."
1922980,2025-02-06,House,5,"Subcommittee recommends passage."
1922980,2025-02-19,House,6,"Committee report, recommending passage. H.J. 370."
1922980,2025-02-19,House,7,"Committee vote: Yeas, 20. Nays, 0. Excused, 1. H.J. 370."
1922980,2025-03-05,House,8,"Committee report approving bill, renumbered as HF 765."
1923015,2025-01-16,House,1,"Introduced, referred to Public Safety. H.J. 86."
1923060,2025-01-16,House,1,"Introduced, referred to Transportation. H.J. 86."
1923060,2025-01-29,House,2,"Subcommittee: Meggers, Behn and Gosa. H.J. 140."
1923060,2025-02-05,House,3,"Subcommittee Meeting: 02/06/2025 12:30PM RM 102."
1923060,2025-02-06,House,4,"Subcommittee recommends amendment and passage."
1923060,2025-02-26,House,5,"Committee report, recommending amendment and passage. H.J. 448."
1923060,2025-02-26,House,6,"Committee vote: Yeas, 18. Nays, 2. Excused, 1. H.J. 448."
1923060,2025-03-05,House,7,"Committee report approving bill, renumbered as HF 762."
1923099,2025-01-16,House,1,"Introduced, referred to Health and Human Services. H.J. 85."
1923099,2025-01-16,House,2,"Rereferred to Commerce. H.J. 97."
1923099,2025-01-22,House,3,"Subcommittee: Mohr, G., Latham and Srinivas. H.J. 116."
1923099,2025-01-22,House,4,"Subcommittee Meeting: 01/23/2025 8:30AM RM 102."
1923099,2025-01-23,House,5,"Subcommittee recommends amendment and passage."
1923099,2025-02-06,House,6,"Committee report, recommending amendment and passage. H.J. 266."
1923099,2025-02-06,House,7,"Committee vote: Yeas, 23. Nays, 0. H.J. 266."
1923099,2025-02-10,House,8,"Committee report approving bill, renumbered as HF 308."
1923140,2025-01-16,House,1,"Introduced, referred to Ways and Means. H.J. 86."
1923140,2025-01-23,House,2,"Subcommittee: Vondran, Behn and Wilson. H.J. 123."
1923140,2025-02-05,House,3,"Subcommittee Meeting: 02/05/2025 8:00AM House Lounge 2."
1923140,2025-02-05,House,4,"Subcommittee recommends passage."
1923179,2025-01-16,House,1,"By COMMITTEE ON JUDICIARY"
1923179,2025-01-16,House,2,"Introduced, referred to Judiciary. H.J. 98."
1923179,2025-01-16,House,3,"Subcommittee: Thomson, C., James and Wheeler. H.J. 98."
1923179,2025-01-16,House,4,"Subcommittee Meeting: 01/22/2025 8:00AM RM 304.1."
1923179,2025-01-22,House,5,"Subcommittee recommends passage."
1923179,2025-02-24,House,6,"Committee report, recommending passage. H.J. 420."
1923179,2025-02-24,House,7,"Committee vote: Yeas, 18. Nays, 3. H.J. 420."
1923179,2025-02-25,House,8,"Committee report approving bill, renumbered as HJR 9."
1923213,2025-01-16,House,1,"Introduced, referred to Public Safety. H.J. 85."
1923213,2025-01-21,House,2,"Subcommittee: Meggers, Gosa and Henderson. H.J. 106."
1923213,2025-01-27,House,3,"Subcommittee Meeting: 01/28/2025 2:30PM House Lounge 2."
1923213,2025-01-28,House,4,"Tabled until future meeting."
1923305,2025-01-16,Senate,1,"Introduced, referred to Health and Human Services. S.J. 106."
1923305,2025-01-21,Senate,2,"Subcommittee: Klimesh, Costello, and Trone Garriott. S.J. 114."
1923381,2025-01-16,Senate,1,"Introduced, referred to Education. S.J. 106."
1923381,2025-01-28,Senate,2,"Subcommittee: Evans, Taylor, and Winckler. S.J. 151."
1923381,2025-02-03,Senate,3,"Subcommittee Meeting: 02/05/2025 10:30AM Room 217 Conference Room."
1923381,2025-02-05,Senate,4,"Subcommittee recommends passage."
1923381,2025-02-18,Senate,5,"Committee report, recommending passage. S.J. 305."
1923381,2025-02-18,Senate,6,"Placed on calendar."
1923381,2025-02-20,Senate,7,"Referred to Ways and Means. S.J. 319."
1923381,2025-02-26,Senate,8,"Fiscal note."
1923381,2025-03-03,Senate,9,"Subcommittee: Dawson, Quirmbach, and Rowley. S.J. 392."
1923462,2025-01-16,Senate,1,"Introduced, referred to Judiciary. S.J. 104."
1923462,2025-01-23,Senate,2,"Subcommittee: Rowley, Blake, and Schultz. S.J. 135."
1923462,2025-01-27,Senate,3,"Subcommittee Meeting: 01/29/2025 12:00PM Room 315."
1923462,2025-02-25,Senate,4,"Subcommittee Meeting: 02/26/2025 4:00PM Room 217 Conference Room."
1923462,2025-03-03,Senate,5,"Subcommittee recommends amendment and passage."
1923462,2025-03-10,Senate,6,"Committee report approving bill, renumbered as SF 586. S.J. 473."
1923541,2025-01-16,Senate,1,"Introduced, referred to Judiciary. S.J. 106."
1923541,2025-01-23,Senate,2,"Subcommittee: Bousselot, Petersen, and Schultz. S.J. 136."
1923621,2025-01-16,Senate,1,"Introduced, referred to Health and Human Services. S.J. 105."
1923621,2025-01-21,Senate,2,"Subcommittee: Pike, Lofgren, and Petersen. S.J. 114."
1923621,2025-02-03,Senate,3,"Subcommittee Meeting: 02/04/2025 3:30PM Lobbyist Lounge."
1923621,2025-02-04,Senate,4,"Subcommittee recommends passage."
1923621,2025-02-06,Senate,5,"Placed on calendar."
1923621,2025-02-06,Senate,6,"Committee report, recommending passage. S.J. 210."
1923621,2025-02-06,Senate,7,"Placed on calendar."
1923621,2025-02-10,Senate,8,"Referred to Appropriations. S.J. 211."
1923621,2025-02-11,Senate,9,"Subcommittee: Sires, Costello, and Petersen. S.J. 243."
1923621,2025-02-20,Senate,10,"Subcommittee Meeting: 02/24/2025 12:00PM Room 315."
1923621,2025-04-14,Senate,11,"Subcommittee Meeting: 04/15/2025 10:00AM Senate Lounge."
1923621,2025-04-15,Senate,12,"Subcommittee recommends passage."
1923621,2025-04-15,Senate,13,"Committee report approving bill, renumbered as SF 623. S.J. 801."
1923701,2025-01-16,Senate,1,"Introduced, referred to Ways and Means. S.J. 105."
1923701,2025-01-28,Senate,2,"Subcommittee: Driscoll, Bisignano, and Dawson. S.J. 151."
1923701,2025-03-03,Senate,3,"Subcommittee reassigned: Dawson, Bisignano, and Driscoll. S.J. 392."
1923785,2025-01-16,Senate,1,"Introduced, referred to Judiciary. S.J. 106."
1923785,2025-01-23,Senate,2,"Subcommittee: Schultz, Bousselot, and Petersen. S.J. 136."
1923861,2025-01-16,Senate,1,"Introduced, referred to Education. S.J. 105."
1923861,2025-01-28,Senate,2,"Subcommittee: Kraayenbrink, Pike, and Trone Garriott. S.J. 151."
1923861,2025-01-29,Senate,3,"Subcommittee Meeting: 02/03/2025 12:30PM Senate Lounge."
1923861,2025-02-03,Senate,4,"Subcommittee recommends passage."
1923861,2025-02-12,Senate,5,"Committee report approving bill, renumbered as SF 278. S.J. 257."
1923940,2025-01-16,Senate,1,"Introduced, referred to Education. S.J. 105."
1923940,2025-01-28,Senate,2,"Subcommittee: Rozenboom, Evans, and Winckler. S.J. 151."
1924020,2025-01-16,Senate,1,"Introduced, referred to Transportation. S.J. 104."
1924020,2025-01-23,Senate,2,"Subcommittee: Webster, Pike, and Townsend. S.J. 135."
1924020,2025-02-04,Senate,3,"Subcommittee Meeting: 02/06/2025 11:00AM Senate Lounge."
1924020,2025-02-06,Senate,4,"Subcommittee recommends passage."
1924098,2025-01-16,Senate,1,"By COMMITTEE ON LOCAL GOVERNMENT"
1924098,2025-01-16,Senate,2,"Introduced, referred to Local Government."
1924098,2025-01-16,Senate,3,"Subcommittee: Driscoll, Sires, and Weiner."
1924098,2025-01-21,Senate,4,"Subcommittee Meeting: 01/21/2025 3:00PM Room 217 Conference Room."
1924098,2025-01-21,Senate,5,"Subcommittee recommends passage."
1924098,2025-01-22,Senate,6,"Committee report approving bill, renumbered as SF 75."
1924179,2025-01-16,Senate,1,"Introduced, referred to Judiciary. S.J. 106."
1924179,2025-01-23,Senate,2,"Subcommittee: Shipley, Quirmbach, and Reichman. S.J. 136."
1924179,2025-02-17,Senate,3,"Subcommittee Meeting: 02/18/2025 2:30PM Room 217 Conference Room."
1924179,2025-02-18,Senate,4,"Subcommittee recommends passage."
1924179,2025-02-26,Senate,5,"Committee report, recommending passage. S.J. 370."
1924179,2025-02-26,Senate,6,"Placed on calendar."
1924179,2025-03-24,Senate,7,"Passed Senate, yeas 49, nays 0. S.J. 608."
1924179,2025-03-24,Senate,8,"Immediate message. S.J. 613."
1924179,2025-03-24,House,9,"Message from Senate. H.J. 776."
1924179,2025-03-24,House,10,"Read first time, referred to Transportation. H.J. 778."
1924179,2025-03-26,House,11,"Subcommittee: Young, Williams and Wilson. H.J. 852."
1924179,2025-03-27,House,12,"Subcommittee Meeting: 04/01/2025 12:00PM RM 304.1."
1924179,2025-04-01,House,13,"Tabled until future meeting."
1924257,2025-01-16,Senate,1,"Introduced, referred to Education. S.J. 105."
1924257,2025-01-28,Senate,2,"Subcommittee: Taylor, Garrett, and Quirmbach. S.J. 151."
1924257,2025-02-03,Senate,3,"Subcommittee Meeting: 02/06/2025 11:30AM Room 217 Conference Room."
1924257,2025-02-06,Senate,4,"Subcommittee recommends passage."
1924330,2025-01-16,Senate,1,"Introduced, referred to Health and Human Services. S.J. 104."
1924330,2025-01-21,Senate,2,"Subcommittee: Rowley, Campbell, and Celsi. S.J. 114."
1924330,2025-01-22,Senate,3,"Subcommittee reassigned: Alons, Celsi, and Klimesh. S.J. 126."
1924330,2025-01-23,Senate,4,"Subcommittee Meeting: 01/27/2025 1:30PM Senate Lounge."
1924330,2025-01-27,Senate,5,"Subcommittee recommends passage."
1924330,2025-02-10,Senate,6,"Committee report approving bill, renumbered as SF 233. S.J. 219."
1926907,2025-01-17,House,1,"Introduced, referred to Judiciary. H.J. 99."
1926918,2025-01-17,House,1,"Introduced, referred to Judiciary. H.J. 99."
1926918,2025-01-23,House,2,"Subcommittee: Lohse, Nordman and Wilburn. H.J. 123."
1926918,2025-01-24,House,3,"Subcommittee Meeting: 01/28/2025 12:00PM RM 102."
1926918,2025-01-28,House,4,"Subcommittee recommends passage."
1926918,2025-03-04,House,5,"Committee report, recommending amendment and passage. H.J. 506."
1926918,2025-03-04,House,6,"Committee vote: Yeas, 20. Nays, 0. Excused, 1. H.J. 506."
1926918,2025-03-07,House,7,"Committee report approving bill, renumbered as HF 873."
1926933,2025-01-17,House,1,"Introduced, referred to Public Safety. H.J. 99."
1926933,2025-01-21,House,2,"Subcommittee: Dieken, Hermanson and Kressig. H.J. 106."
1926933,2025-01-27,House,3,"Subcommittee Meeting: 01/30/2025 8:30AM House Lounge."
1926933,2025-01-30,House,4,"Tabled until future meeting."
1926945,2025-01-17,House,1,"By COMMITTEE ON JUDICIARY"
1926945,2025-01-17,House,2,"Introduced, referred to Judiciary. H.J. 101."
1926945,2025-01-17,House,3,"Subcommittee: Williams, Lohse and Wessel-Kroeschell. H.J. 102."
1926945,2025-01-23,House,4,"Subcommittee Meeting: 01/28/2025 8:15AM House Lounge 2."
1926945,2025-01-28,House,5,"Subcommittee recommends passage."
1926945,2025-02-06,House,6,"Committee report, recommending amendment and passage. H.J. 270."
1926945,2025-02-06,House,7,"Committee vote: Yeas, 20. Nays, 0. Excused, 1. H.J. 270."
1926945,2025-02-10,House,8,"Committee report approving bill, renumbered as HF 298."
1926968,2025-01-17,House,1,"Introduced, referred to Economic Growth and Technology. H.J. 99."
1926968,2025-02-06,House,2,"Subcommittee: Sexton, Baeth and Weldon. H.J. 264."
1926983,2025-01-17,House,1,"Introduced, referred to State Government. H.J. 100."
1926983,2025-01-30,House,2,"Subcommittee: Lundgren, Harris and Srinivas. H.J. 171."
1926983,2025-02-05,House,3,"Subcommittee Meeting: 02/06/2025 8:00AM House Lounge (Cancelled)."
1926997,2025-01-17,House,1,"Introduced, referred to Education. H.J. 100."
1926997,2025-01-22,House,2,"Subcommittee: Fett, Gehlbach and Matson. H.J. 116."
1926997,2025-01-23,House,3,"Subcommittee Meeting: 01/27/2025 11:30AM RM 103."
1926997,2025-01-27,House,4,"Subcommittee recommends passage."
1926997,2025-01-29,House,5,"Committee report, recommending amendment and passage. H.J. 142."
1926997,2025-01-29,House,6,"Committee vote: Yeas, 14. Nays, 9. H.J. 142."
1926997,2025-03-07,House,7,"Committee report approving bill, renumbered as HF 888."
1927016,2025-01-17,House,1,"Introduced, referred to Ways and Means. H.J. 100."
1927016,2025-01-23,House,2,"Subcommittee: Holt, Gjerde and Johnson, C. H.J. 123."
1927016,2025-01-23,House,3,"Subcommittee Meeting: 01/29/2025 12:15PM RM 304."
1927016,2025-01-29,House,4,"Subcommittee recommends passage."
1927031,2025-01-17,House,1,"By COMMITTEE ON JUDICIARY"
1927031,2025-01-17,House,2,"Introduced, referred to Judiciary. H.J. 101."
1927031,2025-01-17,House,3,"Subcommittee: Lawler, Olson and Thomson, C. H.J. 101."
1927031,2025-02-03,House,4,"Subcommittee Meeting: 02/04/2025 12:15PM RM 19 (Cancelled)."
1927031,2025-02-10,House,5,"Subcommittee Meeting: 02/13/2025 12:00PM RM 304."
1927031,2025-02-13,House,6,"Subcommittee recommends passage."
1927046,2025-01-17,House,1,"Introduced, referred to Public Safety. H.J. 100."
1927046,2025-01-21,House,2,"Subcommittee: Dieken, Meyer, B. and Wengryn. H.J. 106."
1927046,2025-01-27,House,3,"Subcommittee Meeting: 01/28/2025 8:00AM RM 304.1."
1927046,2025-01-28,House,4,"Subcommittee recommends passage."
1927046,2025-02-05,House,5,"Committee report, recommending passage. H.J. 185."
1927046,2025-02-05,House,6,"Committee vote: Yeas, 21. Nays, 2. H.J. 185."
1927046,2025-03-05,House,7,"Committee report approving bill, renumbered as HF 770."
1927059,2025-01-17,House,1,"Introduced, referred to State Government. H.J. 100."
1927082,2025-01-17,House,1,"Introduced, referred to Transportation. H.J. 100."
1927082,2025-01-29,House,2,"Subcommittee: Determann, Scholten and Wilson. H.J. 140."
1927082,2025-01-30,House,3,"Subcommittee reassigned: Determann, Scholten and Williams. H.J. 171."
1927082,2025-02-03,House,4,"Subcommittee Meeting: 02/05/2025 3:45PM House Lounge."
1927082,2025-02-05,House,5,"Subcommittee recommends amendment and passage."
1927096,2025-01-17,House,1,"By COMMITTEE ON JUDICIARY"
1927096,2025-01-17,House,2,"Introduced, referred to Judiciary. H.J. 101."
1927096,2025-01-17,House,3,"Subcommittee: Lawler, James and Thomson, C. H.J. 102."
1927096,2025-02-06,House,4,"Subcommittee reassigned: Lawler, Holt and James. H.J. 264."
1927096,2025-02-13,House,5,"Subcommittee Meeting: 02/18/2025 8:00AM House Lounge 2."
1927096,2025-02-18,House,6,"Subcommittee recommends passage."
1927096,2025-02-24,House,7,"Committee report, recommending passage. H.J. 421."
1927096,2025-02-24,House,8,"Committee vote: Yeas, 21. Nays, 0. H.J. 421."
1927096,2025-02-25,House,9,"Committee report approving bill, renumbered as HF 602."
1927111,2025-01-17,House,1,"By COMMITTEE ON JUDICIARY"
1927111,2025-01-17,House,2,"Introduced, referred to Judiciary. H.J. 101."
1927111,2025-01-17,House,3,"Subcommittee: Lohse, Shipley and Wessel-Kroeschell. H.J. 102."
1927111,2025-01-21,House,4,"Subcommittee Meeting: 01/28/2025 4:15PM House Lounge."
1927111,2025-01-28,House,5,"Subcommittee recommends passage."
1927111,2025-02-06,House,6,"Committee report, recommending passage. H.J. 270."
1927111,2025-02-06,House,7,"Committee vote: Yeas, 14. Nays, 6. Excused, 1. H.J. 270."
1927111,2025-02-10,House,8,"Committee report approving bill, renumbered as HF 314."
1927131,2025-01-17,Senate,1,"Introduced, referred to Judiciary. S.J. 109."
1927131,2025-01-23,Senate,2,"Subcommittee: Schultz, Bousselot, and Weiner. S.J. 136."
1927144,2025-01-17,House,1,"By COMMITTEE ON JUDICIARY"
1927144,2025-01-17,House,2,"Introduced, referred to Judiciary. H.J. 101."
1927144,2025-01-17,House,3,"Subcommittee: Williams, Lohse and Wilburn. H.J. 102."
1927144,2025-01-22,House,4,"Subcommittee Meeting: 01/27/2025 12:30PM RM 304.1."
1927144,2025-01-27,House,5,"Subcommittee recommends passage."
1927144,2025-02-11,House,6,"Committee report, recommending passage. H.J. 297."
1927144,2025-02-11,House,7,"Committee vote: Yeas, 14. Nays, 7. H.J. 297."
1927144,2025-02-12,House,8,"Committee report approving bill, renumbered as HF 367."
1927160,2025-01-17,House,1,"By COMMITTEE ON JUDICIARY"
1927160,2025-01-17,House,2,"Introduced, referred to Judiciary. H.J. 101."
1927160,2025-01-17,House,3,"Subcommittee: Wheeler, James and Williams. H.J. 102."
1927160,2025-01-28,House,4,"Subcommittee Meeting: 01/29/2025 4:30PM RM 304."
1927160,2025-01-29,House,5,"Subcommittee recommends passage."
1927160,2025-02-13,House,6,"Committee report, recommending passage. H.J. 333."
1927160,2025-02-13,House,7,"Committee vote: Yeas, 14. Nays, 5. Excused, 2. H.J. 333."
1927160,2025-02-17,House,8,"Committee report approving bill, renumbered as HF 439."
1931193,2025-01-21,House,1,"Introduced, referred to Ways and Means. H.J. 103."
1931193,2025-01-23,House,2,"Subcommittee: Jones, Bloomingdale and Judge. H.J. 123."
1931193,2025-01-27,House,3,"Subcommittee Meeting: 01/28/2025 12:00PM House Lounge 2."
1931193,2025-01-28,House,4,"Subcommittee recommends passage."
1931193,2025-03-13,House,5,"Committee report, recommending passage. H.J. 658."
1931193,2025-03-13,House,6,"Committee vote: Yeas, 23. Nays, 0. Excused, 2. H.J. 658."
1931193,2025-03-13,House,7,"Committee report approving bill, renumbered as HF 961."
1931233,2025-01-21,House,1,"By COMMITTEE ON EDUCATION"
1931233,2025-01-21,House,2,"Introduced, referred to Education. H.J. 105."
1931233,2025-01-21,House,3,"Subcommittee: Henderson, Gjerde and Ingels. H.J. 106."
1931233,2025-01-22,House,4,"Subcommittee reassigned: Ingels, Gjerde and Henderson. H.J. 116."
1931233,2025-01-23,House,5,"Subcommittee Meeting: 01/28/2025 12:00PM RM 19."
1931233,2025-01-28,House,6,"Subcommittee recommends passage."
1931233,2025-01-28,House,7,"Committee report, recommending passage. H.J. 145."
1931233,2025-01-28,House,8,"Committee vote: Yeas, 22. Nays, 0. Excused, 1. H.J. 145."
1931233,2025-03-05,House,9,"Committee report approving bill, renumbered as HF 772."
1931272,2025-01-21,Senate,1,"By COMMITTEE ON TRANSPORTATION"
1931272,2025-01-21,Senate,2,"Introduced, referred to Transportation."
1931272,2025-01-21,Senate,3,"Subcommittee: Dickey, Celsi, and Warme."
1931272,2025-01-23,Senate,4,"Subcommittee Meeting: 01/29/2025 12:00PM Senate Lounge."
1931272,2025-01-29,Senate,5,"Subcommittee recommends passage."
1931313,2025-01-21,Senate,1,"By COMMITTEE ON ETHICS"
1931313,2025-01-21,Senate,2,"Introduced, referred to Ethics."
1931313,2025-01-22,Senate,3,"Subcommittee: Rowley, Petersen, Rozenboom, Staed, Westrich, and Winckler."
1931313,2025-01-23,Senate,4,"Committee report approving bill, renumbered as SR 1."
1931351,2025-01-21,House,1,"By COMMITTEE ON EDUCATION"
1931351,2025-01-21,House,2,"Introduced, referred to Education. H.J. 104."
1931351,2025-01-21,House,3,"Subcommittee: Weldon, Bradley and Levin. H.J. 106."
1931351,2025-01-22,House,4,"Subcommittee Meeting: 01/23/2025 2:00PM House Lounge."
1931351,2025-01-23,House,5,"Subcommittee recommends passage."
1931351,2025-01-28,House,6,"Committee report, recommending passage. H.J. 144."
1931351,2025-01-28,House,7,"Committee vote: Yeas, 22. Nays, 0. Excused, 1. H.J. 144."
1931351,2025-03-05,House,8,"Committee report approving bill, renumbered as HF 771."
1931391,2025-01-21,Senate,1,"By COMMITTEE ON ETHICS"
1931391,2025-01-21,Senate,2,"Introduced, referred to Ethics."
1931391,2025-01-22,Senate,3,"Subcommittee: Rowley, Petersen, Rozenboom, Staed, Westrich, and Winckler."
1931391,2025-01-23,Senate,4,"Committee report approving bill, renumbered as SCR 1."
1931434,2025-01-21,House,1,"By COMMITTEE ON EDUCATION"
1931434,2025-01-21,House,2,"Introduced, referred to Education. H.J. 104."
1931434,2025-01-21,House,3,"Subcommittee: Wheeler, Fett and Matson. H.J. 106."
1931434,2025-01-22,House,4,"Subcommittee Meeting: 01/28/2025 12:00PM House Lounge."
1931434,2025-01-28,House,5,"Subcommittee recommends passage."
1931434,2025-01-28,House,6,"Committee report, recommending passage. H.J. 144."
1931434,2025-01-28,House,7,"Committee vote: Yeas, 22. Nays, 0. Excused, 1. H.J. 144."
1931434,2025-03-07,House,8,"Committee report approving bill, renumbered as HF 890."
1931472,2025-01-21,House,1,"Introduced, referred to Natural Resources. H.J. 103."
1931472,2025-01-29,House,2,"Subcommittee: Harris, Collins and Kurth. H.J. 140."
1931472,2025-01-29,House,3,"Subcommittee Meeting: 02/03/2025 12:00PM RM 304.1."
1931472,2025-02-03,House,4,"Subcommittee recommends passage."
1931472,2025-03-04,House,5,"Committee report, recommending passage. H.J. 508."
1931472,2025-03-04,House,6,"Committee vote: Yeas, 21. Nays, 0. H.J. 508."
1931472,2025-03-07,House,7,"Committee report approving bill, renumbered as HF 863."
1931512,2025-01-21,House,1,"By COMMITTEE ON EDUCATION"
1931512,2025-01-21,House,2,"Introduced, referred to Education. H.J. 104."
1931512,2025-01-21,House,3,"Subcommittee: Kniff McCulla, Bradley and Ehlert. H.J. 106."
1931512,2025-01-28,House,4,"Subcommittee Meeting: 01/29/2025 12:30PM House Lounge 2."
1931512,2025-01-29,House,5,"Subcommittee recommends passage."
1931512,2025-02-06,House,6,"Committee report, recommending passage. H.J. 268."
1931512,2025-02-06,House,7,"Committee vote: Yeas, 15. Nays, 7. Excused, 1. H.J. 268."
1931512,2025-02-10,House,8,"Committee report approving bill, renumbered as HF 316."
1931552,2025-01-21,House,1,"By COMMITTEE ON JUDICIARY"
1931552,2025-01-21,House,2,"Introduced, referred to Judiciary. H.J. 104."
1931552,2025-01-21,House,3,"Subcommittee: Lawler, Meyer, B. and Thomson, C. H.J. 106."
1931552,2025-01-27,House,4,"Subcommittee Meeting: 01/29/2025 3:30PM RM 304."
1931552,2025-01-29,House,5,"Subcommittee recommends passage."
1931592,2025-01-21,House,1,"Introduced, referred to Commerce. H.J. 103."
1931592,2025-01-21,House,2,"Rereferred to State Government. H.J. 104."
1931592,2025-01-23,House,3,"Subcommittee: Jones, Srinivas and Wilz, H. H.J. 123."
1931592,2025-01-23,House,4,"Subcommittee Meeting: 01/29/2025 11:30AM House Lounge."
1931592,2025-01-29,House,5,"Subcommittee recommends passage."
1931631,2025-01-21,House,1,"By COMMITTEE ON JUDICIARY"
1931631,2025-01-21,House,2,"Introduced, referred to Judiciary. H.J. 105."
1931631,2025-01-21,House,3,"Subcommittee: Shipley, Croken and Thomson, C. H.J. 107."
1931631,2025-01-27,House,4,"Subcommittee Meeting: 01/30/2025 8:00AM House Lounge."
1931631,2025-01-30,House,5,"Subcommittee recommends passage."
1931631,2025-02-25,House,6,"Committee report, recommending passage. H.J. 434."
1931631,2025-02-25,House,7,"Committee vote: Yeas, 21. Nays, 0. H.J. 434."
1931631,2025-02-28,House,8,"Committee report approving bill, renumbered as HF 647."
1931672,2025-01-21,House,1,"By COMMITTEE ON EDUCATION"
1931672,2025-01-21,House,2,"Introduced, referred to Education. H.J. 105."
1931672,2025-01-21,House,3,"Subcommittee: Stone, Behn and Kurth. H.J. 106."
1931672,2025-01-22,House,4,"Subcommittee Meeting: 01/28/2025 12:00PM RM 304.1."
1931672,2025-01-28,House,5,"Subcommittee recommends passage."
1931672,2025-01-28,House,6,"Committee report, recommending passage. H.J. 144."
1931672,2025-01-28,House,7,"Committee vote: Yeas, 16. Nays, 6. Excused, 1. H.J. 144."
1931672,2025-01-30,House,8,"Committee report approving bill, renumbered as HF 163."
1931705,2025-01-21,House,1,"By COMMITTEE ON EDUCATION"
1931705,2025-01-21,House,2,"Introduced, referred to Education. H.J. 104."
1931705,2025-01-21,House,3,"Subcommittee: Boden, Hora and Wessel-Kroeschell. H.J. 106."
1931705,2025-01-22,House,4,"Subcommittee Meeting: 01/28/2025 12:30PM House Lounge."
1931705,2025-01-28,House,5,"Subcommittee recommends passage."
1931705,2025-01-28,House,6,"Committee report, recommending passage. H.J. 144."
1931705,2025-01-28,House,7,"Committee vote: Yeas, 16. Nays, 6. Excused, 1. H.J. 144."
1931705,2025-01-30,House,8,"Committee report approving bill, renumbered as HF 167."
1931813,2025-01-21,Senate,1,"By COMMITTEE ON EDUCATION"
1931813,2025-01-21,Senate,2,"Introduced, referred to Education."
1931813,2025-01-21,Senate,3,"Subcommittee: Gruenhagen, Evans, and Staed."
1931813,2025-01-23,Senate,4,"Subcommittee Meeting: 01/27/2025 2:30PM Room 217 Conference Room."
1931813,2025-01-27,Senate,5,"Subcommittee recommends passage."
1931813,2025-01-30,Senate,6,"Committee report approving bill, renumbered as SF 168."
1931911,2025-01-21,Senate,1,"By COMMITTEE ON EDUCATION"
1931911,2025-01-21,Senate,2,"Introduced, referred to Education."
1931911,2025-01-21,Senate,3,"Subcommittee: Evans, Donahue, and Green."
1931911,2025-01-23,Senate,4,"Subcommittee Meeting: 01/29/2025 1:00PM Room 217 Conference Room."
1931911,2025-01-29,Senate,5,"Subcommittee recommends passage."
1931911,2025-02-04,Senate,6,"Committee report approving bill, renumbered as SF 211."
1932007,2025-01-21,Senate,1,"Introduced, referred to Commerce. S.J. 112."
1932007,2025-01-28,Senate,2,"Subcommittee: Gruenhagen, Knox, and Rowley. S.J. 152."
1932007,2025-01-29,Senate,3,"Subcommittee Meeting: 02/03/2025 2:00PM Senate Lounge."
1932007,2025-02-03,Senate,4,"Subcommittee recommends passage."
1932107,2025-01-21,Senate,1,"Introduced, referred to State Government. S.J. 111."
1932107,2025-01-27,Senate,2,"Subcommittee: Rozenboom, Schultz, and Staed. S.J. 142."
1932207,2025-01-21,Senate,1,"Introduced, referred to Judiciary. S.J. 112."
1932207,2025-01-23,Senate,2,"Subcommittee: Taylor, Bisignano, and Dawson. S.J. 136."
1932207,2025-01-27,Senate,3,"Subcommittee Meeting: 01/29/2025 2:30PM Room 217 Conference Room."
1932207,2025-01-29,Senate,4,"Subcommittee recommends amendment and passage."
1932303,2025-01-21,Senate,1,"Introduced, referred to Education. S.J. 112."
1932303,2025-01-28,Senate,2,"Subcommittee: Taylor, Gruenhagen, and Quirmbach. S.J. 152."
1932303,2025-02-03,Senate,3,"Subcommittee Meeting: 02/06/2025 11:00AM Room 217 Conference Room."
1932303,2025-02-06,Senate,4,"Subcommittee recommends amendment and passage."
1932303,2025-02-12,Senate,5,"Committee report approving bill, renumbered as SF 286. S.J. 258."
1932406,2025-01-21,Senate,1,"By COMMITTEE ON EDUCATION"
1932406,2025-01-21,Senate,2,"Introduced, referred to Education."
1932406,2025-01-21,Senate,3,"Subcommittee: Evans, Campbell, and Winckler."
1932406,2025-01-23,Senate,4,"Subcommittee Meeting: 01/29/2025 11:00AM Room 217 Conference Room."
1932406,2025-01-29,Senate,5,"Subcommittee recommends passage."
1932406,2025-02-04,Senate,6,"Committee report approving bill, renumbered as SF 206."
1932503,2025-01-21,Senate,1,"By COMMITTEE ON EDUCATION"
1932503,2025-01-21,Senate,2,"Introduced, referred to Education."
1932503,2025-01-21,Senate,3,"Subcommittee: Taylor, Salmon, and Trone Garriott."
1932503,2025-01-23,Senate,4,"Subcommittee recommends passage."
1932503,2025-01-23,Senate,5,"Subcommittee Meeting: 01/23/2025 1:30PM Room 315."
1932503,2025-01-30,Senate,6,"Committee report approving bill, renumbered as []."
1932598,2025-01-21,Senate,1,"By COMMITTEE ON EDUCATION"
1932598,2025-01-21,Senate,2,"Introduced, referred to Education."
1932598,2025-01-21,Senate,3,"Subcommittee: Rozenboom, Donahue, and Pike."
1932598,2025-01-28,Senate,4,"Subcommittee Meeting: 01/29/2025 2:00PM Room G15."
1932598,2025-01-29,Senate,5,"Subcommittee recommends passage."
1932699,2025-01-21,Senate,1,"Introduced, referred to State Government. S.J. 112."
1932699,2025-01-27,Senate,2,"Subcommittee: Rozenboom, Schultz, and Townsend. S.J. 142."
1932798,2025-01-21,Senate,1,"Introduced, referred to Transportation. S.J. 112."
1932798,2025-01-23,Senate,2,"Subcommittee: Gruenhagen, Celsi, and Koelker. S.J. 136."
1932798,2025-02-07,Senate,3,"Subcommittee Meeting: 02/10/2025 1:30PM Senate Lounge."
1932798,2025-02-10,Senate,4,"Subcommittee recommends passage."
1932798,2025-02-19,Senate,5,"Committee report approving bill, renumbered as SF 378. S.J. 318."
1932896,2025-01-21,Senate,1,"By COMMITTEE ON EDUCATION"
1932896,2025-01-21,Senate,2,"Introduced, referred to Education."
1932896,2025-01-21,Senate,3,"Subcommittee: Evans, Garrett, and Quirmbach."
1932896,2025-01-27,Senate,4,"Subcommittee Meeting: 01/28/2025 11:00AM Room G15."
1932896,2025-01-28,Senate,5,"Subcommittee recommends passage."
1932993,2025-01-21,Senate,1,"Introduced, referred to Commerce. S.J. 112."
1932993,2025-01-22,Senate,2,"Subcommittee: Webster, Blake, and Sweeney. S.J. 126."
1933086,2025-01-21,Senate,1,"By COMMITTEE ON EDUCATION"
1933086,2025-01-21,Senate,2,"Introduced, referred to Education."
1933086,2025-01-21,Senate,3,"Subcommittee: Taylor, Shipley, and Staed."
1933086,2025-01-22,Senate,4,"Subcommittee Meeting: 01/23/2025 12:30PM Room 217 Conference Room."
1933086,2025-01-23,Senate,5,"Subcommittee recommends passage."
1933086,2025-01-30,Senate,6,"Committee report approving bill, renumbered as SF 176."
1933867,2025-01-22,House,1,"By COMMITTEE ON HIGHER EDUCATION"
1933867,2025-01-22,House,2,"Introduced, referred to Higher Education. H.J. 114."
1933867,2025-01-22,House,3,"Subcommittee: Wills, J., Collins and Wilburn. H.J. 117."
1933867,2025-01-27,House,4,"Subcommittee Meeting: 01/29/2025 7:30AM RM 102."
1933867,2025-01-29,House,5,"Subcommittee recommends passage."
1933867,2025-02-05,House,6,"Committee report, recommending amendment and passage. H.J. 269."
1933867,2025-02-05,House,7,"Committee vote: Yeas, 7. Nays, 3. Excused, 1. H.J. 269."
1933867,2025-02-10,House,8,"Committee report approving bill, renumbered as HF 295."
1933889,2025-01-22,House,1,"Introduced, referred to Education. H.J. 109."
1933889,2025-01-23,House,2,"Subcommittee: Hora, Ehlert and Kniff McCulla. H.J. 123."
1933889,2025-01-27,House,3,"Subcommittee Meeting: 01/28/2025 3:00PM House Lounge."
1933889,2025-01-28,House,4,"Subcommittee recommends passage."
1933907,2025-01-22,House,1,"Introduced, referred to Transportation. H.J. 109."
1933907,2025-01-29,House,2,"Subcommittee: Meggers, Bagniewski and Young. H.J. 140."
1933907,2025-02-05,House,3,"Subcommittee Meeting: 02/06/2025 12:00PM RM 102."
1933907,2025-02-06,House,4,"Subcommittee recommends passage."
1933929,2025-01-22,House,1,"Introduced, referred to Judiciary. H.J. 110."
1933929,2025-01-23,House,2,"Subcommittee: Fett, Gustoff and Wessel-Kroeschell. H.J. 123."
1933929,2025-01-29,House,3,"Subcommittee Meeting: 01/30/2025 11:30AM RM 19 (Cancelled)."
1933950,2025-01-22,House,1,"By COMMITTEE ON HIGHER EDUCATION"
1933950,2025-01-22,House,2,"Introduced, referred to Higher Education. H.J. 114."
1933950,2025-01-22,House,3,"Subcommittee: Wheeler, Holt and Kurth. H.J. 117."
1933950,2025-01-28,House,4,"Subcommittee Meeting: 01/28/2025 4:00PM RM 304 (Cancelled)."
1933950,2025-02-03,House,5,"Subcommittee Meeting: 02/05/2025 12:00PM RM 304.1."
1933950,2025-02-05,House,6,"Subcommittee recommends passage."
1933950,2025-02-12,House,7,"Committee report, recommending passage. H.J. 310."
1933950,2025-02-12,House,8,"Committee vote: Yeas, 7. Nays, 4. H.J. 310."
1933950,2025-02-13,House,9,"Committee report approving bill, renumbered as HF 402."
1933974,2025-01-22,House,1,"Introduced, referred to Health and Human Services. H.J. 109."
1933974,2025-01-22,House,2,"Subcommittee: Andrews, Gehlbach and Matson. H.J. 116."
1933974,2025-01-28,House,3,"Subcommittee Meeting: 01/30/2025 8:30AM House Lounge 2."
1933974,2025-01-30,House,4,"Subcommittee recommends passage."
1933974,2025-02-11,House,5,"Committee report, recommending passage. H.J. 296."
1933974,2025-02-11,House,6,"Committee vote: Yeas, 13. Nays, 7. Excused, 1. H.J. 296."
1933974,2025-02-13,House,7,"Committee report approving bill, renumbered as HF 384."
1933996,2025-01-22,House,1,"Introduced, referred to State Government. H.J. 108."
1934018,2025-01-22,House,1,"By COMMITTEE ON HIGHER EDUCATION"
1934018,2025-01-22,House,2,"Introduced, referred to Higher Education. H.J. 114."
1934018,2025-01-22,House,3,"Subcommittee: Shipley, Collins and Jacoby. H.J. 117."
1934018,2025-01-27,House,4,"Subcommittee reassigned: Shipley, Collins and Kurth. H.J. 131."
1934018,2025-01-28,House,5,"Subcommittee Meeting: 01/29/2025 3:00PM House Lounge 2."
1934018,2025-01-29,House,6,"Subcommittee recommends passage."
1934018,2025-02-05,House,7,"Committee report, recommending amendment and passage. H.J. 269."
1934018,2025-02-05,House,8,"Committee vote: Yeas, 7. Nays, 3. Excused, 1. H.J. 269."
1934018,2025-02-10,House,9,"Committee report approving bill, renumbered as HF 296."
1934038,2025-01-22,House,1,"By COMMITTEE ON HIGHER EDUCATION"
1934038,2025-01-22,House,2,"Introduced, referred to Higher Education. H.J. 114."
1934038,2025-01-22,House,3,"Subcommittee: Hora, Collins and Kurth. H.J. 117."
1934038,2025-01-23,House,4,"Subcommittee Meeting: 01/29/2025 12:00PM House Lounge."
1934038,2025-01-29,House,5,"Subcommittee recommends passage."
1934038,2025-02-05,House,6,"Committee report, recommending amendment and passage. H.J. 269."
1934038,2025-02-05,House,7,"Committee vote: Yeas, 7. Nays, 3. Excused, 1. H.J. 269."
1934038,2025-02-06,House,8,"Committee report approving bill, renumbered as HF 270."
1934062,2025-01-22,House,1,"By COMMITTEE ON HIGHER EDUCATION"
1934062,2025-01-22,House,2,"Introduced, referred to Higher Education. H.J. 114."
1934062,2025-01-22,House,3,"Subcommittee: Collins, Hora and Konfrst. H.J. 117."
1934062,2025-02-03,House,4,"Subcommittee Meeting: 02/04/2025 12:15PM House Lounge (Cancelled)."
1934062,2025-02-06,House,5,"Subcommittee Meeting: 02/12/2025 12:30PM House Lounge."
1934062,2025-02-12,House,6,"Subcommittee recommends passage."
1934062,2025-02-26,House,7,"Committee report, recommending amendment and passage. H.J. 443."
1934062,2025-02-26,House,8,"Committee vote: Yeas, 7. Nays, 4. H.J. 443."
1934062,2025-03-07,House,9,"Committee report approving bill, renumbered as HF 854."
1934086,2025-01-22,House,1,"Introduced, referred to Ways and Means. H.J. 110."
1934086,2025-01-23,House,2,"Subcommittee: Sexton, Boden and Scheetz. H.J. 123."
1934086,2025-01-27,House,3,"Subcommittee Meeting: 01/29/2025 3:45PM House Lounge."
1934086,2025-01-29,House,4,"Subcommittee recommends passage."
1934086,2025-04-16,House,5,"Committee report, recommending passage. H.J. 989."
1934086,2025-04-16,House,6,"Committee vote: Yeas, 24. Nays, 0. Excused, 1. H.J. 990."
1934086,2025-04-17,House,7,"Committee report approving bill, renumbered as HF 1024."
1934108,2025-01-22,House,1,"By COMMITTEE ON HIGHER EDUCATION"
1934108,2025-01-22,House,2,"Introduced, referred to Higher Education. H.J. 113."
1934108,2025-01-22,House,3,"Subcommittee: Collins, Hora and Jacoby. H.J. 117."
1934108,2025-01-27,House,4,"Subcommittee Meeting: 01/28/2025 2:30PM RM 19."
1934108,2025-01-28,House,5,"Subcommittee recommends passage."
1934108,2025-02-12,House,6,"Committee report, recommending passage. H.J. 310."
1934108,2025-02-12,House,7,"Committee vote: Yeas, 7. Nays, 4. H.J. 310."
1934108,2025-02-17,House,8,"Committee report approving bill, renumbered as HF 437."
1934131,2025-01-22,House,1,"By COMMITTEE ON HIGHER EDUCATION"
1934131,2025-01-22,House,2,"Introduced, referred to Higher Education. H.J. 114."
1934131,2025-01-22,House,3,"Subcommittee: Kaufmann, Collins and Jacoby. H.J. 117."
1934131,2025-02-13,House,4,"Subcommittee Meeting: 02/18/2025 12:30PM RM 103."
1934131,2025-02-18,House,5,"Subcommittee recommends passage."
1934153,2025-01-22,House,1,"By COMMITTEE ON HIGHER EDUCATION"
1934153,2025-01-22,House,2,"Introduced, referred to Higher Education. H.J. 115."
1934153,2025-01-22,House,3,"Subcommittee: Holt, Collins and Wilburn. H.J. 117."
1934153,2025-01-23,House,4,"Subcommittee Meeting: 01/28/2025 8:00AM RM 102."
1934153,2025-01-28,House,5,"Subcommittee recommends passage."
1934153,2025-02-12,House,6,"Committee report, recommending amendment and passage. H.J. 310."
1934153,2025-02-12,House,7,"Committee vote: Yeas, 7. Nays, 4. H.J. 310."
1934153,2025-02-13,House,8,"Committee report approving bill, renumbered as HF 401."
1934176,2025-01-22,House,1,"Introduced, referred to Education. H.J. 108."
1934176,2025-01-28,House,2,"Subcommittee: Ingels, Behn and Gjerde. H.J. 134."
1934176,2025-02-05,House,3,"Subcommittee Meeting: 02/06/2025 8:15AM RM 102."
1934176,2025-02-06,House,4,"Subcommittee recommends passage."
1934176,2025-02-06,House,5,"Committee report, recommending passage. H.J. 268."
1934176,2025-02-06,House,6,"Committee vote: Yeas, 22. Nays, 0. Excused, 1. H.J. 268."
1934176,2025-02-10,House,7,"Committee report approving bill, renumbered as HF 271."
1934197,2025-01-22,House,1,"Introduced, referred to Public Safety. H.J. 110."
1934197,2025-01-22,House,2,"Subcommittee: Gustoff, Amos Jr. and Cisneros. H.J. 116."
1934197,2025-01-22,House,3,"Subcommittee Meeting: 01/23/2025 8:30AM RM 304."
1934197,2025-01-23,House,4,"Subcommittee recommends passage."
1934197,2025-02-19,House,5,"Committee report, recommending passage. H.J. 367."
1934197,2025-02-19,House,6,"Committee vote: Yeas, 15. Nays, 5. Excused, 3. H.J. 367."
1934197,2025-02-20,House,7,"Committee report approving bill, renumbered as HF 523."
1934197,2025-03-14,House,8,"Withdrawn. H.J. 660."
1934220,2025-01-22,House,1,"Introduced, referred to Ways and Means. H.J. 109."
1934220,2025-01-23,House,2,"Subcommittee: Meggers, Wichtendahl and Wills, J. H.J. 123."
1934242,2025-01-22,House,1,"Introduced, referred to Health and Human Services. H.J. 109."
1934242,2025-01-22,House,2,"Subcommittee: Wilz, H., Johnson, R. and Wood. H.J. 116."
1934242,2025-01-22,House,3,"Subcommittee Meeting: 01/27/2025 11:30AM House Lounge."
1934242,2025-01-27,House,4,"Subcommittee recommends passage."
1934242,2025-02-27,House,5,"Sponsor added, Young. H.J. 461."
1934242,2025-03-05,House,6,"Committee report, recommending amendment and passage. H.J. 546."
1934242,2025-03-05,House,7,"Committee vote: Yeas, 19. Nays, 1. Excused, 1. H.J. 546."
1934242,2025-03-12,House,8,"Committee report approving bill, renumbered as HF 950."
1934265,2025-01-22,House,1,"By COMMITTEE ON HIGHER EDUCATION"
1934265,2025-01-22,House,2,"Introduced, referred to Higher Education. H.J. 115."
1934265,2025-01-22,House,3,"Subcommittee: Collins, Konfrst and Shipley. H.J. 117."
1934265,2025-01-29,House,4,"Subcommittee Meeting: 01/30/2025 12:00PM House Lounge 2 (Cancelled)."
1934265,2025-02-10,House,5,"Subcommittee Meeting: 02/11/2025 3:30PM House Lounge."
1934265,2025-02-11,House,6,"Subcommittee recommends passage."
1934265,2025-03-05,House,7,"Committee report, recommending passage. H.J. 530."
1934265,2025-03-05,House,8,"Committee vote: Yeas, 7. Nays, 3. Excused, 1. H.J. 530."
1934265,2025-03-07,House,9,"Committee report approving bill, renumbered as HF 867."
1934288,2025-01-22,House,1,"Introduced, referred to Ways and Means. H.J. 110."
1934313,2025-01-22,House,1,"Introduced, referred to Natural Resources. H.J. 110."
1934313,2025-01-22,House,2,"Subcommittee: Harris, Sexton and Turek. H.J. 116."
1934313,2025-01-23,House,3,"Subcommittee Meeting: 01/27/2025 12:15PM RM 304.1."
1934313,2025-01-27,House,4,"Subcommittee recommends passage."
1934313,2025-02-18,House,5,"Committee report, recommending passage. H.J. 367."
1934313,2025-02-18,House,6,"Committee vote: Yeas, 14. Nays, 5. Excused, 2. H.J. 367."
1934313,2025-02-19,House,7,"Committee report approving bill, renumbered as HF 473."
1934333,2025-01-22,House,1,"By COMMITTEE ON HIGHER EDUCATION"
1934333,2025-01-22,House,2,"Introduced, referred to Higher Education. H.J. 113."
1934333,2025-01-22,House,3,"Subcommittee: Shipley, Wilburn and Wills, J. H.J. 117."
1934333,2025-02-10,House,4,"Subcommittee Meeting: 02/11/2025 3:00PM House Lounge."
1934333,2025-02-12,House,5,"Subcommittee recommends amendment and passage."
1934333,2025-02-19,House,6,"Committee report, recommending amendment and passage. H.J. 366."
1934333,2025-02-19,House,7,"Committee vote: Yeas, 10. Nays, 1. H.J. 366."
1934333,2025-02-24,House,8,"Committee report approving bill, renumbered as HF 575."
1934354,2025-01-22,House,1,"By COMMITTEE ON HIGHER EDUCATION"
1934354,2025-01-22,House,2,"Introduced, referred to Higher Education. H.J. 113."
1934354,2025-01-22,House,3,"Subcommittee: Collins, Konfrst and Wheeler. H.J. 116."
1934354,2025-01-27,House,4,"Subcommittee Meeting: 01/29/2025 2:30PM House Lounge."
1934354,2025-01-29,House,5,"Subcommittee recommends passage."
1934354,2025-02-12,House,6,"Committee report, recommending passage. H.J. 310."
1934354,2025-02-12,House,7,"Committee vote: Yeas, 10. Nays, 1. H.J. 310."
1934354,2025-02-13,House,8,"Committee report approving bill, renumbered as HF 420."
1934376,2025-01-22,Senate,1,"By COMMITTEE ON HEALTH AND HUMAN SERVICES"
1934376,2025-01-22,Senate,2,"Introduced, referred to Health and Human Services."
1934376,2025-01-22,Senate,3,"Subcommittee: Klimesh, Costello, and Petersen."
1934376,2025-01-23,Senate,4,"Subcommittee Meeting: 01/27/2025 2:00PM Senate Lounge."
1934376,2025-01-27,Senate,5,"Subcommittee recommends amendment and passage."
1934376,2025-02-12,Senate,6,"Committee report approving bill, renumbered as SF 319."
1934395,2025-01-22,House,1,"By COMMITTEE ON HIGHER EDUCATION"
1934395,2025-01-22,House,2,"Introduced, referred to Higher Education. H.J. 113."
1934395,2025-01-22,House,3,"Subcommittee: Holt, Wheeler and Wilburn. H.J. 117."
1934395,2025-01-23,House,4,"Subcommittee Meeting: 01/29/2025 4:00PM RM 304."
1934395,2025-01-30,House,5,"Subcommittee recommends passage."
1934395,2025-02-05,House,6,"Committee report, recommending passage. H.J. 268."
1934395,2025-02-05,House,7,"Committee vote: Yeas, 7. Nays, 3. Excused, 1. H.J. 268."
1934395,2025-02-06,House,8,"Committee report approving bill, renumbered as HF 269."
1934419,2025-01-22,House,1,"Introduced, referred to Ways and Means. H.J. 110."
1934438,2025-01-22,House,1,"Introduced, referred to Public Safety. H.J. 108."
1934438,2025-01-22,House,2,"Subcommittee: Meggers, Brown-Powers and Dieken. H.J. 116."
1934438,2025-01-28,House,3,"Subcommittee Meeting: 01/29/2025 8:00AM RM 304."
1934438,2025-01-29,House,4,"Subcommittee recommends passage."
1934438,2025-02-19,House,5,"Committee report, recommending passage. H.J. 367."
1934438,2025-02-19,House,6,"Committee vote: Yeas, 20. Nays, 0. Excused, 3. H.J. 367."
1934438,2025-02-20,House,7,"Committee report approving bill, renumbered as HF 542."
1934462,2025-01-22,House,1,"Introduced, referred to Education. H.J. 108."
1934462,2025-01-23,House,2,"Subcommittee: Johnson, C., Ehlert and Weldon. H.J. 123."
1934462,2025-01-27,House,3,"Subcommittee Meeting: 01/29/2025 11:30AM House Lounge 2."
1934462,2025-01-29,House,4,"Subcommittee recommends passage."
1934462,2025-02-06,House,5,"Committee report, recommending passage. H.J. 268."
1934462,2025-02-06,House,6,"Committee vote: Yeas, 22. Nays, 0. Excused, 1. H.J. 268."
1934462,2025-02-10,House,7,"Committee report approving bill, renumbered as HF 272."
1934481,2025-01-22,House,1,"By COMMITTEE ON HIGHER EDUCATION"
1934481,2025-01-22,House,2,"Introduced, referred to Higher Education. H.J. 114."
1934481,2025-01-22,House,3,"Subcommittee: Collins, Hora and Kurth. H.J. 117."
1934481,2025-01-27,House,4,"Subcommittee Meeting: 01/29/2025 12:30PM House Lounge."
1934481,2025-01-29,House,5,"Tabled until future meeting."
1934481,2025-02-26,House,6,"Committee report, recommending passage. H.J. 443."
1934481,2025-02-26,House,7,"Committee vote: Yeas, 7. Nays, 4. H.J. 443."
1934481,2025-03-07,House,8,"Committee report approving bill, renumbered as HF 855."
1934503,2025-01-22,House,1,"Introduced, referred to Education. H.J. 109."
1934503,2025-01-30,House,2,"Subcommittee: Bradley, Kniff McCulla and Levin. H.J. 171."
1934503,2025-02-05,House,3,"Subcommittee Meeting: 02/11/2025 12:30PM RM 102."
1934503,2025-02-11,House,4,"Subcommittee recommends passage."
1934503,2025-03-04,House,5,"Committee report, recommending passage. H.J. 527."
1934503,2025-03-04,House,6,"Committee vote: Yeas, 21. Nays, 2. H.J. 527."
1934503,2025-03-07,House,7,"Committee report approving bill, renumbered as HF 835."
1934503,2025-04-10,House,8,"Withdrawn. H.J. 04/10."
1934520,2025-01-22,House,1,"By COMMITTEE ON HIGHER EDUCATION"
1934520,2025-01-22,House,2,"Introduced, referred to Higher Education. H.J. 113."
1934520,2025-01-22,House,3,"Subcommittee: Collins, Jacoby and Wills, J. H.J. 117."
1934520,2025-01-27,House,4,"Subcommittee Meeting: 01/30/2025 11:00AM House Lounge."
1934520,2025-01-30,House,5,"Subcommittee recommends passage."
1934520,2025-02-12,House,6,"Committee report, recommending passage. H.J. 310."
1934520,2025-02-12,House,7,"Committee vote: Yeas, 9. Nays, 2. H.J. 310."
1934520,2025-02-17,House,8,"Committee report approving bill, renumbered as HF 440."
1934596,2025-01-22,House,1,"By COMMITTEE ON COMMERCE"
1934596,2025-01-22,House,2,"Introduced, referred to Commerce. H.J. 115."
1934596,2025-01-22,House,3,"Subcommittee: Wilz, H., Blom and Johnson, R. H.J. 118."
1934596,2025-01-22,House,4,"Subcommittee Meeting: 01/27/2025 11:00AM House Lounge."
1934596,2025-01-27,House,5,"Subcommittee recommends passage."
1934596,2025-02-06,House,6,"Committee report, recommending passage. H.J. 266."
1934596,2025-02-06,House,7,"Committee vote: Yeas, 23. Nays, 0. H.J. 266."
1934596,2025-02-10,House,8,"Committee report approving bill, renumbered as HF 304."
1934656,2025-01-22,Senate,1,"By COMMITTEE ON VETERANS AFFAIRS"
1934656,2025-01-22,Senate,2,"Introduced, referred to Veterans Affairs."
1934656,2025-01-22,Senate,3,"Subcommittee: Costello, Blake, and Campbell."
1934656,2025-01-27,Senate,4,"Subcommittee Meeting: 01/28/2025 11:45AM Room 315."
1934656,2025-01-28,Senate,5,"Subcommittee recommends passage."
1934656,2025-01-28,Senate,6,"Committee report approving bill, renumbered as SF 152."
1934714,2025-01-22,Senate,1,"By COMMITTEE ON EDUCATION"
1934714,2025-01-22,Senate,2,"Introduced, referred to Education."
1934714,2025-01-22,Senate,3,"Subcommittee: Shipley, Gruenhagen, and Trone Garriott."
1934714,2025-01-27,Senate,4,"Subcommittee Meeting: 01/30/2025 9:30AM Senate Lounge."
1934714,2025-01-30,Senate,5,"Subcommittee recommends passage."
1934714,2025-02-04,Senate,6,"Committee report approving bill, renumbered as SF 205."
1934778,2025-01-22,Senate,1,"By COMMITTEE ON STATE GOVERNMENT"
1934778,2025-01-22,Senate,2,"Introduced, referred to State Government."
1934778,2025-01-22,Senate,3,"Subcommittee: Webster, Celsi, and Koelker."
1934778,2025-01-23,Senate,4,"Subcommittee Meeting: 01/28/2025 11:00AM Lobbyist Lounge."
1934778,2025-02-04,Senate,5,"Subcommittee recommends passage."
1934778,2025-02-04,Senate,6,"Committee report approving bill, renumbered as SF 213."
1934842,2025-01-22,Senate,1,"By COMMITTEE ON COMMERCE"
1934842,2025-01-22,Senate,2,"Introduced, referred to Commerce."
1934842,2025-01-22,Senate,3,"Subcommittee: Dickey, Bisignano, and Reichman."
1934842,2025-01-23,Senate,4,"Subcommittee Meeting: 01/28/2025 11:00AM Room 217 Conference Room."
1934842,2025-01-28,Senate,5,"Subcommittee recommends amendment and passage."
1934842,2025-02-26,Senate,6,"Committee report approving bill, renumbered as SF 468."
1934900,2025-01-22,Senate,1,"By COMMITTEE ON STATE GOVERNMENT"
1934900,2025-01-22,Senate,2,"Introduced, referred to State Government."
1934900,2025-01-22,Senate,3,"Subcommittee: Westrich, Bisignano, and Salmon."
1934900,2025-01-24,Senate,4,"Subcommittee Meeting: 01/28/2025 11:30AM Room 217 Conference Room."
1934900,2025-01-28,Senate,5,"Subcommittee recommends passage."
1934900,2025-01-29,Senate,6,"Committee report approving bill, renumbered as SF 166."
1934963,2025-01-22,Senate,1,"By COMMITTEE ON STATE GOVERNMENT"
1934963,2025-01-22,Senate,2,"Introduced, referred to State Government."
1934963,2025-01-22,Senate,3,"Subcommittee: Alons, Staed, and Webster."
1934963,2025-01-23,Senate,4,"Subcommittee Meeting: 01/27/2025 3:00PM Room 217 Conference Room."
1934963,2025-01-27,Senate,5,"Subcommittee recommends passage."
1934963,2025-01-29,Senate,6,"Committee report approving bill, renumbered as SF 162."
1935023,2025-01-22,House,1,"By COMMITTEE ON TRANSPORTATION"
1935023,2025-01-22,House,2,"Introduced, referred to Transportation. H.J. 115."
1935023,2025-01-22,House,3,"Subcommittee: Meyer, A., Bagniewski, Madison, Siegrist and Young. H.J. 117."
1935023,2025-01-23,House,4,"Subcommittee Meeting: 01/28/2025 12:00PM RM 304."
1935023,2025-01-28,House,5,"Subcommittee recommends passage."
1935023,2025-02-12,House,6,"Committee report, recommending passage. H.J. 313."
1935023,2025-02-12,House,7,"Committee vote: Yeas, 20. Nays, 0. Excused, 1. H.J. 313."
1935023,2025-03-06,House,8,"Committee report approving bill, renumbered as HF 827."
1935086,2025-01-22,Senate,1,"By COMMITTEE ON EDUCATION"
1935086,2025-01-22,Senate,2,"Introduced, referred to Education."
1935086,2025-01-22,Senate,3,"Subcommittee: Green, Quirmbach, and Taylor."
1935086,2025-01-23,Senate,4,"Subcommittee Meeting: 01/30/2025 12:00PM Room 217 Conference Room."
1935086,2025-01-30,Senate,5,"Subcommittee recommends amendment and passage."
1935086,2025-02-18,Senate,6,"Committee report approving bill, renumbered as SF 369."
1935148,2025-01-22,House,1,"By COMMITTEE ON NATURAL RESOURCES"
1935148,2025-01-22,House,2,"Introduced, referred to Natural Resources. H.J. 115."
1935148,2025-01-22,House,3,"Subcommittee: Harris, Kurth and Wulf. H.J. 118."
1935148,2025-01-22,House,4,"Subcommittee Meeting: 01/27/2025 12:00PM House Lounge 2."
1935148,2025-01-27,House,5,"Subcommittee recommends passage."
1935148,2025-03-04,House,6,"Committee report, recommending amendment and passage. H.J. 509."
1935148,2025-03-04,House,7,"Committee vote: Yeas, 20. Nays, 0. Excused, 1. H.J. 509."
1935148,2025-03-07,House,8,"Committee report approving bill, renumbered as HF 881."
1935205,2025-01-22,Senate,1,"By COMMITTEE ON STATE GOVERNMENT"
1935205,2025-01-22,Senate,2,"Introduced, referred to State Government."
1935205,2025-01-22,Senate,3,"Subcommittee: Koelker, Alons, and Townsend."
1935205,2025-02-04,Senate,4,"Subcommittee Meeting: 02/05/2025 11:00AM Room 315."
1935205,2025-02-05,Senate,5,"Subcommittee recommends amendment and passage."
1935205,2025-02-12,Senate,6,"Committee report approving bill, renumbered as SF 306."
1935266,2025-01-22,Senate,1,"By COMMITTEE ON STATE GOVERNMENT"
1935266,2025-01-22,Senate,2,"Introduced, referred to State Government."
1935266,2025-01-22,Senate,3,"Subcommittee: Green, Reichman, and Winckler."
1935266,2025-01-23,Senate,4,"Subcommittee Meeting: 01/29/2025 12:00PM Room 217 Conference Room."
1935266,2025-01-29,Senate,5,"Subcommittee recommends passage."
1935266,2025-02-04,Senate,6,"Committee report approving bill, renumbered as SF 214."
1935321,2025-01-22,Senate,1,"Introduced, placed on calendar. S.J. 118."
1935321,2025-01-22,Senate,2,"Committee report, approving bill. S.J. 127."
1935321,2025-03-10,Senate,3,"Amendment S-3018 filed, adopted. S.J. 445."
1935321,2025-03-10,Senate,4,"Passed Senate, yeas 35, nays 12. S.J. 445."
1935321,2025-03-10,Senate,5,"Immediate message. S.J. 448."
1935321,2025-03-10,House,6,"Message from Senate. H.J. 589."
1935321,2025-03-11,House,7,"Read first time, passed on file. H.J. 594."
1935321,2025-03-17,House,8,"Amendments H-1107 and H-1108 filed. H.J. 677."
1935321,2025-03-18,House,9,"Placed on calendar under unfinished business. H.J. 682."
1935321,2025-03-18,House,10,"Substituted for HF 786. H.J. 682."
1935321,2025-03-18,House,11,"Point of order raised on amendment H-1107, ruled not germane. H.J. 682."
1935321,2025-03-18,House,12,"Motion to suspend rules for immediate consideration of amendment H-1107, yeas 33, nays 65. H.J. 683."
1935321,2025-03-18,House,13,"Motion to suspend rules failed. H.J. 683."
1935321,2025-03-18,House,14,"Point of order raised on amendment H-1108, ruled not germane. H.J. 684."
1935321,2025-03-18,House,15,"Motion to suspend rules for immediate consideration of amendment H-1108, yeas 33, nays 65. H.J. 684."
1935321,2025-03-18,House,16,"Motion to suspend rules failed. H.J. 685."
1935321,2025-03-18,House,17,"Passed House, yeas 65, nays 33. H.J. 685."
1935321,2025-03-18,House,18,"Immediate message. H.J. 692."
1935321,2025-03-19,Senate,19,"Message from House. S.J. 569."
1935321,2025-04-10,Senate,20,"Reported correctly enrolled, signed by President and Speaker, and sent to Governor. S.J. 760."
1935321,2025-04-10,Senate,21,"Signed by Governor. S.J. 781."
1935339,2025-01-22,Senate,1,"Introduced, referred to Health and Human Services. S.J. 122."
1935339,2025-01-30,Senate,2,"Subcommittee: Klimesh, Celsi, and Costello. S.J. 169."
1935364,2025-01-22,Senate,1,"Introduced, referred to State Government. S.J. 118."
1935364,2025-01-28,Senate,2,"Subcommittee: Rozenboom, Bisignano, and Schultz. S.J. 152."
1935394,2025-01-22,Senate,1,"Introduced, referred to State Government. S.J. 121."
1935394,2025-02-04,Senate,2,"Subcommittee: Rozenboom, Schultz, and Staed. S.J. 193."
1935394,2025-02-10,Senate,3,"Subcommittee Meeting: 02/11/2025 4:00PM Room 217 Conference Room."
1935394,2025-02-12,Senate,4,"Subcommittee recommends amendment and passage."
1935426,2025-01-22,House,1,"By COMMITTEE ON COMMERCE"
1935426,2025-01-22,House,2,"Introduced, referred to Commerce. H.J. 115."
1935426,2025-01-22,House,3,"Subcommittee: Thomson, C., Lawler and Zabner. H.J. 118."
1935426,2025-01-27,House,4,"Subcommittee Meeting: 01/28/2025 3:00PM RM 102 (Cancelled)."
1935426,2025-01-27,House,5,"Subcommittee Meeting: 02/05/2025 12:30PM RM 102."
1935426,2025-02-05,House,6,"Subcommittee recommends passage."
1935426,2025-02-06,House,7,"Committee report, recommending passage. H.J. 267."
1935426,2025-02-06,House,8,"Committee vote: Yeas, 15. Nays, 8. H.J. 267."
1935426,2025-02-10,House,9,"Committee report approving bill, renumbered as HF 302."
1935459,2025-01-22,Senate,1,"Introduced, referred to Workforce. S.J. 124."
1935459,2025-01-23,Senate,2,"Subcommittee: Driscoll, Sires, and Wahls. S.J. 137."
1935491,2025-01-22,Senate,1,"Introduced, referred to Judiciary. S.J. 123."
1935491,2025-01-23,Senate,2,"Subcommittee: Lofgren, Petersen, and Shipley. S.J. 137."
1935522,2025-01-22,Senate,1,"Introduced, referred to Appropriations. S.J. 120."
1935522,2025-01-28,Senate,2,"Subcommittee: Costello, Kraayenbrink, and Petersen. S.J. 152."
1935554,2025-01-22,Senate,1,"Introduced, referred to Education. S.J. 121."
1935554,2025-01-28,Senate,2,"Subcommittee: Rozenboom, Kraayenbrink, and Trone Garriott. S.J. 152."
1935587,2025-01-22,Senate,1,"Introduced, referred to Workforce. S.J. 122."
1935587,2025-01-23,Senate,2,"Subcommittee: Driscoll, Donahue, and Lofgren. S.J. 137."
1935620,2025-01-22,Senate,1,"Introduced, referred to Local Government. S.J. 122."
1935620,2025-02-04,Senate,2,"Subcommittee: Driscoll, Quirmbach, and Webster."
1935649,2025-01-22,Senate,1,"Introduced, referred to Commerce. S.J. 120."
1935649,2025-01-23,Senate,2,"Subcommittee: Driscoll, Dickey, and Trone Garriott. S.J. 136."
1935684,2025-01-22,Senate,1,"Introduced, referred to Education. S.J. 119."
1935684,2025-01-28,Senate,2,"Subcommittee: Rozenboom, Donahue, and Kraayenbrink. S.J. 152."
1935717,2025-01-22,Senate,1,"Introduced, referred to Judiciary. S.J. 120."
1935717,2025-01-23,Senate,2,"Subcommittee: Schultz, Blake, and Bousselot. S.J. 136."
1935751,2025-01-22,Senate,1,"Introduced, referred to Ways and Means. S.J. 122."
1935751,2025-01-28,Senate,2,"Subcommittee: Dickey, Rowley, and Townsend. S.J. 152."
1935751,2025-04-03,Senate,3,"Subcommittee Meeting: 04/07/2025 12:30PM Room 217 Conference Room."
1935751,2025-04-07,Senate,4,"Subcommittee recommends passage."
1935751,2025-04-22,Senate,5,"Committee report approving bill, renumbered as SF 635. S.J. 859."
1935781,2025-01-22,Senate,1,"Introduced, referred to State Government. S.J. 121."
1935781,2025-01-27,Senate,2,"Subcommittee: Rozenboom, Schultz, and Winckler. S.J. 143."
1935813,2025-01-22,Senate,1,"Introduced, referred to Veterans Affairs. S.J. 121."
1935813,2025-01-27,Senate,2,"Subcommittee: Reichman, Bennett, and Pike. S.J. 143."
1935813,2025-01-28,Senate,3,"Subcommittee Meeting: 01/29/2025 1:00PM Senate Lounge."
1935813,2025-01-29,Senate,4,"Subcommittee recommends amendment and passage."
1935813,2025-02-11,Senate,5,"Committee report, recommending amendment and passage. S.J. 247."
1935813,2025-02-11,Senate,6,"Placed on calendar."
1935813,2025-02-11,Senate,7,"Amendment S-3003 filed. S.J. 247."
1935813,2025-03-10,Senate,8,"Amendment S-3003 adopted. S.J. 446."
1935813,2025-03-10,Senate,9,"Passed Senate, yeas 47, nays 0. S.J. 446."
1935813,2025-03-10,Senate,10,"Immediate message. S.J. 448."
1935813,2025-03-10,House,11,"Message from Senate. H.J. 589."
1935813,2025-03-11,House,12,"Read first time, referred to Veterans Affairs. H.J. 594."
1935813,2025-03-13,House,13,"Subcommittee: Boden, Hermanson and Levin. H.J. 657."
1935813,2025-03-13,House,14,"Subcommittee Meeting: 03/17/2025 12:00PM House Lounge."
1935813,2025-03-17,House,15,"Subcommittee recommends passage."
1935813,2025-03-31,House,16,"Committee report, recommending passage. H.J. 880."
1935813,2025-03-31,House,17,"Committee vote: Yeas, 13. Nays, 0. Excused, 4. H.J. 880."
1935813,2025-04-01,House,18,"Placed on calendar. H.J. 880."
1935813,2025-04-10,House,19,"Placed on calendar under unfinished business. H.J. 928."
1935813,2025-05-15,House,20,"Rereferred to Veterans Affairs. H.J. 1222."
1935848,2025-01-22,Senate,1,"Introduced, referred to Agriculture. S.J. 123."
1935848,2025-01-27,Senate,2,"Subcommittee: Zumbach, Bennett, and Driscoll. S.J. 143."
1935877,2025-01-22,Senate,1,"Introduced, referred to Education. S.J. 120."
1935877,2025-01-28,Senate,2,"Subcommittee: Salmon, Campbell, and Staed. S.J. 152."
1935877,2025-01-31,Senate,3,"Subcommittee Meeting: 02/04/2025 3:00PM Room 217 Conference Room."
1935877,2025-02-04,Senate,4,"Subcommittee recommends passage."
1935913,2025-01-22,Senate,1,"Introduced, referred to Health and Human Services. S.J. 123."
1935913,2025-01-28,Senate,2,"Subcommittee: Lofgren, Klimesh, and Trone Garriott. S.J. 153."
1935913,2025-01-27,Senate,3,"Subcommittee Meeting: 01/29/2025 10:00AM Room 315."
1935913,2025-01-29,Senate,4,"Subcommittee recommends amendment and passage."
1935941,2025-01-22,Senate,1,"Introduced, referred to Judiciary. S.J. 123."
1935941,2025-01-23,Senate,2,"Subcommittee: Schultz, Knox, and Webster. S.J. 137."
1935941,2025-01-28,Senate,3,"Subcommittee Meeting: 01/29/2025 11:30AM Room 217 Conference Room."
1935941,2025-01-29,Senate,4,"Subcommittee recommends passage."
1935941,2025-02-12,Senate,5,"Committee report, recommending passage. S.J. 259."
1935941,2025-02-12,Senate,6,"Placed on calendar."
1935941,2025-03-17,Senate,7,"Passed Senate, yeas 39, nays 7. S.J. 542."
1935941,2025-03-17,Senate,8,"Immediate message. S.J. 545."
1935941,2025-03-17,House,9,"Message from Senate. H.J. 663."
1935941,2025-03-18,House,10,"Read first time, referred to Judiciary. H.J. 678."
1935941,2025-03-19,House,11,"Passed on file. H.J. 750."
1935941,2025-03-25,House,12,"Amendment H-1174 filed. H.J. 814."
1935941,2025-03-26,House,13,"Substituted for HF 925. H.J. 837."
1935941,2025-03-26,House,14,"Amendment H-1174 adopted. H.J. 838."
1935941,2025-03-26,House,15,"Passed House, yeas 93, nays 3. H.J. 838."
1935941,2025-04-22,House,16,"Explanation of vote. H.J. 1034."
1935941,2025-03-26,House,17,"Immediate message. H.J. 850."
1935941,2025-03-27,Senate,18,"Message from House, with amendment S-3060. S.J. 656."
1935941,2025-04-28,Senate,19,"Senate concurred with S-3060. S.J. 904."
1935941,2025-04-28,Senate,20,"Passed Senate, yeas 42, nays 8. S.J. 905."
1935941,2025-04-28,Senate,21,"Immediate message. S.J. 906."
1935941,2025-04-29,House,22,"Message from Senate. H.J. 1075."
1935941,2025-05-06,Senate,23,"Reported correctly enrolled, signed by President and Speaker, and sent to Governor. S.J. 942."
1935941,2025-05-06,Senate,24,"Signed by Governor. S.J. 943."
1935973,2025-01-22,Senate,1,"Introduced, referred to Commerce. S.J. 121."
1935973,2025-01-23,Senate,2,"Subcommittee: Webster, Sweeney, and Wahls. S.J. 136."
1936005,2025-01-22,Senate,1,"Introduced, referred to Natural Resources and Environment. S.J. 120."
1936005,2025-01-23,Senate,2,"Subcommittee: Zumbach, Rozenboom, and Trone Garriott. S.J. 136."
1936005,2025-01-27,Senate,3,"Subcommittee Meeting: 01/28/2025 1:30PM Room G15."
1936038,2025-01-22,Senate,1,"Introduced, referred to Judiciary. S.J. 119."
1936038,2025-01-23,Senate,2,"Subcommittee: Dickey, Knox, and Schultz. S.J. 136."
1936071,2025-01-22,Senate,1,"Introduced, referred to Education. S.J. 122."
1936071,2025-01-28,Senate,2,"Subcommittee: Evans, Staed, and Taylor. S.J. 152."
1936104,2025-01-22,Senate,1,"Introduced, referred to Natural Resources and Environment. S.J. 123."
1936104,2025-01-28,Senate,2,"Subcommittee: Evans, Staed, and Westrich. S.J. 153."
1936104,2025-01-28,Senate,3,"Subcommittee Meeting: 01/29/2025 10:30AM Room 217 Conference Room."
1936104,2025-01-29,Senate,4,"Subcommittee recommends amendment and passage."
1936104,2025-03-06,Senate,5,"Committee report approving bill, renumbered as SF 548. S.J. 439."
1936138,2025-01-22,Senate,1,"Introduced, referred to Natural Resources and Environment. S.J. 119."
1936138,2025-01-23,Senate,2,"Subcommittee: Westrich, Celsi, and Pike. S.J. 136."
1936138,2025-02-24,Senate,3,"Subcommittee reassigned: Westrich, Pike, and Zimmer. S.J. 341."
1936167,2025-01-22,Senate,1,"Introduced, referred to Education. S.J. 123."
1936167,2025-01-28,Senate,2,"Subcommittee: Evans, Donahue, and Taylor. S.J. 153."
1936201,2025-01-22,Senate,1,"Introduced, referred to Judiciary. S.J. 122."
1936201,2025-01-23,Senate,2,"Subcommittee: Schultz, Blake, and Dickey. S.J. 137."
1936231,2025-01-22,Senate,1,"Introduced, referred to Education. S.J. 119."
1936231,2025-01-28,Senate,2,"Subcommittee: Rozenboom, Donahue, and Kraayenbrink. S.J. 152."
1936267,2025-01-22,Senate,1,"Introduced, referred to State Government. S.J. 121."
1936267,2025-01-28,Senate,2,"Subcommittee: Reichman, Koelker, and Townsend. S.J. 152."
1936296,2025-01-22,Senate,1,"Introduced, referred to Judiciary. S.J. 123."
1936296,2025-01-23,Senate,2,"Subcommittee: Reichman, Dawson, and Knox. S.J. 137."
1936296,2025-01-27,Senate,3,"Subcommittee Meeting: 01/29/2025 11:00AM Senate Lounge."
1936296,2025-01-29,Senate,4,"Subcommittee recommends amendment and passage."
1936296,2025-03-06,Senate,5,"Committee report, recommending passage. S.J. 437."
1936296,2025-03-06,Senate,6,"Placed on calendar."
1936296,2025-03-14,Senate,7,"Fiscal note."
1936296,2025-04-03,Senate,8,"Placed on calendar under unfinished business. S.J. 688."
1936296,2025-06-16,Senate,9,"Referred to Judiciary. S.J. 1057."
1936330,2025-01-22,Senate,1,"Introduced, referred to Education. S.J. 120."
1936330,2025-01-28,Senate,2,"Subcommittee: Rozenboom, Donahue, and Kraayenbrink. S.J. 152."
1936362,2025-01-22,Senate,1,"Introduced, referred to Judiciary. S.J. 119."
1936362,2025-01-23,Senate,2,"Subcommittee: Evans, Knox, and Rowley. S.J. 136."
1936362,2025-01-27,Senate,3,"Subcommittee Meeting: 01/29/2025 10:00AM Room 217 Conference Room."
1936362,2025-01-29,Senate,4,"Subcommittee recommends passage."
1936362,2025-02-12,Senate,5,"Committee report, recommending passage. S.J. 259."
1936362,2025-02-12,Senate,6,"Placed on calendar."
1936362,2025-06-16,Senate,7,"Referred to Judiciary. S.J. 1057."
1936394,2025-01-22,Senate,1,"Introduced, referred to Commerce. S.J. 121."
1936394,2025-01-23,Senate,2,"Subcommittee: Webster, Knox, and Sweeney. S.J. 137."
1936422,2025-01-22,Senate,1,"Introduced, referred to Education. S.J. 120."
1936422,2025-01-28,Senate,2,"Subcommittee: Rozenboom, Kraayenbrink, and Staed. S.J. 152."
1936837,2025-01-23,House,1,"Introduced, referred to Education. H.J. 119."
1936837,2025-01-30,House,2,"Subcommittee: Moore, T., Henderson and Levin. H.J. 171."
1936837,2025-02-03,House,3,"Subcommittee Meeting: 02/05/2025 8:00AM RM 304.1."
1936837,2025-02-05,House,4,"Subcommittee recommends passage."
1936850,2025-01-23,House,1,"By COMMITTEE ON LABOR AND WORKFORCE"
1936850,2025-01-23,House,2,"Introduced, referred to Labor and Workforce. H.J. 120."
1936850,2025-01-23,House,3,"Subcommittee: Moore, T., Jeneary and McBurney. H.J. 124."
1936850,2025-01-29,House,4,"Subcommittee Meeting: 02/03/2025 12:00PM House Lounge."
1936850,2025-02-03,House,5,"Subcommittee recommends passage."
1936850,2025-02-25,House,6,"Committee report, recommending amendment and passage. H.J. 434."
1936850,2025-02-25,House,7,"Committee vote: Yeas, 17. Nays, 0. H.J. 434."
1936850,2025-03-04,House,8,"Committee report approving bill, renumbered as HF 722."
1936859,2025-01-23,House,1,"Introduced, referred to Economic Growth and Technology. H.J. 119."
1936859,2025-02-06,House,2,"Subcommittee: Sorensen, Baeth and Sitzmann. H.J. 264."
1936859,2025-02-06,House,3,"Subcommittee Meeting: 02/11/2025 12:00PM RM 19."
1936859,2025-02-11,House,4,"Subcommittee recommends passage."
1936859,2025-03-05,House,5,"Committee report, recommending amendment and passage. H.J. 526."
1936859,2025-03-05,House,6,"Committee vote: Yeas, 13. Nays, 7. Excused, 1. H.J. 526."
1936859,2025-03-07,House,7,"Committee report approving bill, renumbered as HF 872."
1936859,2025-03-31,House,8,"Withdrawn. H.J. 871."
1936874,2025-01-23,Senate,1,"By COMMITTEE ON WORKFORCE"
1936874,2025-01-23,Senate,2,"Introduced, referred to Workforce."
1936874,2025-01-23,Senate,3,"Subcommittee: Driscoll, Dotzler, and Schultz."
1936874,2025-01-27,Senate,4,"Subcommittee Meeting: 01/28/2025 11:00AM Room 315."
1936874,2025-01-28,Senate,5,"Subcommittee recommends passage."
1936885,2025-01-23,House,1,"By COMMITTEE ON STATE GOVERNMENT"
1936885,2025-01-23,House,2,"Introduced, referred to State Government. H.J. 121."
1936885,2025-01-23,House,3,"Subcommittee: Siegrist, Jones and Scheetz. H.J. 124."
1936885,2025-01-27,House,4,"Subcommittee Meeting: 01/29/2025 12:00PM RM 103."
1936885,2025-01-29,House,5,"Subcommittee recommends passage."
1936885,2025-02-05,House,6,"Committee report, recommending passage. H.J. 186."
1936885,2025-02-05,House,7,"Committee vote: Yeas, 23. Nays, 0. H.J. 186."
1936885,2025-03-07,House,8,"Committee report approving bill, renumbered as HF 889."
1936900,2025-01-23,House,1,"By COMMITTEE ON STATE GOVERNMENT"
1936900,2025-01-23,House,2,"Introduced, referred to State Government. H.J. 121."
1936900,2025-01-23,House,3,"Subcommittee: Bergan, Cooling and Jones. H.J. 124."
1936900,2025-02-10,House,4,"Subcommittee Meeting: 02/11/2025 8:30AM RM 304.1."
1936900,2025-02-11,House,5,"Tabled until future meeting."
1936900,2025-02-20,House,6,"Subcommittee Meeting: 02/25/2025 7:45AM House Lounge."
1936900,2025-02-25,House,7,"Subcommittee recommends amendment and passage."
1936900,2025-02-26,House,8,"Committee report, recommending amendment and passage. H.J. 447."
1936900,2025-02-26,House,9,"Committee vote: Yeas, 23. Nays, 0. H.J. 447."
1936900,2025-03-05,House,10,"Committee report approving bill, renumbered as HF 756."
1936913,2025-01-23,House,1,"By COMMITTEE ON STATE GOVERNMENT"
1936913,2025-01-23,House,2,"Introduced, referred to State Government. H.J. 120."
1936913,2025-01-23,House,3,"Subcommittee: Hora, Turek and Wilz, H. H.J. 124."
1936913,2025-01-30,House,4,"Subcommittee Meeting: 02/03/2025 1:00PM House Lounge."
1936913,2025-02-03,House,5,"Subcommittee recommends passage."
1936913,2025-02-12,House,6,"Committee report, recommending passage. H.J. 311."
1936913,2025-02-12,House,7,"Committee vote: Yeas, 23. Nays, 0. H.J. 311."
1936913,2025-02-13,House,8,"Committee report approving bill, renumbered as HF 396."
1936926,2025-01-23,Senate,1,"By COMMITTEE ON STATE GOVERNMENT"
1936926,2025-01-23,Senate,2,"Introduced, referred to State Government."
1936926,2025-01-23,Senate,3,"Subcommittee: Guth, Blake, and Webster."
1936926,2025-01-27,Senate,4,"Subcommittee Meeting: 01/29/2025 2:00PM Senate Lounge."
1936926,2025-01-29,Senate,5,"Subcommittee recommends amendment and passage."
1936926,2025-03-05,Senate,6,"Committee report approving bill, renumbered as SF 565."
1936942,2025-01-23,House,1,"Introduced, placed on calendar. H.J. 120."
1936942,2025-01-29,House,2,"Amendment H-1001 filed. H.J. 147."
1936942,2025-01-30,House,3,"Amendment H-1001, yeas 31, nays 68, lost. H.J. 163."
1936942,2025-01-30,House,4,"Passed House, yeas 99, nays 0. H.J. 164."
1936942,2025-01-30,House,5,"Immediate message. H.J. 169."
1936942,2025-02-03,Senate,6,"Message from House. S.J. 173."
1936942,2025-02-03,Senate,7,"Read first time, referred to Veterans Affairs. S.J. 173."
1936942,2025-02-05,Senate,8,"Subcommittee: Salmon, Bennett, and Pike. S.J. 203."
1936942,2025-02-06,Senate,9,"Subcommittee Meeting: []."
1936942,2025-02-11,Senate,10,"Subcommittee recommends passage."
1936942,2025-02-24,Senate,11,"Committee report, recommending passage. S.J. 360."
1936942,2025-02-24,Senate,12,"Placed on calendar."
1936942,2025-04-09,Senate,13,"Passed Senate, yeas 47, nays 0. S.J. 747."
1936942,2025-04-09,Senate,14,"Immediate message. S.J. 748."
1936942,2025-04-10,House,15,"Message from Senate. H.J. 925."
1936942,2025-05-02,House,16,"Reported correctly enrolled, signed by Speaker and President, and sent to Governor. H.J. 1089."
1936942,2025-05-02,House,17,"Signed by Governor. H.J. 1089."
1936958,2025-01-23,House,1,"By COMMITTEE ON STATE GOVERNMENT"
1936958,2025-01-23,House,2,"Introduced, referred to State Government. H.J. 121."
1936958,2025-01-23,House,3,"Subcommittee: Collins, Jeneary and Wilburn. H.J. 124."
1936958,2025-01-29,House,4,"Subcommittee Meeting: 01/30/2025 11:30AM RM 304."
1936958,2025-01-30,House,5,"Subcommittee recommends passage."
1936958,2025-02-12,House,6,"Committee report, recommending passage. H.J. 312."
1936958,2025-02-12,House,7,"Committee vote: Yeas, 23. Nays, 0. H.J. 312."
1936958,2025-02-13,House,8,"Committee report approving bill, renumbered as HF 400."
1936969,2025-01-23,House,1,"Introduced, referred to Education. H.J. 119."
1936969,2025-01-30,House,2,"Subcommittee: Shipley, Gehlbach and Wessel-Kroeschell. H.J. 171."
1936969,2025-02-14,House,3,"Subcommittee Meeting: 02/17/2025 12:30PM RM 103."
1936969,2025-02-17,House,4,"Subcommittee recommends amendment and passage."
1936969,2025-02-18,House,5,"Committee report, recommending amendment and passage. H.J. 364."
1936969,2025-02-18,House,6,"Committee vote: Yeas, 17. Nays, 5. Excused, 1. H.J. 364."
1936969,2025-02-20,House,7,"Committee report approving bill, renumbered as HF 522."
1936969,2025-03-21,House,8,"Withdrawn. H.J. 772."
1936981,2025-01-23,House,1,"By COMMITTEE ON STATE GOVERNMENT"
1936981,2025-01-23,House,2,"Introduced, referred to State Government. H.J. 120."
1936981,2025-01-23,House,3,"Subcommittee: Dunwell, Cooling and Johnson, C. H.J. 124."
1936981,2025-01-27,House,4,"Subcommittee Meeting: 01/28/2025 12:30PM House Lounge 2."
1936981,2025-01-28,House,5,"Subcommittee recommends passage."
1936981,2025-02-05,House,6,"Committee report, recommending passage. H.J. 185."
1936981,2025-02-05,House,7,"Committee vote: Yeas, 23. Nays, 0. H.J. 185."
1936981,2025-02-06,House,8,"Committee report approving bill, renumbered as HF 260."
1936998,2025-01-23,House,1,"By COMMITTEE ON WAYS AND MEANS"
1936998,2025-01-23,House,2,"Introduced, referred to Ways and Means. H.J. 121."
1936998,2025-01-23,House,3,"Subcommittee: Kaufmann, Jacoby, Nordman, Scheetz and Siegrist. H.J. 125."
1936998,2025-01-23,House,4,"Subcommittee Meeting: 01/27/2025 12:30PM RM 102."
1936998,2025-01-27,House,5,"Subcommittee recommends passage."
1936998,2025-01-27,House,6,"Committee report, recommending passage. H.J. 132."
1936998,2025-01-27,House,7,"Committee vote: Yeas, 17. Nays, 8. H.J. 132."
1936998,2025-01-27,House,8,"Committee report approving bill, renumbered as HF 144."
1937010,2025-01-23,House,1,"By COMMITTEE ON STATE GOVERNMENT"
1937010,2025-01-23,House,2,"Introduced, referred to State Government. H.J. 120."
1937010,2025-01-23,House,3,"Subcommittee: Wulf, Bossman and Scheetz. H.J. 124."
1937010,2025-01-27,House,4,"Subcommittee Meeting: 01/28/2025 11:30AM RM 305 (Cancelled)."
1937010,2025-01-28,House,5,"Subcommittee Meeting: 01/30/2025 12:30PM House Lounge."
1937010,2025-01-30,House,6,"Subcommittee recommends passage."
1937010,2025-03-05,House,7,"Committee report, recommending amendment and passage. H.J. 533."
1937010,2025-03-05,House,8,"Committee vote: Yeas, 15. Nays, 6. Excused, 2. H.J. 533."
1937010,2025-03-12,House,9,"Committee report approving bill, renumbered as HF 952."
1937023,2025-01-23,Senate,1,"Introduced, placed on calendar. S.J. 129."
1937023,2025-01-23,Senate,2,"Committee report, approving bill. S.J. 138."
1937023,2025-03-31,Senate,3,"Attached to HF 767. S.J. 663."
1937023,2025-04-03,Senate,4,"Placed on calendar under unfinished business. S.J. 688."
1937023,2025-05-14,Senate,5,"HF 767 substituted. S.J. 1016."
1937023,2025-05-14,Senate,6,"Withdrawn. S.J. 1017."
1937038,2025-01-23,House,1,"By COMMITTEE ON STATE GOVERNMENT"
1937038,2025-01-23,House,2,"Introduced, referred to State Government. H.J. 121."
1937038,2025-01-23,House,3,"Subcommittee: Siegrist, Dunwell and Zabner. H.J. 124."
1937038,2025-01-27,House,4,"Subcommittee Meeting: 01/30/2025 8:00AM RM 102."
1937038,2025-01-30,House,5,"Subcommittee recommends passage."
1937038,2025-02-05,House,6,"Committee report, recommending passage. H.J. 186."
1937038,2025-02-05,House,7,"Committee vote: Yeas, 23. Nays, 0. H.J. 186."
1937038,2025-02-06,House,8,"Committee report approving bill, renumbered as HF 259."
1937055,2025-01-23,House,1,"Introduced, placed on calendar. H.J. 120."
1937055,2025-01-29,House,2,"Amendment H-1003 filed. H.J. 147."
1937055,2025-01-29,House,3,"Fiscal note."
1937055,2025-01-30,House,4,"Point of order raised on amendment H-1003, ruled not germane. H.J. 165."
1937055,2025-01-30,House,5,"Motion to suspend rules for immediate consideration of amendment H-1003, yeas 32, nays 67. H.J. 165."
1937055,2025-01-30,House,6,"Motion to suspend rules failed. H.J. 166."
1937055,2025-01-30,House,7,"Passed House, yeas 99, nays 0. H.J. 167."
1937055,2025-01-30,House,8,"Immediate message. H.J. 169."
1937055,2025-02-03,Senate,9,"Message from House. S.J. 172."
1937055,2025-02-03,Senate,10,"Read first time, referred to Education. S.J. 172."
1937055,2025-02-10,Senate,11,"Subcommittee: Salmon, Pike, and Winckler."
1937055,2025-02-17,Senate,12,"Subcommittee Meeting: []."
1937055,2025-02-19,Senate,13,"Subcommittee recommends passage."
1937055,2025-03-31,Senate,14,"Committee report, recommending passage. S.J. 666."
1937055,2025-03-31,Senate,15,"Placed on calendar."
1937055,2025-04-10,Senate,16,"Placed on calendar under unfinished business. S.J. 757."
1937055,2025-04-22,Senate,17,"Passed Senate, yeas 46, nays 0. S.J. 856."
1937055,2025-04-22,Senate,18,"Immediate message. S.J. 856."
1937055,2025-04-22,House,19,"Message from Senate. H.J. 1015."
1937055,2025-05-02,House,20,"Reported correctly enrolled, signed by Speaker and President, and sent to Governor. H.J. 1089."
1937055,2025-05-02,House,21,"Signed by Governor. H.J. 1089."
1937067,2025-01-23,House,1,"Introduced, referred to State Government. H.J. 120."
1937067,2025-01-30,House,2,"Subcommittee: Wilz, H., Smith and Turek. H.J. 171."
1937067,2025-02-03,House,3,"Subcommittee Meeting: 02/06/2025 12:30PM RM 304."
1937067,2025-02-06,House,4,"Subcommittee recommends passage."
1937067,2025-02-19,House,5,"Committee report, recommending amendment and passage. H.J. 369."
1937067,2025-02-19,House,6,"Committee vote: Yeas, 22. Nays, 0. Excused, 1. H.J. 369."
1937067,2025-02-20,House,7,"Committee report approving bill, renumbered as HF 524."
1937067,2025-03-21,House,8,"Withdrawn. H.J. 772."
1937080,2025-01-23,House,1,"By COMMITTEE ON STATE GOVERNMENT"
1937080,2025-01-23,House,2,"Introduced, referred to State Government. H.J. 121."
1937080,2025-01-23,House,3,"Subcommittee: Bossman, Hora and Srinivas. H.J. 124."
1937080,2025-01-23,House,4,"Subcommittee Meeting: 01/30/2025 12:00PM House Lounge."
1937080,2025-01-30,House,5,"Subcommittee recommends passage."
1937080,2025-02-12,House,6,"Committee report, recommending passage. H.J. 311."
1937080,2025-02-12,House,7,"Committee vote: Yeas, 23. Nays, 0. H.J. 311."
1937080,2025-02-13,House,8,"Committee report approving bill, renumbered as HF 397."
1937096,2025-01-23,House,1,"By COMMITTEE ON COMMERCE"
1937096,2025-01-23,House,2,"Introduced, referred to Commerce. H.J. 122."
1937096,2025-01-23,House,3,"Subcommittee: Wilz, H., Bagniewski and Wills, J. H.J. 125."
1937096,2025-01-23,House,4,"Subcommittee Meeting: 01/27/2025 12:30PM RM 103."
1937096,2025-01-27,House,5,"Subcommittee recommends passage."
1937096,2025-02-11,House,6,"Committee report, recommending amendment and passage. H.J. 293."
1937096,2025-02-11,House,7,"Committee vote: Yeas, 23. Nays, 0. H.J. 293."
1937096,2025-02-13,House,8,"Committee report approving bill, renumbered as HF 404."
1937107,2025-01-23,Senate,1,"By COMMITTEE ON NATURAL RESOURCES AND ENVIRONMENT"
1937107,2025-01-23,Senate,2,"Introduced, referred to Natural Resources and Environment."
1937107,2025-01-27,Senate,3,"Subcommittee: Sweeney, Bennett, and Shipley."
1937107,2025-01-28,Senate,4,"Subcommittee Meeting: 01/29/2025 3:15PM Room 217 Conference Room."
1937107,2025-01-29,Senate,5,"Subcommittee recommends amendment and passage."
1937107,2025-02-24,Senate,6,"Committee report approving bill, renumbered as SF 426."
1937122,2025-01-23,House,1,"By COMMITTEE ON STATE GOVERNMENT"
1937122,2025-01-23,House,2,"Introduced, referred to State Government. H.J. 121."
1937122,2025-01-23,House,3,"Subcommittee: Collins, Jeneary and Zabner. H.J. 124."
1937122,2025-01-27,House,4,"Subcommittee Meeting: 01/29/2025 8:00AM House Lounge."
1937122,2025-01-29,House,5,"Subcommittee recommends passage."
1937122,2025-02-05,House,6,"Committee report, recommending passage. H.J. 186."
1937122,2025-02-05,House,7,"Committee vote: Yeas, 21. Nays, 2. H.J. 186."
1937122,2025-02-06,House,8,"Committee report approving bill, renumbered as HF 261."
1937133,2025-01-23,House,1,"By COMMITTEE ON STATE GOVERNMENT"
1937133,2025-01-23,House,2,"Introduced, referred to State Government. H.J. 121."
1937133,2025-01-23,House,3,"Subcommittee: Wilz, H., Smith and Wilburn. H.J. 124."
1937133,2025-01-23,House,4,"Subcommittee Meeting: 01/30/2025 12:00PM House Lounge 2."
1937133,2025-01-30,House,5,"Subcommittee recommends passage."
1937133,2025-02-12,House,6,"Committee report, recommending passage. H.J. 312."
1937133,2025-02-12,House,7,"Committee vote: Yeas, 23. Nays, 0. H.J. 312."
1937133,2025-03-05,House,8,"Committee report approving bill, renumbered as HF 768."
1937145,2025-01-23,House,1,"Introduced, referred to Higher Education. H.J. 119."
1937145,2025-01-27,House,2,"Subcommittee: Wills, J., Shipley and Wilburn. H.J. 131."
1937145,2025-02-10,House,3,"Subcommittee Meeting: 02/11/2025 7:30AM House Lounge."
1937145,2025-02-11,House,4,"Subcommittee recommends amendment and passage."
1937145,2025-02-19,House,5,"Committee report, recommending passage. H.J. 366."
1937145,2025-02-19,House,6,"Committee vote: Yeas, 8. Nays, 3. H.J. 366."
1937145,2025-02-24,House,7,"Committee report approving bill, renumbered as HF 576."
1937152,2025-01-23,House,1,"By COMMITTEE ON STATE GOVERNMENT"
1937152,2025-01-23,House,2,"Introduced, referred to State Government. H.J. 121."
1937152,2025-01-23,House,3,"Subcommittee: Lundgren, Johnson, C. and Scheetz. H.J. 124."
1937152,2025-01-27,House,4,"Subcommittee Meeting: 01/29/2025 12:45PM RM 304."
1937152,2025-01-29,House,5,"Subcommittee recommends passage."
1937152,2025-02-12,House,6,"Committee report, recommending passage. H.J. 312."
1937152,2025-02-12,House,7,"Committee vote: Yeas, 23. Nays, 0. H.J. 312."
1937152,2025-02-19,House,8,"Committee report approving bill, renumbered as HF 470."
1937172,2025-01-23,Senate,1,"Introduced, placed on calendar. S.J. 129."
1937172,2025-01-23,Senate,2,"Committee report, approving bill. S.J. 138."
1937172,2025-02-06,Senate,3,"Deferred. S.J. 205."
1937172,2025-02-06,Senate,4,"Attached to HCR 4. S.J. 206."
1937172,2025-02-06,Senate,5,"HCR 4 substituted. S.J. 207."
1937172,2025-02-06,Senate,6,"Withdrawn. S.J. 207."
1937233,2025-01-23,Senate,1,"Introduced, referred to Natural Resources and Environment. S.J. 130."
1937233,2025-01-27,Senate,2,"Subcommittee: Shipley, Bennett, and Pike. S.J. 143."
1937233,2025-02-05,Senate,3,"Subcommittee Meeting: 02/06/2025 12:30PM Room 217 Conference Room."
1937233,2025-02-06,Senate,4,"Subcommittee recommends amendment and passage."
1937304,2025-01-23,Senate,1,"Introduced, referred to Education. S.J. 130."
1937304,2025-01-28,Senate,2,"Subcommittee: Rozenboom, Donahue, and Kraayenbrink. S.J. 153."
1937373,2025-01-23,House,1,"By COMMITTEE ON LOCAL GOVERNMENT"
1937373,2025-01-23,House,2,"Introduced, referred to Local Government. H.J. 122."
1937373,2025-01-23,House,3,"Subcommittee: Graber, Golding and McBurney. H.J. 125."
1937373,2025-02-03,House,4,"Subcommittee Meeting: 02/05/2025 12:00PM House Lounge (Cancelled)."
1937373,2025-02-03,House,5,"Subcommittee reassigned: Wengryn, Jones and McBurney. H.J. 179."
1937373,2025-02-10,House,6,"Subcommittee Meeting: 02/13/2025 8:00AM RM 102."
1937373,2025-02-13,House,7,"Subcommittee recommends amendment and passage."
1937373,2025-02-25,House,8,"Committee report, recommending amendment and passage. H.J. 435."
1937373,2025-02-25,House,9,"Committee vote: Yeas, 20. Nays, 0. Excused, 1. H.J. 435."
1937373,2025-02-28,House,10,"Committee report approving bill, renumbered as HF 641."
1937445,2025-01-23,House,1,"By COMMITTEE ON LOCAL GOVERNMENT"
1937445,2025-01-23,House,2,"Introduced, referred to Local Government. H.J. 122."
1937445,2025-01-23,House,3,"Subcommittee: Graber, Golding and Zabner. H.J. 125."
1937445,2025-02-03,House,4,"Subcommittee reassigned: Williams, Jones and Zabner. H.J. 179."
1937445,2025-02-11,House,5,"Subcommittee Meeting: 02/11/2025 3:00PM RM 102."
1937445,2025-02-11,House,6,"Subcommittee recommends amendment and passage."
1937520,2025-01-23,Senate,1,"Introduced, referred to Judiciary. S.J. 131."
1937520,2025-01-29,Senate,2,"Subcommittee: Westrich, Taylor, and Weiner. S.J. 162."
1937520,2025-02-04,Senate,3,"Subcommittee Meeting: 02/05/2025 2:30PM Senate Lounge."
1937520,2025-02-05,Senate,4,"Subcommittee recommends passage."
1937592,2025-01-23,Senate,1,"Introduced, referred to State Government. S.J. 131."
1937592,2025-02-04,Senate,2,"Subcommittee: Rozenboom, Celsi, and Schultz. S.J. 193."
1937662,2025-01-23,Senate,1,"Introduced, referred to Education. S.J. 130."
1937662,2025-01-28,Senate,2,"Subcommittee: Salmon, Campbell, and Winckler. S.J. 153."
1937662,2025-02-05,Senate,3,"Subcommittee Meeting: 02/06/2025 8:00AM Room 315."
1937662,2025-02-06,Senate,4,"Subcommittee recommends passage."
1937733,2025-01-23,Senate,1,"By COMMITTEE ON LOCAL GOVERNMENT"
1937733,2025-01-23,Senate,2,"Introduced, referred to Local Government."
1937733,2025-01-27,Senate,3,"Subcommittee: Webster, Knox, and Sires."
1937733,2025-01-27,Senate,4,"Subcommittee reassigned: Sires, Knox, and Webster."
1937733,2025-01-27,Senate,5,"Subcommittee Meeting: 01/29/2025 9:30AM Room 217 Conference Room."
1937733,2025-01-29,Senate,6,"Subcommittee recommends amendment and passage."
1937733,2025-03-03,Senate,7,"Committee report approving bill, renumbered as SF 493."
1937806,2025-01-23,Senate,1,"Introduced, referred to Commerce. S.J. 131."
1937806,2025-01-27,Senate,2,"Subcommittee: Rowley, Knox, and Zumbach. S.J. 143."
1937806,2025-01-28,Senate,3,"Subcommittee Meeting: 02/03/2025 1:30PM Senate Lounge."
1937806,2025-02-03,Senate,4,"Subcommittee recommends passage."
1937806,2025-02-24,Senate,5,"Committee report, recommending passage. S.J. 343."
1937806,2025-02-24,Senate,6,"Placed on calendar. S.J. 343."
1937806,2025-03-24,Senate,7,"Amendment S-3044 filed. S.J. 622."
1937806,2025-06-16,Senate,8,"Referred to Commerce. S.J. 1057."
1937878,2025-01-23,Senate,1,"Introduced, referred to Health and Human Services. S.J. 131."
1937878,2025-01-30,Senate,2,"Subcommittee: Campbell, Garrett, and Petersen. S.J. 169."
1937878,2025-02-03,Senate,3,"Subcommittee Meeting: 02/04/2025 2:00PM Room 217 Conference Room."
1937878,2025-02-04,Senate,4,"Subcommittee recommends passage."
1937878,2025-02-13,Senate,5,"Committee report approving bill, renumbered as SF 313. S.J. 271."
1937948,2025-01-23,Senate,1,"Introduced, referred to Education. S.J. 129."
1937948,2025-01-28,Senate,2,"Subcommittee: Evans, Donahue, and Gruenhagen. S.J. 153."
1937948,2025-02-03,Senate,3,"Subcommittee Meeting: 02/04/2025 3:00PM Senate Lounge."
1937948,2025-02-04,Senate,4,"Subcommittee recommends passage."
1937948,2025-02-19,Senate,5,"Committee report approving bill, renumbered as SF 368. S.J. 316."
1938022,2025-01-23,Senate,1,"Introduced, referred to State Government. S.J. 130."
1938022,2025-01-28,Senate,2,"Subcommittee: Rozenboom, Celsi, and Schultz. S.J. 153."
1938106,2025-01-23,Senate,1,"Introduced, referred to Health and Human Services. S.J. 133."
1938106,2025-01-30,Senate,2,"Subcommittee: Klimesh, Costello, and Petersen. S.J. 169."
1938142,2025-01-23,Senate,1,"Introduced, referred to Judiciary. S.J. 132."
1938142,2025-01-28,Senate,2,"Subcommittee: Taylor, Dawson, and Knox. S.J. 153."
1938142,2025-01-28,Senate,3,"Subcommittee Meeting: 01/29/2025 1:30PM Room 217 Conference Room."
1938142,2025-01-29,Senate,4,"Subcommittee recommends passage."
1938181,2025-01-23,Senate,1,"Introduced, referred to Education. S.J. 132."
1938181,2025-01-28,Senate,2,"Subcommittee: Rozenboom, Kraayenbrink, and Winckler. S.J. 153."
1938226,2025-01-23,Senate,1,"Introduced, referred to Commerce. S.J. 133."
1938226,2025-01-27,Senate,2,"Subcommittee: Driscoll, Klimesh, and Petersen. S.J. 143."
1938266,2025-01-23,Senate,1,"Introduced, referred to Education. S.J. 133."
1938266,2025-01-28,Senate,2,"Subcommittee: Gruenhagen, Quirmbach, and Taylor. S.J. 153."
1938266,2025-02-04,Senate,3,"Subcommittee Meeting: 02/06/2025 10:00AM Senate Lounge."
1938266,2025-02-06,Senate,4,"Subcommittee recommends passage."
1938266,2025-03-05,Senate,5,"Committee report approving bill, renumbered as SF 519. S.J. 423."
1938309,2025-01-23,Senate,1,"Introduced, referred to Commerce. S.J. 132."
1938309,2025-01-27,Senate,2,"Subcommittee: Gruenhagen, De Witt, and Trone Garriott. S.J. 143."
1938309,2025-02-03,Senate,3,"Subcommittee Meeting: 02/04/2025 1:30PM Room 217 Conference Room."
1938309,2025-02-04,Senate,4,"Subcommittee recommends passage."
1938309,2025-02-24,Senate,5,"Committee report, recommending passage. S.J. 343."
1938309,2025-02-24,Senate,6,"Placed on calendar."
1938309,2025-06-16,Senate,7,"Referred to Commerce. S.J. 1057."
1938349,2025-01-23,House,1,"By COMMITTEE ON EDUCATION"
1938349,2025-01-23,House,2,"Introduced, referred to Education. H.J. 122."
1938349,2025-01-23,House,3,"Subcommittee: Wheeler, Levin and Stone. H.J. 125."
1938349,2025-02-11,House,4,"Subcommittee Meeting: 02/12/2025 12:30PM RM 103."
1938349,2025-02-12,House,5,"Subcommittee recommends passage."
1938391,2025-01-23,Senate,1,"Introduced, referred to Health and Human Services. S.J. 131."
1938391,2025-01-30,Senate,2,"Subcommittee: Salmon, Petersen, and Pike. S.J. 169."
1938391,2025-02-04,Senate,3,"Subcommittee Meeting: 02/06/2025 1:00PM Senate Lounge."
1938391,2025-02-06,Senate,4,"Subcommittee recommends passage."
1938391,2025-02-13,Senate,5,"Committee report approving bill, renumbered as SF 304. S.J. 271."
1938436,2025-01-23,Senate,1,"Introduced, referred to Judiciary. S.J. 132."
1938436,2025-01-28,Senate,2,"Subcommittee: Schultz, Bousselot, and Petersen. S.J. 153."
1938475,2025-01-23,Senate,1,"Introduced, referred to Health and Human Services. S.J. 133."
1938475,2025-01-30,Senate,2,"Subcommittee: Guth, Donahue, and Salmon. S.J. 169."
1938475,2025-02-03,Senate,3,"Subcommittee Meeting: 02/05/2025 10:00AM Senate Lounge."
1938475,2025-02-05,Senate,4,"Subcommittee recommends passage."
1938475,2025-03-06,Senate,5,"Committee report, recommending passage. S.J. 435."
1938475,2025-03-06,Senate,6,"Placed on calendar."
1938475,2025-06-16,Senate,7,"Referred to Health and Human Services. S.J. 1057."
1938518,2025-01-23,Senate,1,"Introduced, referred to Health and Human Services. S.J. 134."
1938518,2025-01-30,Senate,2,"Subcommittee: Klimesh, Costello, and Petersen. S.J. 170."
1938563,2025-01-23,Senate,1,"Introduced, referred to Transportation. S.J. 134."
1938563,2025-01-28,Senate,2,"Subcommittee: Pike, Blake, and Shipley. S.J. 153."
1938563,2025-02-04,Senate,3,"Subcommittee Meeting: 02/05/2025 11:30AM Senate Lounge."
1938563,2025-02-05,Senate,4,"Subcommittee recommends passage."
1938563,2025-02-11,Senate,5,"Committee report approving bill, renumbered as SF 257. S.J. 246."
1938606,2025-01-23,Senate,1,"Introduced, referred to Health and Human Services. S.J. 133."
1938606,2025-01-30,Senate,2,"Subcommittee: Klimesh, Costello, and Petersen. S.J. 169."
1938646,2025-01-23,Senate,1,"Introduced, referred to Health and Human Services. S.J. 132."
1938646,2025-01-30,Senate,2,"Subcommittee: Klimesh, Costello, and Petersen. S.J. 169."
1938685,2025-01-23,Senate,1,"Introduced, referred to Health and Human Services. S.J. 133."
1938685,2025-01-30,Senate,2,"Subcommittee: Costello, Klimesh, and Petersen. S.J. 169."
1938732,2025-01-23,Senate,1,"Introduced, referred to Judiciary. S.J. 134."
1938732,2025-01-28,Senate,2,"Subcommittee: Webster, Green, and Quirmbach. S.J. 153."
1938732,2025-02-17,Senate,3,"Subcommittee Meeting: 02/18/2025 12:30PM Senate Lounge."
1938732,2025-02-18,Senate,4,"Subcommittee recommends passage."
1938732,2025-02-26,Senate,5,"Committee report, recommending passage. S.J. 370."
1938732,2025-02-26,Senate,6,"Placed on calendar."
1938732,2025-03-11,Senate,7,"Passed Senate, yeas 47, nays 0. S.J. 481."
1938732,2025-03-11,Senate,8,"Immediate message. S.J. 485."
1938732,2025-03-11,House,9,"Message from Senate. H.J. 606."
1938732,2025-03-12,House,10,"Read first time, referred to Public Safety. H.J. 614."
1938732,2025-03-17,House,11,"Subcommittee: Gearhart, Gosa and Hermanson. H.J. 677."
1938732,2025-03-17,House,12,"Subcommittee Meeting: 03/18/2025 8:15AM House Lounge 2."
1938732,2025-03-18,House,13,"Subcommittee recommends passage."
1938732,2025-03-25,House,14,"Committee report, recommending passage. H.J. 814."
1938732,2025-03-25,House,15,"Committee vote: Yeas, 23. Nays, 0. H.J. 814."
1938732,2025-03-25,House,16,"Placed on calendar. H.J. 814."
1938732,2025-04-10,House,17,"Placed on calendar under unfinished business. H.J. 928."
1938732,2025-05-15,House,18,"Rereferred to Public Safety. H.J. 1222."
1938772,2025-01-23,Senate,1,"Introduced, referred to State Government. S.J. 129."
1938772,2025-01-27,Senate,2,"Subcommittee: Rozenboom, Celsi, and Schultz. S.J. 142."
1938815,2025-01-23,Senate,1,"Introduced, referred to Commerce. S.J. 134."
1938815,2025-01-27,Senate,2,"Subcommittee: Bousselot, Blake, and Webster. S.J. 143."
1938856,2025-01-23,Senate,1,"Introduced, referred to State Government. S.J. 129."
1938856,2025-01-27,Senate,2,"Subcommittee: Schultz, Blake, and Rozenboom. S.J. 142."
1938856,2025-01-28,Senate,3,"Subcommittee Meeting: 01/29/2025 2:45PM Room G15."
1938856,2025-01-30,Senate,4,"Subcommittee recommends passage."
1938900,2025-01-23,Senate,1,"Introduced, referred to Health and Human Services. S.J. 134."
1938900,2025-01-30,Senate,2,"Subcommittee: Klimesh, Costello, and Petersen. S.J. 170."
1938940,2025-01-23,Senate,1,"Introduced, referred to Health and Human Services. S.J. 132."
1938940,2025-01-30,Senate,2,"Subcommittee: Klimesh, Costello, and Petersen. S.J. 169."
1941892,2025-01-27,House,1,"Introduced, referred to Education. H.J. 127."
1941892,2025-01-30,House,2,"Subcommittee: Behn, Bradley and Gjerde. H.J. 171."
1941892,2025-02-10,House,3,"Subcommittee Meeting: 02/12/2025 12:00PM House Lounge."
1941892,2025-02-12,House,4,"Subcommittee recommends passage."
1941892,2025-02-18,House,5,"Committee report, recommending passage. H.J. 364."
1941892,2025-02-18,House,6,"Committee vote: Yeas, 22. Nays, 0. Excused, 1. H.J. 364."
1941892,2025-02-20,House,7,"Committee report approving bill, renumbered as HF 515."
1941892,2025-03-14,House,8,"Withdrawn. H.J. 660."
1941918,2025-01-27,House,1,"Introduced, referred to Health and Human Services. H.J. 127."
1941918,2025-01-28,House,2,"Subcommittee: Ingels, Johnson, R. and Wilz, H. H.J. 135."
1941918,2025-02-04,House,3,"Subcommittee Meeting: 02/05/2025 12:00PM RM 19."
1941918,2025-02-05,House,4,"Subcommittee recommends passage."
1941918,2025-02-06,House,5,"Committee report, recommending passage. H.J. 281."
1941918,2025-02-06,House,6,"Committee vote: Yeas, 20. Nays, 0. Excused, 1. H.J. 281."
1941918,2025-02-10,House,7,"Committee report approving bill, renumbered as HF 312."
1941918,2025-02-24,House,8,"Withdrawn. H.J. 418."
1941939,2025-01-27,House,1,"Introduced, referred to Ways and Means. H.J. 128."
1941939,2025-02-20,House,2,"Subcommittee: Wulf, Behn and Wilson. H.J. 405."
1941939,2025-03-17,House,3,"Subcommittee Meeting: 03/19/2025 12:30PM House Lounge."
1941939,2025-03-19,House,4,"Subcommittee recommends passage."
1941969,2025-01-27,House,1,"Introduced, referred to Public Safety. H.J. 127."
1941993,2025-01-27,House,1,"Introduced, referred to Health and Human Services. H.J. 127."
1941993,2025-01-28,House,2,"Subcommittee: Andrews, Brown-Powers and Meyer, A. H.J. 135."
1941993,2025-02-03,House,3,"Subcommittee Meeting: 02/05/2025 2:30PM House Lounge 2."
1941993,2025-02-05,House,4,"Subcommittee recommends passage."
1941993,2025-02-11,House,5,"Committee report, recommending passage. H.J. 296."
1941993,2025-02-11,House,6,"Committee vote: Yeas, 20. Nays, 0. Excused, 1. H.J. 296."
1941993,2025-02-13,House,7,"Committee report approving bill, renumbered as HF 385."
1941993,2025-03-21,House,8,"Withdrawn. H.J. 772."
1942020,2025-01-27,House,1,"Introduced, referred to Education. H.J. 126."
1942050,2025-01-27,House,1,"Introduced, referred to State Government. H.J. 127."
1942073,2025-01-27,Senate,1,"Introduced, referred to Education. S.J. 141."
1942073,2025-01-28,Senate,2,"Subcommittee: Salmon, Campbell, and Trone Garriott. S.J. 154."
1942073,2025-02-03,Senate,3,"Subcommittee Meeting: 02/13/2025 8:00AM Room 315."
1942073,2025-02-13,Senate,4,"Subcommittee recommends passage."
1942073,2025-03-04,Senate,5,"Committee report approving bill, renumbered as SF 510. S.J. 406."
1942099,2025-01-27,House,1,"Introduced, referred to Education. H.J. 126."
1942099,2025-01-30,House,2,"Subcommittee: Hora, Ehlert and Kniff McCulla. H.J. 171."
1942099,2025-02-03,House,3,"Subcommittee Meeting: 02/05/2025 12:30PM RM 304."
1942099,2025-02-05,House,4,"Subcommittee recommends passage."
1942099,2025-02-11,House,5,"Committee report, recommending passage. H.J. 294."
1942099,2025-02-11,House,6,"Committee vote: Yeas, 23. Nays, 0. H.J. 294."
1942099,2025-02-13,House,7,"Committee report approving bill, renumbered as HF 392."
1942099,2025-02-24,House,8,"Withdrawn. H.J. 418."
1942123,2025-01-27,House,1,"Introduced, referred to Transportation. H.J. 128."
1942123,2025-01-29,House,2,"Subcommittee: Bossman, Madison and Williams. H.J. 140."
1942123,2025-01-29,House,3,"Subcommittee Meeting: 02/05/2025 12:00PM RM 304."
1942123,2025-02-05,House,4,"Subcommittee recommends passage."
1942151,2025-01-27,House,1,"Introduced, referred to Judiciary. H.J. 127."
1942151,2025-01-29,House,2,"Subcommittee: Nordman, Croken and Gustoff. H.J. 140."
1942151,2025-01-30,House,3,"Subcommittee reassigned: Nordman, Croken and Lawler. H.J. 171."
1942151,2025-01-30,House,4,"Subcommittee Meeting: 02/06/2025 12:00PM House Lounge."
1942151,2025-02-06,House,5,"Subcommittee recommends passage."
1942182,2025-01-27,House,1,"Introduced, referred to Education. H.J. 126."
1942182,2025-03-03,House,2,"Subcommittee: Kniff McCulla, Kurth and Shipley. H.J. 487."
1942182,2025-03-04,House,3,"Subcommittee Meeting: 03/05/2025 8:15AM RM 102."
1942182,2025-03-05,House,4,"Subcommittee recommends passage."
1942211,2025-01-27,House,1,"Introduced, referred to State Government. H.J. 127."
1942211,2025-01-30,House,2,"Subcommittee: Kaufmann, Wulf and Zabner. H.J. 171."
1942211,2025-02-11,House,3,"Subcommittee Meeting: 02/12/2025 2:30PM House Lounge."
1942211,2025-02-13,House,4,"Subcommittee recommends passage."
1942211,2025-02-26,House,5,"Committee report, recommending amendment and passage. H.J. 446."
1942211,2025-02-26,House,6,"Committee vote: Yeas, 15. Nays, 7. Excused, 1. H.J. 446."
1942211,2025-03-05,House,7,"Committee report approving bill, renumbered as HF 786."
1942211,2025-03-21,House,8,"Withdrawn. H.J. 772."
1942238,2025-01-27,House,1,"Introduced, referred to Transportation. H.J. 128."
1942238,2025-01-29,House,2,"Subcommittee: Wood, Scholten and Williams. H.J. 140."
1942238,2025-02-03,House,3,"Subcommittee Meeting: 02/05/2025 12:45PM House Lounge."
1942238,2025-02-05,House,4,"Subcommittee recommends passage."
1942238,2025-02-12,House,5,"Committee report, recommending passage. H.J. 313."
1942238,2025-02-12,House,6,"Committee vote: Yeas, 20. Nays, 0. Excused, 1. H.J. 313."
1942238,2025-02-24,House,7,"Committee report approving bill, renumbered as HF 581."
1942264,2025-01-27,House,1,"Introduced, referred to Ways and Means. H.J. 128."
1942264,2025-02-20,House,2,"Subcommittee: Young, Gjerde and Wills, J. H.J. 405."
1942264,2025-02-24,House,3,"Subcommittee Meeting: 02/26/2025 8:15AM House Lounge 2."
1942264,2025-02-26,House,4,"Subcommittee recommends passage."
1942264,2025-04-23,House,5,"Committee report, recommending passage. H.J. 1051."
1942264,2025-04-23,House,6,"Committee vote: Yeas, 22. Nays, 0. Excused, 3. H.J. 1051."
1942264,2025-04-24,House,7,"Committee report approving bill, renumbered as HF 1034."
1942264,2025-05-14,House,8,"Withdrawn. H.J. 1219."
1942291,2025-01-27,House,1,"By COMMITTEE ON HEALTH AND HUMAN SERVICES"
1942291,2025-01-27,House,2,"Introduced, referred to Health and Human Services. H.J. 131."
1942291,2025-01-27,House,3,"Subcommittee: Moore, T., Bradley and Ehlert. H.J. 131."
1942291,2025-02-03,House,4,"Subcommittee Meeting: 02/04/2025 12:00PM House Lounge 2 (Cancelled)."
1942291,2025-02-10,House,5,"Subcommittee Meeting: 02/11/2025 8:30AM RM 304."
1942291,2025-02-11,House,6,"Subcommittee recommends passage."
1942291,2025-02-18,House,7,"Committee report, recommending passage. H.J. 353."
1942291,2025-02-18,House,8,"Committee vote: Yeas, 19. Nays, 0. Excused, 2. H.J. 353."
1942291,2025-02-19,House,9,"Committee report approving bill, renumbered as HF 471."
1942309,2025-01-27,House,1,"By COMMITTEE ON HEALTH AND HUMAN SERVICES"
1942309,2025-01-27,House,2,"Introduced, referred to Health and Human Services. H.J. 131."
1942309,2025-01-27,House,3,"Subcommittee: Meyer, A., Brown-Powers and Ingels. H.J. 131."
1942309,2025-01-28,House,4,"Subcommittee Meeting: 01/30/2025 8:00AM House Lounge 2."
1942309,2025-01-30,House,5,"Subcommittee recommends passage."
1942309,2025-02-06,House,6,"Committee report, recommending passage. H.J. 282."
1942309,2025-02-06,House,7,"Committee vote: Yeas, 20. Nays, 0. Excused, 1. H.J. 282."
1942309,2025-02-10,House,8,"Committee report approving bill, renumbered as HF 313."
1942330,2025-01-27,Senate,1,"By COMMITTEE ON TRANSPORTATION"
1942330,2025-01-27,Senate,2,"Introduced, referred to Transportation."
1942330,2025-01-27,Senate,3,"Subcommittee: Zumbach, Koelker, and Townsend."
1942330,2025-02-04,Senate,4,"Subcommittee Meeting: 02/05/2025 9:30AM Senate Lounge."
1942330,2025-02-05,Senate,5,"Subcommittee recommends passage."
1942330,2025-02-10,Senate,6,"Committee report approving bill, renumbered as SCR 2."
1942397,2025-01-27,Senate,1,"By COMMITTEE ON TRANSPORTATION"
1942397,2025-01-27,Senate,2,"Introduced, referred to Transportation."
1942397,2025-01-27,Senate,3,"Subcommittee: Rozenboom, Bennett, and Warme."
1942397,2025-02-03,Senate,4,"Subcommittee Meeting: 02/05/2025 12:00PM Senate Lounge."
1942397,2025-02-05,Senate,5,"Subcommittee recommends passage."
1942397,2025-02-10,Senate,6,"Committee report approving bill, renumbered as SF 258."
1942475,2025-01-27,Senate,1,"By COMMITTEE ON TRANSPORTATION"
1942475,2025-01-27,Senate,2,"Introduced, referred to Transportation."
1942475,2025-01-27,Senate,3,"Subcommittee: Gruenhagen, Bennett, and De Witt."
1942475,2025-02-03,Senate,4,"Subcommittee Meeting: 02/04/2025 3:30PM Room 217 Conference Room."
1942475,2025-02-04,Senate,5,"Subcommittee recommends passage."
1942475,2025-02-19,Senate,6,"Committee report approving bill, renumbered as SF 390."
1942555,2025-01-27,Senate,1,"Introduced, placed on calendar. S.J. 140."
1942555,2025-01-27,Senate,2,"Committee report, approving bill. S.J. 144."
1942555,2025-02-06,Senate,3,"Resolution adopted. S.J. 206."
1942628,2025-01-27,House,1,"Introduced, referred to Economic Growth and Technology. H.J. 128."
1942628,2025-02-06,House,2,"Subcommittee: Barker, Baeth and Moore, T. H.J. 264."
1942628,2025-02-10,House,3,"Subcommittee Meeting: 02/12/2025 12:30PM RM 304."
1942628,2025-02-12,House,4,"Subcommittee recommends passage."
1942628,2025-02-19,House,5,"Committee report, recommending passage. H.J. 364."
1942628,2025-02-19,House,6,"Committee vote: Yeas, 18. Nays, 3. H.J. 364."
1942628,2025-02-20,House,7,"Committee report approving bill, renumbered as HF 517."
1942709,2025-01-27,House,1,"Introduced, referred to Natural Resources. H.J. 128."
1942709,2025-01-30,House,2,"Subcommittee: Fisher, Levin and Sexton. H.J. 171."
1942788,2025-01-27,Senate,1,"By COMMITTEE ON TRANSPORTATION"
1942788,2025-01-27,Senate,2,"Introduced, referred to Transportation."
1942788,2025-01-27,Senate,3,"Subcommittee: Webster, Lofgren, and Townsend."
1942788,2025-01-29,Senate,4,"Subcommittee Meeting: 02/03/2025 3:30PM Lobbyist Lounge."
1942788,2025-02-03,Senate,5,"Subcommittee recommends passage."
1942788,2025-02-03,Senate,6,"Committee report approving bill, renumbered as SF 611."
1942889,2025-01-27,House,1,"Introduced, referred to Judiciary. H.J. 130."
1942889,2025-01-29,House,2,"Subcommittee: Lawler, Thomson, C. and Wilburn. H.J. 140."
1942889,2025-02-11,House,3,"Subcommittee Meeting: 02/13/2025 12:30PM RM 304."
1942889,2025-02-13,House,4,"Subcommittee recommends passage."
1942889,2025-02-20,House,5,"Committee report, recommending passage. H.J. 410."
1942889,2025-02-20,House,6,"Committee vote: Yeas, 17. Nays, 0. Excused, 4. H.J. 410."
1942889,2025-02-24,House,7,"Committee report approving bill, renumbered as HF 573."
1942889,2025-03-14,House,8,"Withdrawn. H.J. 660."
1942910,2025-01-27,House,1,"Introduced, referred to Ways and Means. H.J. 130."
1942910,2025-02-20,House,2,"Subcommittee: Jones, Bloomingdale and Wilson. H.J. 406."
1942910,2025-02-27,House,3,"Subcommittee Meeting: 03/06/2025 8:15AM House Lounge."
1942910,2025-03-06,House,4,"Subcommittee recommends passage."
1942929,2025-01-27,Senate,1,"Introduced, referred to Education. S.J. 141."
1942929,2025-01-28,Senate,2,"Subcommittee: Shipley, Pike, and Staed. S.J. 153."
1942929,2025-02-04,Senate,3,"Subcommittee Meeting: 02/05/2025 2:30PM Room 315."
1942929,2025-02-05,Senate,4,"Subcommittee recommends amendment and passage."
1942929,2025-02-12,Senate,5,"Committee report approving bill, renumbered as SF 274. S.J. 256."
1942948,2025-01-27,Senate,1,"By COMMITTEE ON COMMERCE"
1942948,2025-01-27,Senate,2,"Introduced, referred to Commerce."
1942948,2025-01-27,Senate,3,"Subcommittee: Webster, Driscoll, and Wahls."
1942948,2025-01-28,Senate,4,"Subcommittee Meeting: 01/30/2025 9:00AM Room 217 Conference Room."
1942948,2025-01-30,Senate,5,"Subcommittee recommends passage."
1942948,2025-02-20,Senate,6,"Committee report approving bill, renumbered as SF 412."
1942965,2025-01-27,House,1,"Introduced, referred to State Government. H.J. 130."
1942965,2025-01-29,House,2,"Subcommittee: Jones, Cooling and Wulf. H.J. 140."
1942965,2025-02-05,House,3,"Subcommittee Meeting: 02/06/2025 8:00AM House Lounge 2."
1942965,2025-02-06,House,4,"Subcommittee recommends passage."
1942965,2025-02-26,House,5,"Committee report, recommending passage. H.J. 446."
1942965,2025-02-26,House,6,"Committee vote: Yeas, 17. Nays, 6. H.J. 446."
1942965,2025-03-05,House,7,"Committee report approving bill, renumbered as HF 761."
1942982,2025-01-27,House,1,"Introduced, referred to Education. H.J. 129."
1943005,2025-01-27,House,1,"Introduced, referred to Education. H.J. 129."
1943005,2025-01-30,House,2,"Subcommittee: Ingels, Ehlert and Johnson, C. H.J. 171."
1943005,2025-02-05,House,3,"Subcommittee Meeting: 02/06/2025 12:30PM House Lounge."
1943005,2025-02-06,House,4,"Subcommittee recommends passage."
1943005,2025-02-11,House,5,"Committee report, recommending passage. H.J. 294."
1943005,2025-02-11,House,6,"Committee vote: Yeas, 23. Nays, 0. H.J. 294."
1943005,2025-02-13,House,7,"Committee report approving bill, renumbered as HF 393."
1943005,2025-03-14,House,8,"Withdrawn. H.J. 660."
1943024,2025-01-27,House,1,"Resolution filed, laid over under Rule 25. H.J. 132."
1943024,2025-02-12,House,2,"Amendments H-1011 and H-1012 filed. H.J. 314."
1943024,2025-02-13,House,3,"Amendment H-1012, yeas 27, nays 58, lost. H.J. 321."
1943024,2025-02-13,House,4,"Amendment H-1011, yeas 28, nays 58, lost. H.J. 322."
1943024,2025-02-13,House,5,"Recorded vote on adoption: yeas 76, nays 10 H.J. 323."
1943024,2025-02-18,House,6,"Explanation of vote. H.J. 350."
1943024,2025-02-18,House,7,"Explanation of vote. H.J. 351."
1943024,2025-02-13,House,8,"Resolution adopted. H.J. 323."
1943047,2025-01-27,House,1,"Introduced, referred to Ways and Means. H.J. 130."
1943065,2025-01-27,House,1,"Introduced, referred to Appropriations. H.J. 130."
1943080,2025-01-27,House,1,"Introduced, referred to Health and Human Services. H.J. 129."
1943080,2025-01-28,House,2,"Subcommittee: Meyer, A., Jeneary and Matson. H.J. 135."
1943080,2025-02-05,House,3,"Subcommittee Meeting: 02/11/2025 8:30AM House Lounge."
1943080,2025-02-11,House,4,"Subcommittee reassigned: Meyer, A., Matson and Wood. H.J. 289."
1943080,2025-02-11,House,5,"Subcommittee recommends passage."
1943080,2025-02-18,House,6,"Committee report, recommending amendment and passage. H.J. 352."
1943080,2025-02-18,House,7,"Committee vote: Yeas, 15. Nays, 4. Excused, 2. H.J. 352."
1943080,2025-02-20,House,8,"Committee report approving bill, renumbered as HF 516."
1943080,2025-03-14,House,9,"Withdrawn. H.J. 660."
1943105,2025-01-27,Senate,1,"Introduced, referred to Ways and Means. S.J. 141."
1943105,2025-01-30,Senate,2,"Subcommittee: Klimesh, Bisignano, and Schultz. S.J. 170."
1943105,2025-03-18,Senate,3,"Subcommittee Meeting: 03/19/2025 1:30PM Senate Lounge."
1943119,2025-01-27,House,1,"Introduced, referred to Judiciary. H.J. 129."
1943119,2025-01-29,House,2,"Subcommittee: Gustoff, Dunwell and Olson. H.J. 140."
1943119,2025-01-29,House,3,"Subcommittee Meeting: 01/30/2025 12:15PM House Lounge."
1943119,2025-01-30,House,4,"Subcommittee recommends passage."
1943139,2025-01-27,Senate,1,"Introduced, referred to State Government. S.J. 141."
1943139,2025-01-28,Senate,2,"Subcommittee: Driscoll, Alons, and Winckler. S.J. 154."
1943139,2025-01-28,Senate,3,"Subcommittee Meeting: 01/30/2025 12:00PM Senate Lounge."
1943139,2025-01-30,Senate,4,"Subcommittee recommends passage."
1943139,2025-03-06,Senate,5,"Committee report, recommending passage. S.J. 440."
1943139,2025-03-06,Senate,6,"Placed on calendar."
1943139,2025-03-17,Senate,7,"Amendment S-3025 filed, adopted. S.J. 543."
1943139,2025-03-17,Senate,8,"Passed Senate, yeas 33, nays 13. S.J. 543."
1943139,2025-03-17,Senate,9,"Immediate message. S.J. 545."
1943139,2025-03-17,House,10,"Message from Senate. H.J. 663."
1943139,2025-03-18,House,11,"Read first time, referred to State Government. H.J. 678."
1943151,2025-01-27,House,1,"Introduced, placed on Ways and Means calendar. H.J. 130."
1943151,2025-01-29,House,2,"Amendment H-1002 filed. H.J. 147."
1943151,2025-01-29,House,3,"Fiscal note."
1943151,2025-01-30,House,4,"Amendment H-1004 to amendment H-1002 filed, adopted. H.J. 168."
1943151,2025-01-30,House,5,"Amendment H-1002 adopted, as amended. H.J. 168."
1943151,2025-01-30,House,6,"Passed House, yeas 68, nays 31. H.J. 168."
1943151,2025-01-30,House,7,"Immediate message. H.J. 169."
1943151,2025-02-03,Senate,8,"Message from House. S.J. 173."
1943151,2025-02-03,Senate,9,"Read first time, referred to State Government. S.J. 173."
1943151,2025-02-03,Senate,10,"Subcommittee: Driscoll, Bisignano, and Westrich. S.J. 178."
1943151,2025-02-03,Senate,11,"Subcommittee Meeting: []."
1943151,2025-02-04,Senate,12,"Subcommittee recommends passage."
1943515,2025-01-28,Senate,1,"By COMMITTEE ON JUDICIARY"
1943515,2025-01-28,Senate,2,"Introduced, referred to Judiciary."
1943515,2025-01-28,Senate,3,"Subcommittee: Rowley, Bisignano, and Dawson."
1943515,2025-02-10,Senate,4,"Subcommittee Meeting: 02/12/2025 1:00PM Room 217 Conference Room."
1943515,2025-02-12,Senate,5,"Subcommittee recommends amendment and passage."
1943515,2025-02-19,Senate,6,"Committee report approving bill, renumbered as SF 397."
1943523,2025-01-28,House,1,"By COMMITTEE ON HEALTH AND HUMAN SERVICES"
1943523,2025-01-28,House,2,"Introduced, referred to Health and Human Services. H.J. 133."
1943523,2025-01-28,House,3,"Subcommittee: Bergan, Baeth and Jeneary. H.J. 135."
1943523,2025-02-03,House,4,"Subcommittee Meeting: 02/04/2025 8:00AM RM 304 (Cancelled)."
1943523,2025-02-03,House,5,"Subcommittee Meeting: 02/06/2025 8:30AM House Lounge."
1943523,2025-02-06,House,6,"Subcommittee recommends passage."
1943523,2025-02-06,House,7,"Committee report, recommending passage. H.J. 283."
1943523,2025-02-06,House,8,"Committee vote: Yeas, 20. Nays, 0. Excused, 1. H.J. 283."
1943523,2025-02-10,House,9,"Committee report approving bill, renumbered as HF 300."
1943538,2025-01-28,House,1,"By COMMITTEE ON ETHICS"
1943538,2025-01-28,House,2,"Introduced, referred to Ethics. H.J. 134."
1943538,2025-01-28,House,3,"Subcommittee: Gustoff, Brown-Powers, Gaines, Johnson, C., Kurth and Stone. H.J. 135."
1943538,2025-01-30,House,4,"Committee report, recommending passage. H.J. 173."
1943538,2025-01-30,House,5,"Committee vote: Yeas, 6. Nays, 0. H.J. 173."
1943538,2025-02-03,House,6,"Committee report approving bill, renumbered as HR 4."
1943549,2025-01-28,House,1,"By COMMITTEE ON WAYS AND MEANS"
1943549,2025-01-28,House,2,"Introduced, referred to Ways and Means. H.J. 134."
1943549,2025-01-28,House,3,"Subcommittee: Sexton, Bloomingdale and McBurney. H.J. 135."
1943549,2025-02-11,House,4,"Subcommittee Meeting: 02/19/2025 8:15AM House Lounge."
1943549,2025-02-19,House,5,"Subcommittee recommends passage."
1943549,2025-02-25,House,6,"Committee report, recommending passage. H.J. 451."
1943549,2025-02-25,House,7,"Committee vote: Yeas, 24. Nays, 0. Excused, 1. H.J. 451."
1943549,2025-03-05,House,8,"Committee report approving bill, renumbered as HF 795."
1943563,2025-01-28,Senate,1,"By COMMITTEE ON JUDICIARY"
1943563,2025-01-28,Senate,2,"Introduced, referred to Judiciary."
1943563,2025-01-28,Senate,3,"Subcommittee: Dawson, Evans, and Petersen."
1943563,2025-02-10,Senate,4,"Subcommittee Meeting: 02/12/2025 3:00PM Room 217 Conference Room."
1943563,2025-02-13,Senate,5,"Subcommittee recommends passage."
1943563,2025-02-26,Senate,6,"Committee report approving bill, renumbered as SJR 9."
1943575,2025-01-28,House,1,"By COMMITTEE ON WAYS AND MEANS"
1943575,2025-01-28,House,2,"Introduced, referred to Ways and Means. H.J. 134."
1943575,2025-01-28,House,3,"Subcommittee: Sexton, Bloomingdale and McBurney. H.J. 135."
1943575,2025-02-11,House,4,"Subcommittee Meeting: 02/19/2025 8:00AM House Lounge."
1943575,2025-02-19,House,5,"Subcommittee recommends passage."
1943575,2025-02-25,House,6,"Committee report, recommending passage. H.J. 451."
1943575,2025-02-25,House,7,"Committee vote: Yeas, 24. Nays, 0. Excused, 1. H.J. 451."
1943575,2025-03-05,House,8,"Committee report approving bill, renumbered as HF 794."
1943591,2025-01-28,House,1,"By COMMITTEE ON WAYS AND MEANS"
1943591,2025-01-28,House,2,"Introduced, referred to Ways and Means. H.J. 133."
1943591,2025-01-28,House,3,"Subcommittee: Siegrist, Hermanson and Wilson. H.J. 135."
1943591,2025-02-10,House,4,"Subcommittee Meeting: 02/12/2025 12:30PM RM 19."
1943591,2025-02-12,House,5,"Subcommittee recommends passage."
1943591,2025-05-12,House,6,"Committee report, recommending amendment and passage. H.J. 1144."
1943591,2025-05-12,House,7,"Committee vote: Yeas, 22. Nays, 0. Excused, 3. H.J. 1144."
1943591,2025-05-13,House,8,"Committee report approving bill, renumbered as HF 1052."
1943601,2025-01-28,Senate,1,"By COMMITTEE ON TRANSPORTATION"
1943601,2025-01-28,Senate,2,"Introduced, referred to Transportation."
1943601,2025-01-28,Senate,3,"Subcommittee: Lofgren, Bisignano, and Dickey."
1943601,2025-02-11,Senate,4,"Subcommittee reassigned: Lofgren, Dickey, and Townsend."
1943620,2025-01-28,Senate,1,"By COMMITTEE ON HEALTH AND HUMAN SERVICES"
1943620,2025-01-28,Senate,2,"Introduced, referred to Health and Human Services."
1943620,2025-01-28,Senate,3,"Subcommittee: Warme, Campbell, and Trone Garriott."
1943620,2025-02-04,Senate,4,"Subcommittee Meeting: 02/05/2025 11:00AM Room 217 Conference Room."
1943620,2025-02-05,Senate,5,"Subcommittee recommends passage."
1943620,2025-02-12,Senate,6,"Committee report approving bill, renumbered as SF 312."
1943633,2025-01-28,Senate,1,"By COMMITTEE ON JUDICIARY"
1943633,2025-01-28,Senate,2,"Introduced, referred to Judiciary."
1943633,2025-01-30,Senate,3,"Subcommittee: Bousselot, Bisignano, and Shipley."
1943633,2025-02-03,Senate,4,"Subcommittee Meeting: 02/05/2025 1:30PM Room 217 Conference Room."
1943633,2025-02-05,Senate,5,"Subcommittee recommends passage."
1943633,2025-02-19,Senate,6,"Committee report approving bill, renumbered as SF 394."
1943647,2025-01-28,Senate,1,"By COMMITTEE ON VETERANS AFFAIRS"
1943647,2025-01-28,Senate,2,"Introduced, referred to Veterans Affairs."
1943647,2025-01-28,Senate,3,"Subcommittee: Dawson, Dotzler, and McClintock."
1943676,2025-01-28,House,1,"By COMMITTEE ON COMMERCE"
1943676,2025-01-28,House,2,"Introduced, referred to Commerce. H.J. 134."
1943676,2025-01-28,House,3,"Subcommittee: Determann, Blom and Johnson, R. H.J. 135."
1943676,2025-01-29,House,4,"Subcommittee Meeting: 02/03/2025 11:30AM House Lounge."
1943676,2025-02-03,House,5,"Subcommittee recommends amendment and passage."
1943676,2025-02-06,House,6,"Committee report, recommending amendment and passage. H.J. 267."
1943676,2025-02-06,House,7,"Committee vote: Yeas, 22. Nays, 1. Excused, 2. H.J. 267."
1943676,2025-02-10,House,8,"Committee report approving bill, renumbered as HF 311."
1943688,2025-01-28,House,1,"By COMMITTEE ON WAYS AND MEANS"
1943688,2025-01-28,House,2,"Introduced, referred to Ways and Means. H.J. 133."
1943688,2025-01-28,House,3,"Subcommittee: Sexton, Bloomingdale and Jacoby. H.J. 135."
1943688,2025-02-11,House,4,"Subcommittee Meeting: 02/18/2025 12:00PM House Lounge."
1943688,2025-02-18,House,5,"Subcommittee recommends passage."
1943688,2025-02-25,House,6,"Committee report, recommending passage. H.J. 450."
1943688,2025-02-25,House,7,"Committee vote: Yeas, 23. Nays, 1. Excused, 1. H.J. 451."
1943688,2025-02-28,House,8,"Committee report approving bill, renumbered as HF 653."
1943702,2025-01-28,House,1,"By COMMITTEE ON ETHICS"
1943702,2025-01-28,House,2,"Introduced, referred to Ethics. H.J. 134."
1943702,2025-01-28,House,3,"Subcommittee: Gustoff, Brown-Powers, Gaines, Johnson, C., Kurth and Stone. H.J. 135."
1943702,2025-01-30,House,4,"Committee report, recommending passage. H.J. 173."
1943702,2025-01-30,House,5,"Committee vote: Yeas, 6. Nays, 0. H.J. 173."
1943702,2025-02-03,House,6,"Committee report approving bill, renumbered as HCR 4."
1943715,2025-01-28,House,1,"By COMMITTEE ON LOCAL GOVERNMENT"
1943715,2025-01-28,House,2,"Introduced, referred to Local Government. H.J. 134."
1943715,2025-01-28,House,3,"Subcommittee: Wengryn, Determann and Gosa. H.J. 136."
1943715,2025-01-28,House,4,"Subcommittee Meeting: 01/29/2025 8:00AM House Lounge 2."
1943715,2025-01-29,House,5,"Subcommittee recommends passage."
1943732,2025-01-28,Senate,1,"By COMMITTEE ON VETERANS AFFAIRS"
1943732,2025-01-28,Senate,2,"Introduced, referred to Veterans Affairs."
1943732,2025-01-28,Senate,3,"Subcommittee: Salmon, Campbell, and Townsend."
1943732,2025-01-28,Senate,4,"Subcommittee Meeting: 01/29/2025 3:00PM Senate Lounge."
1943732,2025-01-29,Senate,5,"Subcommittee recommends amendment and passage."
1943732,2025-02-10,Senate,6,"Committee report approving bill, renumbered as SF 276."
1943744,2025-01-28,House,1,"By COMMITTEE ON WAYS AND MEANS"
1943744,2025-01-28,House,2,"Introduced, referred to Ways and Means. H.J. 133."
1943744,2025-01-28,House,3,"Subcommittee: Sexton, Bloomingdale and McBurney. H.J. 135."
1943744,2025-02-11,House,4,"Subcommittee Meeting: 02/19/2025 8:30AM House Lounge."
1943744,2025-02-19,House,5,"Subcommittee recommends passage."
1943744,2025-03-20,House,6,"Committee report, recommending amendment and passage. H.J. 769."
1943744,2025-03-20,House,7,"Committee vote: Yeas, 24. Nays, 0. Excused, 1. H.J. 769."
1943744,2025-03-24,House,8,"Committee report approving bill, renumbered as HF 976."
1943759,2025-01-28,Senate,1,"Introduced, referred to Judiciary. S.J. 147."
1943759,2025-02-03,Senate,2,"Subcommittee: Schultz, Blake, and Bousselot. S.J. 178."
1943772,2025-01-28,Senate,1,"By COMMITTEE ON AGRICULTURE"
1943772,2025-01-28,Senate,2,"Introduced, referred to Agriculture."
1943772,2025-01-28,Senate,3,"Subcommittee: Costello, Dotzler, and Guth."
1943784,2025-01-28,Senate,1,"By COMMITTEE ON EDUCATION"
1943784,2025-01-28,Senate,2,"Introduced, referred to Education."
1943784,2025-01-28,Senate,3,"Subcommittee: Evans, Kraayenbrink, and Quirmbach."
1943784,2025-01-28,Senate,4,"Subcommittee Meeting: 01/30/2025 8:30AM Room 217 Conference Room."
1943784,2025-01-30,Senate,5,"Subcommittee recommends passage."
1943784,2025-01-30,Senate,6,"Committee report approving bill, renumbered as SF 167."
1943796,2025-01-28,Senate,1,"By COMMITTEE ON JUDICIARY"
1943796,2025-01-28,Senate,2,"Introduced, referred to Judiciary."
1943796,2025-01-28,Senate,3,"Subcommittee: Taylor, Blake, and Westrich."
1943796,2025-01-28,Senate,4,"Subcommittee Meeting: 01/29/2025 1:00PM Room 315."
1943796,2025-01-29,Senate,5,"Subcommittee recommends passage."
1943796,2025-03-06,Senate,6,"Committee report approving bill, renumbered as SF 571."
1943810,2025-01-28,Senate,1,"By COMMITTEE ON VETERANS AFFAIRS"
1943810,2025-01-28,Senate,2,"Introduced, referred to Veterans Affairs."
1943810,2025-01-28,Senate,3,"Subcommittee: Reichman, Blake, and Pike."
1943810,2025-01-29,Senate,4,"Subcommittee Meeting: 01/30/2025 10:30AM Senate Lounge."
1943810,2025-01-30,Senate,5,"Subcommittee recommends passage."
1943810,2025-02-10,Senate,6,"Committee report approving bill, renumbered as SF 252."
1943840,2025-01-28,Senate,1,"By COMMITTEE ON COMMERCE"
1943840,2025-01-28,Senate,2,"Introduced, referred to Commerce."
1943840,2025-01-28,Senate,3,"Subcommittee: Driscoll, Koelker, and Trone Garriott."
1943840,2025-02-07,Senate,4,"Subcommittee Meeting: 02/11/2025 11:30AM Senate Lounge."
1943840,2025-02-11,Senate,5,"Subcommittee recommends passage."
1943886,2025-01-28,Senate,1,"By COMMITTEE ON EDUCATION"
1943886,2025-01-28,Senate,2,"Introduced, referred to Education."
1943886,2025-01-28,Senate,3,"Subcommittee: Evans, Quirmbach, and Taylor."
1943886,2025-02-04,Senate,4,"Subcommittee Meeting: 02/05/2025 3:30PM Senate Lounge."
1943886,2025-02-06,Senate,5,"Subcommittee recommends passage."
1943886,2025-02-18,Senate,6,"Committee report approving bill, renumbered as SF 370."
1943938,2025-01-28,Senate,1,"Introduced, referred to Local Government. S.J. 147."
1943938,2025-01-29,Senate,2,"Subcommittee: Driscoll, Webster, and Weiner. S.J. 162."
1943990,2025-01-28,Senate,1,"By COMMITTEE ON NATURAL RESOURCES AND ENVIRONMENT"
1943990,2025-01-28,Senate,2,"Introduced, referred to Natural Resources and Environment."
1943990,2025-01-28,Senate,3,"Subcommittee: Sweeney, Bennett, and Shipley."
1943990,2025-01-28,Senate,4,"Subcommittee Meeting: 02/03/2025 2:30PM Room 217 Conference Room."
1943990,2025-02-03,Senate,5,"Subcommittee recommends passage."
1943990,2025-02-10,Senate,6,"Committee report approving bill, renumbered as SJR 4."
1944041,2025-01-28,House,1,"By COMMITTEE ON EDUCATION"
1944041,2025-01-28,House,2,"Introduced, referred to Education. H.J. 134."
1944041,2025-01-28,House,3,"Subcommittee: Henderson, Bradley and Madison. H.J. 136."
1944041,2025-01-29,House,4,"Subcommittee Meeting: 01/30/2025 8:00AM RM 304.1 (Cancelled)."
1944041,2025-01-30,House,5,"Subcommittee Meeting: 02/03/2025 11:45AM RM 103."
1944041,2025-02-03,House,6,"Subcommittee recommends passage."
1944095,2025-01-28,Senate,1,"By COMMITTEE ON JUDICIARY"
1944095,2025-01-28,Senate,2,"Introduced, referred to Judiciary."
1944095,2025-01-28,Senate,3,"Subcommittee: Webster, Quirmbach, and Westrich."
1944095,2025-02-20,Senate,4,"Subcommittee Meeting: 02/25/2025 12:30PM Room 217 Conference Room."
1944095,2025-02-25,Senate,5,"Subcommittee recommends amendment and passage."
1944147,2025-01-28,Senate,1,"By COMMITTEE ON EDUCATION"
1944147,2025-01-28,Senate,2,"Introduced, referred to Education."
1944147,2025-01-28,Senate,3,"Subcommittee: Salmon, Donahue, and Pike."
1944147,2025-02-04,Senate,4,"Subcommittee recommends amendment and passage."
1944147,2025-02-04,Senate,5,"Subcommittee Meeting: 02/04/2025 8:00AM Room 217 Conference Room."
1944147,2025-02-11,Senate,6,"Committee report approving bill, renumbered as SF 273."
1944197,2025-01-28,Senate,1,"By COMMITTEE ON EDUCATION"
1944197,2025-01-28,Senate,2,"Introduced, referred to Education."
1944197,2025-01-28,Senate,3,"Subcommittee: Gruenhagen, Taylor, and Trone Garriott."
1944197,2025-02-03,Senate,4,"Subcommittee Meeting: 02/04/2025 1:00PM Room 217 Conference Room."
1944197,2025-02-04,Senate,5,"Subcommittee recommends passage."
1944197,2025-02-11,Senate,6,"Committee report approving bill, renumbered as SF 275."
1944250,2025-01-28,Senate,1,"By COMMITTEE ON NATURAL RESOURCES AND ENVIRONMENT"
1944250,2025-01-28,Senate,2,"Introduced, referred to Natural Resources and Environment."
1944250,2025-01-28,Senate,3,"Subcommittee: Sweeney, Rozenboom, and Trone Garriott."
1944250,2025-01-28,Senate,4,"Subcommittee Meeting: 02/03/2025 3:00PM Room 217 Conference Room."
1944250,2025-02-04,Senate,5,"Subcommittee recommends passage."
1944250,2025-02-10,Senate,6,"Committee report approving bill, renumbered as SF 256."
1944302,2025-01-28,Senate,1,"Introduced, referred to Technology. S.J. 147."
1944302,2025-01-28,Senate,2,"Subcommittee: Alons, Bennett, and Campbell. S.J. 153."
1944302,2025-01-29,Senate,3,"Subcommittee Meeting: 01/30/2025 11:30AM Room 217 Conference Room."
1944302,2025-01-30,Senate,4,"Subcommittee recommends passage."
1944353,2025-01-28,Senate,1,"Introduced, referred to State Government. S.J. 148."
1944353,2025-02-05,Senate,2,"Subcommittee: Westrich, Bisignano, and Webster. S.J. 202."
1944353,2025-02-06,Senate,3,"Subcommittee Meeting: 02/11/2025 1:00PM Room 217 Conference Room."
1944353,2025-02-11,Senate,4,"Subcommittee recommends passage."
1944405,2025-01-28,Senate,1,"By COMMITTEE ON NATURAL RESOURCES AND ENVIRONMENT"
1944405,2025-01-28,Senate,2,"Introduced, referred to Natural Resources and Environment."
1944405,2025-01-28,Senate,3,"Subcommittee: Sweeney, Celsi, and Pike."
1944405,2025-01-28,Senate,4,"Subcommittee Meeting: 02/03/2025 3:30PM Room 217 Conference Room."
1944405,2025-02-04,Senate,5,"Subcommittee recommends passage."
1944405,2025-02-24,Senate,6,"Committee report approving bill, renumbered as SF 425."
1944457,2025-01-28,Senate,1,"By COMMITTEE ON STATE GOVERNMENT"
1944457,2025-01-28,Senate,2,"Introduced, referred to State Government."
1944457,2025-01-28,Senate,3,"Subcommittee: Campbell, Bisignano, and Reichman."
1944457,2025-02-17,Senate,4,"Subcommittee Meeting: 02/19/2025 3:00PM Room 217 Conference Room."
1944457,2025-02-19,Senate,5,"Subcommittee recommends amendment and passage."
1944457,2025-02-26,Senate,6,"Committee report approving bill, renumbered as SF 458."
1944507,2025-01-28,Senate,1,"Introduced, placed on calendar. S.J. 148."
1944507,2025-01-28,Senate,2,"Committee report, approving bill. S.J. 156."
1944507,2025-02-11,Senate,3,"Amendment S-3001 filed, adopted. S.J. 232."
1944507,2025-02-11,Senate,4,"Passed Senate, yeas 47, nays 0. S.J. 232."
1944507,2025-02-11,Senate,5,"Immediate message. S.J. 236."
1944507,2025-02-12,House,6,"Message from Senate. H.J. 300."
1944507,2025-02-12,House,7,"Read first time, referred to Economic Growth and Technology. H.J. 306."
1944507,2025-03-31,House,8,"Committee report, recommending passage. H.J. 883."
1944507,2025-03-31,House,9,"Committee vote: Yeas, 20. Nays, 0. Excused, 1. H.J. 884."
1944507,2025-04-02,House,10,"Placed on calendar. H.J. 884."
1944507,2025-04-10,House,11,"Placed on calendar under unfinished business. H.J. 928."
1944507,2025-04-22,House,12,"Amendment H-1270 filed. H.J. 1035."
1944507,2025-04-22,House,13,"Amendment H-1274 filed. H.J. 1036."
1944507,2025-04-23,House,14,"Amendments H-1270 and H-1274 adopted. H.J. 1049."
1944507,2025-04-23,House,15,"Passed House, yeas 93, nays 0. H.J. 1049."
1944507,2025-04-23,House,16,"Immediate message. H.J. 1050."
1944507,2025-04-23,Senate,17,"Message from House, with amendment S-3137. S.J. 878."
1944507,2025-04-28,Senate,18,"Senate concurred with S-3137. S.J. 905."
1944507,2025-04-28,Senate,19,"Passed Senate, yeas 50, nays 0. S.J. 906."
1944507,2025-04-28,Senate,20,"Immediate message. S.J. 906."
1944507,2025-04-29,House,21,"Message from Senate. H.J. 1075."
1944507,2025-05-19,Senate,22,"Reported correctly enrolled, signed by President and Speaker, and sent to Governor. S.J. 1050."
1944507,2025-06-06,Senate,23,"Signed by Governor. S.J. 1051."
1944834,2025-01-28,Senate,1,"By COMMITTEE ON WORKFORCE"
1944834,2025-01-28,Senate,2,"Introduced, referred to Workforce."
1944834,2025-01-28,Senate,3,"Subcommittee: Pike, Taylor, and Townsend."
1944834,2025-02-03,Senate,4,"Subcommittee Meeting: 02/04/2025 10:00AM Room 217 Conference Room."
1944834,2025-02-04,Senate,5,"Subcommittee recommends passage."
1944834,2025-02-05,Senate,6,"Committee report approving bill, renumbered as SF 222."
1945100,2025-01-28,Senate,1,"Introduced, referred to Workforce. S.J. 148."
1945100,2025-01-30,Senate,2,"Subcommittee: Driscoll, Lofgren, and Wahls. S.J. 170."
1945489,2025-01-29,Senate,1,"Introduced, placed on calendar. S.J. 158."
1945489,2025-01-29,Senate,2,"Committee report, approving bill. S.J. 163."
1945489,2025-03-24,Senate,3,"Passed Senate, yeas 49, nays 0. S.J. 609."
1945489,2025-03-24,Senate,4,"Immediate message. S.J. 613."
1945489,2025-03-24,House,5,"Message from Senate. H.J. 777."
1945489,2025-03-24,House,6,"Read first time, referred to Natural Resources. H.J. 778."
1945489,2025-03-25,House,7,"Subcommittee: Collins, Barker and Gjerde. H.J. 813."
1945489,2025-03-26,House,8,"Subcommittee Meeting: 03/27/2025 12:00PM House Lounge."
1945489,2025-03-27,House,9,"Subcommittee recommends passage."
1945489,2025-04-01,House,10,"Committee report, recommending passage. H.J. 886."
1945489,2025-04-01,House,11,"Committee vote: Yeas, 17. Nays, 4. H.J. 886."
1945489,2025-04-02,House,12,"Placed on calendar. H.J. 886."
1945489,2025-04-10,House,13,"Placed on calendar under unfinished business. H.J. 928."
1945489,2025-04-17,House,14,"Passed House, yeas 88, nays 4. H.J. 981."
1945489,2025-04-24,House,15,"Explanation of vote. H.J. 1070."
1945489,2025-04-17,House,16,"Immediate message. H.J. 985."
1945489,2025-04-21,Senate,17,"Message from House. S.J. 830."
1945489,2025-05-06,Senate,18,"Reported correctly enrolled, signed by President and Speaker, and sent to Governor. S.J. 942."
1945489,2025-05-06,Senate,19,"Signed by Governor. S.J. 943."
1945523,2025-01-29,House,1,"By COMMITTEE ON ADMINISTRATION AND RULES"
1945523,2025-01-29,House,2,"Introduced, referred to Administration and Rules. H.J. 139."
1945523,2025-01-29,House,3,"Subcommittee: Siegrist, Bagniewski, Dunwell, Grassley, Hora, Johnson, C., Kaufmann, Konfrst, Matson, Meyer, B., Nielsen, Stone, Wills, J., Wilson and Windschitl. H.J. 141."
1945523,2025-01-30,House,4,"Committee report, recommending passage. H.J. 173."
1945523,2025-01-30,House,5,"Committee vote: Yeas, 15. Nays, 0. H.J. 173."
1945523,2025-02-03,House,6,"Committee report approving bill, renumbered as HR 5."
1945561,2025-01-29,Senate,1,"Introduced, placed on calendar. S.J. 158."
1945561,2025-01-29,Senate,2,"Committee report, approving bill. S.J. 163."
1945561,2025-02-11,Senate,3,"Fiscal note."
1945561,2025-03-24,Senate,4,"Passed Senate, yeas 49, nays 0. S.J. 609."
1945561,2025-03-24,Senate,5,"Immediate message. S.J. 613."
1945561,2025-03-24,House,6,"Message from Senate. H.J. 777."
1945561,2025-03-24,House,7,"Read first time, referred to Judiciary. H.J. 778."
1945561,2025-03-28,House,8,"Subcommittee: Fett, Thomson, C. and Wilburn. H.J. 873."
1945561,2025-03-30,House,9,"Subcommittee Meeting: 03/31/2025 1:30PM House Lounge."
1945561,2025-03-31,House,10,"Subcommittee reassigned: Fett, Wilburn and Williams. H.J. 873."
1945561,2025-03-31,House,11,"Subcommittee recommends passage."
1945561,2025-04-01,House,12,"Committee report, recommending passage. H.J. 885."
1945561,2025-04-01,House,13,"Committee vote: Yeas, 21. Nays, 0. H.J. 885."
1945561,2025-04-02,House,14,"Placed on calendar. H.J. 885."
1945561,2025-04-10,House,15,"Placed on calendar under unfinished business. H.J. 928."
1945561,2025-04-23,House,16,"Passed House, yeas 92, nays 0. H.J. 1043."
1945561,2025-04-23,House,17,"Immediate message. H.J. 1050."
1945561,2025-04-23,Senate,18,"Message from House. S.J. 877."
1945561,2025-05-06,Senate,19,"Reported correctly enrolled, signed by President and Speaker, and sent to Governor. S.J. 942."
1945561,2025-05-06,Senate,20,"Signed by Governor. S.J. 943."
1945595,2025-01-29,House,1,"By COMMITTEE ON COMMERCE"
1945595,2025-01-29,House,2,"Introduced, referred to Commerce. H.J. 139."
1945595,2025-01-29,House,3,"Subcommittee: Barker, Lundgren and Wilson. H.J. 141."
1945595,2025-01-29,House,4,"Subcommittee Meeting: 02/05/2025 12:00PM RM 103."
1945595,2025-02-05,House,5,"Subcommittee recommends passage."
1945595,2025-02-11,House,6,"Committee report, recommending passage. H.J. 294."
1945595,2025-02-11,House,7,"Committee vote: Yeas, 23. Nays, 0. H.J. 294."
1945595,2025-03-07,House,8,"Committee report approving bill, renumbered as HF 852."
1945635,2025-01-29,House,1,"By COMMITTEE ON ADMINISTRATION AND RULES"
1945635,2025-01-29,House,2,"Introduced, referred to Administration and Rules. H.J. 139."
1945635,2025-01-29,House,3,"Subcommittee: Siegrist, Bagniewski, Dunwell, Grassley, Hora, Johnson, C., Kaufmann, Konfrst, Matson, Meyer, B., Nielsen, Stone, Wills, J., Wilson and Windschitl. H.J. 141."
1945635,2025-01-30,House,4,"Committee report, recommending passage. H.J. 173."
1945635,2025-01-30,House,5,"Committee vote: Yeas, 15. Nays, 0. H.J. 173."
1945635,2025-02-03,House,6,"Committee report approving bill, renumbered as HCR 5."
1945670,2025-01-29,House,1,"Introduced, referred to Education. H.J. 138."
1945704,2025-01-29,Senate,1,"Introduced, placed on calendar. S.J. 159."
1945704,2025-01-29,Senate,2,"Committee report, approving bill. S.J. 164."
1945704,2025-03-11,Senate,3,"Passed Senate, yeas 47, nays 0. S.J. 482."
1945704,2025-03-11,Senate,4,"Immediate message. S.J. 485."
1945704,2025-03-11,House,5,"Message from Senate. H.J. 606."
1945704,2025-03-12,House,6,"Read first time, passed on file. H.J. 614."
1945704,2025-03-12,House,7,"Substituted for HF 527. H.J. 622."
1945704,2025-03-12,House,8,"Passed House, yeas 92, nays 4. H.J. 622."
1945704,2025-03-12,House,9,"Explanation of vote. H.J. 638."
1945704,2025-03-19,House,10,"Explanation of vote. H.J. 751."
1945704,2025-03-12,House,11,"Immediate message. H.J. 635."
1945704,2025-03-13,Senate,12,"Message from House. S.J. 509."
1945704,2025-03-28,Senate,13,"Reported correctly enrolled, signed by President and Speaker, and sent to Governor. S.J. 667."
1945704,2025-03-28,Senate,14,"Signed by Governor. S.J. 668."
1945738,2025-01-29,House,1,"By COMMITTEE ON COMMERCE"
1945738,2025-01-29,House,2,"Introduced, referred to Commerce. H.J. 139."
1945738,2025-01-29,House,3,"Subcommittee: Latham, Lundgren and Srinivas. H.J. 141."
1945738,2025-02-03,House,4,"Subcommittee Meeting: 02/04/2025 8:15AM House Lounge (Cancelled)."
1945738,2025-02-03,House,5,"Subcommittee Meeting: 02/05/2025 8:15AM RM 304."
1945738,2025-02-05,House,6,"Subcommittee recommends passage."
1945738,2025-02-06,House,7,"Committee report, recommending passage. H.J. 267."
1945738,2025-02-06,House,8,"Committee vote: Yeas, 23. Nays, 0. H.J. 267."
1945738,2025-02-10,House,9,"Committee report approving bill, renumbered as HF 318."
1945777,2025-01-29,House,1,"By COMMITTEE ON LOCAL GOVERNMENT"
1945777,2025-01-29,House,2,"Introduced, referred to Local Government. H.J. 139."
1945777,2025-01-29,House,3,"Subcommittee: Wengryn, Determann and Gosa. H.J. 141."
1945777,2025-01-29,House,4,"Subcommittee Meeting: 01/30/2025 8:15AM RM 304."
1945777,2025-01-30,House,5,"Subcommittee recommends passage."
1945777,2025-02-06,House,6,"Committee report, recommending passage. H.J. 271."
1945777,2025-02-06,House,7,"Committee vote: Yeas, 18. Nays, 0. H.J. 271."
1945777,2025-02-10,House,8,"Committee report approving bill, renumbered as HF 297."
1945810,2025-01-29,Senate,1,"Introduced, placed on calendar. S.J. 159."
1945810,2025-01-29,Senate,2,"Committee report, approving bill. S.J. 165."
1945810,2025-02-11,Senate,3,"Passed Senate, yeas 47, nays 0. S.J. 233."
1945810,2025-02-11,Senate,4,"Immediate message. S.J. 236."
1945810,2025-02-12,House,5,"Message from Senate. H.J. 300."
1945810,2025-02-12,House,6,"Read first time, referred to Veterans Affairs. H.J. 307."
1945810,2025-02-17,House,7,"Subcommittee: Gearhart, Gerhold and Levin. H.J. 341."
1945810,2025-02-24,House,8,"Subcommittee Meeting: 02/25/2025 12:00PM House Lounge."
1945810,2025-02-25,House,9,"Subcommittee recommends passage."
1945810,2025-03-05,House,10,"Committee report, recommending passage. H.J. 556."
1945810,2025-03-05,House,11,"Committee vote: Yeas, 15. Nays, 0. Excused, 2. H.J. 556."
1945810,2025-03-06,House,12,"Placed on calendar. H.J. 556."
1945810,2025-04-10,House,13,"Placed on calendar under unfinished business. H.J. 928."
1945810,2025-05-15,House,14,"Rereferred to Veterans Affairs. H.J. 1222."
1945849,2025-01-29,House,1,"Introduced, referred to Health and Human Services. H.J. 138."
1945849,2025-01-29,House,2,"Subcommittee: Wood, Jeneary and Turek. H.J. 140."
1945849,2025-02-03,House,3,"Subcommittee Meeting: 02/05/2025 8:30AM House Lounge."
1945849,2025-02-05,House,4,"Subcommittee recommends passage."
1945849,2025-02-06,House,5,"Committee report, recommending passage. H.J. 281."
1945849,2025-02-06,House,6,"Committee vote: Yeas, 18. Nays, 2. Excused, 1. H.J. 281."
1945849,2025-02-10,House,7,"Committee report approving bill, renumbered as HF 301."
1945885,2025-01-29,Senate,1,"By COMMITTEE ON LOCAL GOVERNMENT"
1945885,2025-01-29,Senate,2,"Introduced, referred to Local Government."
1945885,2025-01-29,Senate,3,"Subcommittee: Webster, Driscoll, and Knox."
1945885,2025-01-29,Senate,4,"Subcommittee Meeting: 01/30/2025 8:00AM Senate Lounge."
1945885,2025-01-30,Senate,5,"Subcommittee recommends passage."
1945885,2025-01-30,Senate,6,"Committee report approving bill, renumbered as SF 173."
1945922,2025-01-29,Senate,1,"Introduced, placed on calendar. S.J. 158."
1945922,2025-01-29,Senate,2,"Committee report, approving bill. S.J. 163."
1945922,2025-03-17,Senate,3,"Attached to HF 647. S.J. 540."
1945922,2025-04-03,Senate,4,"Placed on calendar under unfinished business. S.J. 688."
1945922,2025-04-08,Senate,5,"HF 647 substituted. S.J. 721."
1945922,2025-04-08,Senate,6,"Withdrawn. S.J. 722."
1945958,2025-01-29,House,1,"Introduced, referred to Health and Human Services. H.J. 138."
1945958,2025-01-29,House,2,"Subcommittee: Nordman, Baeth and Meyer, A. H.J. 140."
1945958,2025-01-30,House,3,"Subcommittee Meeting: 02/05/2025 12:00PM RM 102."
1945958,2025-02-05,House,4,"Subcommittee recommends passage."
1945958,2025-02-11,House,5,"Committee report, recommending passage. H.J. 296."
1945958,2025-02-11,House,6,"Committee vote: Yeas, 13. Nays, 7. Excused, 1. H.J. 296."
1945958,2025-02-13,House,7,"Committee report approving bill, renumbered as HF 386."
1945958,2025-03-14,House,8,"Withdrawn. H.J. 660."
1945987,2025-01-29,Senate,1,"Introduced, placed on calendar. S.J. 159."
1945987,2025-01-29,Senate,2,"Committee report, approving bill. S.J. 164."
1945987,2025-02-06,Senate,3,"Referred to Ways and Means. S.J. 205."
1945987,2025-02-11,Senate,4,"Subcommittee: Rowley, Dotzler, and Gruenhagen. S.J. 243."
1945987,2025-03-26,Senate,5,"Subcommittee reassigned: Reichman, Dotzler, and Gruenhagen. S.J. 653."
1945987,2025-03-26,Senate,6,"Subcommittee Meeting: 03/31/2025 3:00PM Room 217 Conference Room."
1945987,2025-03-31,Senate,7,"Subcommittee recommends passage."
1945987,2025-04-22,Senate,8,"Committee report approving bill, renumbered as SF 637. S.J. 859."
1946029,2025-01-29,Senate,1,"By COMMITTEE ON LOCAL GOVERNMENT"
1946029,2025-01-29,Senate,2,"Introduced, referred to Local Government."
1946029,2025-01-29,Senate,3,"Subcommittee: Driscoll, Lofgren, and Wahls."
1946029,2025-02-20,Senate,4,"Subcommittee Meeting: 02/25/2025 1:00PM Senate Lounge."
1946029,2025-02-25,Senate,5,"Subcommittee recommends passage."
1946029,2025-03-03,Senate,6,"Committee report approving bill, renumbered as SF 499."
1946061,2025-01-29,Senate,1,"Introduced, referred to State Government. S.J. 160."
1946061,2025-02-04,Senate,2,"Subcommittee: Rozenboom, Schultz, and Winckler. S.J. 193."
1946089,2025-01-29,Senate,1,"By COMMITTEE ON LOCAL GOVERNMENT"
1946089,2025-01-29,Senate,2,"Introduced, referred to Local Government."
1946089,2025-01-29,Senate,3,"Subcommittee: Webster, Quirmbach, and Sires."
1946089,2025-02-20,Senate,4,"Subcommittee Meeting: 02/24/2025 12:30PM Room 315."
1946089,2025-02-24,Senate,5,"Subcommittee recommends amendment and passage."
1946089,2025-03-03,Senate,6,"Committee report approving bill, renumbered as SF 503."
1946115,2025-01-29,Senate,1,"Introduced, referred to State Government. S.J. 160."
1946115,2025-02-04,Senate,2,"Subcommittee: Rozenboom, Schultz, and Winckler. S.J. 194."
1946149,2025-01-29,House,1,"By COMMITTEE ON NATURAL RESOURCES"
1946149,2025-01-29,House,2,"Introduced, referred to Natural Resources. H.J. 139."
1946149,2025-01-29,House,3,"Subcommittee: Harris, Kurth and Wulf. H.J. 141."
1946149,2025-01-30,House,4,"Subcommittee Meeting: 02/03/2025 12:30PM House Lounge."
1946149,2025-02-03,House,5,"Subcommittee recommends passage."
1946149,2025-03-04,House,6,"Committee report, recommending passage. H.J. 509."
1946149,2025-03-04,House,7,"Committee vote: Yeas, 21. Nays, 0. H.J. 509."
1946149,2025-03-07,House,8,"Committee report approving bill, renumbered as HF 847."
1946182,2025-01-29,Senate,1,"Introduced, placed on calendar. S.J. 159."
1946182,2025-01-29,Senate,2,"Committee report, approving bill. S.J. 163."
1946182,2025-03-10,Senate,3,"Attached to HF 314. S.J. 457."
1946182,2025-04-03,Senate,4,"Placed on calendar under unfinished business. S.J. 688."
1946182,2025-04-07,Senate,5,"HF 314 substituted. S.J. 700."
1946182,2025-04-07,Senate,6,"Withdrawn. S.J. 701."
1946210,2025-01-29,Senate,1,"Introduced, referred to State Government. S.J. 158."
1946210,2025-02-04,Senate,2,"Subcommittee: Rozenboom, Bisignano, and Schultz. S.J. 193."
1946247,2025-01-29,Senate,1,"By COMMITTEE ON COMMERCE"
1946247,2025-01-29,Senate,2,"Introduced, referred to Commerce."
1946247,2025-01-29,Senate,3,"Subcommittee: Warme, Knox, and Rowley."
1946247,2025-02-03,Senate,4,"Subcommittee Meeting: 02/04/2025 1:00PM Lobbyist Lounge."
1946247,2025-02-19,Senate,5,"Subcommittee recommends passage."
1946247,2025-02-20,Senate,6,"Committee report approving bill, renumbered as SF 413."
1946271,2025-01-29,Senate,1,"Introduced, referred to State Government. S.J. 159."
1946271,2025-02-05,Senate,2,"Subcommittee: Rozenboom, Schultz, and Staed. S.J. 202."
1946301,2025-01-29,Senate,1,"Introduced, placed on calendar. S.J. 160."
1946301,2025-01-29,Senate,2,"Committee report, approving bill. S.J. 164."
1946301,2025-02-11,Senate,3,"Passed Senate, yeas 47, nays 0. S.J. 234."
1946301,2025-02-11,Senate,4,"Immediate message. S.J. 236."
1946301,2025-02-12,House,5,"Message from Senate. H.J. 300."
1946301,2025-02-12,House,6,"Read first time, passed on file. H.J. 307."
1946301,2025-03-04,House,7,"Substituted for HF 261. H.J. 494."
1946301,2025-03-04,House,8,"Passed House, yeas 88, nays 7. H.J. 495."
1946301,2025-03-10,House,9,"Explanation of vote. H.J. 590."
1946301,2025-03-04,House,10,"Immediate message. H.J. 498."
1946301,2025-03-05,Senate,11,"Message from House. S.J. 413."
1946301,2025-05-19,Senate,12,"Reported correctly enrolled, signed by President and Speaker, and sent to Governor. S.J. 1050."
1946301,2025-05-19,Senate,13,"Signed by Governor. S.J. 1051."
1946332,2025-01-29,Senate,1,"Introduced, referred to Local Government. S.J. 160."
1946332,2025-02-03,Senate,2,"Subcommittee: Westrich, Quirmbach, and Sires. S.J. 178."
1946332,2025-02-17,Senate,3,"Subcommittee Meeting: 02/19/2025 12:30PM Room 217 Conference Room."
1946332,2025-02-19,Senate,4,"Subcommittee recommends passage."
1946332,2025-03-04,Senate,5,"Committee report approving bill, renumbered as SF 494. S.J. 407."
1946366,2025-01-29,Senate,1,"Introduced, referred to Workforce. S.J. 159."
1946366,2025-01-30,Senate,2,"Subcommittee: Driscoll, Dotzler, and Taylor. S.J. 170."
1946393,2025-01-29,Senate,1,"Introduced, referred to Health and Human Services. S.J. 161."
1946393,2025-02-04,Senate,2,"Subcommittee: Klimesh, Campbell, and Trone Garriott. S.J. 194."
1946393,2025-02-19,Senate,3,"Subcommittee Meeting: 02/20/2025 2:00PM Senate Lounge."
1946393,2025-02-20,Senate,4,"Subcommittee recommends amendment and passage."
1946419,2025-01-29,Senate,1,"Introduced, referred to Workforce. S.J. 160."
1946419,2025-01-30,Senate,2,"Subcommittee: Driscoll, Donahue, and Sires. S.J. 170."
1946451,2025-01-29,Senate,1,"By COMMITTEE ON NATURAL RESOURCES AND ENVIRONMENT"
1946451,2025-01-29,Senate,2,"Introduced, referred to Natural Resources and Environment."
1946451,2025-01-30,Senate,3,"Subcommittee: Sweeney, Staed, and Westrich."
1946472,2025-01-29,Senate,1,"Introduced, referred to State Government. S.J. 160."
1946472,2025-02-04,Senate,2,"Subcommittee: Rozenboom, Schultz, and Winckler. S.J. 194."
1946727,2025-01-29,House,1,"By COMMITTEE ON PUBLIC SAFETY"
1946727,2025-01-29,House,2,"Introduced, referred to Public Safety. H.J. 139."
1946727,2025-01-29,House,3,"Subcommittee: Vondran, Gjerde and Holt. H.J. 141."
1946727,2025-02-11,House,4,"Subcommittee Meeting: 02/13/2025 8:15AM House Lounge (Cancelled)."
1946727,2025-02-11,House,5,"Subcommittee Meeting: 02/20/2025 8:15AM House Lounge."
1946727,2025-02-24,House,6,"Tabled until future meeting."
1946962,2025-01-29,Senate,1,"Introduced, referred to Appropriations. S.J. 161."
1946962,2025-02-05,Senate,2,"Subcommittee: Lofgren, Blake, and Shipley. S.J. 203."
1946962,2025-02-05,Senate,3,"Subcommittee Meeting: 02/06/2025 12:00PM Room 315."
1946962,2025-02-06,Senate,4,"Subcommittee recommends passage."
1946962,2025-04-16,Senate,5,"Committee report approving bill, renumbered as SF 627. S.J. 819."
1947197,2025-01-29,Senate,1,"Introduced, referred to State Government. S.J. 161."
1947197,2025-02-04,Senate,2,"Subcommittee: Rozenboom, Schultz, and Winckler. S.J. 194."
1947431,2025-01-29,Senate,1,"By COMMITTEE ON HEALTH AND HUMAN SERVICES"
1947431,2025-01-29,Senate,2,"Introduced, referred to Health and Human Services."
1947431,2025-01-30,Senate,3,"Subcommittee: Klimesh, Sweeney, and Trone Garriott."
1947431,2025-02-04,Senate,4,"Subcommittee Meeting: 02/05/2025 2:00PM Room G15."
1947431,2025-02-05,Senate,5,"Subcommittee recommends passage."
1947431,2025-02-19,Senate,6,"Committee report approving bill, renumbered as SF 383."
1947726,2025-01-30,House,1,"Introduced, referred to Judiciary. H.J. 151."
1947736,2025-01-30,House,1,"Introduced, placed on calendar. H.J. 151."
1947736,2025-04-03,House,2,"Placed on calendar under unfinished business. H.J. 894."
1947736,2025-04-21,House,3,"Amendment H-1259 filed, adopted. H.J. 1004."
1947736,2025-04-21,House,4,"SF 583 substituted. H.J. 1004."
1947736,2025-04-21,House,5,"Withdrawn. H.J. 1010."
1947748,2025-01-30,House,1,"Introduced, placed on calendar. H.J. 151."
1947748,2025-03-06,House,2,"Amendments H-1035 and H-1036 filed. H.J. 557."
1947748,2025-04-03,House,3,"Referred to Education. H.J. 895."
1947764,2025-01-30,House,1,"Introduced, placed on calendar. H.J. 154."
1947764,2025-02-20,House,2,"Passed House, yeas 87, nays 5. H.J. 385."
1947764,2025-02-20,House,3,"Immediate message. H.J. 401."
1947764,2025-02-24,Senate,4,"Message from House. S.J. 336."
1947764,2025-02-24,Senate,5,"Read first time, passed on file. S.J. 336."
1947764,2025-02-27,Senate,6,"Attached to SF 461. S.J. 387."
1947764,2025-03-12,Senate,7,"Substituted for SF 461. S.J. 503."
1947764,2025-03-12,Senate,8,"Passed Senate, yeas 48, nays 0. S.J. 504."
1947764,2025-03-12,Senate,9,"Immediate message. S.J. 505."
1947764,2025-03-12,House,10,"Message from Senate. H.J. 635."
1947764,2025-03-28,House,11,"Reported correctly enrolled, signed by Speaker and President, and sent to Governor. H.J. 872."
1947764,2025-03-28,House,12,"Signed by Governor. H.J. 872."
1947778,2025-01-30,House,1,"Introduced, referred to Agriculture. H.J. 149."
1947792,2025-01-30,House,1,"Introduced, placed on calendar. H.J. 154."
1947792,2025-02-20,House,2,"Passed House, yeas 92, nays 0. H.J. 386."
1947792,2025-02-20,House,3,"Immediate message. H.J. 401."
1947792,2025-02-24,Senate,4,"Message from House. S.J. 336."
1947792,2025-02-24,Senate,5,"Read first time, attached to SF 305. S.J. 336."
1947792,2025-03-12,Senate,6,"Substituted for SF 305. S.J. 498."
1947792,2025-03-12,Senate,7,"Passed Senate, yeas 48, nays 0. S.J. 498."
1947792,2025-03-12,Senate,8,"Immediate message. S.J. 501."
1947792,2025-03-12,House,9,"Message from Senate. H.J. 635."
1947792,2025-03-28,House,10,"Reported correctly enrolled, signed by Speaker and President, and sent to Governor. H.J. 872."
1947792,2025-03-28,House,11,"Signed by Governor. H.J. 872."
1947805,2025-01-30,House,1,"Introduced, referred to Health and Human Services. H.J. 149."
1947821,2025-01-30,House,1,"Introduced, referred to Higher Education. H.J. 150."
1947821,2025-02-03,House,2,"Subcommittee: Hora, Collins and Kurth. H.J. 178."
1947821,2025-02-06,House,3,"Subcommittee Meeting: 02/11/2025 12:00PM RM 304.1."
1947821,2025-02-11,House,4,"Subcommittee recommends passage."
1947821,2025-02-19,House,5,"Committee report, recommending amendment and passage. H.J. 366."
1947821,2025-02-19,House,6,"Committee vote: Yeas, 8. Nays, 3. H.J. 366."
1947821,2025-02-24,House,7,"Committee report approving bill, renumbered as HF 577."
1947834,2025-01-30,House,1,"Introduced, placed on calendar. H.J. 153."
1947834,2025-02-11,House,2,"Fiscal note."
1947834,2025-02-18,House,3,"Amendment H-1015 filed. H.J. 354."
1947834,2025-03-04,House,4,"Amendment H-1015 withdrawn. H.J. 493."
1947834,2025-03-04,House,5,"Passed House, yeas 90, nays 5. H.J. 494."
1947834,2025-03-10,House,6,"Explanation of vote. H.J. 590."
1947834,2025-03-04,House,7,"Immediate message. H.J. 498."
1947834,2025-03-05,Senate,8,"Message from House. S.J. 414."
1947834,2025-03-05,Senate,9,"Read first time, referred to Transportation. S.J. 414."
1947834,2025-03-11,Senate,10,"Subcommittee: Gruenhagen, De Witt, and Townsend. S.J. 492."
1947834,2025-03-17,Senate,11,"Subcommittee Meeting: 03/18/2025 8:30AM Senate Lounge."
1947834,2025-03-18,Senate,12,"Subcommittee recommends passage."
1947834,2025-04-01,Senate,13,"Committee report, recommending passage. S.J. 674."
1947834,2025-04-01,Senate,14,"Placed on calendar."
1947850,2025-01-30,House,1,"Introduced, referred to State Government. H.J. 149."
1947859,2025-01-30,House,1,"By COMMITTEE ON EDUCATION"
1947859,2025-01-30,House,2,"Introduced, referred to Education. H.J. 169."
1947859,2025-01-30,House,3,"Subcommittee: Shipley, Hora and Matson. H.J. 172."
1947859,2025-02-10,House,4,"Subcommittee Meeting: 02/12/2025 12:30PM RM 102."
1947859,2025-02-12,House,5,"Subcommittee recommends passage."
1947859,2025-02-27,House,6,"Committee report, recommending amendment and passage. H.J. 465."
1947859,2025-02-27,House,7,"Committee vote: Yeas, 21. Nays, 2. H.J. 466."
1947859,2025-03-05,House,8,"Committee report approving bill, renumbered as HF 782."
1947875,2025-01-30,House,1,"Introduced, placed on calendar. H.J. 153."
1947875,2025-02-11,House,2,"Fiscal note."
1947875,2025-04-03,House,3,"Referred to Public Safety. H.J. 895."
1947888,2025-01-30,House,1,"Introduced, placed on calendar. H.J. 152."
1947888,2025-03-07,House,2,"Amendment H-1039 filed. H.J. 569."
1947888,2025-04-03,House,3,"Placed on calendar under unfinished business. H.J. 894."
1947888,2025-05-15,House,4,"Rereferred to Education. H.J. 1221."
1947903,2025-01-30,House,1,"Introduced, referred to Education. H.J. 152."
1947915,2025-01-30,House,1,"Introduced, referred to Environmental Protection. H.J. 149."
1947927,2025-01-30,House,1,"Introduced, referred to Local Government. H.J. 150."
1947927,2025-01-30,House,2,"Subcommittee: Golding, Henderson and Zabner. H.J. 171."
1947927,2025-02-03,House,3,"Subcommittee reassigned: Jones, Henderson and Zabner. H.J. 179."
1947927,2025-02-10,House,4,"Subcommittee Meeting: 02/12/2025 7:30AM RM 19."
1947927,2025-02-12,House,5,"Subcommittee recommends amendment and passage."
1947927,2025-02-18,House,6,"Committee report, recommending amendment and passage. H.J. 354."
1947927,2025-02-18,House,7,"Committee vote: Yeas, 13. Nays, 6. Excused, 2. H.J. 354."
1947927,2025-02-20,House,8,"Committee report approving bill, renumbered as HF 510."
1947927,2025-03-21,House,9,"Withdrawn. H.J. 772."
1947942,2025-01-30,House,1,"By COMMITTEE ON EDUCATION"
1947942,2025-01-30,House,2,"Introduced, referred to Education. H.J. 169."
1947942,2025-01-30,House,3,"Subcommittee: Wheeler, Gehlbach and Kurth. H.J. 172."
1947942,2025-02-11,House,4,"Subcommittee Meeting: 02/12/2025 12:00PM RM 304."
1947942,2025-02-12,House,5,"Subcommittee recommends passage."
1947942,2025-02-27,House,6,"Committee report, recommending amendment and passage. H.J. 465."
1947942,2025-02-27,House,7,"Committee vote: Yeas, 14. Nays, 9. H.J. 465."
1947942,2025-03-05,House,8,"Committee report approving bill, renumbered as HF 785."
1947952,2025-01-30,House,1,"Introduced, referred to State Government. H.J. 151."
1947965,2025-01-30,House,1,"Introduced, referred to State Government. H.J. 151."
1947978,2025-01-30,Senate,1,"Introduced, placed on calendar. S.J. 167."
1947978,2025-01-30,Senate,2,"Committee report, approving bill. S.J. 171."
1947978,2025-02-18,Senate,3,"Passed Senate, yeas 44, nays 0. S.J. 288."
1947978,2025-02-18,Senate,4,"Immediate message. S.J. 292."
1947978,2025-02-19,House,5,"Message from Senate. H.J. 355."
1947978,2025-02-20,House,6,"Read first time, passed on file. H.J. 377."
1947978,2025-03-11,House,7,"Substituted for HF 396. H.J. 601."
1947978,2025-03-11,House,8,"Passed House, yeas 91, nays 0. H.J. 601."
1947978,2025-03-12,House,9,"Explanation of vote. H.J. 638."
1947978,2025-03-19,House,10,"Explanation of vote. H.J. 751."
1947978,2025-03-11,House,11,"Immediate message. H.J. 607."
1947978,2025-03-12,Senate,12,"Message from House. S.J. 494."
1947978,2025-04-17,Senate,13,"Reported correctly enrolled, signed by President and Speaker, and sent to Governor. S.J. 829."
1947978,2025-04-18,Senate,14,"Signed by Governor. S.J. 845."
1947997,2025-01-30,House,1,"Introduced, referred to Education. H.J. 149."
1947997,2025-02-06,House,2,"Subcommittee: Hayes, Levin and Stone. H.J. 264."
1947997,2025-02-10,House,3,"Subcommittee Meeting: 02/11/2025 12:00PM RM 103."
1947997,2025-02-11,House,4,"Subcommittee recommends passage."
1947997,2025-03-04,House,5,"Committee report, recommending amendment and passage. H.J. 527."
1947997,2025-03-04,House,6,"Committee vote: Yeas, 16. Nays, 7. H.J. 527."
1947997,2025-03-07,House,7,"Committee report approving bill, renumbered as HF 865."
1947997,2025-03-21,House,8,"Withdrawn. H.J. 772."
1948012,2025-01-30,House,1,"Introduced, placed on calendar. H.J. 153."
1948012,2025-02-19,House,2,"Amendment H-1017 filed. H.J. 372."
1948012,2025-02-20,House,3,"Amendment H-1017 adopted. H.J. 393."
1948012,2025-02-20,House,4,"Passed House, yeas 92, nays 0. H.J. 393."
1948012,2025-02-20,House,5,"Immediate message. H.J. 401."
1948012,2025-02-24,Senate,6,"Message from House. S.J. 336."
1948012,2025-02-24,Senate,7,"Read first time, referred to Veterans Affairs. S.J. 336."
1948012,2025-02-25,Senate,8,"Subcommittee: Dawson, Dotzler, and McClintock. S.J. 357."
1948012,2025-03-26,Senate,9,"Subcommittee Meeting: 03/27/2025 11:00AM Room 217 Conference Room."
1948012,2025-03-27,Senate,10,"Subcommittee recommends amendment and passage."
1948028,2025-01-30,House,1,"Introduced, referred to Local Government. H.J. 150."
1948042,2025-01-30,House,1,"Introduced, referred to Higher Education. H.J. 150."
1948042,2025-02-03,House,2,"Subcommittee: Wheeler, Jacoby and Shipley. H.J. 178."
1948042,2025-02-10,House,3,"Subcommittee Meeting: 02/11/2025 4:00PM House Lounge."
1948042,2025-02-11,House,4,"Subcommittee recommends passage."
1948053,2025-01-30,House,1,"Introduced, placed on calendar. H.J. 154."
1948053,2025-03-10,House,2,"Passed House, yeas 86, nays 1. H.J. 574."
1948053,2025-03-18,House,3,"Explanation of vote. H.J. 718."
1948053,2025-03-10,House,4,"Immediate message. H.J. 590."
1948053,2025-03-10,Senate,5,"Message from House. S.J. 456."
1948053,2025-03-10,Senate,6,"Read first time, attached to SF 392. S.J. 456."
1948053,2025-03-12,Senate,7,"Substituted for SF 392. S.J. 500."
1948053,2025-03-12,Senate,8,"Passed Senate, yeas 48, nays 0. S.J. 501."
1948053,2025-03-12,Senate,9,"Immediate message. S.J. 501."
1948053,2025-03-12,House,10,"Message from Senate. H.J. 635."
1948053,2025-03-28,House,11,"Reported correctly enrolled, signed by Speaker and President, and sent to Governor. H.J. 872."
1948053,2025-03-28,House,12,"Signed by Governor. H.J. 872."
1948066,2025-01-30,House,1,"Introduced, referred to Ways and Means. H.J. 152."
1948066,2025-02-26,House,2,"Subcommittee: Young, Behn and Wilson. H.J. 441."
1948066,2025-03-05,House,3,"Subcommittee Meeting: 03/12/2025 12:45PM RM 304."
1948066,2025-03-12,House,4,"Subcommittee recommends passage."
1948077,2025-01-30,House,1,"Introduced, placed on calendar. H.J. 153."
1948077,2025-02-27,House,2,"Fiscal note."
1948077,2025-03-26,House,3,"Amendment H-1208 filed. H.J. 854."
1948077,2025-03-26,House,4,"Amendment H-1210 filed. H.J. 854."
1948077,2025-03-27,House,5,"Amendment H-1210 adopted. H.J. 861."
1948077,2025-03-27,House,6,"Amendment H-1208 out of order. H.J. 861."
1948077,2025-03-27,House,7,"SF 397 substituted. H.J. 861."
1948077,2025-03-27,House,8,"Withdrawn. H.J. 866."
1948090,2025-01-30,House,1,"Introduced, placed on calendar. H.J. 153."
1948090,2025-02-20,House,2,"Passed House, yeas 92, nays 0. H.J. 383."
1948090,2025-02-20,House,3,"Immediate message. H.J. 401."
1948090,2025-02-24,Senate,4,"Message from House. S.J. 335."
1948090,2025-02-24,Senate,5,"Read first time, referred to Transportation. S.J. 335."
1948090,2025-03-05,Senate,6,"Subcommittee: Warme, Koelker, and Townsend. S.J. 421."
1948090,2025-03-06,Senate,7,"Subcommittee reassigned: Koelker, Townsend, and Warme. S.J. 434."
1948090,2025-03-18,Senate,8,"Subcommittee Meeting: 03/19/2025 12:30PM Lobbyist Lounge."
1948090,2025-03-19,Senate,9,"Subcommittee recommends passage."
1948105,2025-01-30,House,1,"Introduced, referred to Education. H.J. 149."
1948105,2025-02-06,House,2,"Subcommittee: Fett, Hora and Matson. H.J. 264."
1948105,2025-02-13,House,3,"Subcommittee Meeting: 02/13/2025 12:30PM House Lounge 2."
1948105,2025-02-13,House,4,"Subcommittee recommends passage."
1948120,2025-01-30,House,1,"Introduced, referred to Transportation. H.J. 151."
1948120,2025-02-06,House,2,"Sponsor added, Young. H.J. 262."
1948120,2025-02-10,House,3,"Subcommittee: Young, Bagniewski and Behn. H.J. 280."
1948120,2025-02-10,House,4,"Subcommittee Meeting: 02/11/2025 2:30PM House Lounge."
1948120,2025-02-11,House,5,"Subcommittee recommends passage."
1948120,2025-02-26,House,6,"Committee report, recommending amendment and passage. H.J. 448."
1948120,2025-02-26,House,7,"Committee vote: Yeas, 19. Nays, 1. Excused, 1. H.J. 448."
1948120,2025-03-05,House,8,"Committee report approving bill, renumbered as HF 788."
1948131,2025-01-30,House,1,"Introduced, referred to Transportation. H.J. 152."
1948131,2025-02-05,House,2,"Subcommittee: Wood, Bossman and Cooling. H.J. 183."
1948131,2025-02-13,House,3,"Subcommittee Meeting: 02/19/2025 12:00PM RM 19."
1948131,2025-02-19,House,4,"Subcommittee recommends passage."
1948146,2025-01-30,House,1,"Introduced, referred to State Government. H.J. 152."
1948158,2025-01-30,House,1,"Introduced, placed on calendar. H.J. 153."
1948158,2025-02-19,House,2,"Amendment H-1019 filed. H.J. 372."
1948158,2025-02-20,House,3,"Amendment H-1019 withdrawn. H.J. 383."
1948158,2025-02-20,House,4,"SF 171 substituted. H.J. 383."
1948158,2025-02-20,House,5,"Withdrawn. H.J. 401."
1948170,2025-01-30,House,1,"Introduced, referred to Environmental Protection. H.J. 148."
1948185,2025-01-30,House,1,"Introduced, referred to Local Government. H.J. 150."
1948197,2025-01-30,House,1,"Introduced, referred to Higher Education. H.J. 150."
1948211,2025-01-30,House,1,"Introduced, referred to Natural Resources. H.J. 148."
1948226,2025-01-30,House,1,"Introduced, placed on calendar. H.J. 151."
1948226,2025-02-12,House,2,"Amendment H-1007 filed. H.J. 314."
1948226,2025-03-13,House,3,"Amendment H-1078 filed. H.J. 659."
1948226,2025-04-03,House,4,"Placed on calendar under unfinished business. H.J. 894."
1948226,2025-04-15,House,5,"Amendment H-1229 filed. H.J. 945."
1948226,2025-04-17,House,6,"Amendment H-1078 to amendment H-1007 withdrawn. H.J. 957."
1948226,2025-04-17,House,7,"Amendment H-1007 withdrawn. H.J. 957."
1948226,2025-04-17,House,8,"Amendment H-1229 adopted. H.J. 957."
1948226,2025-04-17,House,9,"SF 369 substituted. H.J. 957."
1948226,2025-04-17,House,10,"Withdrawn. H.J. 985."
1948240,2025-01-30,House,1,"Introduced, referred to Local Government. H.J. 150."
1948253,2025-01-30,House,1,"Introduced, placed on calendar. H.J. 154."
1948253,2025-03-03,House,2,"Referred to Ways and Means. H.J. 485."
1948253,2025-03-18,House,3,"Subcommittee: Meggers, Behn and Judge. H.J. 719."
1948253,2025-03-19,House,4,"Subcommittee Meeting: 03/20/2025 8:15AM House Lounge 2."
1948253,2025-03-20,House,5,"Subcommittee recommends passage."
1948253,2025-04-09,House,6,"Committee report, recommending passage. H.J. 922."
1948253,2025-04-09,House,7,"Committee vote: Yeas, 24. Nays, 0. Excused, 1. H.J. 922."
1948253,2025-04-14,House,8,"Committee report approving bill, renumbered as HF 1006."
1948253,2025-04-28,House,9,"Withdrawn. H.J. 1073."
1948263,2025-01-30,House,1,"Introduced, referred to Ways and Means. H.J. 152."
1948281,2025-01-30,House,1,"Introduced, referred to Commerce. H.J. 155."
1948309,2025-01-30,House,1,"Introduced, referred to Commerce. H.J. 154."
1948346,2025-01-30,House,1,"Introduced, referred to Commerce. H.J. 154."
1948380,2025-01-30,House,1,"By COMMITTEE ON STATE GOVERNMENT"
1948380,2025-01-30,House,2,"Introduced, referred to State Government. H.J. 170."
1948380,2025-01-30,House,3,"Subcommittee: Dunwell, Turek and Wilz, H. H.J. 172."
1948380,2025-02-03,House,4,"Subcommittee Meeting: 02/06/2025 8:15AM RM 19."
1948380,2025-02-06,House,5,"Subcommittee recommends amendment and passage."
1948380,2025-02-12,House,6,"Committee report, recommending amendment and passage. H.J. 313."
1948380,2025-02-12,House,7,"Committee vote: Yeas, 16. Nays, 7. H.J. 313."
1948380,2025-02-13,House,8,"Committee report approving bill, renumbered as HF 398."
1948421,2025-01-30,House,1,"By COMMITTEE ON LABOR AND WORKFORCE"
1948421,2025-01-30,House,2,"Introduced, referred to Labor and Workforce. H.J. 170."
1948421,2025-01-30,House,3,"Subcommittee: Kniff McCulla, Cooling and Meggers. H.J. 172."
1948454,2025-01-30,House,1,"Introduced, referred to Education. H.J. 155."
1948492,2025-01-30,House,1,"By COMMITTEE ON STATE GOVERNMENT"
1948492,2025-01-30,House,2,"Introduced, referred to State Government. H.J. 170."
1948492,2025-01-30,House,3,"Subcommittee: Dunwell, Turek and Wilz, H. H.J. 172."
1948492,2025-02-03,House,4,"Subcommittee Meeting: 02/06/2025 8:00AM RM 19."
1948492,2025-02-06,House,5,"Subcommittee recommends passage."
1948492,2025-02-19,House,6,"Committee report, recommending passage. H.J. 369."
1948492,2025-02-19,House,7,"Committee vote: Yeas, 22. Nays, 0. Excused, 1. H.J. 369."
1948492,2025-02-20,House,8,"Committee report approving bill, renumbered as HF 544."
1948528,2025-01-30,House,1,"By COMMITTEE ON STATE GOVERNMENT"
1948528,2025-01-30,House,2,"Introduced, referred to State Government. H.J. 170."
1948528,2025-01-30,House,3,"Subcommittee: Hora, Dunwell and Wilburn. H.J. 172."
1948528,2025-02-05,House,4,"Subcommittee Meeting: 02/06/2025 12:30PM RM 19."
1948528,2025-02-06,House,5,"Subcommittee recommends passage."
1948528,2025-03-05,House,6,"Committee report, recommending amendment and passage. H.J. 533."
1948528,2025-03-05,House,7,"Committee vote: Yeas, 21. Nays, 0. Excused, 2. H.J. 533."
1948528,2025-03-11,House,8,"Committee report approving bill, renumbered as HF 913."
1948568,2025-01-30,House,1,"Introduced, placed on calendar. H.J. 155."
1948568,2025-02-13,House,2,"Amendment H-1013 filed. H.J. 334."
1948568,2025-03-06,House,3,"Amendments H-1037 and H-1038 filed. H.J. 557."
1948568,2025-03-12,House,4,"Amendment H-1072 filed. H.J. 639."
1948568,2025-03-17,House,5,"Amendments H-1101 and H-1105 filed. H.J. 677."
1948568,2025-03-19,House,6,"Amendment H-1072 to amendment H-1013 withdrawn. H.J. 744."
1948568,2025-03-19,House,7,"Amendment H-1105 to amendment H-1013 adopted. H.J. 744."
1948568,2025-03-19,House,8,"Amendment H-1013 adopted, as amended. H.J. 744."
1948568,2025-03-19,House,9,"Amendment H-1101 to amendment H-1037 adopted. H.J. 744."
1948568,2025-03-19,House,10,"Point of order raised on H-1037, as amended, ruled not germane. H.J. 744."
1948568,2025-03-19,House,11,"Motion to suspend rules for immediate consideration of amendment H-1037, as amended, yeas 32, nays 64. H.J. 745."
1948568,2025-03-19,House,12,"Motion to suspend rules failed. H.J. 745."
1948568,2025-03-19,House,13,"Amendment H-1038 withdrawn. H.J. 745."
1948568,2025-03-19,House,14,"Passed House, yeas 63, nays 33. H.J. 746."
1948568,2025-03-24,House,15,"Explanation of vote. H.J. 789."
1948568,2025-03-19,House,16,"Immediate message. H.J. 748."
1948568,2025-03-20,Senate,17,"Message from House. S.J. 602."
1948568,2025-03-20,Senate,18,"Read first time, referred to Education. S.J. 602."
1948568,2025-03-26,Senate,19,"Subcommittee: Kraayenbrink, Pike, and Zimmer. S.J. 653."
1948568,2025-03-26,Senate,20,"Subcommittee Meeting: 03/27/2025 9:30AM Senate Lounge."
1948568,2025-03-27,Senate,21,"Subcommittee recommends passage."
1948568,2025-04-07,Senate,22,"Committee report, recommending passage. S.J. 714."
1948568,2025-04-07,Senate,23,"Placed on calendar."
1948568,2025-04-10,Senate,24,"Placed on calendar under unfinished business. S.J. 757."
1948568,2025-05-13,Senate,25,"Amendments S-3171 and S-3176 filed. S.J. 1004."
1948568,2025-05-14,Senate,26,"Amendments S-3176 lost. S.J. 1022."
1948568,2025-05-14,Senate,27,"Amendment S-3187 to S-3171 filed, adopted. S.J. 1022."
1948568,2025-05-14,Senate,28,"Amendment S-3171 adopted, as amended. S.J. 1023."
1948568,2025-05-14,Senate,29,"Passed Senate, yeas 31, nays 13. S.J. 1023."
1948568,2025-05-14,Senate,30,"Immediate message. S.J. 1025."
1948568,2025-05-14,House,31,"Message from Senate. H.J. 1198."
1948568,2025-05-14,House,32,"Senate amendment H-1355 filed. H.J. 1205."
1948568,2025-05-14,House,33,"House concurred in Senate amendment H-1355. H.J. 1205."
1948568,2025-05-14,House,34,"Passed House, yeas 59, nays 26. H.J. 1205."
1948568,2025-05-20,House,35,"Explanation of vote. H.J. 1223."
1948568,2025-06-27,House,36,"Explanations of votes. H.J. 1224."
1948568,2025-05-14,House,37,"Immediate message. H.J. 1207."
1948568,2025-05-14,Senate,38,"Message from House. S.J. 1029."
1948568,2025-05-27,House,39,"Reported correctly enrolled, signed by Speaker and President, and sent to Governor. H.J. 1225."
1948568,2025-06-06,House,40,"Signed by Governor. H.J. 1225."
1948605,2025-01-30,House,1,"Introduced, placed on calendar. H.J. 155."
1948605,2025-03-11,House,2,"Amendment H-1057 filed. H.J. 608."
1948605,2025-03-11,House,3,"Fiscal note."
1948605,2025-03-18,House,4,"Amendment H-1057 adopted. H.J. 697."
1948605,2025-03-18,House,5,"Passed House, yeas 86, nays 11. H.J. 697."
1948605,2025-03-18,House,6,"Immediate message. H.J. 717."
1948605,2025-03-19,Senate,7,"Message from House. S.J. 570."
1948605,2025-03-19,Senate,8,"Read first time, attached to SF 211. S.J. 570."
1948605,2025-04-03,Senate,9,"Placed on calendar under unfinished business. S.J. 688."
1948605,2025-04-15,Senate,10,"Substituted for SF 211. S.J. 784."
1948605,2025-04-15,Senate,11,"Passed Senate, yeas 44, nays 2. S.J. 785."
1948605,2025-04-15,Senate,12,"Immediate message. S.J. 789."
1948605,2025-04-16,House,13,"Message from Senate. H.J. 946."
1948605,2025-05-08,House,14,"Fiscal note."
1948605,2025-05-19,House,15,"Reported correctly enrolled, signed by Speaker and President, and sent to Governor. H.J. 1224."
1948605,2025-06-11,House,16,"Signed by Governor. H.J. 1225."
1948640,2025-01-30,Senate,1,"By COMMITTEE ON EDUCATION"
1948640,2025-01-30,Senate,2,"Introduced, referred to Education."
1948640,2025-02-12,Senate,3,"Subcommittee: Taylor, Garrett, and Trone Garriott."
1948640,2025-02-17,Senate,4,"Subcommittee Meeting: 02/19/2025 12:30PM Senate Lounge."
1948640,2025-02-19,Senate,5,"Subcommittee recommends passage."
1948640,2025-03-04,Senate,6,"Committee report approving bill, renumbered as SF 520."
1948679,2025-01-30,House,1,"By COMMITTEE ON EDUCATION"
1948679,2025-01-30,House,2,"Introduced, referred to Education. H.J. 169."
1948679,2025-01-30,House,3,"Subcommittee: Moore, T., Kurth and Weldon. H.J. 172."
1948679,2025-02-03,House,4,"Subcommittee Meeting: 02/06/2025 12:00PM House Lounge 2."
1948679,2025-02-06,House,5,"Subcommittee recommends passage."
1948679,2025-02-11,House,6,"Committee report, recommending passage. H.J. 295."
1948679,2025-02-11,House,7,"Committee vote: Yeas, 23. Nays, 0. H.J. 295."
1948679,2025-02-13,House,8,"Committee report approving bill, renumbered as HF 395."
1948720,2025-01-30,Senate,1,"Introduced, referred to Commerce. S.J. 168."
1948720,2025-02-05,Senate,2,"Subcommittee: Dickey, Sweeney, and Wahls. S.J. 203."
1948720,2025-02-11,Senate,3,"Subcommittee Meeting: 02/13/2025 10:00AM Senate Lounge."
1948720,2025-02-13,Senate,4,"Subcommittee recommends amendment and passage."
1948720,2025-03-10,Senate,5,"Committee report approving bill, renumbered as SF 578. S.J. 469."
1948758,2025-01-30,House,1,"Introduced, referred to State Government. H.J. 155."
1948795,2025-01-30,Senate,1,"Introduced, placed on calendar. S.J. 168."
1948795,2025-01-30,Senate,2,"Committee report, approving bill. S.J. 171."
1948795,2025-02-13,Senate,3,"Fiscal note."
1948795,2025-06-16,Senate,4,"Referred to Education. S.J. 1057."
1948835,2025-01-30,Senate,1,"Introduced, placed on calendar. S.J. 167."
1948835,2025-01-30,Senate,2,"Committee report, approving bill. S.J. 170."
1948835,2025-02-10,Senate,3,"Fiscal note."
1948835,2025-02-11,Senate,4,"Amendment S-3002 filed, lost. S.J. 234."
1948835,2025-02-11,Senate,5,"Passed Senate, yeas 29, nays 18. S.J. 235."
1948835,2025-02-11,Senate,6,"Immediate message. S.J. 236."
1948835,2025-02-12,House,7,"Message from Senate. H.J. 300."
1948835,2025-02-12,House,8,"Read first time, passed on file. H.J. 307."
1948835,2025-02-12,House,9,"Amendments H-1008 and H-1010 filed. H.J. 314."
1948835,2025-02-13,House,10,"Substituted for HF 319. H.J. 324."
1948835,2025-02-13,House,11,"Amendment H-1008, yeas 30, nays 63, lost. H.J. 325."
1948835,2025-02-13,House,12,"Amendment H-1010 adopted. H.J. 325."
1948835,2025-02-13,House,13,"Passed House, yeas 58, nays 35. H.J. 326."
1948835,2025-02-18,House,14,"Explanation of vote. H.J. 350."
1948835,2025-02-18,House,15,"Explanation of vote. H.J. 351."
1948835,2025-02-13,House,16,"Immediate message. H.J. 327."
1948835,2025-02-17,Senate,17,"Message from House, with amendment S-3004. S.J. 275."
1948835,2025-02-18,Senate,18,"Fiscal note."
1948835,2025-04-07,Senate,19,"Amendment S-3067 to S-3004 filed, adopted. S.J. 699."
1948835,2025-04-07,Senate,20,"Senate concurred with S-3004, as amended. S.J. 699."
1948835,2025-04-07,Senate,21,"Passed Senate, yeas 32, nays 15. S.J. 699."
1948835,2025-04-07,Senate,22,"Immediate message. S.J. 702."
1948835,2025-04-08,House,23,"Message from Senate. H.J. 905."
1948835,2025-04-08,House,24,"Senate amendment H-1220 filed. H.J. 915."
1948835,2025-04-08,House,25,"House concurred with Senate amendment H-1220. H.J. 915."
1948835,2025-04-08,House,26,"Passed House, yeas 60, nays 36. H.J. 916."
1948835,2025-04-24,House,27,"Explanation of vote. H.J. 1069."
1948835,2025-04-08,House,28,"Immediate message. H.J. 917."
1948835,2025-04-08,Senate,29,"Message from House. S.J. 732."
1948835,2025-04-09,Senate,30,"Fiscal note."
1948835,2025-05-19,Senate,31,"Reported correctly enrolled, signed by President and Speaker, and sent to Governor. S.J. 1050."
1948835,2025-05-19,Senate,32,"Signed by Governor. S.J. 1051."
1948877,2025-01-30,Senate,1,"By COMMITTEE ON EDUCATION"
1948877,2025-01-30,Senate,2,"Introduced, referred to Education."
1948877,2025-02-03,Senate,3,"Subcommittee: Evans, Shipley, and Winckler."
1948877,2025-02-03,Senate,4,"Subcommittee Meeting: 02/05/2025 12:00PM Room 217 Conference Room."
1948877,2025-02-05,Senate,5,"Subcommittee recommends passage."
1948877,2025-02-11,Senate,6,"Committee report approving bill, renumbered as SF 277."
1948914,2025-01-30,House,1,"Introduced, referred to Education. H.J. 155."
1948914,2025-02-06,House,2,"Subcommittee: Boden, Kniff McCulla and Wessel-Kroeschell. H.J. 264."
1948914,2025-02-06,House,3,"Subcommittee Meeting: 02/10/2025 12:00PM House Lounge."
1948914,2025-02-10,House,4,"Subcommittee recommends passage."
1948914,2025-02-11,House,5,"Committee report, recommending passage. H.J. 295."
1948914,2025-02-11,House,6,"Committee vote: Yeas, 23. Nays, 0. H.J. 295."
1948914,2025-02-13,House,7,"Committee report approving bill, renumbered as HF 389."
1948914,2025-03-21,House,8,"Withdrawn. H.J. 772."
1948954,2025-01-30,Senate,1,"Introduced, referred to Ways and Means. S.J. 168."
1948954,2025-02-11,Senate,2,"Subcommittee: Dawson, Bisignano, and Rowley. S.J. 243."
1948954,2025-05-08,Senate,3,"Subcommittee Meeting: 05/09/2025 8:30AM Senate Lounge."
1948954,2025-05-09,Senate,4,"Subcommittee recommends passage."
1948954,2025-05-09,Senate,5,"Committee report approving bill, renumbered as SF 653. S.J. 955."
1948990,2025-01-30,House,1,"By COMMITTEE ON STATE GOVERNMENT"
1948990,2025-01-30,House,2,"Introduced, referred to State Government. H.J. 170."
1948990,2025-01-30,House,3,"Subcommittee: Jeneary, Johnson, C. and Zabner. H.J. 172."
1948990,2025-02-03,House,4,"Subcommittee Meeting: 02/06/2025 8:00AM RM 304."
1948990,2025-02-06,House,5,"Subcommittee recommends passage."
1948990,2025-02-12,House,6,"Committee report, recommending passage. H.J. 313."
1948990,2025-02-12,House,7,"Committee vote: Yeas, 23. Nays, 0. H.J. 313."
1948990,2025-02-13,House,8,"Committee report approving bill, renumbered as HF 399."
1949031,2025-01-30,House,1,"By COMMITTEE ON STATE GOVERNMENT"
1949031,2025-01-30,House,2,"Introduced, referred to State Government. H.J. 170."
1949031,2025-01-30,House,3,"Subcommittee: Smith, Hora and Wilburn. H.J. 172."
1949031,2025-02-05,House,4,"Subcommittee Meeting: 02/06/2025 12:00PM RM 19."
1949031,2025-02-06,House,5,"Subcommittee recommends passage."
1949031,2025-02-12,House,6,"Committee report, recommending passage. H.J. 312."
1949031,2025-02-12,House,7,"Committee vote: Yeas, 23. Nays, 0. H.J. 312."
1949031,2025-03-05,House,8,"Committee report approving bill, renumbered as HF 759."
1949068,2025-01-30,House,1,"By COMMITTEE ON EDUCATION"
1949068,2025-01-30,House,2,"Introduced, referred to Education. H.J. 169."
1949068,2025-01-30,House,3,"Subcommittee: Gehlbach, Madison and Shipley. H.J. 172."
1949068,2025-02-05,House,4,"Subcommittee Meeting: 02/06/2025 12:30PM House Lounge 2."
1949068,2025-02-06,House,5,"Subcommittee recommends passage."
1949068,2025-02-27,House,6,"Committee report, recommending passage. H.J. 466."
1949068,2025-02-27,House,7,"Committee vote: Yeas, 14. Nays, 9. H.J. 466."
1949068,2025-03-05,House,8,"Committee report approving bill, renumbered as HF 789."
1949106,2025-01-30,Senate,1,"By COMMITTEE ON EDUCATION"
1949106,2025-01-30,Senate,2,"Introduced, referred to Education."
1949106,2025-02-12,Senate,3,"Subcommittee: Shipley, Rozenboom, and Winckler."
1949106,2025-02-14,Senate,4,"Subcommittee Meeting: 02/17/2025 3:00PM Room 315."
1949106,2025-02-17,Senate,5,"Subcommittee recommends passage."
1949106,2025-02-25,Senate,6,"Committee report approving bill, renumbered as SF 444."
1949373,2025-01-30,Senate,1,"Introduced, placed on calendar. S.J. 168."
1949373,2025-01-30,Senate,2,"Committee report, approving bill. S.J. 171."
1949373,2025-02-18,Senate,3,"Passed Senate, yeas 44, nays 0. S.J. 289."
1949373,2025-02-18,Senate,4,"Immediate message. S.J. 292."
1949373,2025-02-19,House,5,"Message from Senate. H.J. 355."
1949373,2025-02-20,House,6,"Read first time, passed on file. H.J. 377."
1949373,2025-02-20,House,7,"Substituted for HF 174. H.J. 383."
1949373,2025-02-20,House,8,"Passed House, yeas 92, nays 0. H.J. 384."
1949373,2025-02-20,House,9,"Immediate message. H.J. 401."
1949373,2025-02-24,Senate,10,"Message from House. S.J. 335."
1949373,2025-03-11,Senate,11,"Reported correctly enrolled, signed by President and Speaker, and sent to Governor. S.J. 493."
1949373,2025-03-12,Senate,12,"Signed by Governor. S.J. 508."
1949595,2025-01-30,Senate,1,"Introduced, referred to Education. S.J. 168."
1949595,2025-02-10,Senate,2,"Subcommittee: Taylor, Gruenhagen, and Trone Garriott."
1949595,2025-02-13,Senate,3,"Subcommittee Meeting: 02/20/2025 1:00PM Room 315."
1949595,2025-02-20,Senate,4,"Subcommittee recommends passage."
1949595,2025-03-04,Senate,5,"Committee report, recommending amendment and passage. S.J. 406."
1949595,2025-03-04,Senate,6,"Placed on calendar."
1949595,2025-03-05,Senate,7,"Amendment S-3017 filed. S.J. 426."
1949595,2025-06-16,Senate,8,"Referred to Education. S.J. 1057."
1951410,2025-02-03,House,1,"By COMMITTEE ON JUDICIARY"
1951410,2025-02-03,House,2,"Introduced, referred to Judiciary. H.J. 177."
1951410,2025-02-03,House,3,"Subcommittee: Williams, Croken and Lawler. H.J. 179."
1951410,2025-02-04,House,4,"Subcommittee Meeting: 02/05/2025 4:00PM House Lounge."
1951410,2025-02-05,House,5,"Subcommittee recommends passage."
1951410,2025-02-11,House,6,"Committee report, recommending passage. H.J. 297."
1951410,2025-02-11,House,7,"Committee vote: Yeas, 21. Nays, 0. H.J. 297."
1951410,2025-02-13,House,8,"Committee report approving bill, renumbered as HF 381."
1951424,2025-02-03,Senate,1,"Introduced, placed on calendar. S.J. 174."
1951424,2025-02-03,Senate,2,"Committee report, approving bill. S.J. 180."
1951424,2025-02-03,Senate,3,"Referred to State Government. S.J. 172."
1951424,2025-02-03,Senate,4,"Subcommittee: Rozenboom, Bisignano, and Schultz. S.J. 178."
1951442,2025-02-03,House,1,"Introduced, referred to Ways and Means. H.J. 176."
1951442,2025-02-20,House,2,"Subcommittee: Holt, James and Jones. H.J. 406."
1951442,2025-03-13,House,3,"Subcommittee Meeting: 03/13/2025 3:00PM House Lounge."
1951442,2025-03-13,House,4,"Subcommittee recommends passage."
1951442,2025-04-02,House,5,"Committee report, recommending amendment and passage. H.J. 887."
1951442,2025-04-02,House,6,"Committee vote: Yeas, 23. Nays, 1. Excused, 1. H.J. 887."
1951442,2025-04-07,House,7,"Committee report approving bill, renumbered as HF 985."
1951442,2025-05-14,House,8,"Withdrawn. H.J. 1219."
1951462,2025-02-03,House,1,"By COMMITTEE ON JUDICIARY"
1951462,2025-02-03,House,2,"Introduced, referred to Judiciary. H.J. 178."
1951462,2025-02-03,House,3,"Subcommittee: Wheeler, Holt and Wilburn. H.J. 179."
1951462,2025-02-18,House,4,"Subcommittee Meeting: 02/19/2025 3:30PM RM 102."
1951462,2025-02-19,House,5,"Subcommittee recommends passage."
1951483,2025-02-03,House,1,"Introduced, referred to Higher Education. H.J. 175."
1951505,2025-02-03,House,1,"Introduced, referred to Local Government. H.J. 175."
1951505,2025-02-05,House,2,"Subcommittee: Jones, Bloomingdale and Wichtendahl. H.J. 183."
1951505,2025-02-10,House,3,"Subcommittee Meeting: 02/12/2025 8:00AM RM 19."
1951505,2025-02-12,House,4,"Tabled until future meeting."
1951525,2025-02-03,House,1,"Introduced, referred to Judiciary. H.J. 175."
1951525,2025-02-06,House,2,"Subcommittee: Lohse, Croken and Holt. H.J. 264."
1951525,2025-02-10,House,3,"Subcommittee Meeting: 02/11/2025 12:30PM RM 103."
1951525,2025-02-11,House,4,"Subcommittee recommends passage."
1951547,2025-02-03,Senate,1,"Introduced, placed on calendar. S.J. 175."
1951547,2025-02-03,Senate,2,"Committee report, approving bill. S.J. 178."
1951547,2025-02-18,Senate,3,"Amendment S-3005 filed, adopted. S.J. 286."
1951547,2025-02-18,Senate,4,"Amendment S-3007 filed, lost. S.J. 286."
1951547,2025-02-18,Senate,5,"Passed Senate, yeas 31, nays 13. S.J. 287."
1951547,2025-02-18,Senate,6,"Explanation of vote. S.J. 306."
1951547,2025-02-18,Senate,7,"Immediate message. S.J. 288."
1951547,2025-02-19,House,8,"Message from Senate. H.J. 355."
1951547,2025-02-19,House,9,"Read first time, passed on file. H.J. 360."
1951547,2025-04-03,House,10,"Placed on calendar under unfinished business. H.J. 894."
1951547,2025-04-16,House,11,"Amendment H-1237 filed. H.J. 950."
1951547,2025-04-17,House,12,"Substituted for HF 391. H.J. 977."
1951547,2025-04-17,House,13,"Amendment H-1252 to amendment H-1237, yeas 29, nays 62, filed, lost. H.J. 978."
1951547,2025-04-17,House,14,"Amendment H-1237 adopted. H.J. 979."
1951547,2025-04-17,House,15,"Amendment H-1253, yeas 29, nays 60, filed, lost. H.J. 979."
1951547,2025-04-17,House,16,"Passed House, yeas 60, nays 31. H.J. 980."
1951547,2025-04-24,House,17,"Explanation of vote. H.J. 1070."
1951547,2025-04-17,House,18,"Immediate message. H.J. 985."
1951547,2025-04-21,Senate,19,"Message from House, with amendment S-3111. S.J. 831."
1951547,2025-04-28,Senate,20,"Senate concurred with S-3111. S.J. 907."
1951547,2025-04-28,Senate,21,"Passed Senate, yeas 33, nays 16. S.J. 907."
1951547,2025-04-28,Senate,22,"Immediate message. S.J. 908."
1951547,2025-04-29,House,23,"Message from Senate. H.J. 1075."
1951547,2025-05-19,Senate,24,"Reported correctly enrolled, signed by President and Speaker, and sent to Governor. S.J. 1050."
1951547,2025-06-06,Senate,25,"Signed by Governor. S.J. 1051."
1951567,2025-02-03,House,1,"Introduced, referred to Ways and Means. H.J. 176."
1951584,2025-02-03,Senate,1,"Introduced, placed on calendar. S.J. 174."
1951584,2025-02-03,Senate,2,"Committee report, approving bill. S.J. 179."
1951584,2025-03-10,Senate,3,"Attached to HF 298. S.J. 457."
1951584,2025-03-11,Senate,4,"HF 298 substituted. S.J. 483."
1951584,2025-03-11,Senate,5,"Withdrawn. S.J. 484."
1951612,2025-02-03,House,1,"By COMMITTEE ON STATE GOVERNMENT"
1951612,2025-02-03,House,2,"Introduced, referred to State Government. H.J. 178."
1951612,2025-02-03,House,3,"Subcommittee: Smith, Siegrist and Srinivas. H.J. 179."
1951612,2025-02-03,House,4,"Subcommittee Meeting: 02/05/2025 12:45PM House Lounge."
1951612,2025-02-05,House,5,"Subcommittee recommends passage."
1951612,2025-02-19,House,6,"Committee report, recommending passage. H.J. 369."
1951612,2025-02-19,House,7,"Committee vote: Yeas, 22. Nays, 0. Excused, 1. H.J. 369."
1951612,2025-02-20,House,8,"Committee report approving bill, renumbered as HF 532."
1951631,2025-02-03,House,1,"By COMMITTEE ON STATE GOVERNMENT"
1951631,2025-02-03,House,2,"Introduced, referred to State Government. H.J. 178."
1951631,2025-02-03,House,3,"Subcommittee: Jeneary, Johnson, C. and Srinivas. H.J. 179."
1951631,2025-02-03,House,4,"Subcommittee Meeting: 02/11/2025 8:00AM House Lounge."
1951631,2025-02-11,House,5,"Subcommittee reassigned: Johnson, C., Jeneary and Srinivas. H.J. 291."
1951631,2025-02-11,House,6,"Subcommittee recommends passage."
1951631,2025-02-19,House,7,"Committee report, recommending passage. H.J. 369."
1951631,2025-02-19,House,8,"Committee vote: Yeas, 22. Nays, 0. Excused, 1. H.J. 369."
1951631,2025-02-20,House,9,"Committee report approving bill, renumbered as HF 547."
1951648,2025-02-03,Senate,1,"Introduced, placed on calendar. S.J. 175."
1951648,2025-02-03,Senate,2,"Committee report, approving bill. S.J. 179."
1951648,2025-03-11,Senate,3,"Passed Senate, yeas 47, nays 0. S.J. 484."
1951648,2025-03-11,Senate,4,"Immediate message. S.J. 485."
1951648,2025-03-11,House,5,"Message from Senate. H.J. 607."
1951648,2025-03-12,House,6,"Read first time, referred to Education. H.J. 615."
1951648,2025-03-20,House,7,"Subcommittee: Fett, Gjerde and Stone. H.J. 767."
1951648,2025-03-20,House,8,"Subcommittee Meeting: 03/24/2025 12:30PM RM 304.1."
1951648,2025-03-24,House,9,"Subcommittee recommends passage."
1951648,2025-04-01,House,10,"Committee report, recommending amendment and passage. H.J. 884."
1951648,2025-04-01,House,11,"Committee vote: Yeas, 22. Nays, 1. H.J. 884."
1951648,2025-04-02,House,12,"Placed on calendar. H.J. 884."
1951648,2025-04-02,House,13,"Committee amendment H-1217 filed. H.J. 892."
1951648,2025-04-10,House,14,"Placed on calendar under unfinished business. H.J. 928."
1951648,2025-05-15,House,15,"Rereferred to Education. H.J. 1222."
1951674,2025-02-03,House,1,"Introduced, referred to Natural Resources. H.J. 176."
1951696,2025-02-03,House,1,"By COMMITTEE ON JUDICIARY"
1951696,2025-02-03,House,2,"Introduced, referred to Judiciary. H.J. 178."
1951696,2025-02-03,House,3,"Subcommittee: Holt, Srinivas and Williams. H.J. 179."
1951696,2025-02-11,House,4,"Subcommittee Meeting: 02/11/2025 2:45PM RM 103."
1951696,2025-02-11,House,5,"Subcommittee recommends passage."
1951696,2025-02-18,House,6,"Committee report, recommending passage. H.J. 353."
1951696,2025-02-18,House,7,"Committee vote: Yeas, 19. Nays, 0. Excused, 2. H.J. 353."
1951696,2025-02-19,House,8,"Committee report approving bill, renumbered as HF 472."
1951714,2025-02-03,House,1,"Introduced, referred to Environmental Protection. H.J. 175."
1951714,2025-02-05,House,2,"Subcommittee: Wengryn, Croken and Johnson, C. H.J. 183."
1951714,2025-02-05,House,3,"Subcommittee Meeting: 02/11/2025 12:00PM RM 102."
1951714,2025-02-11,House,4,"Subcommittee recommends passage."
1951714,2025-03-06,House,5,"Committee report, recommending passage. H.J. 546."
1951714,2025-03-06,House,6,"Committee vote: Yeas, 11. Nays, 5. Excused, 1. H.J. 546."
1951714,2025-03-12,House,7,"Committee report approving bill, renumbered as HF 927."
1951737,2025-02-03,House,1,"Introduced, referred to Ways and Means. H.J. 176."
1951756,2025-02-03,House,1,"By COMMITTEE ON JUDICIARY"
1951756,2025-02-03,House,2,"Introduced, referred to Judiciary. H.J. 178."
1951756,2025-02-03,House,3,"Subcommittee: Lohse, Meyer, B. and Stone. H.J. 179."
1951756,2025-02-19,House,4,"Subcommittee Meeting: 02/20/2025 11:00AM House Lounge (Cancelled)."
1951756,2025-02-20,House,5,"Subcommittee Meeting: 02/25/2025 12:30PM RM 304.1."
1951756,2025-02-25,House,6,"Subcommittee recommends passage."
1951810,2025-02-03,House,1,"Introduced, referred to Education. H.J. 176."
1951831,2025-02-03,House,1,"By COMMITTEE ON HEALTH AND HUMAN SERVICES"
1951831,2025-02-03,House,2,"Introduced, referred to Health and Human Services. H.J. 178."
1951831,2025-02-03,House,3,"Subcommittee: Bradley, Gehlbach and Matson. H.J. 179."
1951831,2025-02-05,House,4,"Subcommittee Meeting: 02/11/2025 12:00PM House Lounge."
1951831,2025-02-11,House,5,"Subcommittee recommends passage."
1951831,2025-02-18,House,6,"Committee report, recommending passage. H.J. 353."
1951831,2025-02-18,House,7,"Committee vote: Yeas, 19. Nays, 0. Excused, 2. H.J. 353."
1951831,2025-03-05,House,8,"Committee report approving bill, renumbered as HF 806."
1951853,2025-02-03,House,1,"Introduced, placed on calendar. H.J. 180."
1951853,2025-02-06,House,2,"Resolution adopted. H.J. 252."
1951879,2025-02-03,House,1,"Introduced, referred to Health and Human Services. H.J. 176."
1951879,2025-02-17,House,2,"Subcommittee: Jeneary, Bergan and Matson. H.J. 340."
1951879,2025-02-17,House,3,"Subcommittee Meeting: 02/20/2025 8:30AM Room 19."
1951879,2025-02-20,House,4,"Subcommittee recommends passage."
1951879,2025-02-25,House,5,"Committee report, recommending passage. H.J. 430."
1951879,2025-02-25,House,6,"Committee vote: Yeas, 19. Nays, 0. Excused, 2. H.J. 430."
1951879,2025-02-28,House,7,"Committee report approving bill, renumbered as HF 643."
1951879,2025-03-14,House,8,"Withdrawn. H.J. 660."
1951901,2025-02-03,House,1,"Introduced, placed on calendar. H.J. 180."
1951901,2025-02-06,House,2,"Resolution adopted. H.J. 236."
1951901,2025-02-06,House,3,"Immediate message. H.J. 252."
1951901,2025-02-06,Senate,4,"Message from House. S.J. 206."
1951901,2025-02-06,Senate,5,"Read first time, attached to SCR 1. S.J. 206."
1951901,2025-02-06,Senate,6,"Substituted for SCR 1. S.J. 207."
1951901,2025-02-06,Senate,7,"Resolution adopted. S.J. 207."
1951901,2025-02-06,Senate,8,"Immediate message. S.J. 207."
1951901,2025-02-06,House,9,"Message from Senate. H.J. 252."
1951923,2025-02-03,House,1,"Introduced, referred to Education. H.J. 177."
1951923,2025-02-06,House,2,"Subcommittee: Moore, T., Ehlert and Weldon. H.J. 264."
1951923,2025-02-11,House,3,"Subcommittee Meeting: 02/13/2025 8:30AM House Lounge 2."
1951923,2025-02-13,House,4,"Subcommittee recommends passage."
1951923,2025-02-18,House,5,"Committee report, recommending passage. H.J. 365."
1951923,2025-02-18,House,6,"Committee vote: Yeas, 22. Nays, 0. Excused, 1. H.J. 365."
1951923,2025-02-20,House,7,"Committee report approving bill, renumbered as HF 514."
1951923,2025-03-07,House,8,"Withdrawn. H.J. 569."
1951951,2025-02-03,Senate,1,"Introduced, referred to Natural Resources and Environment. S.J. 175."
1951951,2025-02-04,Senate,2,"Subcommittee: Rozenboom, Bennett, and De Witt. S.J. 194."
1951975,2025-02-03,Senate,1,"Introduced, referred to Education. S.J. 175."
1951975,2025-02-12,Senate,2,"Subcommittee: Campbell, Gruenhagen, and Zimmer. S.J. 255."
1951975,2025-02-11,Senate,3,"Subcommittee Meeting: 02/13/2025 10:00AM Room 217 Conference Room."
1951975,2025-02-13,Senate,4,"Subcommittee recommends passage."
1951995,2025-02-03,Senate,1,"Introduced, referred to Education. S.J. 176."
1951995,2025-02-10,Senate,2,"Subcommittee: Pike, Green, and Quirmbach."
1951995,2025-02-11,Senate,3,"Subcommittee Meeting: 02/13/2025 12:00PM Senate Lounge."
1951995,2025-02-13,Senate,4,"Subcommittee recommends passage."
1952026,2025-02-03,House,1,"Introduced, referred to Public Safety. H.J. 176."
1952026,2025-02-05,House,2,"Subcommittee: Wengryn, Cisneros and Levin. H.J. 183."
1952026,2025-02-05,House,3,"Subcommittee Meeting: 02/12/2025 8:00AM House Lounge."
1952026,2025-02-12,House,4,"Subcommittee recommends passage."
1952026,2025-03-05,House,5,"Committee report, recommending passage. H.J. 531."
1952026,2025-03-05,House,6,"Committee vote: Yeas, 13. Nays, 8. Excused, 2. H.J. 531."
1952026,2025-03-07,House,7,"Committee report approving bill, renumbered as HF 849."
1952046,2025-02-03,House,1,"Introduced, referred to Ways and Means. H.J. 177."
1952066,2025-02-03,House,1,"Introduced, placed on calendar. H.J. 180."
1952066,2025-02-05,House,2,"Amendments H-1005 and H-1006 filed. H.J. 187."
1952066,2025-02-06,House,3,"Amendment H-1006 withdrawn. H.J. 230."
1952066,2025-02-06,House,4,"Amendment H-1005 adopted. H.J. 230."
1952066,2025-02-06,House,5,"Resolution adopted. H.J. 230."
1952089,2025-02-03,House,1,"Introduced, referred to Transportation. H.J. 177."
1952089,2025-02-05,House,2,"Subcommittee: Williams, Madison and Sieck. H.J. 183."
1952089,2025-02-11,House,3,"Subcommittee Meeting: 02/11/2025 3:30PM RM 102."
1952089,2025-02-11,House,4,"Subcommittee recommends amendment and passage."
1952089,2025-02-19,House,5,"Committee report, recommending amendment and passage. H.J. 370."
1952089,2025-02-19,House,6,"Committee vote: Yeas, 18. Nays, 3. H.J. 370."
1952089,2025-02-24,House,7,"Committee report approving bill, renumbered as 574."
1952118,2025-02-03,House,1,"Introduced, referred to Natural Resources. H.J. 177."
1952118,2025-02-11,House,2,"Subcommittee: Golding, Andrews and Turek. H.J. 290."
1952118,2025-02-11,House,3,"Subcommittee Meeting: 02/13/2025 12:00PM House Lounge."
1952118,2025-02-13,House,4,"Subcommittee recommends passage."
1952118,2025-02-25,House,5,"Committee report, recommending passage. H.J. 436."
1952118,2025-02-25,House,6,"Committee vote: Yeas, 13. Nays, 8. H.J. 436."
1952118,2025-02-28,House,7,"Committee report approving bill, renumbered as HF 646."
1952140,2025-02-03,House,1,"Resolution filed, laid over under Rule 25. H.J. 180."
1952140,2025-02-06,House,2,"Resolution adopted. H.J. 202."
1952140,2025-02-06,House,3,"Immediate message. H.J. 252."
1952140,2025-02-10,Senate,4,"Message from House. S.J. 212."
1952140,2025-02-10,Senate,5,"Read first time, referred to Rules and Administration. S.J. 212."
1952140,2025-02-17,Senate,6,"Committee report, recommending passage. S.J. 283."
1952140,2025-02-17,Senate,7,"Placed on calendar."
1952140,2025-02-18,Senate,8,"Resolution adopted. S.J. 291."
1952140,2025-02-18,Senate,9,"Immediate message. S.J. 292."
1952140,2025-02-19,House,10,"Message from Senate. H.J. 355."
1952160,2025-02-03,Senate,1,"Introduced, referred to Education. S.J. 175."
1952160,2025-02-10,Senate,2,"Subcommittee: Campbell, Taylor, and Zimmer. S.J. 218."
1952160,2025-02-11,Senate,3,"Subcommittee Meeting: 02/18/2025 8:30AM Room 217 Conference Room."
1952160,2025-02-18,Senate,4,"Subcommittee recommends passage."
1952186,2025-02-03,House,1,"Introduced, referred to Transportation. H.J. 177."
1952186,2025-02-10,House,2,"Subcommittee: Jeneary, Gosa and Henderson. H.J. 280."
1952186,2025-02-12,House,3,"Subcommittee reassigned: Determann, Gosa and Henderson. H.J. 308."
1952186,2025-02-17,House,4,"Subcommittee Meeting: 02/18/2025 8:00AM RM 304.1."
1952186,2025-02-18,House,5,"Subcommittee recommends passage."
1952186,2025-02-19,House,6,"Committee report, recommending amendment and passage. H.J. 370."
1952186,2025-02-19,House,7,"Committee vote: Yeas, 13. Nays, 7. Excused, 1. H.J. 370."
1952186,2025-03-05,House,8,"Committee report approving bill, renumbered as HF 766."
1952186,2025-03-31,House,9,"Withdrawn. H.J. 871."
1952208,2025-02-03,Senate,1,"Introduced, referred to Judiciary. S.J. 176."
1952208,2025-02-04,Senate,2,"Subcommittee: Taylor, Quirmbach, and Rowley. S.J. 194."
1952208,2025-02-10,Senate,3,"Subcommittee Meeting: 02/13/2025 11:00AM Senate Lounge."
1952208,2025-02-13,Senate,4,"Subcommittee recommends passage."
1952208,2025-03-05,Senate,5,"Committee report approving bill, renumbered as SF 515. S.J. 425."
1952228,2025-02-03,House,1,"By COMMITTEE ON HEALTH AND HUMAN SERVICES"
1952228,2025-02-03,House,2,"Introduced, referred to Health and Human Services. H.J. 178."
1952228,2025-02-03,House,3,"Subcommittee: Bergan, Ingels and Turek. H.J. 179."
1952228,2025-02-06,House,4,"Subcommittee Meeting: 02/10/2025 12:30PM House Lounge."
1952228,2025-02-10,House,5,"Subcommittee recommends passage."
1952228,2025-02-18,House,6,"Committee report, recommending amendment and passage. H.J. 353."
1952228,2025-02-18,House,7,"Committee vote: Yeas, 19. Nays, 0. Excused, 2. H.J. 353."
1952228,2025-02-20,House,8,"Committee report approving bill, renumbered as HF 509."
1952246,2025-02-03,Senate,1,"Introduced, referred to Judiciary. S.J. 175."
1952246,2025-02-04,Senate,2,"Subcommittee: Taylor, Blake, and Green. S.J. 194."
1952246,2025-02-06,Senate,3,"Subcommittee Meeting: 02/11/2025 12:00PM Room 217 Conference Room."
1952246,2025-02-11,Senate,4,"Subcommittee recommends passage."
1952246,2025-03-05,Senate,5,"Committee report, recommending passage. S.J. 424."
1952246,2025-03-04,Senate,6,"Placed on calendar."
1952246,2025-03-26,Senate,7,"Passed Senate, yeas 32, nays 15. S.J. 646."
1952246,2025-03-26,Senate,8,"Immediate message. S.J. 649."
1952246,2025-03-26,House,9,"Message from Senate. H.J. 817."
1952246,2025-03-26,House,10,"Read first time, referred to Judiciary. H.J. 850."
1952246,2025-03-28,House,11,"Subcommittee: Wheeler, Holt and Srinivas. H.J. 873."
1952246,2025-04-01,House,12,"Subcommittee Meeting: 04/02/2025 8:15AM RM 102."
1952246,2025-04-02,House,13,"Subcommittee recommends passage."
1952246,2025-04-02,House,14,"Committee report, recommending passage. H.J. 885."
1952246,2025-04-02,House,15,"Committee vote: Yeas, 14. Nays, 6. Excused, 1. H.J. 885."
1952246,2025-04-02,House,16,"Placed on calendar. H.J. 885."
1952246,2025-04-10,House,17,"Placed on calendar under unfinished business. H.J. 928."
1952246,2025-05-15,House,18,"Rereferred to Judiciary. H.J. 1222."
1952315,2025-02-03,Senate,1,"Introduced, referred to Judiciary. S.J. 177."
1952315,2025-02-04,Senate,2,"Subcommittee: Bousselot, Blake, and Schultz. S.J. 194."
1952376,2025-02-03,Senate,1,"Introduced, referred to Commerce. S.J. 177."
1952376,2025-02-05,Senate,2,"Subcommittee: Driscoll, Trone Garriott, and Warme. S.J. 203."
1952432,2025-02-03,Senate,1,"Introduced, referred to Workforce. S.J. 177."
1952432,2025-02-04,Senate,2,"Subcommittee: Driscoll, Donahue, and Taylor. S.J. 194."
1952493,2025-02-03,Senate,1,"Introduced, referred to Judiciary. S.J. 178."
1952493,2025-02-04,Senate,2,"Subcommittee: Schultz, Blake, and Bousselot. S.J. 195."
1952557,2025-02-03,Senate,1,"Introduced, referred to Natural Resources and Environment. S.J. 176."
1952557,2025-02-04,Senate,2,"Subcommittee: Evans, Pike, and Staed. S.J. 194."
1952611,2025-02-03,Senate,1,"Introduced, referred to Judiciary. S.J. 176."
1952611,2025-02-04,Senate,2,"Subcommittee: Schultz, Blake, and Bousselot. S.J. 194."
1952673,2025-02-03,Senate,1,"Introduced, referred to Judiciary. S.J. 178."
1952673,2025-02-04,Senate,2,"Subcommittee: Schultz, Blake, and Bousselot. S.J. 194."
1952730,2025-02-03,Senate,1,"Introduced, referred to Judiciary. S.J. 177."
1952730,2025-02-04,Senate,2,"Subcommittee: Schultz, Blake, and Bousselot. S.J. 194."
1952791,2025-02-03,Senate,1,"Introduced, referred to Education. S.J. 177."
1952791,2025-02-10,Senate,2,"Subcommittee: Campbell, Kraayenbrink, and Quirmbach."
1952791,2025-02-17,Senate,3,"Subcommittee Meeting: 02/19/2025 1:00PM Senate Lounge."
1952791,2025-02-19,Senate,4,"Subcommittee recommends passage."
1952843,2025-02-03,Senate,1,"Introduced, referred to State Government. S.J. 176."
1952843,2025-02-05,Senate,2,"Subcommittee: Rozenboom, Blake, and Schultz. S.J. 203."
1953330,2025-02-04,Senate,1,"By COMMITTEE ON STATE GOVERNMENT"
1953330,2025-02-04,Senate,2,"Introduced, referred to State Government."
1953330,2025-02-04,Senate,3,"Subcommittee: Koelker, Staed, and Webster."
1953330,2025-02-11,Senate,4,"Subcommittee Meeting: 02/12/2025 10:30AM Lobbyist Lounge."
1953330,2025-02-12,Senate,5,"Subcommittee recommends passage."
1953330,2025-02-19,Senate,6,"Committee report approving bill, renumbered as SF 386."
1953368,2025-02-04,Senate,1,"By COMMITTEE ON STATE GOVERNMENT"
1953368,2025-02-04,Senate,2,"Introduced, referred to State Government."
1953368,2025-02-04,Senate,3,"Subcommittee: Rozenboom, Reichman, and Winckler."
1953368,2025-02-18,Senate,4,"Subcommittee Meeting: 02/20/2025 8:30AM Room 315."
1953368,2025-02-20,Senate,5,"Subcommittee recommends passage."
1953368,2025-03-05,Senate,6,"Committee report approving bill, renumbered as SF 550."
1953407,2025-02-04,Senate,1,"By COMMITTEE ON HEALTH AND HUMAN SERVICES"
1953407,2025-02-04,Senate,2,"Introduced, referred to Health and Human Services."
1953407,2025-02-04,Senate,3,"Subcommittee: Rowley, Trone Garriott, and Warme."
1953407,2025-02-12,Senate,4,"Subcommittee Meeting: 02/18/2025 9:30AM Room 217 Conference Room."
1953407,2025-02-18,Senate,5,"Subcommittee recommends amendment and passage."
1953407,2025-02-19,Senate,6,"Committee report approving bill, renumbered as SF 391."
1953444,2025-02-04,Senate,1,"By COMMITTEE ON HEALTH AND HUMAN SERVICES"
1953444,2025-02-04,Senate,2,"Introduced, referred to Health and Human Services."
1953444,2025-02-04,Senate,3,"Subcommittee: Warme, Alons, and Trone Garriott."
1953444,2025-02-10,Senate,4,"Subcommittee Meeting: 02/11/2025 2:00PM Lobbyist Lounge."
1953444,2025-02-11,Senate,5,"Subcommittee recommends passage."
1953444,2025-02-19,Senate,6,"Committee report approving bill, renumbered as SF 385."
1953481,2025-02-04,Senate,1,"By COMMITTEE ON STATE GOVERNMENT"
1953481,2025-02-04,Senate,2,"Introduced, referred to State Government."
1953481,2025-02-04,Senate,3,"Subcommittee: Koelker, Townsend, and Webster."
1953481,2025-02-17,Senate,4,"Subcommittee Meeting: 02/18/2025 11:30AM Lobbyist Lounge."
1953481,2025-02-18,Senate,5,"Subcommittee recommends passage."
1953481,2025-02-19,Senate,6,"Committee report approving bill, renumbered as SF 388."
1953523,2025-02-04,Senate,1,"By COMMITTEE ON NATURAL RESOURCES AND ENVIRONMENT"
1953523,2025-02-04,Senate,2,"Introduced, referred to Natural Resources and Environment."
1953523,2025-02-04,Senate,3,"Subcommittee: Sweeney, Celsi, and Rozenboom."
1953523,2025-02-04,Senate,4,"Subcommittee Meeting: 02/06/2025 9:30AM Senate Lounge."
1953523,2025-02-06,Senate,5,"Subcommittee recommends passage."
1953523,2025-02-10,Senate,6,"Committee report approving bill, renumbered as SF 253."
1953561,2025-02-04,Senate,1,"By COMMITTEE ON EDUCATION"
1953561,2025-02-04,Senate,2,"Introduced, referred to Education."
1953561,2025-02-05,Senate,3,"Subcommittee: Evans, Gruenhagen, and Quirmbach."
1953561,2025-02-17,Senate,4,"Subcommittee Meeting: 02/18/2025 12:00PM Room 217 Conference Room."
1953561,2025-02-18,Senate,5,"Subcommittee recommends amendment and passage."
1953561,2025-02-25,Senate,6,"Committee report approving bill, renumbered as SF 450."
1953602,2025-02-04,Senate,1,"By COMMITTEE ON STATE GOVERNMENT"
1953602,2025-02-04,Senate,2,"Introduced, referred to State Government."
1953602,2025-02-04,Senate,3,"Subcommittee: Koelker, Townsend, and Webster."
1953602,2025-02-17,Senate,4,"Subcommittee Meeting: 02/18/2025 10:30AM Lobbyist Lounge."
1953602,2025-02-18,Senate,5,"Subcommittee recommends passage."
1953602,2025-02-19,Senate,6,"Committee report approving bill, renumbered as SF 389."
1953646,2025-02-04,Senate,1,"By COMMITTEE ON HEALTH AND HUMAN SERVICES"
1953646,2025-02-04,Senate,2,"Introduced, referred to Health and Human Services."
1953646,2025-02-04,Senate,3,"Subcommittee: Campbell, Pike, and Wahls."
1953646,2025-02-04,Senate,4,"Subcommittee Meeting: 02/06/2025 9:15AM Room 315."
1953646,2025-02-06,Senate,5,"Subcommittee recommends passage."
1953646,2025-02-12,Senate,6,"Committee report approving bill, renumbered as SF 305."
1953690,2025-02-04,Senate,1,"By COMMITTEE ON NATURAL RESOURCES AND ENVIRONMENT"
1953690,2025-02-04,Senate,2,"Introduced, referred to Natural Resources and Environment."
1953690,2025-02-04,Senate,3,"Subcommittee: Sweeney, Trone Garriott, and Zumbach."
1953690,2025-02-04,Senate,4,"Subcommittee Meeting: 02/05/2025 12:00PM Room 315."
1953690,2025-02-05,Senate,5,"Subcommittee recommends passage."
1953690,2025-02-24,Senate,6,"Committee report approving bill, renumbered as SF 422."
1953730,2025-02-04,Senate,1,"Introduced, placed on calendar. S.J. 187."
1953730,2025-02-04,Senate,2,"Committee report, approving bill. S.J. 198."
1953730,2025-02-06,Senate,3,"Referred to Ways and Means. S.J. 205."
1953730,2025-02-11,Senate,4,"Subcommittee: Klimesh, Gruenhagen, and Petersen. S.J. 243."
1953730,2025-03-03,Senate,5,"Subcommittee reassigned: Gruenhagen, Klimesh, and Petersen. S.J. 392."
1953730,2025-03-12,Senate,6,"Subcommittee Meeting: 03/13/2025 1:00PM Room 217 Conference Room."
1953730,2025-03-13,Senate,7,"Subcommittee recommends passage."
1953730,2025-03-19,Senate,8,"Committee report approving bill, renumbered as SF 611. S.J. 590."
1953767,2025-02-04,Senate,1,"By COMMITTEE ON STATE GOVERNMENT"
1953767,2025-02-04,Senate,2,"Introduced, referred to State Government."
1953767,2025-02-04,Senate,3,"Subcommittee: Rozenboom, Celsi, and Schultz."
1953767,2025-02-10,Senate,4,"Subcommittee Meeting: 02/11/2025 10:30AM Room 217 Conference Room."
1953767,2025-02-11,Senate,5,"Subcommittee recommends passage."
1953767,2025-02-12,Senate,6,"Committee report approving bill, renumbered as SF 295."
1953807,2025-02-04,Senate,1,"By COMMITTEE ON STATE GOVERNMENT"
1953807,2025-02-04,Senate,2,"Introduced, referred to State Government."
1953807,2025-02-04,Senate,3,"Subcommittee: Driscoll, Bisignano, and Green."
1953807,2025-02-06,Senate,4,"Subcommittee Meeting: 02/13/2025 11:30AM Room 217 Conference Room."
1953807,2025-02-13,Senate,5,"Subcommittee recommends passage."
1953807,2025-02-19,Senate,6,"Committee report approving bill, renumbered as SF 387."
1953851,2025-02-04,Senate,1,"By COMMITTEE ON STATE GOVERNMENT"
1953851,2025-02-04,Senate,2,"Introduced, referred to State Government."
1953851,2025-02-04,Senate,3,"Subcommittee: Rozenboom, Bousselot, and Staed."
1953851,2025-02-06,Senate,4,"Subcommittee Meeting: 02/11/2025 3:00PM Room 217 Conference Room."
1953851,2025-02-11,Senate,5,"Subcommittee recommends amendment and passage."
1953851,2025-02-12,Senate,6,"Committee report approving bill, renumbered as SF 297."
1953892,2025-02-04,Senate,1,"By COMMITTEE ON NATURAL RESOURCES AND ENVIRONMENT"
1953892,2025-02-04,Senate,2,"Introduced, referred to Natural Resources and Environment."
1953892,2025-02-04,Senate,3,"Subcommittee: Sweeney, Celsi, and Zumbach."
1953892,2025-02-04,Senate,4,"Subcommittee Meeting: 02/05/2025 1:30PM Senate Lounge."
1953892,2025-02-05,Senate,5,"Subcommittee recommends passage."
1953892,2025-02-10,Senate,6,"Committee report approving bill, renumbered as SF 260."
1953932,2025-02-04,Senate,1,"By COMMITTEE ON TRANSPORTATION"
1953932,2025-02-04,Senate,2,"Introduced, referred to Transportation."
1953932,2025-02-04,Senate,3,"Subcommittee: Klimesh, Bisignano, and Koelker."
1953932,2025-02-11,Senate,4,"Subcommittee reassigned: Klimesh, Blake, and Koelker."
1953967,2025-02-04,Senate,1,"By COMMITTEE ON STATE GOVERNMENT"
1953967,2025-02-04,Senate,2,"Introduced, referred to State Government."
1953967,2025-02-04,Senate,3,"Subcommittee: Guth, Alons, and Blake."
1953967,2025-02-04,Senate,4,"Subcommittee Meeting: 02/05/2025 3:30PM Room 217 Conference Room."
1953967,2025-02-06,Senate,5,"Subcommittee recommends passage."
1953967,2025-02-12,Senate,6,"Committee report approving bill, renumbered as SF 307."
1953985,2025-02-04,Senate,1,"Introduced, referred to Ways and Means. S.J. 188."
1953985,2025-02-11,Senate,2,"Subcommittee: Schultz, Bisignano, and Dawson. S.J. 243."
1954026,2025-02-04,Senate,1,"By COMMITTEE ON JUDICIARY"
1954026,2025-02-04,Senate,2,"Introduced, referred to Judiciary."
1954026,2025-02-04,Senate,3,"Subcommittee: Dawson, Petersen, and Shipley."
1954026,2025-02-10,Senate,4,"Subcommittee Meeting: 02/12/2025 12:30PM Room 217 Conference Room."
1954026,2025-02-12,Senate,5,"Subcommittee recommends passage."
1954026,2025-02-19,Senate,6,"Committee report approving bill, renumbered as SF 392."
1954072,2025-02-04,Senate,1,"Introduced, referred to Education. S.J. 189."
1954072,2025-02-10,Senate,2,"Subcommittee: Pike, Quirmbach, and Salmon."
1954072,2025-02-12,Senate,3,"Subcommittee Meeting: 02/13/2025 11:30AM Senate Lounge."
1954072,2025-02-13,Senate,4,"Subcommittee recommends passage."
1954117,2025-02-04,Senate,1,"By COMMITTEE ON JUDICIARY"
1954117,2025-02-04,Senate,2,"Introduced, referred to Judiciary."
1954117,2025-02-04,Senate,3,"Subcommittee: Dawson, Petersen, and Shipley."
1954117,2025-02-17,Senate,4,"Subcommittee Meeting: 02/19/2025 11:30AM Senate Lounge."
1954117,2025-02-19,Senate,5,"Subcommittee recommends amendment and passage."
1954117,2025-03-06,Senate,6,"Committee report approving bill, renumbered as SF 583."
1954165,2025-02-04,Senate,1,"By COMMITTEE ON LOCAL GOVERNMENT"
1954165,2025-02-04,Senate,2,"Introduced, referred to Local Government."
1954165,2025-02-04,Senate,3,"Subcommittee: Webster, Lofgren, and Weiner."
1954165,2025-02-11,Senate,4,"Subcommittee Meeting: 02/12/2025 1:30PM Senate Lounge."
1954165,2025-02-12,Senate,5,"Subcommittee recommends amendment and passage."
1954165,2025-02-12,Senate,6,"Committee report approving bill, renumbered as []."
1954212,2025-02-04,Senate,1,"Introduced, referred to Workforce. S.J. 187."
1954212,2025-02-05,Senate,2,"Subcommittee: Driscoll, Donahue, and Sires. S.J. 203."
1954260,2025-02-04,Senate,1,"Introduced, placed on calendar. S.J. 189."
1954260,2025-02-04,Senate,2,"Committee report, approving bill. S.J. 197."
1954260,2025-06-16,Senate,3,"Referred to Education. S.J. 1057."
1954308,2025-02-04,Senate,1,"Introduced, referred to Judiciary. S.J. 187."
1954308,2025-02-04,Senate,2,"Subcommittee: Schultz, Blake, and Bousselot. S.J. 195."
1954356,2025-02-04,Senate,1,"Introduced, referred to Natural Resources and Environment. S.J. 188."
1954356,2025-02-05,Senate,2,"Subcommittee: Evans, De Witt, and Trone Garriott. S.J. 203."
1954404,2025-02-04,Senate,1,"Introduced, placed on calendar. S.J. 189."
1954404,2025-02-04,Senate,2,"Committee report, approving bill. S.J. 197."
1954404,2025-02-06,Senate,3,"Referred to Ways and Means. S.J. 205."
1954404,2025-02-11,Senate,4,"Subcommittee: Dawson, Bisignano, and Rowley. S.J. 243."
1954452,2025-02-04,Senate,1,"Introduced, referred to Education. S.J. 187."
1954452,2025-02-10,Senate,2,"Subcommittee: Rozenboom, Donahue, and Kraayenbrink."
1954495,2025-02-04,Senate,1,"Introduced, referred to Commerce. S.J. 188."
1954495,2025-02-05,Senate,2,"Subcommittee: Sweeney, Koelker, and Petersen. S.J. 203."
1954495,2025-02-10,Senate,3,"Subcommittee Meeting: 02/11/2025 1:30PM Senate Lounge."
1954495,2025-02-11,Senate,4,"Subcommittee recommends passage."
1954551,2025-02-04,Senate,1,"Introduced, referred to Health and Human Services. S.J. 188."
1954551,2025-02-11,Senate,2,"Subcommittee: Klimesh, Costello, and Petersen. S.J. 243."
1954599,2025-02-04,Senate,1,"Introduced, referred to Education. S.J. 188."
1954599,2025-02-10,Senate,2,"Subcommittee: Rozenboom, Donahue, and Kraayenbrink."
1954647,2025-02-04,Senate,1,"Introduced, referred to State Government. S.J. 188."
1954647,2025-02-05,Senate,2,"Subcommittee: Alons, Celsi, and Guth. S.J. 203."
1954647,2025-02-06,Senate,3,"Subcommittee Meeting: 02/10/2025 3:30PM Room 217 Conference Room."
1954647,2025-02-10,Senate,4,"Subcommittee recommends passage."
1954647,2025-03-06,Senate,5,"Committee report approving bill, renumbered as SF 563. S.J. 442."
1954697,2025-02-04,Senate,1,"By COMMITTEE ON JUDICIARY"
1954697,2025-02-04,Senate,2,"Introduced, referred to Judiciary."
1954697,2025-02-04,Senate,3,"Subcommittee: Dawson, Petersen, and Shipley."
1954697,2025-02-10,Senate,4,"Subcommittee Meeting: 02/12/2025 12:00PM Room 217 Conference Room."
1954697,2025-02-12,Senate,5,"Subcommittee recommends passage."
1954697,2025-02-19,Senate,6,"Committee report approving bill, renumbered as SF 395."
1954744,2025-02-04,Senate,1,"By COMMITTEE ON NATURAL RESOURCES AND ENVIRONMENT"
1954744,2025-02-04,Senate,2,"Introduced, referred to Natural Resources and Environment."
1954744,2025-02-04,Senate,3,"Subcommittee: Westrich, Staed, and Sweeney."
1954744,2025-02-06,Senate,4,"Subcommittee Meeting: 02/10/2025 3:00PM Room 217 Conference Room."
1954744,2025-02-10,Senate,5,"Subcommittee recommends passage."
1954744,2025-02-17,Senate,6,"Committee report approving bill, renumbered as SF 338."
1954793,2025-02-04,Senate,1,"By COMMITTEE ON LOCAL GOVERNMENT"
1954793,2025-02-04,Senate,2,"Introduced, referred to Local Government."
1954793,2025-02-04,Senate,3,"Subcommittee: Westrich, Quirmbach, and Webster."
1954793,2025-02-25,Senate,4,"Subcommittee Meeting: 02/26/2025 9:30AM Room 217 Conference Room."
1954793,2025-03-03,Senate,5,"Subcommittee recommends passage."
1954793,2025-03-03,Senate,6,"Committee report approving bill, renumbered as SF 496."
1954839,2025-02-04,Senate,1,"By COMMITTEE ON JUDICIARY"
1954839,2025-02-04,Senate,2,"Introduced, referred to Judiciary."
1954839,2025-02-04,Senate,3,"Subcommittee: Dawson, Petersen, and Shipley."
1954839,2025-02-17,Senate,4,"Subcommittee Meeting: 02/18/2025 3:30PM Senate Lounge."
1954839,2025-02-18,Senate,5,"Subcommittee recommends passage."
1954839,2025-02-26,Senate,6,"Committee report approving bill, renumbered as SF 461."
1954888,2025-02-04,Senate,1,"Introduced, referred to Ways and Means. S.J. 188."
1954888,2025-02-11,Senate,2,"Subcommittee: Schultz, Driscoll, and Townsend. S.J. 243."
1954934,2025-02-04,Senate,1,"By COMMITTEE ON NATURAL RESOURCES AND ENVIRONMENT"
1954934,2025-02-04,Senate,2,"Introduced, referred to Natural Resources and Environment."
1954934,2025-02-24,Senate,3,"Subcommittee: Sweeney, Bennett, and Shipley."
1954980,2025-02-04,Senate,1,"By COMMITTEE ON EDUCATION"
1954980,2025-02-04,Senate,2,"Introduced, referred to Education."
1954980,2025-02-05,Senate,3,"Subcommittee: Evans, Pike, and Quirmbach."
1954980,2025-02-18,Senate,4,"Subcommittee Meeting: 02/19/2025 3:30PM Room 217 Conference Room."
1954980,2025-02-20,Senate,5,"Subcommittee recommends passage."
1954980,2025-02-25,Senate,6,"Committee report approving bill, renumbered as SF 442."
1955039,2025-02-04,Senate,1,"Introduced, referred to Transportation. S.J. 190."
1955039,2025-02-10,Senate,2,"Subcommittee: Klimesh, Townsend, and Zumbach. S.J. 218."
1955123,2025-02-04,Senate,1,"Introduced, referred to Commerce. S.J. 189."
1955123,2025-02-05,Senate,2,"Subcommittee: Schultz, Rowley, and Trone Garriott. S.J. 203."
1955214,2025-02-04,Senate,1,"Introduced, referred to Technology. S.J. 189."
1955214,2025-02-06,Senate,2,"Subcommittee: Alons, Bennett, and Campbell. S.J. 210."
1955214,2025-02-06,Senate,3,"Subcommittee Meeting: 02/10/2025 12:30PM Room 217 Conference Room."
1955214,2025-02-10,Senate,4,"Subcommittee recommends passage."
1955214,2025-02-26,Senate,5,"Committee report approving bill, renumbered as SF 443. S.J. 371."
1955306,2025-02-04,Senate,1,"Introduced, referred to Judiciary. S.J. 189."
1955306,2025-02-06,Senate,2,"Subcommittee: Schultz, Blake, and Bousselot. S.J. 210."
1955306,2025-02-25,Senate,3,"Subcommittee reassigned: Reichman, Blake, and Lofgren. S.J. 356."
1955306,2025-02-26,Senate,4,"Subcommittee Meeting: 03/04/2025 9:30AM Senate Lounge."
1955306,2025-03-04,Senate,5,"Subcommittee recommends passage."
1955398,2025-02-04,Senate,1,"Introduced, referred to State Government. S.J. 189."
1955398,2025-02-05,Senate,2,"Subcommittee: Rozenboom, Schultz, and Townsend. S.J. 203."
1955490,2025-02-04,Senate,1,"Introduced, placed on calendar. S.J. 190."
1955490,2025-02-04,Senate,2,"Committee report, approving bill. S.J. 198."
1955490,2025-03-11,Senate,3,"Fiscal note."
1955490,2025-03-19,Senate,4,"Attached to HF 190. S.J. 570."
1955490,2025-04-03,Senate,5,"Placed on calendar under unfinished business. S.J. 688."
1955490,2025-04-15,Senate,6,"Amendment S-3102 filed, adopted. S.J. 784."
1955490,2025-04-15,Senate,7,"HF 190 substituted. S.J. 784."
1955490,2025-04-15,Senate,8,"Withdrawn. S.J. 785."
1956104,2025-02-05,House,1,"By COMMITTEE ON PUBLIC SAFETY"
1956104,2025-02-05,House,2,"Introduced, referred to Public Safety. H.J. 182."
1956104,2025-02-05,House,3,"Subcommittee: Vondran, Gosa and Holt. H.J. 184."
1956104,2025-02-10,House,4,"Subcommittee Meeting: 02/12/2025 8:00AM House Lounge 2."
1956104,2025-02-12,House,5,"Subcommittee recommends passage."
1956104,2025-02-19,House,6,"Committee report, recommending passage. H.J. 368."
1956104,2025-02-19,House,7,"Committee vote: Yeas, 15. Nays, 5. Excused, 3. H.J. 368."
1956104,2025-02-20,House,8,"Committee report approving bill, renumbered as HF 546."
1956167,2025-02-05,Senate,1,"Introduced, placed on calendar. S.J. 201."
1956167,2025-02-05,Senate,2,"Committee report, approving bill. S.J. 204."
1956167,2025-03-17,Senate,3,"Attached to HF 776. S.J. 541."
1956167,2025-04-03,Senate,4,"Placed on calendar under unfinished business. S.J. 688."
1956167,2025-04-16,Senate,5,"HF 776 substituted. S.J. 811."
1956167,2025-04-16,Senate,6,"Withdrawn. S.J. 812."
1956240,2025-02-05,House,1,"Introduced, referred to Ways and Means. H.J. 181."
1956240,2025-02-20,House,2,"Subcommittee: Vondran, Scheetz and Wulf. H.J. 406."
1956240,2025-02-20,House,3,"Subcommittee Meeting: 02/24/2025 12:00PM House Lounge 2."
1956240,2025-02-24,House,4,"Subcommittee recommends passage."
1956306,2025-02-05,Senate,1,"Introduced, placed on calendar. S.J. 201."
1956306,2025-02-05,Senate,2,"Committee report, approving bill. S.J. 204."
1956306,2025-02-18,Senate,3,"Passed Senate, yeas 46, nays 0. S.J. 290."
1956306,2025-02-18,Senate,4,"Immediate message. S.J. 292."
1956306,2025-02-19,House,5,"Message from Senate. H.J. 356."
1956306,2025-02-20,House,6,"Read first time, passed on file. H.J. 378."
1956306,2025-03-12,House,7,"Substituted for HF 399. H.J. 626."
1956306,2025-03-12,House,8,"Passed House, yeas 96, nays 0. H.J. 626."
1956306,2025-03-19,House,9,"Explanation of vote. H.J. 751."
1956306,2025-03-12,House,10,"Immediate message. H.J. 635."
1956306,2025-03-13,Senate,11,"Message from House. S.J. 509."
1956306,2025-05-19,Senate,12,"Reported correctly enrolled, signed by President and Speaker, and sent to Governor. S.J. 1050."
1956306,2025-05-19,Senate,13,"Signed by Governor. S.J. 1051."
1956372,2025-02-05,House,1,"Introduced, referred to Health and Human Services. H.J. 181."
1956443,2025-02-05,House,1,"By COMMITTEE ON COMMERCE"
1956443,2025-02-05,House,2,"Introduced, referred to Commerce. H.J. 182."
1956443,2025-02-05,House,3,"Subcommittee: Lundgren, Judge and Young. H.J. 184."
1956443,2025-02-11,House,4,"Subcommittee Meeting: 02/17/2025 12:00PM RM 103."
1956443,2025-02-17,House,5,"Subcommittee recommends passage."
1956443,2025-02-18,House,6,"Committee report, recommending amendment and passage. H.J. 352."
1956443,2025-02-18,House,7,"Committee vote: Yeas, 16. Nays, 6. Excused, 1. H.J. 352."
1956443,2025-03-07,House,8,"Committee report approving bill, renumbered as HF 834."
1956514,2025-02-05,House,1,"By COMMITTEE ON COMMERCE"
1956514,2025-02-05,House,2,"Introduced, referred to Commerce. H.J. 182."
1956514,2025-02-05,House,3,"Subcommittee: Nordman, Bossman and Scheetz. H.J. 184."
1956514,2025-02-06,House,4,"Subcommittee Meeting: 02/11/2025 12:30PM House Lounge."
1956514,2025-02-11,House,5,"Subcommittee recommends passage."
1956514,2025-02-18,House,6,"Committee report, recommending passage. H.J. 352."
1956514,2025-02-18,House,7,"Committee vote: Yeas, 22. Nays, 0. Excused, 1. H.J. 352."
1956514,2025-02-20,House,8,"Committee report approving bill, renumbered as HF 512."
1956594,2025-02-05,Senate,1,"Introduced, referred to Appropriations. S.J. 201."
1956594,2025-02-11,Senate,2,"Subcommittee: Costello, Blake, and Zumbach. S.J. 243."
1956657,2025-02-05,House,1,"By COMMITTEE ON ECONOMIC GROWTH AND TECHNOLOGY"
1956657,2025-02-05,House,2,"Introduced, referred to Economic Growth and Technology. H.J. 182."
1956657,2025-02-05,House,3,"Subcommittee: Barker, Kniff McCulla and Scholten. H.J. 184."
1956657,2025-02-10,House,4,"Subcommittee Meeting: 02/12/2025 12:45PM RM 304."
1956657,2025-02-12,House,5,"Subcommittee recommends passage."
1956726,2025-02-05,House,1,"By COMMITTEE ON ECONOMIC GROWTH AND TECHNOLOGY"
1956726,2025-02-05,House,2,"Introduced, referred to Economic Growth and Technology. H.J. 182."
1956726,2025-02-05,House,3,"Subcommittee: Sorensen, Ehlert and Sitzmann. H.J. 184."
1956726,2025-02-06,House,4,"Subcommittee Meeting: 02/11/2025 12:30PM RM 19."
1956726,2025-02-11,House,5,"Subcommittee recommends passage."
1956797,2025-02-05,Senate,1,"Introduced, referred to Health and Human Services. S.J. 202."
1956797,2025-02-11,Senate,2,"Subcommittee: Klimesh, Costello, and Trone Garriott. S.J. 243."
1956864,2025-02-05,House,1,"By COMMITTEE ON AGRICULTURE"
1956864,2025-02-05,House,2,"Introduced, referred to Agriculture. H.J. 183."
1956864,2025-02-05,House,3,"Subcommittee: Sexton, Behn and Cooling. H.J. 184."
1956864,2025-02-06,House,4,"Subcommittee Meeting: 02/11/2025 12:00PM RM 304."
1956864,2025-02-11,House,5,"Subcommittee recommends passage."
1956864,2025-03-03,House,6,"Committee report, recommending passage. H.J. 504."
1956864,2025-03-03,House,7,"Committee vote: Yeas, 22. Nays, 0. Excused, 1. H.J. 504."
1956864,2025-03-05,House,8,"Committee report approving bill, renumbered as HF 800."
1956934,2025-02-05,House,1,"By COMMITTEE ON ECONOMIC GROWTH AND TECHNOLOGY"
1956934,2025-02-05,House,2,"Introduced, referred to Economic Growth and Technology. H.J. 183."
1956934,2025-02-05,House,3,"Subcommittee: Sorensen, Wichtendahl and Wood. H.J. 184."
1956934,2025-02-06,House,4,"Subcommittee Meeting: 02/12/2025 12:30PM House Lounge 2."
1956934,2025-02-12,House,5,"Subcommittee recommends passage."
1957001,2025-02-05,House,1,"By COMMITTEE ON ECONOMIC GROWTH AND TECHNOLOGY"
1957001,2025-02-05,House,2,"Introduced, referred to Economic Growth and Technology. H.J. 182."
1957001,2025-02-05,House,3,"Subcommittee: Sexton, Madison and Weldon. H.J. 184."
1957071,2025-02-05,Senate,1,"By COMMITTEE ON COMMERCE"
1957071,2025-02-05,Senate,2,"Introduced, referred to Commerce."
1957071,2025-02-05,Senate,3,"Subcommittee: Rowley, De Witt, and Knox."
1957071,2025-02-10,Senate,4,"Subcommittee Meeting: 02/13/2025 9:30AM Room 217 Conference Room."
1957071,2025-02-13,Senate,5,"Subcommittee recommends amendment and passage."
1957071,2025-02-20,Senate,6,"Committee report approving bill, renumbered as SF 398."
1957140,2025-02-05,Senate,1,"Introduced, referred to Commerce. S.J. 201."
1957140,2025-02-05,Senate,2,"Subcommittee: Driscoll, Trone Garriott, and Webster. S.J. 203."
1957210,2025-02-05,House,1,"By COMMITTEE ON ECONOMIC GROWTH AND TECHNOLOGY"
1957210,2025-02-05,House,2,"Introduced, referred to Economic Growth and Technology. H.J. 182."
1957210,2025-02-05,House,3,"Subcommittee: Sorensen, Baeth and Moore, T. H.J. 184."
1957210,2025-02-06,House,4,"Subcommittee Meeting: 02/12/2025 12:00PM RM 19."
1957210,2025-02-12,House,5,"Subcommittee recommends passage."
1957210,2025-02-19,House,6,"Committee report, recommending passage. H.J. 364."
1957210,2025-02-19,House,7,"Committee vote: Yeas, 21. Nays, 0. H.J. 364."
1957210,2025-02-20,House,8,"Committee report approving bill, renumbered as HF 533."
1957277,2025-02-05,House,1,"By COMMITTEE ON AGRICULTURE"
1957277,2025-02-05,House,2,"Introduced, referred to Agriculture. H.J. 183."
1957277,2025-02-05,House,3,"Subcommittee: Mommsen, Scholten and Sexton. H.J. 184."
1957277,2025-02-06,House,4,"Subcommittee Meeting: 02/11/2025 8:00AM RM 304."
1957277,2025-02-11,House,5,"Subcommittee recommends amendment and passage."
1957277,2025-02-18,House,6,"Committee report, recommending amendment and passage. H.J. 351."
1957277,2025-02-18,House,7,"Committee vote: Yeas, 21. Nays, 1. Excused, 1. H.J. 351."
1957277,2025-02-20,House,8,"Committee report approving bill, renumbered as HF 508."
1957348,2025-02-05,Senate,1,"By COMMITTEE ON LOCAL GOVERNMENT"
1957348,2025-02-05,Senate,2,"Introduced, referred to Local Government."
1957348,2025-02-05,Senate,3,"Subcommittee: Westrich, Sires, and Weiner."
1957348,2025-02-11,Senate,4,"Subcommittee Meeting: 02/12/2025 2:00PM Room 217 Conference Room."
1957348,2025-02-12,Senate,5,"Subcommittee recommends passage."
1957348,2025-02-12,Senate,6,"Committee report approving bill, renumbered as []."
1957416,2025-02-05,Senate,1,"Introduced, referred to Education. S.J. 201."
1957416,2025-02-11,Senate,2,"Subcommittee: Rozenboom, Kraayenbrink, and Trone Garriott."
1957496,2025-02-05,Senate,1,"Introduced, referred to Ways and Means. S.J. 202."
1957496,2025-02-11,Senate,2,"Subcommittee: Klimesh, Bisignano, and Dawson. S.J. 243."
1957496,2025-03-24,Senate,3,"Subcommittee Meeting: 03/25/2025 11:00AM Room 315."
1957496,2025-03-25,Senate,4,"Subcommittee recommends amendment and passage."
1957496,2025-04-09,Senate,5,"Fiscal note."
1957496,2025-04-21,Senate,6,"Committee report approving bill, renumbered as SF 633. S.J. 844."
1957765,2025-02-05,Senate,1,"Introduced, referred to Education. S.J. 202."
1957765,2025-02-11,Senate,2,"Subcommittee: Salmon, Campbell, and Zimmer."
1957765,2025-02-17,Senate,3,"Subcommittee Meeting: 02/20/2025 10:00AM Room 315."
1957765,2025-02-20,Senate,4,"Subcommittee recommends amendment and passage."
1957765,2025-03-05,Senate,5,"Committee report approving bill, renumbered as SF 517. S.J. 423."
1958040,2025-02-05,Senate,1,"Introduced, referred to Judiciary. S.J. 202."
1958040,2025-02-06,Senate,2,"Subcommittee: Taylor, Blake, and Green. S.J. 210."
1958040,2025-02-11,Senate,3,"Subcommittee Meeting: 02/11/2025 4:00PM Room 315."
1958040,2025-02-12,Senate,4,"Subcommittee recommends passage."
1958040,2025-02-26,Senate,5,"Committee report, recommending passage. S.J. 370."
1958040,2025-02-26,Senate,6,"Placed on calendar."
1958040,2025-03-17,Senate,7,"Amendment S-3024 filed. S.J. 552."
1958040,2025-03-27,Senate,8,"Attached to HF 571. S.J. 657."
1958040,2025-04-03,Senate,9,"Placed on calendar under unfinished business. S.J. 688."
1958040,2025-06-16,Senate,10,"Referred to Judiciary. S.J. 1057."
1958641,2025-02-06,House,1,"Introduced, referred to Judiciary. H.J. 253."
1958641,2025-02-11,House,2,"Subcommittee: Lawler, Gustoff and Wilburn. H.J. 290."
1958641,2025-02-17,House,3,"Subcommittee reassigned: Lawler, Nordman and Wilburn. H.J. 340."
1958641,2025-02-17,House,4,"Subcommittee Meeting: 02/25/2025 12:30PM RM 102."
1958641,2025-02-25,House,5,"Tabled until future meeting."
1958649,2025-02-06,House,1,"Introduced, referred to State Government. H.J. 252."
1958649,2025-02-10,House,2,"Subcommittee: Lundgren, Jones and Zabner. H.J. 280."
1958649,2025-02-11,House,3,"Subcommittee Meeting: 02/18/2025 8:00AM House Lounge."
1958649,2025-02-18,House,4,"Subcommittee recommends passage."
1958649,2025-02-26,House,5,"Committee report, recommending passage. H.J. 445."
1958649,2025-02-26,House,6,"Committee vote: Yeas, 13. Nays, 10. H.J. 445."
1958649,2025-02-28,House,7,"Committee report approving bill, renumbered as HJR 11."
1958656,2025-02-06,House,1,"Introduced, referred to Judiciary. H.J. 258."
1958664,2025-02-06,House,1,"Introduced, referred to Ways and Means. H.J. 259."
1958664,2025-02-20,House,2,"Subcommittee: Vondran, James and Jones. H.J. 406."
1958664,2025-02-24,House,3,"Subcommittee Meeting: 02/25/2025 8:00AM House Lounge."
1958664,2025-02-25,House,4,"Subcommittee recommends passage."
1958664,2025-04-09,House,5,"Committee report, recommending passage. H.J. 922."
1958664,2025-04-09,House,6,"Committee vote: Yeas, 24. Nays, 0. Excused, 1. H.J. 922."
1958664,2025-04-10,House,7,"Committee report approving bill, renumbered as HF 1004."
1958673,2025-02-06,House,1,"Introduced, referred to Judiciary. H.J. 255."
1958673,2025-02-13,House,2,"Subcommittee: Gustoff, Dunwell and Wilburn. H.J. 331."
1958673,2025-02-17,House,3,"Subcommittee reassigned: Holt, Wilburn and Williams. H.J. 340."
1958673,2025-02-19,House,4,"Subcommittee Meeting: 02/24/2025 12:00PM RM 103 (Cancelled)."
1958683,2025-02-06,House,1,"Introduced, referred to Education. H.J. 255."
1958692,2025-02-06,House,1,"Introduced, referred to Education. H.J. 255."
1958692,2025-02-11,House,2,"Subcommittee: Shipley, Gjerde and Hayes. H.J. 290."
1958692,2025-02-26,House,3,"Subcommittee Meeting: 02/27/2025 8:30AM House Lounge 2."
1958692,2025-02-27,House,4,"Subcommittee recommends passage."
1958700,2025-02-06,House,1,"By COMMITTEE ON TRANSPORTATION"
1958700,2025-02-06,House,2,"Introduced, referred to Transportation. H.J. 263."
1958700,2025-02-06,House,3,"Subcommittee: Behn, Scholten and Siegrist. H.J. 265."
1958700,2025-02-06,House,4,"Subcommittee Meeting: 02/11/2025 12:30PM House Lounge 2."
1958700,2025-02-11,House,5,"Subcommittee recommends passage."
1958700,2025-02-19,House,6,"Committee report, recommending amendment and passage. H.J. 371."
1958700,2025-02-19,House,7,"Committee vote: Yeas, 21. Nays, 0. H.J. 371."
1958700,2025-02-20,House,8,"Committee report approving bill, renumbered as HF 548."
1958712,2025-02-06,House,1,"Introduced, referred to Health and Human Services. H.J. 260."
1958722,2025-02-06,House,1,"Introduced, referred to Education. H.J. 254."
1958722,2025-02-11,House,2,"Subcommittee: Wheeler, Ehlert and Moore, T. H.J. 290."
1958722,2025-02-12,House,3,"Subcommittee Meeting: 02/13/2025 12:30PM House Lounge."
1958722,2025-02-13,House,4,"Subcommittee recommends passage."
1958722,2025-02-18,House,5,"Committee report, recommending passage. H.J. 365."
1958722,2025-02-18,House,6,"Committee vote: Yeas, 22. Nays, 0. Excused, 1. H.J. 365."
1958722,2025-02-20,House,7,"Committee report approving bill, renumbered as HF 513."
1958722,2025-03-14,House,8,"Withdrawn. H.J. 660."
1958727,2025-02-06,House,1,"Introduced, referred to Education. H.J. 255."
1958741,2025-02-06,House,1,"Introduced, referred to Education. H.J. 259."
1958747,2025-02-06,House,1,"Introduced, placed on calendar. H.J. 260."
1958747,2025-03-04,House,2,"Passed House, yeas 94, nays 1. H.J. 492."
1958747,2025-03-10,House,3,"Explanation of vote. H.J. 590."
1958747,2025-03-04,House,4,"Immediate message. H.J. 498."
1958747,2025-03-05,Senate,5,"Message from House. S.J. 414."
1958747,2025-03-05,Senate,6,"Read first time, attached to SF 388. S.J. 414."
1958747,2025-04-03,Senate,7,"Placed on calendar under unfinished business. S.J. 689."
1958747,2025-06-16,Senate,8,"Referred to State Government. S.J. 1057."
1958756,2025-02-06,House,1,"Introduced, referred to Ways and Means. H.J. 257."
1958766,2025-02-06,House,1,"Introduced, referred to Local Government. H.J. 256."
1958766,2025-02-06,House,2,"Subcommittee: Kniff McCulla, Golding and McBurney. H.J. 264."
1958766,2025-02-11,House,3,"Subcommittee Meeting: 02/13/2025 8:30AM House Lounge."
1958766,2025-02-13,House,4,"Subcommittee recommends passage."
1958766,2025-02-25,House,5,"Committee report, recommending passage. H.J. 434."
1958766,2025-02-25,House,6,"Committee vote: Yeas, 20. Nays, 0. Excused, 1. H.J. 434."
1958766,2025-02-28,House,7,"Committee report approving bill, renumbered as HF 645."
1958766,2025-03-31,House,8,"Withdrawn. H.J. 871."
1958777,2025-02-06,House,1,"Introduced, referred to Health and Human Services. H.J. 255."
1958787,2025-02-06,House,1,"By COMMITTEE ON TRANSPORTATION"
1958787,2025-02-06,House,2,"Introduced, referred to Transportation. H.J. 262."
1958787,2025-02-06,House,3,"Subcommittee: Siegrist, Behn and Wilson. H.J. 265."
1958787,2025-02-11,House,4,"Subcommittee Meeting: 02/13/2025 8:00AM House Lounge."
1958787,2025-02-13,House,5,"Subcommittee recommends passage."
1958787,2025-02-19,House,6,"Committee report, recommending passage. H.J. 371."
1958787,2025-02-19,House,7,"Committee vote: Yeas, 21. Nays, 0. H.J. 371."
1958787,2025-02-20,House,8,"Committee report approving bill, renumbered as HF 529."
1958795,2025-02-06,House,1,"Introduced, referred to Education. H.J. 259."
1958795,2025-02-11,House,2,"Subcommittee: Ingels, Kurth and Weldon. H.J. 291."
1958795,2025-02-17,House,3,"Subcommittee Meeting: 02/20/2025 8:00AM RM 19."
1958795,2025-02-20,House,4,"Subcommittee recommends passage."
1958805,2025-02-06,House,1,"Introduced, referred to Education. H.J. 260."
1958805,2025-02-11,House,2,"Subcommittee: Ingels, Kurth and Weldon. H.J. 291."
1958805,2025-02-17,House,3,"Subcommittee Meeting: 02/20/2025 8:15AM RM 19."
1958805,2025-02-20,House,4,"Subcommittee recommends passage."
1958817,2025-02-06,House,1,"Introduced, placed on calendar. H.J. 261."
1958817,2025-02-18,House,2,"Amendment H-1014 filed. H.J. 354."
1958817,2025-02-20,House,3,"Amendment H-1014 adopted. H.J. 397."
1958817,2025-02-20,House,4,"Passed House, yeas 92, nays 0. H.J. 397."
1958817,2025-02-20,House,5,"Immediate message. H.J. 401."
1958817,2025-02-24,Senate,6,"Message from House. S.J. 336."
1958817,2025-02-24,Senate,7,"Read first time, attached to SF 306. S.J. 336."
1958817,2025-02-25,Senate,8,"Substituted for SF 306. S.J. 348."
1958817,2025-02-25,Senate,9,"Passed Senate, yeas 41, nays 0. S.J. 348."
1958817,2025-02-25,Senate,10,"Immediate message. S.J. 349."
1958817,2025-02-26,House,11,"Message from Senate. H.J. 437."
1958817,2025-03-28,House,12,"Reported correctly enrolled, signed by Speaker and President, and sent to Governor. H.J. 872."
1958817,2025-03-28,House,13,"Signed by Governor. H.J. 872."
1958826,2025-02-06,House,1,"Introduced, referred to Health and Human Services. H.J. 254."
1958838,2025-02-06,House,1,"Introduced, placed on calendar. H.J. 259."
1958838,2025-02-20,House,2,"Passed House, yeas 92, nays 0. H.J. 387."
1958838,2025-02-20,House,3,"Immediate message. H.J. 401."
1958838,2025-02-24,Senate,4,"Message from House. S.J. 336."
1958838,2025-02-24,Senate,5,"Read first time, passed on file. S.J. 336."
1958838,2025-03-06,Senate,6,"Referred to State Government. S.J. 442."
1958838,2025-03-11,Senate,7,"Subcommittee: Westrich, Bisignano, and Campbell. S.J. 493."
1958838,2025-03-11,Senate,8,"Subcommittee Meeting: 03/12/2025 3:30PM Room 217 Conference Room."
1958838,2025-03-12,Senate,9,"Subcommittee Meeting: 03/12/2025 11:15AM Room 217 Conference Room."
1958838,2025-03-12,Senate,10,"Subcommittee recommends passage."
1958838,2025-04-02,Senate,11,"Committee report, recommending passage. S.J. 680."
1958838,2025-04-02,Senate,12,"Placed on calendar."
1958838,2025-04-09,Senate,13,"Passed Senate, yeas 47, nays 0. S.J. 748."
1958838,2025-04-09,Senate,14,"Immediate message. S.J. 748."
1958838,2025-04-10,House,15,"Message from Senate. H.J. 925."
1958838,2025-05-19,House,16,"Reported correctly enrolled, signed by Speaker and President, and sent to Governor. H.J. 1224."
1958838,2025-05-19,House,17,"Signed by Governor. H.J. 1225."
1958850,2025-02-06,House,1,"Introduced, referred to Judiciary. H.J. 260."
1958850,2025-02-11,House,2,"Subcommittee: Lohse, Meyer, B. and Stone. H.J. 291."
1958850,2025-02-13,House,3,"Subcommittee Meeting: 02/17/2025 12:00PM RM 304.1."
1958850,2025-02-17,House,4,"Subcommittee recommends passage."
1958859,2025-02-06,House,1,"Introduced, referred to Commerce. H.J. 254."
1958867,2025-02-06,House,1,"By COMMITTEE ON TRANSPORTATION"
1958867,2025-02-06,House,2,"Introduced, referred to Transportation. H.J. 263."
1958867,2025-02-06,House,3,"Subcommittee: Bossman, Mommsen and Wilson. H.J. 265."
1958867,2025-02-06,House,4,"Subcommittee Meeting: 02/11/2025 12:00PM House Lounge 2."
1958867,2025-02-11,House,5,"Subcommittee recommends passage."
1958867,2025-02-19,House,6,"Committee report, recommending passage. H.J. 371."
1958867,2025-02-19,House,7,"Committee vote: Yeas, 21. Nays, 0. H.J. 371."
1958867,2025-02-20,House,8,"Committee report approving bill, renumbered as HF 527."
1958875,2025-02-06,House,1,"Introduced, referred to Education. H.J. 257."
1958875,2025-02-11,House,2,"Subcommittee: Moore, T., Henderson and Matson. H.J. 290."
1958875,2025-02-12,House,3,"Subcommittee Meeting: 02/17/2025 12:30PM House Lounge."
1958875,2025-02-17,House,4,"Subcommittee recommends passage."
1958875,2025-02-18,House,5,"Committee report, recommending amendment and passage. H.J. 365."
1958875,2025-02-18,House,6,"Committee vote: Yeas, 20. Nays, 2. Excused, 1. H.J. 365."
1958875,2025-02-20,House,7,"Committee report approving bill, renumbered as HF 520."
1958887,2025-02-06,House,1,"Introduced, referred to Education. H.J. 253."
1958896,2025-02-06,House,1,"Introduced, placed on calendar. H.J. 261."
1958896,2025-03-04,House,2,"SF 162 substituted. H.J. 494."
1958896,2025-03-04,House,3,"Withdrawn. H.J. 498."
1958905,2025-02-06,House,1,"Introduced, referred to Judiciary. H.J. 257."
1958905,2025-02-11,House,2,"Subcommittee: Fett, Lawler and Meyer, B. H.J. 290."
1958905,2025-02-17,House,3,"Subcommittee Meeting: 02/19/2025 3:30PM House Lounge."
1958905,2025-02-19,House,4,"Subcommittee recommends passage."
1958905,2025-03-06,House,5,"Committee report, recommending passage. H.J. 548."
1958905,2025-03-06,House,6,"Committee vote: Yeas, 20. Nays, 1. H.J. 548."
1958905,2025-03-12,House,7,"Committee report approving bill, renumbered as HF 923."
1958915,2025-02-06,House,1,"Introduced, referred to State Government. H.J. 256."
1958922,2025-02-06,House,1,"Introduced, referred to Judiciary. H.J. 257."
1958922,2025-02-11,House,2,"Subcommittee: Thomson, C., Fett and James. H.J. 290."
1958922,2025-02-11,House,3,"Subcommittee Meeting: 02/13/2025 8:30AM RM 304."
1958922,2025-02-13,House,4,"Subcommittee recommends passage."
1958922,2025-02-20,House,5,"Committee report, recommending passage. H.J. 410."
1958922,2025-02-20,House,6,"Committee vote: Yeas, 17. Nays, 0. Excused, 4. H.J. 410."
1958922,2025-02-24,House,7,"Committee report approving bill, renumbered as HF 578."
1958922,2025-03-14,House,8,"Withdrawn. H.J. 660."
1958939,2025-02-06,House,1,"Introduced, referred to State Government. H.J. 258."
1958947,2025-02-06,Senate,1,"By COMMITTEE ON LOCAL GOVERNMENT"
1958947,2025-02-06,Senate,2,"Introduced, referred to Local Government."
1958947,2025-02-06,Senate,3,"Subcommittee: Westrich, Driscoll, and Wahls."
1958947,2025-02-17,Senate,4,"Subcommittee Meeting: 02/18/2025 1:45PM Room 315."
1958947,2025-02-18,Senate,5,"Subcommittee recommends amendment and passage."
1958947,2025-03-03,Senate,6,"Committee report approving bill, renumbered as SF 497."
1958956,2025-02-06,House,1,"Introduced, referred to Health and Human Services. H.J. 260."
1958964,2025-02-06,House,1,"Introduced, referred to Transportation. H.J. 260."
1958974,2025-02-06,House,1,"Introduced, referred to Transportation. H.J. 256."
1958974,2025-02-18,House,2,"Subcommittee: Young, Golding and Gosa. H.J. 349."
1958974,2025-02-24,House,3,"Subcommittee Meeting: 02/25/2025 12:15PM House Lounge."
1958974,2025-02-25,House,4,"Subcommittee recommends passage."
1958984,2025-02-06,House,1,"Introduced, referred to Judiciary. H.J. 256."
1958984,2025-02-11,House,2,"Subcommittee: Lohse, Wessel-Kroeschell and Wheeler. H.J. 290."
1958984,2025-02-25,House,3,"Subcommittee Meeting: 02/26/2025 4:00PM House Lounge 2."
1958984,2025-02-26,House,4,"Subcommittee recommends passage."
1958992,2025-02-06,House,1,"Introduced, referred to Judiciary. H.J. 258."
1958992,2025-02-11,House,2,"Subcommittee: Holt, Fett and Meyer, B. H.J. 290."
1958992,2025-02-18,House,3,"Subcommittee Meeting: 02/20/2025 7:45AM RM 19."
1958992,2025-02-20,House,4,"Subcommittee recommends passage."
1958992,2025-02-25,House,5,"Committee report, recommending passage. H.J. 433."
1958992,2025-02-25,House,6,"Committee vote: Yeas, 21. Nays, 0. H.J. 433."
1958992,2025-03-05,House,7,"Committee report approving bill, renumbered as HF 790."
1958998,2025-02-06,House,1,"Introduced, referred to Education. H.J. 254."
1958998,2025-02-11,House,2,"Sponsor added, Croken. H.J. 286."
1959007,2025-02-06,House,1,"Introduced, referred to Judiciary. H.J. 258."
1959007,2025-02-11,House,2,"Subcommittee: Nordman, Wilburn and Wills, J. H.J. 291."
1959007,2025-02-17,House,3,"Subcommittee Meeting: 02/19/2025 2:30PM RM 102."
1959007,2025-02-19,House,4,"Subcommittee recommends passage."
1959007,2025-02-24,House,5,"Committee report, recommending passage. H.J. 420."
1959007,2025-02-24,House,6,"Committee vote: Yeas, 21. Nays, 0. H.J. 420."
1959007,2025-02-26,House,7,"Committee report approving bill, renumbered as HF 615."
1959007,2025-03-14,House,8,"Withdrawn. H.J. 660."
1959019,2025-02-06,House,1,"Introduced, referred to Veterans Affairs. H.J. 256."
1959019,2025-02-11,House,2,"Subcommittee: Andrews, Ingels and Wichtendahl. H.J. 290."
1959019,2025-02-25,House,3,"Subcommittee Meeting: 02/26/2025 11:00AM House Lounge 2."
1959019,2025-02-26,House,4,"Subcommittee recommends passage."
1959019,2025-03-05,House,5,"Committee report, recommending passage. H.J. 537."
1959019,2025-03-05,House,6,"Committee vote: Yeas, 15. Nays, 0. Excused, 2. H.J. 537."
1959019,2025-03-07,House,7,"Committee report approving bill, renumbered as HF 837."
1959031,2025-02-06,House,1,"Introduced, placed on calendar. H.J. 259."
1959031,2025-02-20,House,2,"Passed House, yeas 92, nays 0. H.J. 388."
1959031,2025-02-20,House,3,"Immediate message. H.J. 401."
1959031,2025-02-24,Senate,4,"Message from House. S.J. 336."
1959031,2025-02-24,Senate,5,"Read first time, attached to SF 276. S.J. 336."
1959031,2025-02-25,Senate,6,"Substituted for SF 276. S.J. 347."
1959031,2025-02-25,Senate,7,"Passed Senate, yeas 41, nays 0. S.J. 347."
1959031,2025-02-25,Senate,8,"Immediate message. S.J. 349."
1959031,2025-02-26,House,9,"Message from Senate. H.J. 437."
1959031,2025-03-28,House,10,"Reported correctly enrolled, signed by Speaker and President, and sent to Governor. H.J. 872."
1959031,2025-03-28,House,11,"Signed by Governor. H.J. 872."
1959040,2025-02-06,House,1,"Introduced, referred to State Government. H.J. 258."
1959040,2025-02-24,House,2,"Subcommittee: Collins, Bossman and Cooling. H.J. 419."
1959040,2025-02-25,House,3,"Subcommittee Meeting: 02/26/2025 12:00PM House Lounge 2."
1959040,2025-02-26,House,4,"Subcommittee recommends passage."
1959048,2025-02-06,House,1,"Introduced, referred to Commerce. H.J. 253."
1959062,2025-02-06,House,1,"Introduced, referred to Ways and Means. H.J. 253."
1959062,2025-04-16,House,2,"Committee report, recommending passage. H.J. 990."
1959062,2025-04-16,House,3,"Committee vote: Yeas, 24. Nays, 0. Excused, 1. H.J. 990."
1959062,2025-04-17,House,4,"Committee report approving bill, renumbered as HF 1027."
1959062,2025-04-28,House,5,"Withdrawn. H.J. 1073."
1959070,2025-02-06,House,1,"Introduced, referred to Appropriations. H.J. 253."
1959070,2025-03-24,House,2,"Subcommittee: Lohse, Bagniewski and Lawler. H.J. 789."
1959070,2025-03-24,House,3,"Subcommittee Meeting: 03/25/2025 12:30PM RM 103."
1959070,2025-03-25,House,4,"Subcommittee recommends passage."
1959070,2025-04-09,House,5,"Committee report, recommending passage. H.J. 921."
1959070,2025-04-09,House,6,"Committee vote: Yeas, 25. Nays, 0. H.J. 921."
1959070,2025-04-10,House,7,"Committee report approving bill, renumbered as HF 1001."
1959070,2025-04-28,House,8,"Withdrawn. H.J. 1073."
1959080,2025-02-06,House,1,"Introduced, referred to Health and Human Services. H.J. 254."
1959091,2025-02-06,House,1,"Introduced, referred to Public Safety. H.J. 256."
1959091,2025-02-10,House,2,"Subcommittee: Meggers, Dieken and Gjerde. H.J. 280."
1959091,2025-02-10,House,3,"Subcommittee Meeting: 02/11/2025 12:15PM House Lounge 2."
1959091,2025-02-11,House,4,"Subcommittee recommends passage."
1959091,2025-02-19,House,5,"Committee report, recommending amendment and passage. H.J. 368."
1959091,2025-02-19,House,6,"Committee vote: Yeas, 20. Nays, 0. Excused, 3. H.J. 368."
1959091,2025-02-20,House,7,"Committee report approving bill, renumbered as HF 528."
1959101,2025-02-06,House,1,"By COMMITTEE ON TRANSPORTATION"
1959101,2025-02-06,House,2,"Introduced, referred to Transportation. H.J. 262."
1959101,2025-02-06,House,3,"Subcommittee: Determann, Cooling and Henderson. H.J. 265."
1959101,2025-02-10,House,4,"Subcommittee Meeting: 02/11/2025 12:30PM RM 304.1."
1959101,2025-02-11,House,5,"Subcommittee recommends passage."
1959101,2025-02-19,House,6,"Committee report, recommending passage. H.J. 370."
1959101,2025-02-19,House,7,"Committee vote: Yeas, 14. Nays, 7. H.J. 370."
1959101,2025-03-05,House,8,"Committee report approving bill, renumbered as HF 758."
1959110,2025-02-06,House,1,"Introduced, referred to Judiciary. H.J. 256."
1959110,2025-02-11,House,2,"Subcommittee: Thompson, M., Wessel-Kroeschell and Williams. H.J. 290."
1959110,2025-02-18,House,3,"Subcommittee Meeting: 02/19/2025 12:30PM RM 304.1."
1959110,2025-02-19,House,4,"Subcommittee recommends passage."
1959117,2025-02-06,House,1,"Introduced, referred to Health and Human Services. H.J. 254."
1959131,2025-02-06,House,1,"Introduced, referred to Health and Human Services. H.J. 255."
1959139,2025-02-06,Senate,1,"Introduced, placed on calendar. S.J. 208."
1959139,2025-02-06,Senate,2,"Committee report, approving bill. S.J. 210."
1959139,2025-02-10,Senate,3,"Referred to Appropriations. S.J. 211."
1959139,2025-02-11,Senate,4,"Subcommittee: Lofgren, Dotzler, and Sires. S.J. 243."
1959139,2025-03-05,Senate,5,"Subcommittee Meeting: 03/06/2025 8:30AM Senate Lounge."
1959139,2025-03-06,Senate,6,"Subcommittee recommends amendment and passage."
1959139,2025-03-11,Senate,7,"Committee report approving bill, renumbered as SF 603. S.J. 493."
1959148,2025-02-06,House,1,"Introduced, placed on calendar. H.J. 253."
1959148,2025-02-20,House,2,"Fiscal note."
1959148,2025-03-19,House,3,"Amendments H-1138 and H-1139 filed. H.J. 752."
1959148,2025-03-25,House,4,"Amendment H-1169 filed. H.J. 814."
1959148,2025-04-03,House,5,"Referred to Education. H.J. 895."
1959161,2025-02-06,House,1,"Introduced, referred to Judiciary. H.J. 257."
1959161,2025-02-11,House,2,"Subcommittee: Holt, Lawler and Meyer, B. H.J. 290."
1959161,2025-02-18,House,3,"Subcommittee Meeting: 02/20/2025 7:30AM RM 19."
1959161,2025-02-20,House,4,"Subcommittee recommends passage."
1959161,2025-02-25,House,5,"Committee report, recommending passage. H.J. 433."
1959161,2025-02-25,House,6,"Committee vote: Yeas, 20. Nays, 1. H.J. 433."
1959161,2025-02-28,House,7,"Committee report approving bill, renumbered as HF 639."
1959161,2025-03-31,House,8,"Withdrawn. H.J. 871."
1959169,2025-02-06,House,1,"By COMMITTEE ON EDUCATION"
1959169,2025-02-06,House,2,"Introduced, referred to Education. H.J. 263."
1959169,2025-02-06,House,3,"Subcommittee: Gehlbach, Henderson and Kurth. H.J. 265."
1959169,2025-02-13,House,4,"Subcommittee Meeting: 02/19/2025 12:30PM RM 304."
1959169,2025-02-19,House,5,"Subcommittee recommends passage."
1959169,2025-02-27,House,6,"Committee report, recommending amendment and passage. H.J. 466."
1959169,2025-02-27,House,7,"Committee vote: Yeas, 21. Nays, 2. H.J. 466."
1959169,2025-03-05,House,8,"Committee report approving bill, renumbered as HF 784."
1959177,2025-02-06,House,1,"Introduced, referred to Judiciary. H.J. 258."
1959177,2025-02-11,House,2,"Subcommittee: Thomson, C., Lawler and Meyer, B. H.J. 291."
1959177,2025-02-11,House,3,"Subcommittee Meeting: 02/13/2025 8:00AM RM 304."
1959177,2025-02-13,House,4,"Subcommittee recommends passage."
1959177,2025-02-25,House,5,"Committee report, recommending passage. H.J. 433."
1959177,2025-02-25,House,6,"Committee vote: Yeas, 19. Nays, 2. H.J. 433."
1959177,2025-03-05,House,7,"Committee report approving bill, renumbered as HF 763."
1959185,2025-02-06,House,1,"Introduced, referred to Judiciary. H.J. 257."
1959185,2025-02-11,House,2,"Subcommittee: Thomson, C., Meyer, B. and Thompson, M. H.J. 290."
1959185,2025-02-11,House,3,"Subcommittee Meeting: 02/13/2025 8:15AM RM 304."
1959185,2025-02-13,House,4,"Subcommittee recommends passage."
1959185,2025-02-25,House,5,"Committee report, recommending passage. H.J. 432."
1959185,2025-02-25,House,6,"Committee vote: Yeas, 20. Nays, 1. H.J. 432."
1959185,2025-03-05,House,7,"Committee report approving bill, renumbered as HF 780."
1959197,2025-02-06,House,1,"Introduced, placed on calendar. H.J. 259."
1959197,2025-03-10,House,2,"Passed House, yeas 87, nays 0. H.J. 575."
1959197,2025-03-18,House,3,"Explanation of vote. H.J. 718."
1959197,2025-03-10,House,4,"Immediate message. H.J. 590."
1959197,2025-03-10,Senate,5,"Message from House. S.J. 457."
1959197,2025-03-10,Senate,6,"Read first time, referred to Workforce. S.J. 457."
1959197,2025-03-14,Senate,7,"Subcommittee: Alons, Donahue, and Lofgren. S.J. 552."
1959197,2025-03-18,Senate,8,"Subcommittee Meeting: 03/19/2025 8:30AM Senate Lounge."
1959197,2025-03-19,Senate,9,"Subcommittee recommends passage."
1959197,2025-04-02,Senate,10,"Committee report, recommending passage. S.J. 682."
1959197,2025-04-02,Senate,11,"Placed on calendar."
1959197,2025-04-10,Senate,12,"Placed on calendar under unfinished business. S.J. 757."
1959197,2025-04-21,Senate,13,"Passed Senate, yeas 45, nays 0. S.J. 840."
1959197,2025-04-21,Senate,14,"Immediate message. S.J. 842."
1959197,2025-04-21,House,15,"Message from Senate. H.J. 995."
1959197,2025-05-19,House,16,"Reported correctly enrolled, signed by Speaker and President, and sent to Governor. H.J. 1224."
1959197,2025-05-19,House,17,"Signed by Governor. H.J. 1225."
1959205,2025-02-06,House,1,"Introduced, referred to Health and Human Services. H.J. 255."
1959211,2025-02-06,House,1,"Introduced, referred to Transportation. H.J. 260."
1959211,2025-02-10,House,2,"Subcommittee: Sieck, Kressig and Wood. H.J. 280."
1959211,2025-02-18,House,3,"Subcommittee Meeting: 02/19/2025 3:00PM House Lounge."
1959211,2025-02-19,House,4,"Subcommittee recommends passage."
1959211,2025-03-06,House,5,"Rereferred to Appropriations. H.J. 542."
1959211,2025-03-24,House,6,"Subcommittee: Bossman, Amos Jr. and Mommsen. H.J. 790."
1959211,2025-03-24,House,7,"Subcommittee Meeting: 03/26/2025 8:30AM RM 304."
1959211,2025-03-26,House,8,"Subcommittee recommends passage."
1959211,2025-04-16,House,9,"Committee report, recommending passage. H.J. 948."
1959211,2025-04-16,House,10,"Committee vote: Yeas 23. Nays, 1. Excused, 1. H.J. 948."
1959211,2025-04-17,House,11,"Committee report approving bill, renumbered as HF 1015."
1959211,2025-04-28,House,12,"Withdrawn. H.J. 1073."
1959286,2025-02-06,House,1,"Introduced, placed on calendar. H.J. 262."
1959286,2025-02-24,House,2,"Amendment H-1021 filed. H.J. 421."
1959286,2025-04-03,House,3,"Referred to Higher Education. H.J. 895."
1959342,2025-02-06,House,1,"Introduced, referred to Ways and Means. H.J. 262."
1959342,2025-02-20,House,2,"Subcommittee: Young, Behn and Wichtendahl. H.J. 406."
1959342,2025-02-24,House,3,"Subcommittee Meeting: 02/25/2025 12:45PM House Lounge 2."
1959342,2025-02-25,House,4,"Subcommittee recommends passage."
1959342,2025-03-19,House,5,"Sponsors added, Behn, Bloomingdale, Boden, Johnson, C., Jones, Lundgren, Meggers, Nordman, Sexton, and Vondran. H.J. 750."
1959342,2025-03-25,House,6,"Sponsor added, Holt. H.J. 811."
1959342,2025-04-16,House,7,"Committee report, recommending amendment and passage. H.J. 990."
1959342,2025-04-16,House,8,"Committee vote: Yeas, 24. Nays, 0. Excused, 1. H.J. 990."
1959342,2025-04-17,House,9,"Committee report approving bill, renumbered as HF 1030."
1959397,2025-02-06,Senate,1,"Introduced, referred to Commerce. S.J. 209."
1959397,2025-02-12,Senate,2,"Subcommittee: Bousselot, Blake, and Webster. S.J. 255."
1959456,2025-02-06,Senate,1,"Introduced, referred to Commerce. S.J. 208."
1959456,2025-02-12,Senate,2,"Subcommittee: Bousselot, Blake, and Webster. S.J. 255."
1959511,2025-02-06,House,1,"Introduced, referred to State Government. H.J. 261."
1959565,2025-02-06,House,1,"Introduced, referred to Public Safety. H.J. 261."
1959565,2025-02-10,House,2,"Subcommittee: Wengryn, Gosa and Rinker. H.J. 280."
1959565,2025-02-17,House,3,"Subcommittee Meeting: 02/19/2025 12:15PM House Lounge."
1959565,2025-02-19,House,4,"Subcommittee recommends passage."
1959565,2025-02-26,House,5,"Committee report, recommending passage. H.J. 444."
1959565,2025-02-26,House,6,"Committee vote: Yeas, 22. Nays, 0. Excused, 1. H.J. 444."
1959565,2025-03-05,House,7,"Committee report approving bill, renumbered as HF 793."
1959565,2025-03-21,House,8,"Withdrawn. H.J. 772."
1959626,2025-02-06,House,1,"Introduced, referred to Education. H.J. 261."
1959626,2025-02-11,House,2,"Subcommittee: Stone, Ehlert and Gehlbach. H.J. 291."
1959626,2025-02-13,House,3,"Subcommittee reassigned: Gehlbach, Ehlert and Stone. H.J. 331."
1959626,2025-02-13,House,4,"Subcommittee Meeting: 02/18/2025 12:30PM House Lounge."
1959626,2025-02-18,House,5,"Subcommittee recommends passage."
1959684,2025-02-06,Senate,1,"Introduced, referred to Commerce. S.J. 209."
1959684,2025-02-12,Senate,2,"Subcommittee: Webster, Blake, and Klimesh. S.J. 255."
1959739,2025-02-06,House,1,"Introduced, referred to State Government. H.J. 262."
1959793,2025-02-06,House,1,"Introduced, placed on calendar. H.J. 262."
1959793,2025-03-13,House,2,"Amendment H-1082 filed. H.J. 659."
1959793,2025-03-17,House,3,"Amendment H-1111 filed. H.J. 677."
1959793,2025-03-18,House,4,"Amendment H-1082 adopted. H.J. 700."
1959793,2025-03-18,House,5,"Amendment H-1114 to amendment H-1111 filed, adopted. H.J. 700."
1959793,2025-03-18,House,6,"Amendment H-1111, yeas 33, nays 64, lost, as amended. H.J. 701."
1959793,2025-03-18,House,7,"Passed House, yeas 63, nays 34. H.J. 702."
1959793,2025-03-18,House,8,"Immediate message. H.J. 717."
1959793,2025-03-19,Senate,9,"Message from House. S.J. 570."
1959793,2025-03-19,Senate,10,"Read first time, referred to Education. S.J. 570."
1959793,2025-03-26,Senate,11,"Subcommittee: Gruenhagen, Pike, and Quirmbach. S.J. 653."
1959793,2025-03-27,Senate,12,"Subcommittee Meeting: 03/31/2025 12:30PM Senate Lounge."
1959793,2025-03-31,Senate,13,"Subcommittee recommends passage."
1959848,2025-02-06,Senate,1,"Introduced, referred to Veterans Affairs. S.J. 209."
1959848,2025-02-12,Senate,2,"Subcommittee: Reichman, Dotzler, and Pike. S.J. 255."
1959905,2025-02-06,House,1,"Resolution filed, laid over under Rule 25. H.J. 271."
1959905,2025-02-11,House,2,"Resolution adopted. H.J. 286."
1959966,2025-02-06,House,1,"Introduced, referred to Higher Education. H.J. 261."
1960020,2025-02-06,Senate,1,"Introduced, referred to Transportation. S.J. 209."
1960020,2025-02-10,Senate,2,"Subcommittee: Klimesh, Townsend, and Zumbach. S.J. 218."
1960075,2025-02-06,House,1,"By COMMITTEE ON APPROPRIATIONS"
1960075,2025-02-06,House,2,"Introduced, referred to Appropriations. H.J. 263."
1960075,2025-02-06,House,3,"Subcommittee: Gehlbach, Nielsen and Stone. H.J. 265."
1960075,2025-02-06,House,4,"Subcommittee Meeting: 02/10/2025 1:00PM RM 103."
1960075,2025-02-10,House,5,"Subcommittee recommends passage."
1960075,2025-02-10,House,6,"Committee report, recommending passage. H.J. 280."
1960075,2025-02-10,House,7,"Committee vote: Yeas, 15. Nays, 9. H.J. 280."
1960075,2025-02-10,House,8,"Committee report approving bill, renumbered as HF 319."
1960134,2025-02-06,Senate,1,"Introduced, referred to Appropriations. S.J. 208."
1960134,2025-02-11,Senate,2,"Subcommittee: Zumbach, Kraayenbrink, and Staed. S.J. 243."
1960189,2025-02-06,House,1,"Introduced, referred to Education. H.J. 261."
1960244,2025-02-06,Senate,1,"Introduced, referred to Commerce. S.J. 209."
1960244,2025-02-12,Senate,2,"Subcommittee: Bousselot, Blake, and Webster. S.J. 255."
1960295,2025-02-06,Senate,1,"Introduced, referred to Commerce. S.J. 209."
1960295,2025-02-12,Senate,2,"Subcommittee: Bousselot, Blake, and Webster. S.J. 255."
1960472,2025-02-06,House,1,"By COMMITTEE ON JUDICIARY"
1960472,2025-02-06,House,2,"Introduced, referred to Judiciary. H.J. 263."
1960472,2025-02-06,House,3,"Subcommittee: Gustoff, Holt and James. H.J. 265."
1960472,2025-02-11,House,4,"Subcommittee Meeting: 02/12/2025 3:00PM RM 102."
1960472,2025-02-12,House,5,"Subcommittee recommends passage."
1960472,2025-02-20,House,6,"Committee report, recommending passage. H.J. 410."
1960472,2025-02-20,House,7,"Committee vote: Yeas, 13. Nays, 4. Excused, 4. H.J. 410."
1960472,2025-02-24,House,8,"Committee report approving bill, renumbered as HF 571."
1960641,2025-02-06,House,1,"By COMMITTEE ON JUDICIARY"
1960641,2025-02-06,House,2,"Introduced, referred to Judiciary. H.J. 263."
1960641,2025-02-06,House,3,"Subcommittee: Dunwell, Fett and Olson. H.J. 265."
1960641,2025-02-11,House,4,"Subcommittee Meeting: 02/12/2025 12:00PM RM 304.1."
1960641,2025-02-12,House,5,"Subcommittee recommends passage."
1960641,2025-02-20,House,6,"Committee report, recommending passage. H.J. 411."
1960641,2025-02-20,House,7,"Committee vote: Yeas, 17. Nays, 0. Excused, 4. H.J. 411."
1960641,2025-02-24,House,8,"Committee report approving bill, renumbered as HF 570."
1960807,2025-02-06,House,1,"By COMMITTEE ON JUDICIARY"
1960807,2025-02-06,House,2,"Introduced, referred to Judiciary. H.J. 263."
1960807,2025-02-06,House,3,"Subcommittee: Stone, Lohse and Wessel-Kroeschell. H.J. 265."
1960807,2025-02-10,House,4,"Subcommittee Meeting: 02/13/2025 8:15AM House Lounge 2."
1960807,2025-02-13,House,5,"Subcommittee recommends passage."
1960807,2025-03-06,House,6,"Committee report, recommending passage. H.J. 550."
1960807,2025-03-06,House,7,"Committee vote: Yeas, 21. Nays, 0. H.J. 550."
1960972,2025-02-06,House,1,"By COMMITTEE ON EDUCATION"
1960972,2025-02-06,House,2,"Introduced, referred to Education. H.J. 264."
1960972,2025-02-06,House,3,"Subcommittee: Shipley, Gjerde and Hora. H.J. 265."
1963383,2025-02-10,Senate,1,"Introduced, placed on calendar. S.J. 214."
1963383,2025-02-10,Senate,2,"Committee report, approving bill. S.J. 218."
1963383,2025-02-24,Senate,3,"Attached to HF 303. S.J. 336."
1963383,2025-03-04,Senate,4,"Amendment S-3014 filed. S.J. 412."
1963383,2025-04-03,Senate,5,"Placed on calendar under unfinished business. S.J. 688."
1963383,2025-04-16,Senate,6,"Amendment S-3014 adopted. S.J. 812."
1963383,2025-04-16,Senate,7,"HF 303 substituted. S.J. 812."
1963383,2025-04-16,Senate,8,"Withdrawn. S.J. 814."
1963434,2025-02-10,Senate,1,"Introduced, placed on calendar. S.J. 214."
1963434,2025-02-10,Senate,2,"Committee report, approving bill. S.J. 219."
1963434,2025-03-18,Senate,3,"Passed Senate, yeas 48, nays 0. S.J. 559."
1963434,2025-03-18,Senate,4,"Immediate message. S.J. 559."
1963434,2025-03-18,House,5,"Message from Senate. H.J. 680."
1963434,2025-03-18,House,6,"Read first time, passed on file. H.J. 681."
1963434,2025-03-18,House,7,"Placed on calendar under unfinished business. H.J. 682."
1963434,2025-03-19,House,8,"Amendment H-1132 filed. H.J. 752."
1963434,2025-03-20,House,9,"Substituted for HF 802. H.J. 758."
1963434,2025-03-20,House,10,"Amendment H-1132 adopted. H.J. 758."
1963434,2025-03-20,House,11,"Passed House, yeas 89, nays 0. H.J. 759."
1963434,2025-03-25,House,12,"Explanation of vote. H.J. 811."
1963434,2025-03-25,House,13,"Explanations of votes. H.J. 812."
1963434,2025-03-20,House,14,"Immediate message. H.J. 767."
1963434,2025-03-24,Senate,15,"Message from House, with amendment S-3038. S.J. 605."
1963434,2025-04-22,Senate,16,"Senate concurred with S-3038. S.J. 849."
1963434,2025-04-22,Senate,17,"Passed Senate, yeas 46, nays 0. S.J. 849."
1963434,2025-04-22,Senate,18,"Immediate message. S.J. 852."
1963434,2025-04-22,House,19,"Message from Senate. H.J. 1015."
1963434,2025-05-19,Senate,20,"Reported correctly enrolled, signed by President and Speaker, and sent to Governor. S.J. 1050."
1963434,2025-05-19,Senate,21,"Signed by Governor. S.J. 1051."
1963490,2025-02-10,Senate,1,"Introduced, placed on calendar. S.J. 214."
1963490,2025-02-10,Senate,2,"Committee report, approving bill. S.J. 218."
1963490,2025-02-11,Senate,3,"Referred to Appropriations. S.J. 231."
1963490,2025-02-11,Senate,4,"Subcommittee: Warme, Donahue, and Zumbach. S.J. 244."
1963566,2025-02-10,Senate,1,"Introduced, referred to Commerce. S.J. 216."
1963566,2025-02-12,Senate,2,"Subcommittee: Sweeney, Koelker, and Trone Garriott. S.J. 255."
1963566,2025-02-13,Senate,3,"Subcommittee Meeting: 02/17/2025 3:00PM Senate Lounge."
1963566,2025-02-17,Senate,4,"Subcommittee recommends passage."
1963573,2025-02-10,House,1,"Introduced, referred to Labor and Workforce. H.J. 274."
1963581,2025-02-10,House,1,"Introduced, referred to Health and Human Services. H.J. 273."
1963581,2025-02-11,House,2,"Subcommittee: Lundgren, Matson and Wood. H.J. 291."
1963581,2025-02-12,House,3,"Subcommittee Meeting: 02/18/2025 8:30AM House Lounge."
1963581,2025-02-18,House,4,"Subcommittee recommends passage."
1963581,2025-02-18,House,5,"Committee report, recommending passage. H.J. 352."
1963581,2025-02-18,House,6,"Committee vote: Yeas, 19. Nays, 0. Excused, 2. H.J. 352."
1963581,2025-03-07,House,7,"Committee report approving bill, renumbered as HF 887."
1963581,2025-03-31,House,8,"Withdrawn. H.J. 871."
1963587,2025-02-10,House,1,"Introduced, referred to State Government. H.J. 275."
1963596,2025-02-10,House,1,"Introduced, placed on calendar. H.J. 276."
1963596,2025-04-03,House,2,"Referred to Commerce. H.J. 895."
1963606,2025-02-10,House,1,"Introduced, placed on calendar. H.J. 277."
1963606,2025-03-10,House,2,"Amendment H-1053 filed. H.J. 591."
1963606,2025-04-03,House,3,"Referred to Commerce. H.J. 895."
1963615,2025-02-10,House,1,"Introduced, referred to Education. H.J. 273."
1963621,2025-02-10,House,1,"Introduced, referred to State Government. H.J. 275."
1963633,2025-02-10,House,1,"Introduced, placed on calendar. H.J. 277."
1963633,2025-03-10,House,2,"SF 42 substituted. H.J. 583."
1963633,2025-03-10,House,3,"Withdrawn. H.J. 590."
1963643,2025-02-10,House,1,"Introduced, referred to Local Government. H.J. 274."
1963643,2025-02-13,House,2,"Rereferred to Education. H.J. 330."
1963643,2025-02-20,House,3,"Subcommittee: Hayes, Kniff McCulla and Matson. H.J. 406."
1963643,2025-02-23,House,4,"Subcommittee Meeting: 02/24/2025 12:30PM RM 19."
1963643,2025-02-24,House,5,"Subcommittee recommends passage."
1963643,2025-03-04,House,6,"Committee report, recommending amendment and passage. H.J. 527."
1963643,2025-03-04,House,7,"Committee vote: Yeas, 14. Nays, 9. H.J. 527."
1963643,2025-03-07,House,8,"Committee report approving bill, renumbered as HF 880."
1963648,2025-02-10,House,1,"Introduced, referred to Education. H.J. 272."
1963662,2025-02-10,Senate,1,"Introduced, referred to Education. S.J. 216."
1963662,2025-02-11,Senate,2,"Subcommittee: Green, Gruenhagen, and Quirmbach."
1963662,2025-02-18,Senate,3,"Subcommittee Meeting: 02/19/2025 2:00PM Room 217 Conference Room."
1963662,2025-02-19,Senate,4,"Subcommittee recommends passage."
1963668,2025-02-10,House,1,"Introduced, referred to Education. H.J. 272."
1963668,2025-02-11,House,2,"Subcommittee: Hayes, Fett and Matson. H.J. 291."
1963668,2025-02-11,House,3,"Subcommittee Meeting: 02/17/2025 11:30AM RM 103."
1963668,2025-02-17,House,4,"Subcommittee recommends passage."
1963668,2025-02-18,House,5,"Committee report, recommending passage. H.J. 365."
1963668,2025-02-18,House,6,"Committee vote: Yeas, 14. Nays, 8. Excused, 1. H.J. 365."
1963668,2025-02-20,House,7,"Committee report approving bill, renumbered as HF 521."
1963678,2025-02-10,Senate,1,"Introduced, referred to Education. S.J. 215."
1963678,2025-02-17,Senate,2,"Subcommittee: Salmon, Pike, and Quirmbach."
1963678,2025-02-20,Senate,3,"Subcommittee Meeting: 02/25/2025 10:00AM Senate Lounge."
1963678,2025-02-25,Senate,4,"Subcommittee recommends passage."
1963684,2025-02-10,House,1,"Introduced, referred to Appropriations. H.J. 272."
1963696,2025-02-10,Senate,1,"Introduced, referred to Health and Human Services. S.J. 216."
1963696,2025-02-11,Senate,2,"Subcommittee: Campbell, Donahue, and Guth. S.J. 244."
1963696,2025-02-11,Senate,3,"Subcommittee Meeting: 02/12/2025 12:00PM Senate Lounge."
1963696,2025-02-12,Senate,4,"Subcommittee recommends passage."
1963708,2025-02-10,Senate,1,"Introduced, referred to Health and Human Services. S.J. 215."
1963708,2025-02-11,Senate,2,"Subcommittee: Salmon, Pike, and Trone Garriott. S.J. 244."
1963708,2025-02-12,Senate,3,"Subcommittee Meeting: 02/24/2025 11:00AM Room 315."
1963708,2025-02-24,Senate,4,"Subcommittee recommends passage."
1963708,2025-02-27,Senate,5,"Committee report approving bill, renumbered as SF 473. S.J. 384."
1963718,2025-02-10,House,1,"Introduced, referred to Ways and Means. H.J. 275."
1963724,2025-02-10,House,1,"Introduced, referred to Ways and Means. H.J. 275."
1963739,2025-02-10,House,1,"Introduced, placed on calendar. H.J. 275."
1963739,2025-03-18,House,2,"Passed House, yeas 65, nays 32. H.J. 706."
1963739,2025-03-18,House,3,"Explanation of vote. H.J. 718."
1963739,2025-03-18,House,4,"Immediate message. H.J. 717."
1963739,2025-03-19,Senate,5,"Message from House. S.J. 570."
1963739,2025-03-19,Senate,6,"Read first time, referred to Education. S.J. 570."
1963739,2025-03-26,Senate,7,"Subcommittee: Gruenhagen, Taylor, and Winckler. S.J. 653."
1963739,2025-03-31,Senate,8,"Subcommittee Meeting: 04/01/2025 8:30AM Room 315."
1963739,2025-04-01,Senate,9,"Subcommittee recommends passage."
1963739,2025-04-07,Senate,10,"Committee report, recommending passage. S.J. 715."
1963739,2025-04-07,Senate,11,"Placed on calendar."
1963739,2025-04-10,Senate,12,"Placed on calendar under unfinished business. S.J. 757."
1963739,2025-04-17,Senate,13,"Passed Senate, yeas 32, nays 15. S.J. 821."
1963739,2025-04-17,Senate,14,"Immediate message. S.J. 826."
1963739,2025-04-17,House,15,"Message from Senate. H.J. 954."
1963739,2025-05-06,House,16,"Reported correctly enrolled, signed by Speaker and President, and sent to Governor. H.J. 1090."
1963739,2025-05-06,House,17,"Signed by Governor. H.J. 1091."
1963748,2025-02-10,House,1,"Introduced, referred to State Government. H.J. 274."
1963754,2025-02-10,House,1,"Introduced, placed on calendar. H.J. 279."
1963754,2025-02-19,House,2,"Amendment H-1016 filed. H.J. 372."
1963754,2025-02-19,House,3,"Fiscal note."
1963754,2025-02-20,House,4,"Amendment H-1016 adopted. H.J. 396."
1963754,2025-02-20,House,5,"Passed House, yeas 92, nays 0. H.J. 396."
1963754,2025-02-20,House,6,"Immediate message. H.J. 401."
1963754,2025-02-24,Senate,7,"Message from House. S.J. 337."
1963754,2025-02-24,Senate,8,"Read first time, referred to Commerce. S.J. 337."
1963754,2025-02-27,Senate,9,"Fiscal note."
1963754,2025-03-05,Senate,10,"Subcommittee: Driscoll, Petersen, and Warme. S.J. 421."
1963754,2025-03-11,Senate,11,"Subcommittee Meeting: 03/12/2025 1:30PM Senate Lounge."
1963754,2025-03-12,Senate,12,"Subcommittee recommends passage."
1963762,2025-02-10,House,1,"Introduced, placed on calendar. H.J. 276."
1963762,2025-03-10,House,2,"Passed House, yeas 88, nays 0. H.J. 576."
1963762,2025-03-18,House,3,"Explanation of vote. H.J. 718."
1963762,2025-03-10,House,4,"Immediate message. H.J. 590."
1963762,2025-03-10,Senate,5,"Message from House. S.J. 457."
1963762,2025-03-10,Senate,6,"Read first time, attached to SF 499. S.J. 457."
1963762,2025-04-03,Senate,7,"Placed on calendar under unfinished business. S.J. 689."
1963762,2025-04-29,Senate,8,"Substituted for SF 499. S.J. 921."
1963762,2025-04-29,Senate,9,"Passed Senate, yeas 48, nays 0. S.J. 922."
1963762,2025-04-29,Senate,10,"Immediate message. S.J. 924."
1963762,2025-04-30,House,11,"Message from Senate. H.J. 1078."
1963762,2025-05-19,House,12,"Reported correctly enrolled, signed by Speaker and President, and sent to Governor. H.J. 1224."
1963762,2025-05-19,House,13,"Signed by Governor. H.J. 1225."
1963770,2025-02-10,House,1,"Introduced, placed on calendar. H.J. 276."
1963770,2025-03-10,House,2,"Passed House, yeas 88, nays 0. H.J. 578."
1963770,2025-03-18,House,3,"Explanation of vote. H.J. 718."
1963770,2025-03-10,House,4,"Immediate message. H.J. 590."
1963770,2025-03-10,Senate,5,"Message from House. S.J. 457."
1963770,2025-03-10,Senate,6,"Read first time, attached to SF 174. S.J. 457."
1963770,2025-03-11,Senate,7,"Substituted for SF 174. S.J. 483."
1963770,2025-03-11,Senate,8,"Passed Senate, yeas 47, nays 0. S.J. 483."
1963770,2025-03-11,Senate,9,"Immediate message. S.J. 485."
1963770,2025-03-11,House,10,"Message from Senate. H.J. 606."
1963770,2025-03-28,House,11,"Reported correctly enrolled, signed by Speaker and President, and sent to Governor. H.J. 872."
1963770,2025-03-28,House,12,"Signed by Governor. H.J. 872."
1963784,2025-02-10,House,1,"Introduced, placed on calendar. H.J. 279."
1963784,2025-03-11,House,2,"Amendment H-1058 filed. H.J. 608."
1963784,2025-03-13,House,3,"Amendment H-1058 adopted. H.J. 651."
1963784,2025-03-13,House,4,"Passed House, yeas 91, nays 5. H.J. 651."
1963784,2025-03-13,House,5,"Explanation of vote. H.J. 657."
1963784,2025-03-17,House,6,"Explanation of vote. H.J. 676."
1963784,2025-03-13,House,7,"Immediate message. H.J. 656."
1963784,2025-03-17,Senate,8,"Message from House. S.J. 539."
1963784,2025-03-17,Senate,9,"Read first time, referred to Judiciary. S.J. 539."
1963784,2025-03-18,Senate,10,"Subcommittee: Bousselot, Quirmbach, and Reichman. S.J. 567."
1963784,2025-03-25,Senate,11,"Subcommittee Meeting: 03/26/2025 4:00PM Room 315."
1963784,2025-03-27,Senate,12,"Subcommittee recommends passage."
1963784,2025-04-03,Senate,13,"Fiscal note."
1963791,2025-02-10,House,1,"Introduced, placed on calendar. H.J. 277."
1963791,2025-02-20,House,2,"Passed House, yeas 91, nays 1. H.J. 398."
1963791,2025-02-20,House,3,"Explanation of vote. H.J. 401."
1963791,2025-02-20,House,4,"Immediate message. H.J. 401."
1963791,2025-02-24,Senate,5,"Message from House. S.J. 337."
1963791,2025-02-24,Senate,6,"Read first time, attached to SF 385. S.J. 337."
1963791,2025-04-03,Senate,7,"Placed on calendar under unfinished business. S.J. 689."
1963791,2025-04-07,Senate,8,"Substituted for SF 385. S.J. 708."
1963791,2025-04-07,Senate,9,"Deferred. S.J. 708."
1963791,2025-04-08,Senate,10,"Amendment S-3081 filed, ruled out of order. S.J. 723."
1963791,2025-04-08,Senate,11,"Amendment S-3082 filed, ruled out of order. S.J. 723."
1963791,2025-04-08,Senate,12,"Amendment S-3083 filed, ruled out of order. S.J. 724."
1963791,2025-04-08,Senate,13,"Amendment S-3084 filed, lost. S.J. 724."
1963791,2025-04-08,Senate,14,"Passed Senate, yeas 39, nays 9. S.J. 725."
1963791,2025-04-08,Senate,15,"Immediate message. S.J. 727."
1963791,2025-04-09,House,16,"Message from Senate. H.J. 919."
1963791,2025-04-17,House,17,"Reported correctly enrolled, signed by Speaker and President, and sent to Governor. H.J. 989."
1963791,2025-04-18,House,18,"Signed by Governor. H.J. 1011."
1963801,2025-02-10,House,1,"Introduced, referred to State Government. H.J. 274."
1963811,2025-02-10,House,1,"Introduced, referred to Judiciary. H.J. 273."
1963817,2025-02-10,House,1,"Introduced, referred to Health and Human Services. H.J. 273."
1963831,2025-02-10,House,1,"Introduced, placed on calendar. H.J. 278."
1963831,2025-02-20,House,2,"Passed House, yeas 91, nays 1. H.J. 395."
1963831,2025-02-20,House,3,"Immediate message. H.J. 401."
1963831,2025-02-24,Senate,4,"Message from House. S.J. 337."
1963831,2025-02-24,Senate,5,"Read first time, referred to Health and Human Services. S.J. 337."
1963831,2025-03-03,Senate,6,"Subcommittee: Rowley, Warme, and Zimmer. S.J. 394."
1963831,2025-03-04,Senate,7,"Subcommittee Meeting: 03/10/2025 12:30PM Room 217 Conference Room."
1963831,2025-03-10,Senate,8,"Subcommittee recommends passage."
1963838,2025-02-10,House,1,"Introduced, referred to Public Safety. H.J. 274."
1963843,2025-02-10,House,1,"Introduced, referred to Judiciary. H.J. 273."
1963854,2025-02-10,House,1,"Introduced, referred to State Government. H.J. 275."
1963864,2025-02-10,House,1,"Introduced, referred to Labor and Workforce. H.J. 274."
1963872,2025-02-10,House,1,"Introduced, placed on calendar. H.J. 276."
1963872,2025-04-03,House,2,"Referred to Health and Human Services. H.J. 895."
1963887,2025-02-10,House,1,"Introduced, placed on calendar. H.J. 277."
1963887,2025-04-03,House,2,"Referred to Commerce. H.J. 895."
1963893,2025-02-10,House,1,"Introduced, placed on calendar. H.J. 278."
1963893,2025-02-20,House,2,"Passed House, yeas 92, nays 0. H.J. 391."
1963893,2025-02-20,House,3,"Immediate message. H.J. 401."
1963893,2025-02-24,Senate,4,"Message from House. S.J. 337."
1963893,2025-02-24,Senate,5,"Read first time, referred to Health and Human Services. S.J. 337."
1963893,2025-03-03,Senate,6,"Subcommittee: Lofgren, Alons, and Petersen. S.J. 394."
1963893,2025-03-06,Senate,7,"Subcommittee Meeting: 03/10/2025 12:00PM Senate Lounge."
1963893,2025-03-10,Senate,8,"Subcommittee recommends passage."
1963900,2025-02-10,House,1,"Introduced, placed on calendar. H.J. 277."
1963900,2025-02-28,House,2,"Fiscal note."
1963900,2025-03-07,House,3,"Amendment H-1040 filed. H.J. 569."
1963900,2025-03-10,House,4,"Amendment H-1047 to amendment H-1040 filed, adopted. H.J. 580."
1963900,2025-03-10,House,5,"Amendment H-1040 adopted, as amended. H.J. 580."
1963900,2025-03-10,House,6,"Passed House, yeas 88, nays 0. H.J. 580."
1963900,2025-03-18,House,7,"Explanation of vote. H.J. 718."
1963900,2025-03-10,House,8,"Immediate message. H.J. 590."
1963900,2025-03-10,Senate,9,"Message from House. S.J. 457."
1963900,2025-03-10,Senate,10,"Read first time, referred to Judiciary. S.J. 457."
1963900,2025-03-13,Senate,11,"Subcommittee: Shipley, Knox, and Taylor. S.J. 513."
1963900,2025-03-18,Senate,12,"Fiscal note."
1963900,2025-03-25,Senate,13,"Subcommittee Meeting: []."
1963900,2025-03-26,Senate,14,"Subcommittee recommends passage."
1963900,2025-04-03,Senate,15,"Committee report, recommending passage. S.J. 692."
1963900,2025-04-03,Senate,16,"Placed on calendar."
1963900,2025-04-10,Senate,17,"Placed on calendar under unfinished business. S.J. 757."
1963900,2025-04-14,Senate,18,"Passed Senate, yeas 45, nays 0. S.J. 768."
1963900,2025-04-14,Senate,19,"Immediate message. S.J. 769."
1963900,2025-04-15,House,20,"Message from Senate. H.J. 933."
1963900,2025-05-19,House,21,"Reported correctly enrolled, signed by Speaker and President, and sent to Governor. H.J. 1224."
1963900,2025-05-27,House,22,"Signed by Governor. H.J. 1225."
1963900,2025-06-06,House,23,"Fiscal note."
1963908,2025-02-10,Senate,1,"Introduced, referred to Commerce. S.J. 215."
1963908,2025-02-12,Senate,2,"Subcommittee: Bousselot, Blake, and Gruenhagen. S.J. 255."
1963922,2025-02-10,House,1,"Introduced, referred to Labor and Workforce. H.J. 274."
1963930,2025-02-10,House,1,"Introduced, referred to Transportation. H.J. 275."
1963940,2025-02-10,House,1,"Introduced, placed on calendar. H.J. 278."
1963940,2025-03-06,House,2,"Amendment H-1034 filed. H.J. 557."
1963940,2025-03-10,House,3,"Amendment H-1034, yeas 31, nays 58, lost. H.J. 586."
1963940,2025-03-10,House,4,"Explanation of vote. H.J. 590."
1963940,2025-03-10,House,5,"Passed House, yeas 61, nays 28. H.J. 587."
1963940,2025-03-18,House,6,"Explanation of vote. H.J. 718."
1963940,2025-03-10,House,7,"Immediate message. H.J. 590."
1963940,2025-03-10,Senate,8,"Message from House. S.J. 458."
1963940,2025-03-10,Senate,9,"Read first time, referred to Education. S.J. 458."
1963940,2025-03-12,Senate,10,"Subcommittee: Evans, Kraayenbrink, and Trone Garriott. S.J. 507."
1963940,2025-03-31,Senate,11,"Subcommittee Meeting: []."
1963940,2025-04-02,Senate,12,"Subcommittee recommends passage."
1963940,2025-04-07,Senate,13,"Committee report, recommending passage. S.J. 715."
1963940,2025-04-07,Senate,14,"Placed on calendar."
1963940,2025-04-10,Senate,15,"Placed on calendar under unfinished business. S.J. 757."
1963940,2025-04-14,Senate,16,"Passed Senate, yeas 45, nays 0. S.J. 769."
1963940,2025-04-14,Senate,17,"Immediate message. S.J. 772."
1963940,2025-04-15,House,18,"Message from Senate. H.J. 933."
1963940,2025-05-06,House,19,"Reported correctly enrolled, signed by Speaker and President, and sent to Governor. H.J. 1090."
1963940,2025-05-06,House,20,"Signed by Governor. H.J. 1091."
1963946,2025-02-10,House,1,"Introduced, placed on calendar. H.J. 278."
1963946,2025-02-25,House,2,"Fiscal note."
1963946,2025-03-10,House,3,"Passed House, yeas 89, nays 0. H.J. 584."
1963946,2025-03-18,House,4,"Explanation of vote. H.J. 718."
1963946,2025-03-10,House,5,"Immediate message. H.J. 590."
1963946,2025-03-10,Senate,6,"Message from House. S.J. 457."
1963946,2025-03-10,Senate,7,"Read first time, referred to Judiciary. S.J. 457."
1963946,2025-03-13,Senate,8,"Subcommittee: Webster, Bisignano, and Westrich. S.J. 513."
1963946,2025-03-17,Senate,9,"Subcommittee Meeting: 03/18/2025 12:00PM Room 217 Conference Room."
1963946,2025-03-18,Senate,10,"Subcommittee recommends passage."
1963946,2025-04-03,Senate,11,"Committee report, recommending passage. S.J. 692."
1963946,2025-04-03,Senate,12,"Placed on calendar."
1963946,2025-04-08,Senate,13,"Passed Senate, yeas 47, nays 0. S.J. 729."
1963946,2025-04-08,Senate,14,"Immediate message. S.J. 730."
1963946,2025-04-09,House,15,"Message from Senate. H.J. 919."
1963946,2025-05-19,House,16,"Reported correctly enrolled, signed by Speaker and President, and sent to Governor. H.J. 1224."
1963946,2025-05-28,House,17,"Signed by Governor. H.J. 1225."
1963956,2025-02-10,House,1,"Introduced, placed on calendar. H.J. 278."
1963956,2025-04-03,House,2,"Referred to Commerce. H.J. 895."
1963969,2025-02-10,House,1,"Introduced, placed on calendar. H.J. 278."
1963969,2025-02-27,House,2,"Fiscal note."
1963969,2025-03-10,House,3,"Passed House, yeas 88, nays 1. H.J. 588."
1963969,2025-03-18,House,4,"Explanation of vote. H.J. 718."
1963969,2025-03-10,House,5,"Immediate message. H.J. 590."
1963969,2025-03-10,Senate,6,"Message from House. S.J. 458."
1963969,2025-03-10,Senate,7,"Read first time, referred to Education. S.J. 458."
1963969,2025-03-12,Senate,8,"Subcommittee: Evans, Shipley, and Winckler. S.J. 507."
1963969,2025-03-18,Senate,9,"Subcommittee Meeting: 03/19/2025 8:30AM Room 217 Conference Room."
1963969,2025-03-19,Senate,10,"Subcommittee recommends passage."
1963969,2025-04-07,Senate,11,"Committee report, recommending passage. S.J. 715."
1963969,2025-04-07,Senate,12,"Placed on calendar."
1963969,2025-04-08,Senate,13,"Referred to Ways and Means. S.J. 720."
1963969,2025-04-14,Senate,14,"Subcommittee: Green, Driscoll, and Townsend. S.J. 780."
1963969,2025-04-15,Senate,15,"Subcommittee Meeting: 04/16/2025 8:00AM Lobbyist Lounge."
1963969,2025-04-16,Senate,16,"Subcommittee recommends passage."
1963974,2025-02-10,House,1,"Introduced, placed on calendar. H.J. 276."
1963974,2025-03-10,House,2,"Passed House, yeas 88, nays 0. H.J. 581."
1963974,2025-03-18,House,3,"Explanation of vote. H.J. 718."
1963974,2025-03-10,House,4,"Immediate message. H.J. 590."
1963974,2025-03-10,Senate,5,"Message from House. S.J. 457."
1963974,2025-03-10,Senate,6,"Read first time, attached to SF 312. S.J. 457."
1963974,2025-03-26,Senate,7,"Substituted for SF 312. S.J. 648."
1963974,2025-03-26,Senate,8,"Passed Senate, yeas 47, nays 0. S.J. 648."
1963974,2025-03-26,Senate,9,"Immediate message. S.J. 649."
1963974,2025-03-26,House,10,"Message from Senate. H.J. 817."
1963974,2025-05-19,House,11,"Reported correctly enrolled, signed by Speaker and President, and sent to Governor. H.J. 1224."
1963974,2025-05-27,House,12,"Signed by Governor. H.J. 1225."
1963984,2025-02-10,House,1,"Introduced, placed on calendar. H.J. 276."
1963984,2025-02-25,House,2,"Amendment H-1025 filed. H.J. 436."
1963984,2025-04-03,House,3,"Referred to Higher Education. H.J. 895."
1963995,2025-02-10,Senate,1,"Introduced, referred to Education. S.J. 216."
1963995,2025-02-11,Senate,2,"Subcommittee: Green, Pike, and Quirmbach."
1964004,2025-02-10,Senate,1,"Introduced, referred to Judiciary. S.J. 216."
1964004,2025-02-11,Senate,2,"Subcommittee: Green, Quirmbach, and Webster. S.J. 244."
1964004,2025-02-20,Senate,3,"Subcommittee Meeting: 02/24/2025 3:30PM Room 217 Conference Room."
1964004,2025-02-25,Senate,4,"Subcommittee recommends passage."
1964004,2025-03-05,Senate,5,"Committee report approving bill, renumbered as SF 513. S.J. 424."
1964012,2025-02-10,House,1,"Introduced, referred to Appropriations. H.J. 272."
1964012,2025-03-24,House,2,"Subcommittee: Harris, Collins and Wilburn. H.J. 790."
1964012,2025-03-24,House,3,"Subcommittee Meeting: 03/27/2025 8:00AM RM 19."
1964012,2025-03-27,House,4,"Subcommittee recommends passage."
1964021,2025-02-10,House,1,"Introduced, referred to Judiciary. H.J. 273."
1964021,2025-02-11,House,2,"Subcommittee: Fett, Wheeler and Wilburn. H.J. 291."
1964021,2025-02-17,House,3,"Subcommittee Meeting: 02/19/2025 4:00PM House Lounge."
1964021,2025-02-19,House,4,"Subcommittee recommends passage."
1964021,2025-02-25,House,5,"Committee report, recommending amendment and passage. H.J. 433."
1964021,2025-02-25,House,6,"Committee vote: Yeas, 19. Nays, 2. H.J. 433."
1964021,2025-03-05,House,7,"Committee report approving bill, renumbered as HF 798."
1964032,2025-02-10,House,1,"Introduced, referred to Veterans Affairs. H.J. 275."
1964032,2025-02-11,House,2,"Subcommittee: Gerhold, Gaines and Hermanson. H.J. 291."
1964032,2025-02-18,House,3,"Subcommittee Meeting: 02/19/2025 12:00PM House Lounge 2."
1964032,2025-02-19,House,4,"Subcommittee recommends passage."
1964032,2025-02-26,House,5,"Committee report, recommending passage. H.J. 450."
1964032,2025-02-26,House,6,"Committee vote: Yeas, 16. Nays, 0. Excused, 1. H.J. 450."
1964032,2025-03-05,House,7,"Committee report approving bill, renumbered as HF 779."
1964032,2025-03-21,House,8,"Withdrawn. H.J. 772."
1964039,2025-02-10,Senate,1,"Introduced, referred to Education. S.J. 215."
1964039,2025-02-11,Senate,2,"Subcommittee: Taylor, Campbell, and Winckler."
1964039,2025-02-17,Senate,3,"Subcommittee Meeting: 02/19/2025 2:00PM Senate Lounge."
1964039,2025-02-19,Senate,4,"Subcommittee recommends passage."
1964039,2025-03-05,Senate,5,"Committee report approving bill, renumbered as SF 516. S.J. 422."
1964048,2025-02-10,House,1,"By COMMITTEE ON AGRICULTURE"
1964048,2025-02-10,House,2,"Introduced, referred to Agriculture. H.J. 279."
1964048,2025-02-10,House,3,"Subcommittee: Sexton, Lohse and Scholten. H.J. 280."
1964048,2025-02-11,House,4,"Subcommittee Meeting: 02/18/2025 12:30PM RM 19."
1964048,2025-02-18,House,5,"Subcommittee recommends passage."
1964048,2025-03-03,House,6,"Committee report, recommending passage. H.J. 504."
1964048,2025-03-03,House,7,"Committee vote: Yeas, 22. Nays, 0. Excused, 1. H.J. 504."
1964048,2025-03-05,House,8,"Committee report approving bill, renumbered as HF 799."
1964057,2025-02-10,House,1,"Introduced, placed on calendar. H.J. 278."
1964057,2025-03-10,House,2,"Passed House, yeas 71, nays 18. H.J. 582."
1964057,2025-03-18,House,3,"Explanation of vote. H.J. 718."
1964057,2025-03-10,House,4,"Immediate message. H.J. 590."
1964057,2025-03-10,Senate,5,"Message from House. S.J. 457."
1964057,2025-03-10,Senate,6,"Read first time, attached to SF 154. S.J. 457."
1964057,2025-04-03,Senate,7,"Placed on calendar under unfinished business. S.J. 688."
1964057,2025-04-07,Senate,8,"Substituted for SF 154. S.J. 700."
1964057,2025-04-07,Senate,9,"Passed Senate, yeas 36, nays 11. S.J. 701."
1964057,2025-04-07,Senate,10,"Immediate message. S.J. 702."
1964057,2025-04-08,House,11,"Message from Senate. H.J. 904."
1964057,2025-04-17,House,12,"Reported correctly enrolled, signed by Speaker and President, and sent to Governor. H.J. 989."
1964057,2025-04-18,House,13,"Signed by Governor. H.J. 1011."
1964065,2025-02-10,House,1,"Introduced, placed on calendar. H.J. 276."
1964065,2025-03-10,House,2,"Passed House, yeas 58, nays 30. H.J. 579."
1964065,2025-03-18,House,3,"Explanation of vote. H.J. 718."
1964065,2025-03-10,House,4,"Immediate message. H.J. 590."
1964065,2025-03-10,Senate,5,"Message from House. S.J. 457."
1964065,2025-03-10,Senate,6,"Read first time, attached to SF 6. S.J. 457."
1964065,2025-04-03,Senate,7,"Placed on calendar under unfinished business. S.J. 688."
1964065,2025-04-29,Senate,8,"Substituted for SF 6. S.J. 920."
1964065,2025-04-29,Senate,9,"Passed Senate, yeas 32, nays 16. S.J. 921."
1964065,2025-04-29,Senate,10,"Immediate message. S.J. 924."
1964065,2025-04-30,House,11,"Message from Senate. H.J. 1078."
1964065,2025-05-19,House,12,"Reported correctly enrolled, signed by Speaker and President, and sent to Governor. H.J. 1224."
1964065,2025-05-27,House,13,"Signed by Governor. H.J. 1225."
1964074,2025-02-10,House,1,"Introduced, placed on calendar. H.J. 277."
1964074,2025-02-20,House,2,"Passed House, yeas 92, nays 0. H.J. 389."
1964074,2025-02-20,House,3,"Immediate message. H.J. 401."
1964074,2025-02-24,Senate,4,"Message from House. S.J. 336."
1964074,2025-02-24,Senate,5,"Read first time, attached to SF 231. S.J. 336."
1964074,2025-03-04,Senate,6,"Amendment S-3015 filed. S.J. 412."
1964074,2025-04-03,Senate,7,"Placed on calendar under unfinished business. S.J. 688."
1964074,2025-04-16,Senate,8,"Substituted for SF 231. S.J. 812."
1964074,2025-04-16,Senate,9,"Amendment S-3015 adopted. S.J. 813."
1964074,2025-04-16,Senate,10,"Passed Senate, yeas 47, nays 0. S.J. 813."
1964074,2025-04-16,Senate,11,"Immediate message. S.J. 814."
1964074,2025-04-17,House,12,"Message from Senate. H.J. 951."
1964074,2025-04-17,House,13,"Senate amendment H-1244 filed. H.J. 993."
1964074,2025-04-22,House,14,"House concurred in Senate amendment H-1244. H.J. 1017."
1964074,2025-04-22,House,15,"Passed House, yeas 92, nays 0. H.J. 1017."
1964074,2025-04-22,House,16,"Immediate message. H.J. 1033."
1964074,2025-04-23,Senate,17,"Message from House. S.J. 862."
1964074,2025-05-19,House,18,"Reported correctly enrolled, signed by Speaker and President, and sent to Governor. H.J. 1224."
1964074,2025-05-27,House,19,"Signed by Governor. H.J. 1225."
1964082,2025-02-10,House,1,"Introduced, placed on calendar. H.J. 277."
1964082,2025-02-20,House,2,"Passed House, yeas 92, nays 0. H.J. 394."
1964082,2025-02-20,House,3,"Immediate message. H.J. 401."
1964082,2025-02-24,Senate,4,"Message from House. S.J. 337."
1964082,2025-02-24,Senate,5,"Read first time, referred to Health and Human Services. S.J. 337."
1964082,2025-03-03,Senate,6,"Subcommittee: Guth, Garrett, and Trone Garriott. S.J. 394."
1964082,2025-03-11,Senate,7,"Subcommittee Meeting: 03/12/2025 1:30PM Room 217 Conference Room."
1964082,2025-03-12,Senate,8,"Subcommittee recommends passage."
1964089,2025-02-10,Senate,1,"Introduced, referred to State Government. S.J. 215."
1964089,2025-02-18,Senate,2,"Subcommittee: Campbell, Green, and Townsend. S.J. 301."
1964089,2025-02-19,Senate,3,"Subcommittee Meeting: 02/24/2025 12:00PM Senate Lounge."
1964089,2025-02-24,Senate,4,"Subcommittee recommends passage."
1964089,2025-02-26,Senate,5,"Committee report, recommending passage. S.J. 371."
1964089,2025-02-26,Senate,6,"Placed on calendar."
1964089,2025-03-17,Senate,7,"Attached to HF 615. S.J. 540."
1964089,2025-04-03,Senate,8,"Placed on calendar under unfinished business. S.J. 688."
1964089,2025-04-21,Senate,9,"HF 615 substituted. S.J. 833."
1964089,2025-04-21,Senate,10,"Withdrawn. S.J. 834."
1964094,2025-02-10,Senate,1,"Introduced, referred to State Government. S.J. 215."
1964094,2025-02-18,Senate,2,"Subcommittee: Salmon, Campbell, and Celsi. S.J. 301."
1964094,2025-02-24,Senate,3,"Subcommittee Meeting: 02/26/2025 10:00AM Room 315."
1964094,2025-02-24,Senate,4,"Subcommittee reassigned: Salmon, Campbell, and Winckler. S.J. 341."
1964094,2025-03-03,Senate,5,"Subcommittee recommends amendment and passage."
1964146,2025-02-10,Senate,1,"Introduced, referred to Local Government. S.J. 217."
1964146,2025-02-18,Senate,2,"Subcommittee: Driscoll, Webster, and Weiner. S.J. 301."
1964185,2025-02-10,Senate,1,"Introduced, referred to Rules and Administration. S.J. 214."
1964225,2025-02-10,Senate,1,"Introduced, referred to Health and Human Services. S.J. 217."
1964225,2025-02-13,Senate,2,"Subcommittee: Salmon, Guth, and Trone Garriott. S.J. 269."
1964225,2025-02-18,Senate,3,"Subcommittee reassigned: Salmon, Pike, and Trone Garriott. S.J. 302."
1964225,2025-02-18,Senate,4,"Subcommittee Meeting: 02/20/2025 12:00PM Room 315."
1964225,2025-02-20,Senate,5,"Subcommittee recommends amendment and passage."
1964225,2025-03-06,Senate,6,"Committee report approving bill, renumbered as SF 564. S.J. 436."
1964267,2025-02-10,Senate,1,"Introduced, referred to Education. S.J. 217."
1964267,2025-02-17,Senate,2,"Subcommittee: Garrett, Campbell, and Winckler. S.J. 281."
1964307,2025-02-10,Senate,1,"Introduced, referred to Natural Resources and Environment. S.J. 217."
1964307,2025-02-11,Senate,2,"Subcommittee: Shipley, Staed, and Zumbach. S.J. 244."
1964307,2025-02-20,Senate,3,"Subcommittee Meeting: 02/20/2025 8:30AM Room 217 Conference Room."
1964307,2025-02-20,Senate,4,"Subcommittee reassigned: Shipley, Zimmer, and Zumbach. S.J. 326."
1964307,2025-02-20,Senate,5,"Subcommittee recommends passage."
1964307,2025-03-06,Senate,6,"Committee report approving bill, renumbered as SF 555. S.J. 439."
1964348,2025-02-10,Senate,1,"Introduced, referred to Health and Human Services. S.J. 217."
1964348,2025-02-13,Senate,2,"Subcommittee: Klimesh, Costello, and Petersen. S.J. 269."
1964389,2025-02-10,Senate,1,"Introduced, referred to Commerce. S.J. 217."
1964389,2025-02-18,Senate,2,"Subcommittee: Bousselot, Blake, and Webster. S.J. 301."
1964427,2025-02-10,Senate,1,"Introduced, referred to Commerce. S.J. 216."
1964427,2025-02-18,Senate,2,"Subcommittee: Webster, Knox, and Warme. S.J. 301."
1964427,2025-02-19,Senate,3,"Subcommittee Meeting: 02/20/2025 9:30AM Room 217 Conference Room."
1964427,2025-02-20,Senate,4,"Subcommittee recommends passage."
1964427,2025-03-06,Senate,5,"Committee report, recommending passage. S.J. 435."
1964427,2025-03-06,Senate,6,"Placed on calendar."
1964427,2025-03-10,Senate,7,"Referred to Ways and Means. S.J. 443."
1964427,2025-03-11,Senate,8,"Subcommittee: Schultz, Bisignano, and Dawson. S.J. 491."
1964462,2025-02-10,House,1,"Introduced, placed on Appropriations calendar. H.J. 279."
1964462,2025-02-12,House,2,"Amendment H-1009 filed. H.J. 314."
1964462,2025-02-12,House,3,"Fiscal note."
1964462,2025-02-13,House,4,"Amendment H-1009 adopted. H.J. 324."
1964462,2025-02-13,House,5,"SF 167 substituted. H.J. 324."
1964462,2025-02-13,House,6,"Withdrawn. H.J. 330."
1964788,2025-02-11,House,1,"Introduced, referred to Ways and Means. H.J. 285."
1964788,2025-02-20,House,2,"Subcommittee: Sexton, Jacoby and Wills, J. H.J. 406."
1964788,2025-03-17,House,3,"Subcommittee Meeting: 03/19/2025 12:30PM House Lounge 2."
1964788,2025-03-19,House,4,"Subcommittee recommends passage."
1964800,2025-02-11,Senate,1,"Introduced, placed on calendar. S.J. 238."
1964800,2025-02-11,Senate,2,"Committee report, approving bill. S.J. 248."
1964800,2025-02-17,Senate,3,"Referred to Appropriations. S.J. 275."
1964800,2025-02-18,Senate,4,"Subcommittee: Reichman, Blake, and Warme. S.J. 302."
1964800,2025-03-11,Senate,5,"Subcommittee Meeting: 03/12/2025 2:00PM Senate Lounge."
1964800,2025-03-12,Senate,6,"Subcommittee recommends passage."
1964800,2025-03-25,Senate,7,"Committee report approving bill, renumbered as SF 617. S.J. 640."
1964806,2025-02-11,Senate,1,"Introduced, placed on calendar. S.J. 237."
1964806,2025-02-11,Senate,2,"Committee report, approving bill. S.J. 245."
1964806,2025-02-19,Senate,3,"Referred to State Government. S.J. 307."
1964806,2025-02-20,Senate,4,"Subcommittee: Reichman, Green, and Staed. S.J. 326."
1964806,2025-02-24,Senate,5,"Subcommittee Meeting: 02/25/2025 11:30AM Senate Lounge."
1964806,2025-02-25,Senate,6,"Subcommittee recommends passage."
1964818,2025-02-11,Senate,1,"By COMMITTEE ON STATE GOVERNMENT"
1964818,2025-02-11,Senate,2,"Introduced, referred to State Government."
1964818,2025-02-11,Senate,3,"Subcommittee: Koelker, Alons, and Blake."
1964818,2025-02-18,Senate,4,"Subcommittee Meeting: 02/19/2025 3:00PM Lobbyist Lounge."
1964818,2025-02-20,Senate,5,"Subcommittee recommends amendment and passage."
1964818,2025-02-26,Senate,6,"Committee report approving bill, renumbered as SF 465."
1964828,2025-02-11,House,1,"Introduced, referred to Health and Human Services. H.J. 284."
1964828,2025-02-17,House,2,"Subcommittee: Barker, Baeth and Bradley. H.J. 340."
1964828,2025-02-17,House,3,"Subcommittee Meeting: 02/19/2025 12:30PM RM 19."
1964828,2025-02-19,House,4,"Subcommittee recommends passage."
1964828,2025-03-03,House,5,"Committee report, recommending amendment and passage. H.J. 3."
1964828,2025-03-03,House,6,"Committee vote: Yeas, 14. Nays, 6. Excused, 1. H.J. 504."
1964828,2025-03-05,House,7,"Committee report approving bill, renumbered as HF 802."
1964828,2025-03-21,House,8,"Withdrawn. H.J. 772."
1964838,2025-02-11,House,1,"Introduced, referred to State Government. H.J. 285."
1964838,2025-02-24,House,2,"Subcommittee: Smith, Cooling and Dunwell. H.J. 419."
1964838,2025-02-25,House,3,"Subcommittee Meeting: 02/26/2025 12:45PM House Lounge."
1964838,2025-02-26,House,4,"Subcommittee recommends passage."
1964844,2025-02-11,Senate,1,"By COMMITTEE ON TRANSPORTATION"
1964844,2025-02-11,Senate,2,"Introduced, referred to Transportation."
1964844,2025-02-11,Senate,3,"Subcommittee: Zumbach, Shipley, and Townsend."
1964844,2025-02-11,Senate,4,"Subcommittee Meeting: 02/12/2025 10:00AM Room 217 Conference Room."
1964844,2025-02-12,Senate,5,"Subcommittee recommends passage."
1964844,2025-02-19,Senate,6,"Committee report approving bill, renumbered as SF 377."
1964857,2025-02-11,Senate,1,"Introduced, referred to Health and Human Services. S.J. 238."
1964857,2025-02-18,Senate,2,"Subcommittee: Alons, Celsi, and Rowley. S.J. 302."
1964857,2025-02-20,Senate,3,"Subcommittee Meeting: 02/24/2025 12:30PM Senate Lounge."
1964857,2025-02-24,Senate,4,"Subcommittee recommends passage."
1964857,2025-03-03,Senate,5,"Committee report approving bill, renumbered as SF 476. S.J. 395."
1964866,2025-02-11,Senate,1,"Introduced, referred to Local Government. S.J. 238."
1964866,2025-02-18,Senate,2,"Subcommittee: Westrich, Lofgren, and Wahls. S.J. 302."
1964866,2025-02-18,Senate,3,"Subcommittee Meeting: 02/19/2025 1:30PM Room 315."
1964866,2025-02-19,Senate,4,"Subcommittee recommends passage."
1964879,2025-02-11,Senate,1,"Introduced, placed on calendar. S.J. 238."
1964879,2025-02-11,Senate,2,"Committee report, approving bill. S.J. 246."
1964879,2025-03-17,Senate,3,"Passed Senate, yeas 46, nays 0. S.J. 544."
1964879,2025-03-17,Senate,4,"Immediate message. S.J. 545."
1964879,2025-03-17,House,5,"Message from Senate. H.J. 663."
1964879,2025-03-18,House,6,"Read first time, referred to Transportation. H.J. 678."
1964879,2025-03-26,House,7,"Subcommittee: Henderson, Gosa and Wood. H.J. 852."
1964879,2025-03-26,House,8,"Subcommittee Meeting: 03/27/2025 8:00AM RM 304.1."
1964879,2025-03-27,House,9,"Subcommittee recommends passage."
1964879,2025-03-31,House,10,"Committee report, recommending passage. H.J. 880."
1964879,2025-03-31,House,11,"Committee vote: Yeas, 19. Nays, 0. Excused, 2. H.J. 880."
1964879,2025-04-01,House,12,"Placed on calendar. H.J. 880."
1964879,2025-04-10,House,13,"Placed on calendar under unfinished business. H.J. 928."
1964879,2025-04-21,House,14,"Passed House, yeas 91, nays 0. H.J. 1007."
1964879,2025-04-21,House,15,"Immediate message. H.J. 1010."
1964879,2025-04-22,Senate,16,"Message from House. S.J. 846."
1964879,2025-05-06,Senate,17,"Reported correctly enrolled, signed by President and Speaker, and sent to Governor. S.J. 942."
1964879,2025-05-06,Senate,18,"Signed by Governor. S.J. 943."
1964885,2025-02-11,Senate,1,"Introduced, placed on calendar. S.J. 238."
1964885,2025-02-11,Senate,2,"Committee report, approving bill. S.J. 245."
1964885,2025-03-11,Senate,3,"Passed Senate, yeas 47, nays 0. S.J. 485."
1964885,2025-03-11,Senate,4,"Immediate message. S.J. 485."
1964885,2025-03-11,House,5,"Message from Senate. H.J. 607."
1964885,2025-03-12,House,6,"Read first time, passed on file. H.J. 615."
1964885,2025-04-03,House,7,"Placed on calendar under unfinished business. H.J. 894."
1964885,2025-05-12,House,8,"Substituted for HF 387. H.J. 1133."
1964885,2025-05-12,House,9,"Passed House, yeas 90, nays 0. H.J. 1133."
1964885,2025-05-20,House,10,"Explanation of vote. H.J. 1223."
1964885,2025-05-12,House,11,"Immediate message. H.J. 1140."
1964885,2025-05-12,Senate,12,"Message from House. S.J. 967."
1964885,2025-05-19,Senate,13,"Reported correctly enrolled, signed by President and Speaker, and sent to Governor. S.J. 1050."
1964885,2025-06-06,Senate,14,"Signed by Governor. S.J. 1051."
1964897,2025-02-11,Senate,1,"Introduced, placed on calendar. S.J. 239."
1964897,2025-02-11,Senate,2,"Committee report, approving bill. S.J. 247."
1964897,2025-04-03,Senate,3,"Placed on calendar under unfinished business. S.J. 688."
1964897,2025-06-16,Senate,4,"Referred to Transportation. S.J. 1057."
1964913,2025-02-11,Senate,1,"Introduced, placed on calendar. S.J. 237."
1964913,2025-02-11,Senate,2,"Committee report, approving bill. S.J. 246."
1964913,2025-04-22,Senate,3,"Attached to HCR 6. S.J. 848."
1964913,2025-06-16,Senate,4,"Referred to Transportation. S.J. 1058."
1964919,2025-02-11,House,1,"Introduced, referred to Judiciary. H.J. 284."
1964919,2025-02-12,House,2,"Subcommittee: Stone, Fett and Olson. H.J. 308."
1964919,2025-02-13,House,3,"Subcommittee Meeting: 02/19/2025 12:30PM House Lounge 2."
1964919,2025-02-19,House,4,"Subcommittee recommends passage."
1964931,2025-02-11,House,1,"By COMMITTEE ON HEALTH AND HUMAN SERVICES"
1964931,2025-02-11,House,2,"Introduced, referred to Health and Human Services. H.J. 287."
1964931,2025-02-11,House,3,"Subcommittee: Weldon, Ehlert and Moore, T. H.J. 292."
1964931,2025-02-18,House,4,"Subcommittee Meeting: 02/19/2025 12:00PM RM 304."
1964931,2025-02-19,House,5,"Subcommittee recommends passage."
1964931,2025-02-25,House,6,"Committee report, recommending amendment and passage. H.J. 431."
1964931,2025-02-25,House,7,"Committee vote: Yeas, 14. Nays, 6. Excused, 1. H.J. 431."
1964931,2025-02-27,House,8,"Committee report approving bill, renumbered as HF 623."
1964939,2025-02-11,House,1,"Introduced, referred to Ways and Means. H.J. 285."
1964939,2025-02-20,House,2,"Subcommittee: Sexton, Gjerde and Nordman. H.J. 406."
1964939,2025-03-11,House,3,"Subcommittee Meeting: 03/12/2025 8:15AM House Lounge."
1964939,2025-03-12,House,4,"Subcommittee recommends passage."
1964949,2025-02-11,House,1,"Introduced, referred to Ways and Means. H.J. 285."
1964949,2025-02-13,House,2,"Sponsor added, Young. H.J. 330."
1964949,2025-02-20,House,3,"Subcommittee: Nordman, Jones and Judge. H.J. 406."
1964949,2025-03-13,House,4,"Subcommittee Meeting: 03/18/2025 12:00PM RM 19."
1964949,2025-03-18,House,5,"Subcommittee recommends passage."
1964949,2025-04-16,House,6,"Committee report, recommending amendment and passage. H.J. 990."
1964949,2025-04-16,House,7,"Committee vote: Yeas, 16. Nays, 8. Excused, 1. H.J. 990."
1964949,2025-04-17,House,8,"Committee report approving bill, renumbered as HF 1031."
1964949,2025-04-28,House,9,"Withdrawn. H.J. 1073."
1964959,2025-02-11,Senate,1,"By COMMITTEE ON LOCAL GOVERNMENT"
1964959,2025-02-11,Senate,2,"Introduced, referred to Local Government."
1964959,2025-02-11,Senate,3,"Subcommittee: Westrich, Quirmbach, and Sires."
1964959,2025-02-17,Senate,4,"Subcommittee Meeting: 02/19/2025 12:00PM Room 217 Conference Room."
1964959,2025-02-19,Senate,5,"Subcommittee recommends passage."
1964959,2025-03-03,Senate,6,"Committee report approving bill, renumbered as SF 498."
1964970,2025-02-11,House,1,"Introduced, referred to Judiciary. H.J. 284."
1964970,2025-02-12,House,2,"Subcommittee: Wills, J., Olson and Stone. H.J. 308."
1964970,2025-02-13,House,3,"Subcommittee Meeting: 02/17/2025 12:30PM House Lounge 2."
1964970,2025-02-17,House,4,"Tabled until future meeting."
1964979,2025-02-11,Senate,1,"Introduced, placed on calendar. S.J. 238."
1964979,2025-02-11,Senate,2,"Committee report, approving bill. S.J. 245."
1964979,2025-03-19,Senate,3,"Passed Senate, yeas 47, nays 0. S.J. 574."
1964979,2025-03-19,Senate,4,"Immediate message. S.J. 577."
1964979,2025-03-19,House,5,"Message from Senate. H.J. 723."
1964979,2025-03-19,House,6,"Read first time, referred to Natural Resources. H.J. 749."
1964979,2025-03-27,House,7,"Subcommittee: Mommsen, Gearhart and Kurth. H.J. 867."
1964979,2025-03-27,House,8,"Subcommittee Meeting: 04/01/2025 8:00AM House Lounge."
1964979,2025-04-01,House,9,"Subcommittee recommends passage."
1964979,2025-04-01,House,10,"Committee report, recommending passage. H.J. 887."
1964979,2025-04-01,House,11,"Committee vote: Yeas, 17. Nays, 4. H.J. 887."
1964979,2025-04-02,House,12,"Placed on calendar. H.J. 887."
1964979,2025-04-10,House,13,"Placed on calendar under unfinished business. H.J. 928."
1964979,2025-05-15,House,14,"Rereferred to Natural Resources. H.J. 1222."
1964988,2025-02-11,House,1,"By COMMITTEE ON HEALTH AND HUMAN SERVICES"
1964988,2025-02-11,House,2,"Introduced, referred to Health and Human Services. H.J. 287."
1964988,2025-02-11,House,3,"Subcommittee: Wilz, H., Johnson, R. and Nordman. H.J. 292."
1964988,2025-02-11,House,4,"Subcommittee Meeting: 02/17/2025 1:00PM House Lounge."
1964988,2025-02-13,House,5,"Subcommittee reassigned: Wilz, H., Barker and Johnson, R. H.J. 332."
1964988,2025-02-17,House,6,"Subcommittee recommends passage."
1964988,2025-02-25,House,7,"Committee report, recommending amendment and passage. H.J. 432."
1964988,2025-02-25,House,8,"Committee vote: Yeas, 20. Nays, 0. Excused, 1. H.J. 432."
1964988,2025-02-28,House,9,"Committee report approving bill, renumbered as HF 638."
1964999,2025-02-11,House,1,"Introduced, referred to Public Safety. H.J. 285."
1965009,2025-02-11,House,1,"By COMMITTEE ON TRANSPORTATION"
1965009,2025-02-11,House,2,"Introduced, referred to Transportation. H.J. 287."
1965009,2025-02-11,House,3,"Subcommittee: Meggers, Cooling and Young. H.J. 292."
1965009,2025-02-17,House,4,"Subcommittee Meeting: 02/18/2025 12:15PM House Lounge."
1965009,2025-02-18,House,5,"Subcommittee recommends passage."
1965009,2025-02-19,House,6,"Committee report, recommending passage. H.J. 371."
1965009,2025-02-19,House,7,"Committee vote: Yeas, 14. Nays, 7. H.J. 371."
1965009,2025-02-20,House,8,"Committee report approving bill, renumbered as HF 525."
1965022,2025-02-11,House,1,"Introduced, referred to Veterans Affairs. H.J. 285."
1965022,2025-02-11,House,2,"Subcommittee: Sorensen, Blom and Turek. H.J. 291."
1965022,2025-02-11,House,3,"Subcommittee Meeting: 02/13/2025 8:15AM House Lounge."
1965022,2025-02-13,House,4,"Subcommittee recommends passage."
1965022,2025-02-19,House,5,"Committee report, recommending passage. H.J. 372."
1965022,2025-02-19,House,6,"Committee vote: Yeas, 16. Nays, 0. Excused, 1. H.J. 372."
1965022,2025-02-20,House,7,"Committee report approving bill, renumbered as HF 518."
1965026,2025-02-11,House,1,"Introduced, placed on calendar. H.J. 286."
1965026,2025-02-19,House,2,"Amendment H-1018 filed. H.J. 372."
1965026,2025-02-20,House,3,"Amendment H-1018 withdrawn. H.J. 390."
1965026,2025-02-20,House,4,"Passed House, yeas 92, nays 0. H.J. 390."
1965026,2025-02-20,House,5,"Immediate message. H.J. 401."
1965026,2025-02-24,Senate,6,"Message from House. S.J. 337."
1965026,2025-02-24,Senate,7,"Read first time, referred to Commerce. S.J. 337."
1965026,2025-03-05,Senate,8,"Subcommittee: Driscoll, Trone Garriott, and Warme. S.J. 421."
1965026,2025-03-11,Senate,9,"Subcommittee Meeting: 03/12/2025 2:30PM Senate Lounge."
1965026,2025-03-12,Senate,10,"Subcommittee recommends passage."
1965026,2025-04-02,Senate,11,"Committee report, recommending passage. S.J. 679."
1965026,2025-04-02,Senate,12,"Placed on calendar."
1965026,2025-04-10,Senate,13,"Placed on calendar under unfinished business. S.J. 757."
1965026,2025-04-21,Senate,14,"Passed Senate, yeas 45, nays 0. S.J. 840."
1965026,2025-04-21,Senate,15,"Immediate message. S.J. 842."
1965026,2025-04-21,House,16,"Message from Senate. H.J. 995."
1965026,2025-05-19,House,17,"Reported correctly enrolled, signed by Speaker and President, and sent to Governor. H.J. 1224."
1965026,2025-06-11,House,18,"Signed by Governor. H.J. 1225."
1965029,2025-02-11,House,1,"Introduced, referred to Natural Resources. H.J. 284."
1965046,2025-02-11,Senate,1,"By COMMITTEE ON WORKFORCE"
1965046,2025-02-11,Senate,2,"Introduced, referred to Workforce."
1965046,2025-02-12,Senate,3,"Subcommittee: Sires, Dotzler, and Pike."
1965046,2025-02-19,Senate,4,"Subcommittee Meeting: 02/20/2025 10:30AM Room 217 Conference Room."
1965046,2025-02-20,Senate,5,"Subcommittee recommends passage."
1965046,2025-02-25,Senate,6,"Committee report approving bill, renumbered as SF 466."
1965054,2025-02-11,Senate,1,"Introduced, referred to Education. S.J. 239."
1965054,2025-02-17,Senate,2,"Subcommittee: Evans, Donahue, and Kraayenbrink. S.J. 281."
1965067,2025-02-11,House,1,"By COMMITTEE ON EDUCATION"
1965067,2025-02-11,House,2,"Introduced, referred to Education. H.J. 287."
1965067,2025-02-11,House,3,"Subcommittee: Wheeler, Johnson, C. and Matson. H.J. 292."
1965067,2025-02-13,House,4,"Subcommittee Meeting: 02/18/2025 12:00PM RM 102."
1965067,2025-02-18,House,5,"Subcommittee recommends passage."
1965067,2025-02-27,House,6,"Committee report, recommending passage. H.J. 466."
1965067,2025-02-27,House,7,"Committee vote: Yeas, 23. Nays, 0. H.J. 466."
1965067,2025-03-05,House,8,"Committee report approving bill, renumbered as HF 787."
1965081,2025-02-11,Senate,1,"Introduced, referred to Local Government. S.J. 239."
1965081,2025-02-18,Senate,2,"Subcommittee: Driscoll, Webster, and Weiner. S.J. 302."
1965081,2025-03-05,Senate,3,"Subcommittee Meeting: 03/06/2025 8:00AM Senate Lounge."
1965081,2025-03-06,Senate,4,"Subcommittee recommends passage."
1965081,2025-03-10,Senate,5,"Committee report approving bill, renumbered as SF 580. S.J. 474."
1965093,2025-02-11,Senate,1,"Introduced, referred to Ways and Means. S.J. 241."
1965093,2025-02-18,Senate,2,"Subcommittee: Rowley, Koelker, and Townsend. S.J. 302."
1965093,2025-03-31,Senate,3,"Subcommittee Meeting: 04/02/2025 8:30AM Senate Lounge."
1965093,2025-04-02,Senate,4,"Subcommittee recommends passage."
1965104,2025-02-11,House,1,"By COMMITTEE ON COMMERCE"
1965104,2025-02-11,House,2,"Introduced, referred to Commerce. H.J. 288."
1965104,2025-02-11,House,3,"Subcommittee: Harris, Johnson, R. and Vondran. H.J. 292."
1965104,2025-02-13,House,4,"Subcommittee Meeting: 02/19/2025 8:00AM House Lounge 2."
1965104,2025-02-19,House,5,"Subcommittee recommends passage."
1965104,2025-02-25,House,6,"Committee report, recommending amendment and passage. H.J. 429."
1965104,2025-02-25,House,7,"Committee vote: Yeas, 22. Nays, 0. Excused, 1. H.J. 429."
1965104,2025-02-27,House,8,"Committee report approving bill, renumbered as HF 622."
1965121,2025-02-11,Senate,1,"Introduced, referred to Natural Resources and Environment. S.J. 241."
1965121,2025-02-17,Senate,2,"Subcommittee: Sweeney, Staed, and Zumbach. S.J. 271."
1965121,2025-02-24,Senate,3,"Subcommittee Meeting: 02/24/2025 3:45PM Senate Lounge."
1965121,2025-02-25,Senate,4,"Subcommittee recommends passage."
1965121,2025-03-06,Senate,5,"Committee report approving bill, renumbered as SF 546. S.J. 438."
1965133,2025-02-11,Senate,1,"By COMMITTEE ON TRANSPORTATION"
1965133,2025-02-11,Senate,2,"Introduced, referred to Transportation."
1965133,2025-02-24,Senate,3,"Subcommittee: Gruenhagen, Townsend, and Zumbach."
1965133,2025-02-26,Senate,4,"Subcommittee Meeting: 03/03/2025 12:00PM Room 217 Conference Room."
1965133,2025-03-03,Senate,5,"Subcommittee recommends amendment and passage."
1965133,2025-03-03,Senate,6,"Committee report approving bill, renumbered as SF 506."
1965145,2025-02-11,Senate,1,"Introduced, placed on calendar. S.J. 239."
1965145,2025-02-11,Senate,2,"Committee report, approving bill. S.J. 247."
1965145,2025-02-18,Senate,3,"Amendment S-3006 filed. S.J. 306."
1965145,2025-03-26,Senate,4,"Amendment S-3006 adopted. S.J. 647."
1965145,2025-03-26,Senate,5,"Passed Senate, yeas 40, nays 7. S.J. 647."
1965145,2025-03-26,Senate,6,"Immediate message. S.J. 649."
1965145,2025-03-26,House,7,"Message from Senate. H.J. 818."
1965145,2025-03-26,House,8,"Read first time, referred to Transportation. H.J. 850."
1965160,2025-02-11,Senate,1,"Introduced, referred to Judiciary. S.J. 240."
1965160,2025-02-17,Senate,2,"Subcommittee: Webster, Blake, and Reichman. S.J. 271."
1965160,2025-03-03,Senate,3,"Subcommittee Meeting: 03/04/2025 10:00AM Senate Lounge."
1965160,2025-03-04,Senate,4,"Subcommittee recommends passage."
1965160,2025-03-06,Senate,5,"Committee report, recommending passage. S.J. 437."
1965160,2025-03-06,Senate,6,"Placed on calendar."
1965160,2025-03-11,Senate,7,"Fiscal note."
1965160,2025-03-12,Senate,8,"Passed Senate, yeas 48, nays 0. S.J. 497."
1965160,2025-03-12,Senate,9,"Immediate message. S.J. 501."
1965160,2025-03-12,House,10,"Message from Senate. H.J. 636."
1965160,2025-03-12,House,11,"Read first time, passed on file. H.J. 637."
1965160,2025-03-18,House,12,"Placed on calendar under unfinished business. H.J. 682."
1965160,2025-03-19,House,13,"Substituted for HF 842. H.J. 728."
1965160,2025-03-19,House,14,"Passed House, yeas 96, nays 0. H.J. 728."
1965160,2025-03-19,House,15,"Immediate message. H.J. 748."
1965160,2025-03-20,Senate,16,"Message from House. S.J. 601."
1965160,2025-04-17,Senate,17,"Reported correctly enrolled, signed by President and Speaker, and sent to Governor. S.J. 829."
1965160,2025-04-18,Senate,18,"Signed by Governor. S.J. 845."
1965174,2025-02-11,Senate,1,"Introduced, referred to Ways and Means. S.J. 241."
1965174,2025-02-18,Senate,2,"Subcommittee: Dawson, Dotzler, and Klimesh. S.J. 302."
1965186,2025-02-11,House,1,"By COMMITTEE ON COMMERCE"
1965186,2025-02-11,House,2,"Introduced, referred to Commerce. H.J. 288."
1965186,2025-02-11,House,3,"Subcommittee: Lawler, Barker and Zabner. H.J. 292."
1965186,2025-02-13,House,4,"Subcommittee Meeting: 02/20/2025 12:00PM RM 19."
1965186,2025-02-20,House,5,"Subcommittee recommends passage."
1965200,2025-02-11,Senate,1,"Introduced, referred to Workforce. S.J. 240."
1965200,2025-02-12,Senate,2,"Subcommittee: Driscoll, Donahue, and Taylor. S.J. 256."
1965214,2025-02-11,House,1,"By COMMITTEE ON HEALTH AND HUMAN SERVICES"
1965214,2025-02-11,House,2,"Introduced, referred to Health and Human Services. H.J. 288."
1965214,2025-02-11,House,3,"Subcommittee: Wilz, H., Nordman and Turek. H.J. 292."
1965214,2025-02-17,House,4,"Subcommittee Meeting: 02/20/2025 11:30AM RM 304."
1965214,2025-02-20,House,5,"Subcommittee recommends passage."
1965214,2025-02-25,House,6,"Committee report, recommending amendment and passage. H.J. 432."
1965214,2025-02-25,House,7,"Committee vote: Yeas, 19. Nays, 0. Excused, 2. H.J. 432."
1965214,2025-03-07,House,8,"Committee report approving bill, renumbered as HF 833."
1965225,2025-02-11,House,1,"By COMMITTEE ON EDUCATION"
1965225,2025-02-11,House,2,"Introduced, referred to Education. H.J. 289."
1965225,2025-02-11,House,3,"Subcommittee: Hayes, Hora and Levin. H.J. 293."
1965225,2025-02-17,House,4,"Subcommittee Meeting: 02/18/2025 12:30PM RM 102."
1965225,2025-02-18,House,5,"Subcommittee recommends passage."
1965225,2025-03-04,House,6,"Committee report, recommending amendment and passage. H.J. 529."
1965225,2025-03-04,House,7,"Committee vote: Yeas, 23. Nays, 0. H.J. 529."
1965225,2025-03-07,House,8,"Committee report approving bill, renumbered as HF 891."
1965242,2025-02-11,House,1,"By COMMITTEE ON EDUCATION"
1965242,2025-02-11,House,2,"Introduced, referred to Education. H.J. 289."
1965242,2025-02-11,House,3,"Subcommittee: Fett, Boden and Levin. H.J. 293."
1965242,2025-02-18,House,4,"Subcommittee Meeting: 02/20/2025 8:30AM House Lounge."
1965242,2025-02-20,House,5,"Subcommittee recommends passage."
1965242,2025-03-04,House,6,"Committee report, recommending amendment and passage. H.J. 529."
1965242,2025-03-04,House,7,"Committee vote: Yeas, 14. Nays, 9. H.J. 529."
1965242,2025-03-12,House,8,"Committee report approving bill, renumbered as HF 929."
1965255,2025-02-11,House,1,"By COMMITTEE ON EDUCATION"
1965255,2025-02-11,House,2,"Introduced, referred to Education. H.J. 288."
1965255,2025-02-11,House,3,"Subcommittee: Stone, Gehlbach and Madison. H.J. 293."
1965255,2025-02-13,House,4,"Subcommittee Meeting: 02/18/2025 12:00PM RM 304."
1965255,2025-02-18,House,5,"Subcommittee recommends passage."
1965255,2025-02-27,House,6,"Committee report, recommending amendment and passage. H.J. 467."
1965255,2025-02-27,House,7,"Committe vote: Yeas, 16. Nays, 7. H.J. 467."
1965255,2025-03-07,House,8,"Committee report approving bill, renumbered as HF 856."
1965270,2025-02-11,House,1,"By COMMITTEE ON LOCAL GOVERNMENT"
1965270,2025-02-11,House,2,"Introduced, referred to Local Government. H.J. 288."
1965270,2025-02-11,House,3,"Subcommittee: Smith, Henderson and McBurney. H.J. 292."
1965270,2025-02-12,House,4,"Subcommittee Meeting: 02/19/2025 12:00PM House Lounge."
1965270,2025-02-19,House,5,"Subcommittee recommends passage."
1965270,2025-02-25,House,6,"Committee report, recommending passage. H.J. 435."
1965270,2025-02-25,House,7,"Committee vote: Yeas, 20. Nays, 0. Excused, 1. H.J. 436."
1965270,2025-02-28,House,8,"Committee report approving bill, renumbered as HF 651."
1965282,2025-02-11,House,1,"By COMMITTEE ON EDUCATION"
1965282,2025-02-11,House,2,"Introduced, referred to Education. H.J. 289."
1965282,2025-02-11,House,3,"Subcommittee: Ingels, Madison and Moore, T. H.J. 293."
1965282,2025-02-12,House,4,"Subcommittee Meeting: 02/13/2025 8:00AM RM 304.1."
1965282,2025-02-13,House,5,"Subcommittee recommends passage."
1965282,2025-02-18,House,6,"Committee report, recommending passage. H.J. 366."
1965282,2025-02-18,House,7,"Committee vote: Yeas, 22. Nays, 0. Excused, 1. H.J. 366."
1965282,2025-02-24,House,8,"Committee report approving bill, renumbered as HF 579."
1965297,2025-02-11,House,1,"By COMMITTEE ON HIGHER EDUCATION"
1965297,2025-02-11,House,2,"Introduced, referred to Higher Education. H.J. 288."
1965297,2025-02-11,House,3,"Subcommittee: Hora, Jacoby and Shipley. H.J. 292."
1965297,2025-02-18,House,4,"Subcommittee Meeting: 02/19/2025 12:30PM RM 103."
1965297,2025-02-19,House,5,"Subcommittee recommends passage."
1965297,2025-02-26,House,6,"Committee report, recommending passage. H.J. 443."
1965297,2025-02-26,House,7,"Committee vote: Yeas, 10. Nays, 1. H.J. 443."
1965297,2025-02-28,House,8,"Committee report approving bill, renumbered as HF 703."
1965310,2025-02-11,Senate,1,"Introduced, referred to Health and Human Services. S.J. 240."
1965310,2025-02-18,Senate,2,"Subcommittee: Klimesh, Celsi, and Costello. S.J. 302."
1965321,2025-02-11,Senate,1,"By COMMITTEE ON COMMERCE"
1965321,2025-02-11,Senate,2,"Introduced, referred to Commerce."
1965321,2025-02-11,Senate,3,"Subcommittee: Bousselot, Klimesh, Knox, Wahls, and Warme."
1965321,2025-02-12,Senate,4,"Subcommittee Meeting: 02/13/2025 11:00AM Room 315."
1965321,2025-02-13,Senate,5,"Subcommittee recommends passage."
1965321,2025-03-06,Senate,6,"Committee report approving bill, renumbered as SF 585."
1965334,2025-02-11,House,1,"By COMMITTEE ON COMMERCE"
1965334,2025-02-11,House,2,"Introduced, referred to Commerce. H.J. 288."
1965334,2025-02-11,House,3,"Subcommittee: Nordman, Johnson, R. and Latham. H.J. 292."
1965334,2025-02-24,House,4,"Subcommittee Meeting: 02/24/2025 1:30PM House Lounge (Cancelled)."
1965334,2025-02-24,House,5,"Subcommittee Meeting: 02/26/2025 11:45AM RM 304."
1965334,2025-02-26,House,6,"Subcommittee recommends amendment and passage."
1965334,2025-03-04,House,7,"Committee report, recommending amendment and passage. H.J. 525."
1965334,2025-03-04,House,8,"Committee vote: Yeas, 23. Nays, 0. H.J. 525."
1965334,2025-03-07,House,9,"Committee report approving bill, renumbered as HF 857."
1965350,2025-02-11,Senate,1,"Introduced, placed on calendar. S.J. 239."
1965350,2025-02-11,Senate,2,"Committee report, approving bill. S.J. 246."
1965350,2025-02-17,Senate,3,"Referred to Ways and Means. S.J. 275."
1965350,2025-02-19,Senate,4,"Subcommittee: Sweeney, Celsi, and Green. S.J. 314."
1965350,2025-03-11,Senate,5,"Subcommittee reassigned: Sweeney, Bisignano, and Green. S.J. 491."
1965350,2025-03-12,Senate,6,"Subcommittee Meeting: 03/12/2025 12:30PM Senate Lounge."
1965350,2025-03-12,Senate,7,"Subcommittee recommends passage."
1965350,2025-05-09,Senate,8,"Committee report approving bill, renumbered as SF 654. S.J. 956."
1965362,2025-02-11,Senate,1,"Introduced, referred to Education. S.J. 240."
1965362,2025-02-17,Senate,2,"Subcommittee: Salmon, Gruenhagen, and Zimmer. S.J. 281."
1965362,2025-02-19,Senate,3,"Subcommittee Meeting: 02/19/2025 4:00PM Room 315."
1965362,2025-02-20,Senate,4,"Subcommittee recommends passage."
1965362,2025-02-26,Senate,5,"Committee report approving bill, renumbered as SF 446. S.J. 369."
1965373,2025-02-11,Senate,1,"By COMMITTEE ON WORKFORCE"
1965373,2025-02-11,Senate,2,"Introduced, referred to Workforce."
1965373,2025-02-12,Senate,3,"Subcommittee: Pike, Donahue, and Sires."
1965373,2025-02-17,Senate,4,"Subcommittee Meeting: 02/18/2025 2:00PM Senate Lounge."
1965373,2025-02-18,Senate,5,"Subcommittee recommends amendment and passage."
1965388,2025-02-11,Senate,1,"Introduced, referred to Commerce. S.J. 240."
1965388,2025-02-18,Senate,2,"Subcommittee: Klimesh, Knox, and Zumbach. S.J. 302."
1965388,2025-02-19,Senate,3,"Subcommittee Meeting: 02/20/2025 12:00PM Senate Lounge."
1965388,2025-02-20,Senate,4,"Subcommittee recommends amendment and passage."
1965401,2025-02-11,House,1,"By COMMITTEE ON COMMERCE"
1965401,2025-02-11,House,2,"Introduced, referred to Commerce. H.J. 288."
1965401,2025-02-11,House,3,"Subcommittee: Lundgren, Harris and Scheetz. H.J. 292."
1965401,2025-02-12,House,4,"Subcommittee Meeting: 02/18/2025 12:00PM RM 19."
1965401,2025-02-18,House,5,"Subcommittee recommends passage."
1965401,2025-02-25,House,6,"Committee report, recommending passage. H.J. 429."
1965401,2025-02-25,House,7,"Committee vote: Yeas, 19. Nays, 3. Excused, 1. H.J. 429."
1965401,2025-03-05,House,8,"Committee report approving bill, renumbered as HF 781."
1965488,2025-02-11,Senate,1,"Introduced, referred to Local Government. S.J. 241."
1965488,2025-02-18,Senate,2,"Subcommittee: Klimesh, Sires, and Wahls. S.J. 302."
1965551,2025-02-11,House,1,"By COMMITTEE ON JUDICIARY"
1965551,2025-02-11,House,2,"Introduced, referred to Judiciary. H.J. 289."
1965551,2025-02-11,House,3,"Subcommittee: Gustoff, Croken and Thomson, C. H.J. 293."
1965551,2025-02-13,House,4,"Subcommittee Meeting: 02/17/2025 11:30AM House Lounge."
1965551,2025-02-17,House,5,"Subcommittee recommends passage."
1965617,2025-02-11,House,1,"By COMMITTEE ON JUDICIARY"
1965617,2025-02-11,House,2,"Introduced, referred to Judiciary. H.J. 289."
1965617,2025-02-11,House,3,"Subcommittee: Lohse, Croken and Dunwell. H.J. 293."
1965617,2025-02-13,House,4,"Subcommittee Meeting: 02/19/2025 12:30PM House Lounge."
1965617,2025-02-19,House,5,"Subcommittee recommends passage."
1965682,2025-02-11,House,1,"By COMMITTEE ON JUDICIARY"
1965682,2025-02-11,House,2,"Introduced, referred to Judiciary. H.J. 289."
1965682,2025-02-11,House,3,"Subcommittee: Thompson, M., Srinivas and Wills, J. H.J. 293."
1965682,2025-02-13,House,4,"Subcommittee Meeting: 02/17/2025 12:00PM House Lounge 2."
1965682,2025-02-17,House,5,"Tabled until future meeting."
1965745,2025-02-11,Senate,1,"Introduced, referred to State Government. S.J. 241."
1965745,2025-02-20,Senate,2,"Subcommittee: Webster, Bousselot, and Townsend. S.J. 326."
1965745,2025-02-24,Senate,3,"Subcommittee Meeting: 02/26/2025 3:30PM Senate Lounge."
1965745,2025-03-03,Senate,4,"Subcommittee recommends amendment and passage."
1965978,2025-02-12,House,1,"Introduced, referred to Education. H.J. 301."
1965992,2025-02-12,House,1,"Introduced, referred to State Government. H.J. 306."
1965992,2025-03-03,House,2,"Subcommittee: Jones, Bossman and Scheetz. H.J. 487."
1965992,2025-03-03,House,3,"Subcommittee Meeting: 03/04/2025 12:15PM RM 304.1."
1965992,2025-03-04,House,4,"Subcommittee recommends passage."
1965992,2025-03-06,House,5,"Committee report, recommending passage. H.J. 555."
1965992,2025-03-06,House,6,"Committee vote: Yeas, 14. Nays, 7. Excused, 2. H.J. 555."
1965992,2025-03-12,House,7,"Committee report approving bill, renumbered as HF 955."
1966006,2025-02-12,House,1,"Introduced, referred to Health and Human Services. H.J. 304."
1966018,2025-02-12,House,1,"Introduced, referred to Public Safety. H.J. 304."
1966018,2025-02-18,House,2,"Subcommittee: Dieken, Gearhart and Meyer, B. H.J. 349."
1966018,2025-02-24,House,3,"Subcommittee Meeting: 02/25/2025 8:00AM RM 102 (Cancelled)."
1966034,2025-02-12,House,1,"Introduced, referred to Health and Human Services. H.J. 302."
1966034,2025-02-17,House,2,"Subcommittee: Bradley, Jeneary and Turek. H.J. 341."
1966034,2025-02-19,House,3,"Subcommittee Meeting: 02/20/2025 1:00PM House Lounge."
1966034,2025-02-20,House,4,"Subcommittee recommends passage."
1966034,2025-02-25,House,5,"Committee report, recommending passage. H.J. 430."
1966034,2025-02-25,House,6,"Committee vote: Yeas, 19. Nays, 0. Excused, 2. H.J. 430."
1966034,2025-02-28,House,7,"Committee report approving bill, renumbered as HF 648."
1966034,2025-03-14,House,8,"Withdrawn. H.J. 660."
1966053,2025-02-12,House,1,"Introduced, referred to Education. H.J. 301."
1966053,2025-02-17,House,2,"Subcommittee: Bradley, Kurth and Weldon. H.J. 341."
1966053,2025-02-18,House,3,"Subcommittee Meeting: 02/24/2025 12:00PM House Lounge."
1966053,2025-02-24,House,4,"Subcommittee recommends passage."
1966064,2025-02-12,House,1,"Introduced, referred to Health and Human Services. H.J. 303."
1966080,2025-02-12,House,1,"Introduced, referred to Health and Human Services. H.J. 302."
1966097,2025-02-12,House,1,"Introduced, referred to Public Safety. H.J. 306."
1966097,2025-02-12,House,2,"Subcommittee: Thomson, C., Meyer, B. and Wengryn. H.J. 308."
1966097,2025-02-17,House,3,"Subcommittee Meeting: 02/20/2025 12:30PM RM 304."
1966097,2025-02-20,House,4,"Subcommittee recommends passage."
1966097,2025-02-26,House,5,"Committee report, recommending passage. H.J. 444."
1966097,2025-02-26,House,6,"Committee vote: Yeas, 17. Nays, 5. Excused, 1. H.J. 444."
1966097,2025-03-05,House,7,"Committee report approving bill, renumbered as HF 792."
1966097,2025-03-31,House,8,"Withdrawn. H.J. 871."
1966114,2025-02-12,House,1,"Introduced, referred to Public Safety. H.J. 304."
1966128,2025-02-12,Senate,1,"Introduced, placed on calendar. S.J. 251."
1966128,2025-02-12,Senate,2,"Committee report, approving bill. S.J. 257."
1966128,2025-02-18,Senate,3,"Passed Senate, yeas 46, nays 0. S.J. 291."
1966128,2025-02-18,Senate,4,"Immediate message. S.J. 292."
1966128,2025-02-19,House,5,"Message from Senate. H.J. 356."
1966128,2025-02-20,House,6,"Read first time, passed on file. H.J. 378."
1966128,2025-03-04,House,7,"Substituted for HF 514. H.J. 496."
1966128,2025-03-04,House,8,"Passed House, yeas 95, nays 0. H.J. 496."
1966128,2025-03-10,House,9,"Explanation of vote. H.J. 590."
1966128,2025-03-04,House,10,"Immediate message. H.J. 498."
1966128,2025-03-05,Senate,11,"Message from House. S.J. 413."
1966128,2025-05-19,Senate,12,"Reported correctly enrolled, signed by President and Speaker, and sent to Governor. S.J. 1050."
1966128,2025-05-27,Senate,13,"Signed by Governor. S.J. 1051."
1966144,2025-02-12,House,1,"Introduced, referred to Health and Human Services. H.J. 303."
1966156,2025-02-12,House,1,"Introduced, placed on calendar. H.J. 306."
1966156,2025-03-10,House,2,"Amendment H-1048 filed. H.J. 591."
1966156,2025-03-11,House,3,"Amendment H-1048 adopted. H.J. 596."
1966156,2025-03-11,House,4,"Passed House, yeas 91, nays 0. H.J. 596."
1966156,2025-03-12,House,5,"Explanation of vote. H.J. 638."
1966156,2025-03-19,House,6,"Explanation of vote. H.J. 751."
1966156,2025-03-11,House,7,"Immediate message. H.J. 607."
1966156,2025-03-12,Senate,8,"Message from House. S.J. 494."
1966156,2025-03-12,Senate,9,"Read first time, referred to Judiciary. S.J. 494."
1966156,2025-03-18,Senate,10,"Subcommittee: Shipley, Petersen, and Rowley. S.J. 567."
1966156,2025-03-24,Senate,11,"Subcommittee Meeting: 03/25/2025 1:30PM Senate Lounge."
1966156,2025-03-25,Senate,12,"Subcommittee recommends passage."
1966156,2025-04-03,Senate,13,"Committee report, recommending passage. S.J. 693."
1966156,2025-04-03,Senate,14,"Placed on calendar."
1966156,2025-04-09,Senate,15,"Amendment S-3091 filed, lost. S.J. 749."
1966156,2025-04-09,Senate,16,"Passed Senate, yeas 47, nays 0. S.J. 749."
1966156,2025-04-09,Senate,17,"Immediate message. S.J. 753."
1966156,2025-04-10,House,18,"Message from Senate. H.J. 925."
1966156,2025-04-17,House,19,"Reported correctly enrolled, signed by Speaker and President, and sent to Governor. H.J. 989."
1966156,2025-04-18,House,20,"Signed by Governor. H.J. 1011."
1966168,2025-02-12,Senate,1,"Introduced, placed on calendar. S.J. 251."
1966168,2025-02-12,Senate,2,"Committee report, approving bill. S.J. 257."
1966168,2025-03-10,Senate,3,"Amendment S-3019 filed, lost. S.J. 447."
1966168,2025-03-10,Senate,4,"Passed Senate, yeas 47, nays 0. S.J. 448."
1966168,2025-03-10,Senate,5,"Immediate message. S.J. 448."
1966168,2025-03-10,House,6,"Message from Senate. H.J. 589."
1966168,2025-03-11,House,7,"Read first time, referred to Education. H.J. 594."
1966168,2025-03-20,House,8,"Subcommittee: Hayes, Ehlert and Gehlbach. H.J. 767."
1966168,2025-03-24,House,9,"Subcommittee Meeting: 03/25/2025 8:30AM House Lounge."
1966168,2025-03-25,House,10,"Subcommittee recommends passage."
1966168,2025-04-01,House,11,"Committee report, recommending passage. H.J. 884."
1966168,2025-04-01,House,12,"Committee vote: Yeas, 21. Nays, 2. H.J. 884."
1966168,2025-04-02,House,13,"Placed on calendar. H.J. 884."
1966168,2025-04-10,House,14,"Placed on calendar under unfinished business. H.J. 928."
1966168,2025-04-17,House,15,"Passed House, yeas 93, nays 0. H.J. 962."
1966168,2025-04-24,House,16,"Explanation of vote. H.J. 1070."
1966168,2025-04-17,House,17,"Immediate message. H.J. 985."
1966168,2025-04-21,Senate,18,"Message from House. S.J. 830."
1966168,2025-05-06,Senate,19,"Reported correctly enrolled, signed by President and Speaker, and sent to Governor. S.J. 942."
1966168,2025-05-06,Senate,20,"Signed by Governor. S.J. 943."
1966188,2025-02-12,House,1,"Introduced, referred to Ways and Means. H.J. 305."
1966200,2025-02-12,House,1,"Introduced, referred to Health and Human Services. H.J. 306."
1966200,2025-02-17,House,2,"Subcommittee: Wilz, H., Gehlbach and Turek. H.J. 341."
1966200,2025-02-17,House,3,"Subcommittee Meeting: 02/20/2025 12:00PM RM 304.1."
1966200,2025-02-20,House,4,"Subcommittee recommends passage."
1966200,2025-02-25,House,5,"Committee report, recommending amendment and passage. H.J. 431."
1966200,2025-02-25,House,6,"Committee vote: Yeas, 19. Nays, 0. Excused, 2. H.J. 431."
1966200,2025-03-03,House,7,"Committee report approving bill, renumbered as HF 707."
1966218,2025-02-12,House,1,"Introduced, referred to Transportation. H.J. 305."
1966234,2025-02-12,House,1,"Introduced, referred to Health and Human Services. H.J. 302."
1966248,2025-02-12,House,1,"Introduced, referred to Labor and Workforce. H.J. 304."
1966265,2025-02-12,House,1,"Introduced, referred to Health and Human Services. H.J. 302."
1966265,2025-02-26,House,2,"Sponsor added, Young. H.J. 440."
1966279,2025-02-12,Senate,1,"Introduced, placed on calendar. S.J. 251."
1966279,2025-02-12,Senate,2,"Committee report, approving bill. S.J. 256."
1966279,2025-02-25,Senate,3,"Passed Senate, yeas 41, nays 0. S.J. 346."
1966279,2025-02-25,Senate,4,"Immediate message. S.J. 349."
1966279,2025-02-26,House,5,"Message from Senate. H.J. 437."
1966279,2025-03-05,House,6,"Read first time, passed on file. H.J. 522."
1966279,2025-04-03,House,7,"Placed on calendar under unfinished business. H.J. 894."
1966279,2025-04-08,House,8,"Substituted for HF 771. H.J. 908."
1966279,2025-04-08,House,9,"Passed House, yeas 96, nays 0. H.J. 909."
1966279,2025-04-24,House,10,"Explanation of vote. H.J. 1069."
1966279,2025-04-08,House,11,"Immediate message. H.J. 917."
1966279,2025-04-08,Senate,12,"Message from House. S.J. 732."
1966279,2025-05-02,Senate,13,"Reported correctly enrolled, signed by President and Speaker, and sent to Governor. S.J. 938."
1966279,2025-05-02,Senate,14,"Signed by Governor. S.J. 938."
1966293,2025-02-12,House,1,"Introduced, referred to Ways and Means. H.J. 305."
1966293,2025-02-26,House,2,"Subcommittee: Jones, Behn and Judge. H.J. 441."
1966293,2025-03-04,House,3,"Subcommittee Meeting: 03/11/2025 8:30AM House Lounge."
1966293,2025-03-11,House,4,"Tabled until future meeting."
1966314,2025-02-12,House,1,"Introduced, referred to Education. H.J. 301."
1966314,2025-02-17,House,2,"Subcommittee: Henderson, Behn and Kurth. H.J. 341."
1966314,2025-02-18,House,3,"Subcommittee Meeting: 02/19/2025 3:30PM RM 304."
1966314,2025-02-19,House,4,"Subcommittee recommends passage."
1966330,2025-02-12,House,1,"Introduced, referred to State Government. H.J. 304."
1966347,2025-02-12,House,1,"Introduced, referred to Education. H.J. 301."
1966347,2025-02-17,House,2,"Subcommittee: Kniff McCulla, Hayes and Levin. H.J. 341."
1966347,2025-02-19,House,3,"Subcommittee Meeting: 02/25/2025 12:30PM RM 19."
1966347,2025-02-25,House,4,"Subcommittee recommends passage."
1966347,2025-03-04,House,5,"Committee report, recommending amendment and passage. H.J. 527."
1966347,2025-03-04,House,6,"Committee vote: Yeas, 14. Nays, 9. H.J. 527."
1966347,2025-03-07,House,7,"Committee report approving bill, renumbered as HF 884."
1966347,2025-03-31,House,8,"Withdrawn. H.J. 871."
1966361,2025-02-12,Senate,1,"Introduced, placed on calendar. S.J. 251."
1966361,2025-02-12,Senate,2,"Committee report, approving bill. S.J. 262."
1966361,2025-02-24,Senate,3,"Attached to HF 250. S.J. 336."
1966361,2025-02-25,Senate,4,"HF 250 substituted. S.J. 347."
1966361,2025-02-25,Senate,5,"Withdrawn. S.J. 347."
1966374,2025-02-12,House,1,"Introduced, referred to Ways and Means. H.J. 305."
1966389,2025-02-12,Senate,1,"Introduced, placed on calendar. S.J. 250."
1966389,2025-02-12,Senate,2,"Committee report, approving bill. S.J. 256."
1966389,2025-03-19,Senate,3,"Passed Senate, yeas 45, nays 2. S.J. 574."
1966389,2025-03-19,Senate,4,"Immediate message. S.J. 577."
1966389,2025-03-19,House,5,"Message from Senate. H.J. 723."
1966389,2025-03-19,House,6,"Read first time, passed on file. H.J. 749."
1966389,2025-04-03,House,7,"Placed on calendar under unfinished business. H.J. 894."
1966389,2025-05-15,House,8,"Rereferred to Education. H.J. 1221."
1966406,2025-02-12,House,1,"Introduced, referred to Judiciary. H.J. 303."
1966406,2025-02-20,House,2,"Subcommittee: Gustoff, Lohse and Wilburn. H.J. 406."
1966406,2025-02-25,House,3,"Subcommittee reassigned: Gustoff, Wheeler and Wilburn. H.J. 427."
1966406,2025-02-25,House,4,"Subcommittee Meeting: 02/26/2025 11:00AM RM 304.1."
1966406,2025-02-26,House,5,"Subcommittee recommends passage."
1966406,2025-03-04,House,6,"Committee report, recommending amendment and passage. H.J. 506."
1966406,2025-03-04,House,7,"Committee vote: Yeas, 20. Nays, 0. Excused, 1. H.J. 506."
1966406,2025-03-06,House,8,"Committee report approving bill, renumbered as HF 824."
1966427,2025-02-12,House,1,"Introduced, referred to Education. H.J. 301."
1966427,2025-02-17,House,2,"Subcommittee: Wheeler, Gjerde and Ingels. H.J. 340."
1966427,2025-02-18,House,3,"Subcommittee Meeting: 02/19/2025 3:00PM RM 102."
1966427,2025-02-19,House,4,"Subcommittee recommends passage."
1966427,2025-02-27,House,5,"Committee report, recommending amendment and passage. H.J. 465."
1966427,2025-02-27,House,6,"Committee vote: Yeas, 23. Nays, 0. H.J. 465."
1966427,2025-03-05,House,7,"Committee report approving bill, renumbered as HF 783."
1966427,2025-03-14,House,8,"Withdrawn. H.J. 660."
1966441,2025-02-12,Senate,1,"By COMMITTEE ON COMMERCE"
1966441,2025-02-12,Senate,2,"Introduced, referred to Commerce."
1966441,2025-02-12,Senate,3,"Subcommittee: Bousselot, Knox, and Webster."
1966456,2025-02-12,House,1,"Introduced, referred to Judiciary. H.J. 305."
1966471,2025-02-12,House,1,"Introduced, referred to Education. H.J. 301."
1966471,2025-02-17,House,2,"Subcommittee: Behn, Boden and Ehlert. H.J. 341."
1966471,2025-02-20,House,3,"Subcommittee Meeting: 02/25/2025 12:00PM RM 103."
1966471,2025-02-25,House,4,"Subcommittee recommends passage."
1966488,2025-02-12,House,1,"Introduced, referred to Health and Human Services. H.J. 303."
1966505,2025-02-12,House,1,"Introduced, referred to State Government. H.J. 304."
1966521,2025-02-12,House,1,"Introduced, referred to Health and Human Services. H.J. 303."
1966536,2025-02-12,House,1,"Introduced, referred to Ways and Means. H.J. 305."
1966550,2025-02-12,House,1,"Introduced, referred to Ways and Means. H.J. 305."
1966562,2025-02-12,House,1,"Introduced, referred to Health and Human Services. H.J. 302."
1966562,2025-02-17,House,2,"Subcommittee: Jeneary, Bradley and Turek. H.J. 341."
1966562,2025-02-18,House,3,"Subcommittee Meeting: 02/25/2025 8:00AM RM 304."
1966562,2025-02-25,House,4,"Subcommittee recommends passage."
1966562,2025-03-03,House,5,"Committee report, recommending passage. H.J. 504."
1966562,2025-03-03,House,6,"Committee vote: Yeas, 20. Nays, 0. Excused, 1. H.J. 504."
1966562,2025-03-05,House,7,"Committee report approving bill, renumbered as HF 805."
1966562,2025-03-21,House,8,"Withdrawn. H.J. 772."
1966581,2025-02-12,House,1,"Introduced, referred to Health and Human Services. H.J. 302."
1966596,2025-02-12,House,1,"Introduced, referred to State Government. H.J. 304."
1966596,2025-02-13,House,2,"Subcommittee: Wulf, Harris and Zabner. H.J. 331."
1966596,2025-02-18,House,3,"Subcommittee Meeting: 02/19/2025 12:30PM RM 102."
1966596,2025-02-19,House,4,"Subcommittee recommends passage."
1966613,2025-02-12,House,1,"Introduced, placed on calendar. H.J. 306."
1966613,2025-03-10,House,2,"Amendment H-1049 filed. H.J. 591."
1966613,2025-03-11,House,3,"Amendment H-1049 adopted. H.J. 597."
1966613,2025-03-11,House,4,"Passed House, yeas 91, nays 0. H.J. 597."
1966613,2025-03-12,House,5,"Explanation of vote. H.J. 638."
1966613,2025-03-19,House,6,"Explanation of vote. H.J. 751."
1966613,2025-03-11,House,7,"Immediate message. H.J. 607."
1966613,2025-03-12,Senate,8,"Message from House. S.J. 494."
1966613,2025-03-12,Senate,9,"Read first time, attached to SF 287. S.J. 494."
1966613,2025-04-03,Senate,10,"Placed on calendar under unfinished business. S.J. 688."
1966613,2025-04-08,Senate,11,"Substituted for SF 287. S.J. 722."
1966613,2025-04-08,Senate,12,"Passed Senate, yeas 47, nays 1. S.J. 722."
1966613,2025-04-08,Senate,13,"Immediate message. S.J. 727."
1966613,2025-04-09,House,14,"Message from Senate. H.J. 919."
1966613,2025-04-17,House,15,"Reported correctly enrolled, signed by President and Speaker, and sent to Governor. H.J. 989."
1966613,2025-04-18,House,16,"Signed by Governor. H.J. 1011."
1966627,2025-02-12,Senate,1,"Introduced, placed on calendar. S.J. 251."
1966627,2025-02-12,Senate,2,"Committee report, approving bill. S.J. 256."
1966627,2025-06-16,Senate,3,"Referred to Education. S.J. 1057."
1966643,2025-02-12,House,1,"Introduced, referred to Labor and Workforce. H.J. 303."
1966656,2025-02-12,House,1,"By COMMITTEE ON LOCAL GOVERNMENT"
1966656,2025-02-12,House,2,"Introduced, referred to Local Government. H.J. 307."
1966656,2025-02-12,House,3,"Subcommittee: Jones, Latham and Zabner. H.J. 309."
1966656,2025-02-17,House,4,"Subcommittee Meeting: 02/18/2025 12:00PM House Lounge 2 (Cancelled)."
1966656,2025-02-18,House,5,"Subcommittee Meeting: 02/26/2025 12:30PM House Lounge."
1966656,2025-02-26,House,6,"Subcommittee recommends amendment and passage."
1966656,2025-03-05,House,7,"Committee report, recommending amendment and passage. H.J. 552."
1966656,2025-03-05,House,8,"Committee vote: Yeas, 16. Nays, 1. Excused, 4. H.J. 552."
1966656,2025-03-12,House,9,"Committee report approving bill, renumbered as HF 947."
1967000,2025-02-12,Senate,1,"Introduced, placed on calendar. S.J. 253."
1967000,2025-02-12,Senate,2,"Committee report, approving bill. S.J. 258."
1967000,2025-03-19,Senate,3,"Amendment S-3031 filed, adopted. S.J. 575."
1967000,2025-03-19,Senate,4,"Passed Senate, yeas 47, nays 0. S.J. 575."
1967000,2025-03-19,Senate,5,"Immediate message. S.J. 577."
1967000,2025-03-19,House,6,"Message from Senate. H.J. 723."
1967000,2025-03-20,House,7,"Read first time, referred to Education. H.J. 753."
1967000,2025-03-27,House,8,"Subcommittee: Henderson, Ehlert and Kniff McCulla. H.J. 867."
1967000,2025-03-27,House,9,"Subcommittee Meeting: 04/01/2025 8:30AM House Lounge 2."
1967000,2025-04-01,House,10,"Subcommittee recommends passage."
1967000,2025-04-01,House,11,"Committee report, recommending passage. H.J. 884."
1967000,2025-04-01,House,12,"Committee vote: Yeas, 22. Nays, 1. H.J. 884."
1967000,2025-04-02,House,13,"Placed on calendar. H.J. 884."
1967000,2025-04-10,House,14,"Placed on calendar under unfinished business. H.J. 928."
1967000,2025-04-16,House,15,"Amendment H-1238 filed. H.J. 950."
1967000,2025-04-17,House,16,"Amendment H-1251 filed. H.J. 993."
1967000,2025-04-21,House,17,"Amendment H-1263 filed. H.J. 1013."
1967000,2025-04-22,House,18,"Point of order raised on amendment H-1251, ruled not germane. H.J. 1029."
1967000,2025-04-22,House,19,"Motion to suspend rules for immediate consideration of amendment H-1251, yeas 30, nays 60. H.J. 1030."
1967000,2025-04-22,House,20,"Motion to suspend rules failed. H.J. 1030."
1967000,2025-04-22,House,21,"Amendment H-1263 to amendment H-1238 adopted. H.J. 1031."
1967000,2025-04-22,House,22,"Amendment H-1238 adopted, as amended. H.J. 1031."
1967000,2025-04-22,House,23,"Passed House, yeas 92, nays 0. H.J. 1031."
1967000,2025-04-22,House,24,"Immediate message. H.J. 1033."
1967000,2025-04-23,Senate,25,"Message from House, with amendment S-3126. S.J. 861."
1967000,2025-04-28,Senate,26,"Senate concurred with S-3126. S.J. 908."
1967000,2025-04-28,Senate,27,"Passed Senate, yeas 49, nays 0. S.J. 908."
1967000,2025-04-28,Senate,28,"Immediate message. S.J. 908."
1967000,2025-04-29,House,29,"Message from Senate. H.J. 1075."
1967000,2025-05-19,Senate,30,"Reported correctly enrolled, signed by President and Speaker, and sent to Governor. S.J. 1050."
1967000,2025-06-06,Senate,31,"Signed by Governor. S.J. 1051."
1967024,2025-02-12,Senate,1,"Introduced, placed on calendar. S.J. 252."
1967024,2025-02-12,Senate,2,"Committee report, approving bill. S.J. 260."
1967024,2025-02-17,Senate,3,"Referred to Ways and Means. S.J. 275."
1967024,2025-02-19,Senate,4,"Subcommittee: Bousselot, Bisignano, and Schultz. S.J. 314."
1967024,2025-03-31,Senate,5,"Subcommittee Meeting: 04/01/2025 10:30AM Room 217 Conference Room."
1967024,2025-04-01,Senate,6,"Subcommittee recommends passage."
1967024,2025-04-17,Senate,7,"Committee report approving bill, renumbered as SF 629. S.J. 828."
1967043,2025-02-12,Senate,1,"Introduced, placed on calendar. S.J. 253."
1967043,2025-02-12,Senate,2,"Committee report, approving bill. S.J. 258."
1967043,2025-02-17,Senate,3,"Referred to Appropriations. S.J. 275."
1967043,2025-02-18,Senate,4,"Subcommittee: Green, Koelker, and Winckler. S.J. 302."
1967043,2025-03-11,Senate,5,"Subcommittee Meeting: 03/12/2025 3:00PM Room 217 Conference Room."
1967043,2025-03-12,Senate,6,"Subcommittee recommends passage."
1967069,2025-02-12,Senate,1,"Introduced, placed on calendar. S.J. 252."
1967069,2025-02-12,Senate,2,"Committee report, approving bill. S.J. 257."
1967069,2025-02-17,Senate,3,"Referred to Appropriations. S.J. 275."
1967069,2025-02-18,Senate,4,"Subcommittee: Green, Sires, and Winckler. S.J. 302."
1967094,2025-02-12,Senate,1,"Introduced, referred to Natural Resources and Environment. S.J. 252."
1967094,2025-02-17,Senate,2,"Subcommittee: Zumbach, De Witt, and Zimmer. S.J. 281."
1967115,2025-02-12,House,1,"By COMMITTEE ON TRANSPORTATION"
1967115,2025-02-12,House,2,"Introduced, referred to Transportation. H.J. 308."
1967115,2025-02-12,House,3,"Subcommittee: Jeneary, Cooling and Golding. H.J. 309."
1967115,2025-02-13,House,4,"Subcommittee Meeting: 02/14/2025 8:00AM RM 304 (Cancelled)."
1967115,2025-02-13,House,5,"Subcommittee Meeting: 02/18/2025 8:00AM RM 304."
1967115,2025-02-18,House,6,"Subcommittee recommends passage."
1967115,2025-02-19,House,7,"Committee report, recommending passage. H.J. 372."
1967115,2025-02-19,House,8,"Committee vote: Yeas, 21. Nays, 0. H.J. 372."
1967115,2025-02-20,House,9,"Committee report approving bill, renumbered as HF 531."
1967136,2025-02-12,Senate,1,"Introduced, placed on calendar. S.J. 254."
1967136,2025-02-12,Senate,2,"Committee report, approving bill. S.J. 261."
1967136,2025-03-07,Senate,3,"Fiscal note."
1967136,2025-03-10,Senate,4,"Passed Senate, yeas 33, nays 14. S.J. 449."
1967136,2025-03-10,Senate,5,"Immediate message. S.J. 451."
1967136,2025-03-10,House,6,"Message from Senate. H.J. 589."
1967136,2025-03-11,House,7,"Read first time, passed on file. H.J. 594."
1967136,2025-03-14,House,8,"Referred to Appropriations. Attached to House File 846. H.J. 660."
1967136,2025-03-27,House,9,"Subcommittee: Lawler, Mohr, G. and Nielsen. H.J. 868."
1967136,2025-03-31,House,10,"Subcommittee Meeting: 04/01/2025 12:00PM RM 19 (Cancelled)."
1967158,2025-02-12,House,1,"By COMMITTEE ON JUDICIARY"
1967158,2025-02-12,House,2,"Introduced, referred to Judiciary. H.J. 308."
1967158,2025-02-12,House,3,"Subcommittee: Stone, James and Wills, J. H.J. 309."
1967158,2025-02-20,House,4,"Subcommittee Meeting: 02/20/2025 8:00AM House Lounge 2 (Cancelled)."
1967185,2025-02-12,Senate,1,"Introduced, referred to Judiciary. S.J. 253."
1967185,2025-02-17,Senate,2,"Subcommittee: Bousselot, Blake, and Webster. S.J. 281."
1967185,2025-02-24,Senate,3,"Subcommittee Meeting: 02/25/2025 1:30PM Room 217 Conference Room."
1967185,2025-02-25,Senate,4,"Subcommittee recommends passage."
1967209,2025-02-12,House,1,"By COMMITTEE ON JUDICIARY"
1967209,2025-02-12,House,2,"Introduced, referred to Judiciary. H.J. 307."
1967209,2025-02-12,House,3,"Subcommittee: Lawler, James and Nordman. H.J. 309."
1967209,2025-02-17,House,4,"Subcommittee reassigned: Lawler, Meyer, B. and Nordman. H.J. 342."
1967209,2025-02-17,House,5,"Subcommittee Meeting: 02/20/2025 2:00PM House Lounge."
1967209,2025-02-20,House,6,"Subcommittee recommends passage."
1967233,2025-02-12,Senate,1,"Introduced, placed on calendar. S.J. 253."
1967233,2025-02-12,Senate,2,"Committee report, approving bill. S.J. 260."
1967233,2025-02-18,Senate,3,"Fiscal note."
1967233,2025-03-11,Senate,4,"Amendment S-3021 filed. S.J. 493."
1967233,2025-03-24,Senate,5,"Amendment S-3021 adopted. S.J. 610."
1967233,2025-03-24,Senate,6,"Passed Senate, yeas 49, nays 0. S.J. 610."
1967233,2025-03-24,Senate,7,"Immediate message. S.J. 613."
1967233,2025-03-24,House,8,"Message from Senate. H.J. 777."
1967233,2025-03-24,House,9,"Read first time, referred to Judiciary. H.J. 778."
1967233,2025-03-25,House,10,"Fiscal note."
1967233,2025-03-28,House,11,"Subcommittee: Lawler, Srinivas and Watkins. H.J. 873."
1967233,2025-03-28,House,12,"Subcommittee Meeting: 03/31/2025 12:30PM RM 304.1."
1967233,2025-03-31,House,13,"Subcommittee recommends passage."
1967256,2025-02-12,Senate,1,"Introduced, placed on calendar. S.J. 252."
1967256,2025-02-12,Senate,2,"Committee report, approving bill. S.J. 259."
1967256,2025-02-17,Senate,3,"Fiscal note."
1967256,2025-04-03,Senate,4,"Placed on calendar under unfinished business. S.J. 688."
1967256,2025-06-16,Senate,5,"Referred to Judiciary. S.J. 1057."
1967282,2025-02-12,House,1,"By COMMITTEE ON AGRICULTURE"
1967282,2025-02-12,House,2,"Introduced, referred to Agriculture. H.J. 307."
1967282,2025-02-12,House,3,"Subcommittee: Dunwell, Mommsen and Srinivas. H.J. 309."
1967282,2025-02-18,House,4,"Subcommittee Meeting: 02/19/2025 12:45PM RM 19."
1967282,2025-02-19,House,5,"Subcommittee recommends passage."
1967282,2025-03-05,House,6,"Committee report, recommending amendment and passage. H.J. 524."
1967282,2025-03-05,House,7,"Committee vote: Yeas, 23. Nays, 0. H.J. 524."
1967282,2025-03-12,House,8,"Committee report approving bill, renumbered as HF 942."
1967304,2025-02-12,Senate,1,"Introduced, referred to Local Government. S.J. 251."
1967304,2025-02-18,Senate,2,"Subcommittee: Westrich, Webster, and Weiner. S.J. 302."
1967304,2025-02-22,Senate,3,"Subcommittee Meeting: 02/24/2025 3:00PM Room 217 Conference Room."
1967304,2025-02-24,Senate,4,"Subcommittee recommends passage."
1967304,2025-03-04,Senate,5,"Committee report approving bill, renumbered as SF 495. S.J. 407."
1967328,2025-02-12,House,1,"By COMMITTEE ON PUBLIC SAFETY"
1967328,2025-02-12,House,2,"Introduced, referred to Public Safety. H.J. 308."
1967328,2025-02-12,House,3,"Subcommittee: Wills, J., Gosa and Rinker. H.J. 309."
1967328,2025-02-17,House,4,"Subcommittee reassigned: Wills, J., Dieken and Gosa. H.J. 342."
1967328,2025-02-17,House,5,"Subcommittee Meeting: 02/18/2025 3:00PM House Lounge."
1967328,2025-02-18,House,6,"Subcommittee recommends amendment and passage."
1967328,2025-02-19,House,7,"Committee report, recommending amendment and passage. H.J. 368."
1967328,2025-02-19,House,8,"Committee vote: Yeas, 16. Nays, 4. Excused, 3. H.J. 368."
1967328,2025-02-20,House,9,"Committee report approving bill, renumbered as HF 530."
1967352,2025-02-12,House,1,"By COMMITTEE ON JUDICIARY"
1967352,2025-02-12,House,2,"Introduced, referred to Judiciary. H.J. 308."
1967352,2025-02-12,House,3,"Subcommittee: Lohse, James and Lawler. H.J. 309."
1967352,2025-02-19,House,4,"Subcommittee Meeting: 02/20/2025 11:30AM House Lounge."
1967352,2025-02-20,House,5,"Subcommittee recommends passage."
1967378,2025-02-12,Senate,1,"Introduced, referred to Natural Resources and Environment. S.J. 254."
1967378,2025-02-17,Senate,2,"Subcommittee: Shipley, Pike, and Trone Garriott. S.J. 282."
1967378,2025-02-18,Senate,3,"Subcommittee Meeting: 02/19/2025 1:00PM Room 217 Conference Room."
1967378,2025-02-19,Senate,4,"Subcommittee recommends passage."
1967378,2025-02-25,Senate,5,"Committee report approving bill, renumbered as SF 424. S.J. 359."
1967401,2025-02-12,Senate,1,"Introduced, referred to Education. S.J. 252."
1967401,2025-02-17,Senate,2,"Subcommittee: Green, Quirmbach, and Salmon. S.J. 281."
1967401,2025-02-27,Senate,3,"Subcommittee Meeting: 03/03/2025 11:00AM Lobbyist Lounge."
1967401,2025-03-03,Senate,4,"Subcommittee recommends passage."
1967424,2025-02-12,Senate,1,"Introduced, referred to Judiciary. S.J. 254."
1967424,2025-02-17,Senate,2,"Subcommittee: Evans, Dickey, and Petersen. S.J. 282."
1967424,2025-02-17,Senate,3,"Subcommittee Meeting: 02/19/2025 11:00AM Senate Lounge."
1967424,2025-02-19,Senate,4,"Subcommittee recommends passage."
1967424,2025-03-05,Senate,5,"Committee report approving bill, renumbered as SF 514. S.J. 425."
1967447,2025-02-12,Senate,1,"Introduced, placed on calendar. S.J. 253."
1967447,2025-02-12,Senate,2,"Committee report, approving bill. S.J. 260."
1967447,2025-03-12,Senate,3,"Attached to HF 367. S.J. 494."
1967447,2025-04-03,Senate,4,"Placed on calendar under unfinished business. S.J. 688."
1967447,2025-04-08,Senate,5,"HF 367 substituted. S.J. 722."
1967447,2025-04-08,Senate,6,"Withdrawn. S.J. 723."
1967471,2025-02-12,House,1,"By COMMITTEE ON NATURAL RESOURCES"
1967471,2025-02-12,House,2,"Introduced, referred to Natural Resources. H.J. 307."
1967471,2025-02-12,House,3,"Subcommittee: Harris, Barker and Turek. H.J. 309."
1967471,2025-02-17,House,4,"Subcommittee Meeting: 02/18/2025 12:30PM RM 304."
1967471,2025-02-18,House,5,"Subcommittee recommends amendment and passage."
1967471,2025-02-25,House,6,"Committee report, recommending amendment and passage. H.J. 436."
1967471,2025-02-25,House,7,"Committee vote: Yeas, 21. Nays, 0. H.J. 436."
1967471,2025-03-03,House,8,"Committee report approving bill, renumbered as HF 710."
1967497,2025-02-12,House,1,"By COMMITTEE ON TRANSPORTATION"
1967497,2025-02-12,House,2,"Introduced, referred to Transportation. H.J. 308."
1967497,2025-02-12,House,3,"Subcommittee: Mommsen, Bossman and Kressig. H.J. 309."
1967497,2025-02-13,House,4,"Subcommittee Meeting: 02/19/2025 12:00PM RM 304.1."
1967497,2025-02-19,House,5,"Subcommittee recommends passage."
1967497,2025-02-26,House,6,"Committee report, recommending passage. H.J. 449."
1967497,2025-02-26,House,7,"Committee vote: Yeas, 20. Nays, 0. Excused, 1. H.J. 449."
1967497,2025-02-28,House,8,"Committee report approving bill, renumbered as HF 698."
1967516,2025-02-12,Senate,1,"Introduced, referred to Education. S.J. 252."
1967516,2025-02-17,Senate,2,"Subcommittee: Green, Pike, and Trone Garriott."
1967516,2025-02-25,Senate,3,"Subcommittee Meeting: 02/27/2025 8:00AM Room 217 Conference Room."
1967516,2025-03-03,Senate,4,"Subcommittee recommends passage."
1967540,2025-02-12,Senate,1,"Introduced, referred to Transportation. S.J. 253."
1967540,2025-02-18,Senate,2,"Subcommittee: Shipley, Townsend, and Warme. S.J. 303."
1967540,2025-02-18,Senate,3,"Subcommittee Meeting: 02/19/2025 2:30PM Room 315."
1967540,2025-02-20,Senate,4,"Subcommittee recommends amendment and passage."
1967557,2025-02-12,Senate,1,"Introduced, referred to Transportation. S.J. 254."
1967557,2025-02-18,Senate,2,"Subcommittee: Shipley, Bennett, and Koelker. S.J. 303."
1967557,2025-02-25,Senate,3,"Subcommittee Meeting: 02/26/2025 2:30PM Senate Lounge."
1967557,2025-03-03,Senate,4,"Subcommittee recommends amendment and passage."
1967557,2025-03-04,Senate,5,"Committee report approving bill, renumbered as SF 492. S.J. 411."
1967568,2025-02-12,Senate,1,"Introduced, placed on calendar. S.J. 254."
1967568,2025-02-12,Senate,2,"Committee report, approving bill. S.J. 261."
1967568,2025-03-11,Senate,3,"Passed Senate, yeas 47, nays 0. S.J. 486."
1967568,2025-03-11,Senate,4,"Immediate message. S.J. 488."
1967568,2025-03-12,House,5,"Message from Senate. H.J. 609."
1967568,2025-03-12,House,6,"Read first time, referred to Public Safety. H.J. 615."
1967568,2025-03-13,House,7,"Subcommittee: Vondran, Gjerde and Wills, J. H.J. 657."
1967568,2025-03-19,House,8,"Subcommittee Meeting: 03/20/2025 12:30PM RM 102."
1967568,2025-03-20,House,9,"Subcommittee recommends passage."
1967568,2025-03-25,House,10,"Committee report, recommending passage. H.J. 814."
1967568,2025-03-25,House,11,"Committee vote: Yeas, 22. Nays, 1. H.J. 814."
1967568,2025-03-25,House,12,"Placed on calendar. H.J. 814."
1967568,2025-04-10,House,13,"Placed on calendar under unfinished business. H.J. 928."
1967568,2025-04-21,House,14,"Passed House, yeas 90, nays 1. H.J. 1006."
1967568,2025-04-21,House,15,"Immediate message. H.J. 1010."
1967568,2025-04-22,Senate,16,"Message from House. S.J. 846."
1967568,2025-05-06,Senate,17,"Reported correctly enrolled, signed by President and Speaker, and sent to Governor. S.J. 942."
1967568,2025-05-06,Senate,18,"Signed by Governor. S.J. 943."
1967735,2025-02-12,Senate,1,"Introduced, referred to Natural Resources and Environment. S.J. 254."
1967735,2025-02-17,Senate,2,"Subcommittee: Pike, Bennett, and Sires. S.J. 282."
1967735,2025-02-18,Senate,3,"Subcommittee Meeting: 02/19/2025 3:00PM Room G15."
1967735,2025-02-25,Senate,4,"Committee report approving bill, renumbered as SF 428. S.J. 360."
1967901,2025-02-12,Senate,1,"Introduced, placed on calendar. S.J. 254."
1967901,2025-02-12,Senate,2,"Committee report, approving bill. S.J. 261."
1967901,2025-04-03,Senate,3,"Placed on calendar under unfinished business. S.J. 688."
1967901,2025-04-21,Senate,4,"Amendment S-3115 filed, adopted. S.J. 835."
1967901,2025-04-21,Senate,5,"Passed Senate, yeas 45, nays 0. S.J. 835."
1967901,2025-04-21,Senate,6,"Immediate message. S.J. 839."
1967901,2025-04-21,House,7,"Message from Senate. H.J. 995."
1967901,2025-04-21,House,8,"Read first time, passed on file. H.J. 1010."
1967901,2025-05-08,House,9,"Substituted for HF 952. H.J. 1100."
1967901,2025-05-08,House,10,"Amendment H-1295 filed, adopted. H.J. 1100."
1967901,2025-05-08,House,11,"Passed House, yeas 58, nays 26. H.J. 1100."
1967901,2025-05-13,House,12,"Explanation of vote. H.J. 1176."
1967901,2025-05-08,House,13,"Immediate message. H.J. 1110."
1967901,2025-05-09,Senate,14,"Message from House, with amendment S-3147. S.J. 948."
1967901,2025-05-14,Senate,15,"Senate refused to concur with S-3147. S.J. 1021."
1967901,2025-05-14,Senate,16,"Immediate message. S.J. 1021."
1967901,2025-05-14,House,17,"Message from Senate. H.J. 1199."
1968367,2025-02-13,House,1,"Introduced, placed on calendar. H.J. 320."
1968367,2025-03-11,House,2,"Passed House, yeas 62, nays 29. H.J. 604."
1968367,2025-03-12,House,3,"Explanation of vote. H.J. 638."
1968367,2025-03-19,House,4,"Explanation of vote. H.J. 751."
1968367,2025-03-11,House,5,"Immediate message. H.J. 607."
1968367,2025-03-12,Senate,6,"Message from House. S.J. 495."
1968367,2025-03-12,Senate,7,"Read first time, referred to State Government. S.J. 495."
1968367,2025-03-13,Senate,8,"Subcommittee: Reichman, Green, and Townsend. S.J. 513."
1968367,2025-03-17,Senate,9,"Subcommittee Meeting: 03/18/2025 1:00PM Room 217 Conference Room."
1968367,2025-03-18,Senate,10,"Subcommittee recommends passage."
1968367,2025-04-02,Senate,11,"Committee report, recommending passage. S.J. 680."
1968367,2025-04-02,Senate,12,"Placed on calendar."
1968367,2025-04-10,Senate,13,"Placed on calendar under unfinished business. S.J. 757."
1968367,2025-04-17,Senate,14,"Passed Senate, yeas 32, nays 15. S.J. 822."
1968367,2025-04-17,Senate,15,"Immediate message. S.J. 826."
1968367,2025-04-17,House,16,"Message from Senate. H.J. 954."
1968367,2025-05-06,House,17,"Reported correctly enrolled, signed by Speaker and President, and sent to Governor. H.J. 1090."
1968367,2025-05-06,House,18,"Signed by Governor. H.J. 1091."
1968377,2025-02-13,House,1,"Introduced, referred to Education. H.J. 316."
1968377,2025-02-17,House,2,"Subcommittee: Stone, Gehlbach and Gjerde. H.J. 341."
1968377,2025-02-18,House,3,"Subcommittee Meeting: 02/19/2025 2:30PM RM 304.1."
1968377,2025-02-19,House,4,"Subcommittee recommends passage."
1968386,2025-02-13,House,1,"Introduced, placed on calendar. H.J. 318."
1968386,2025-04-03,House,2,"Placed on calendar under unfinished business. H.J. 894."
1968386,2025-05-15,House,3,"Rereferred to Health and Human Services. H.J. 1221."
1968398,2025-02-13,House,1,"Introduced, placed on calendar. H.J. 317."
1968398,2025-03-11,House,2,"Passed House, yeas 91, nays 0. H.J. 598."
1968398,2025-03-12,House,3,"Explanation of vote. H.J. 638."
1968398,2025-03-19,House,4,"Explanation of vote. H.J. 751."
1968398,2025-03-11,House,5,"Immediate message. H.J. 607."
1968398,2025-03-12,Senate,6,"Message from House. S.J. 495."
1968398,2025-03-12,Senate,7,"Read first time, attached to SF 396. S.J. 495."
1968398,2025-04-03,Senate,8,"Placed on calendar under unfinished business. S.J. 689."
1968398,2025-04-08,Senate,9,"Substituted for SF 396. S.J. 726."
1968398,2025-04-08,Senate,10,"Passed Senate, yeas 47, nays 0. S.J. 726."
1968398,2025-04-08,Senate,11,"Immediate message. S.J. 727."
1968398,2025-04-09,House,12,"Message from Senate. H.J. 919."
1968398,2025-04-24,House,13,"Reported correctly enrolled, signed by Speaker and President, and sent to Governor. H.J. 1070."
1968398,2025-04-25,House,14,"Signed by Governor. H.J. 1073."
1968411,2025-02-13,House,1,"Introduced, placed on calendar. H.J. 319."
1968411,2025-02-20,House,2,"Passed House, yeas 91, nays 1. H.J. 392."
1968411,2025-02-20,House,3,"Immediate message. H.J. 401."
1968411,2025-02-24,Senate,4,"Message from House. S.J. 338."
1968411,2025-02-24,Senate,5,"Read first time, referred to Education. S.J. 338."
1968411,2025-03-12,Senate,6,"Subcommittee: Gruenhagen, Shipley, and Zimmer. S.J. 507."
1968411,2025-03-24,Senate,7,"Subcommittee Meeting: 03/27/2025 8:30AM Room 217 Conference Room."
1968411,2025-03-27,Senate,8,"Subcommittee recommends passage."
1968411,2025-03-31,Senate,9,"Committee report, recommending passage. S.J. 666."
1968411,2025-03-31,Senate,10,"Placed on calendar."
1968411,2025-04-09,Senate,11,"Passed Senate, yeas 47, nays 0. S.J. 750."
1968411,2025-04-09,Senate,12,"Immediate message. S.J. 753."
1968411,2025-04-10,House,13,"Message from Senate. H.J. 925."
1968411,2025-05-06,House,14,"Reported correctly enrolled, signed by Speaker and President, and sent to Governor. H.J. 1090."
1968411,2025-05-06,House,15,"Signed by Governor. H.J. 1091."
1968419,2025-02-13,House,1,"Introduced, placed on calendar. H.J. 320."
1968419,2025-04-03,House,2,"Referred to State Government. H.J. 895."
1968438,2025-02-13,House,1,"Introduced, referred to Judiciary. H.J. 316."
1968438,2025-03-03,House,2,"Subcommittee: Lohse, Fett and Srinivas. H.J. 487."
1968447,2025-02-13,House,1,"Introduced, placed on calendar. H.J. 317."
1968447,2025-04-03,House,2,"Referred to Health and Human Services. H.J. 895."
1968464,2025-02-13,Senate,1,"By COMMITTEE ON WORKFORCE"
1968464,2025-02-13,Senate,2,"Introduced, referred to Workforce."
1968464,2025-02-13,Senate,3,"Subcommittee: Dickey, Donahue, and Sires."
1968464,2025-02-17,Senate,4,"Subcommittee Meeting: 02/18/2025 2:30PM Senate Lounge."
1968464,2025-02-18,Senate,5,"Subcommittee recommends passage."
1968464,2025-02-19,Senate,6,"Committee report approving bill, renumbered as SF 379."
1968476,2025-02-13,Senate,1,"By COMMITTEE ON LOCAL GOVERNMENT"
1968476,2025-02-13,Senate,2,"Introduced, referred to Local Government."
1968476,2025-02-13,Senate,3,"Subcommittee: Webster, Driscoll, and Quirmbach."
1968476,2025-02-25,Senate,4,"Subcommittee Meeting: 02/26/2025 2:00PM Senate Lounge."
1968476,2025-03-03,Senate,5,"Subcommittee recommends amendment and passage."
1968487,2025-02-13,House,1,"Introduced, placed on calendar. H.J. 315."
1968487,2025-02-26,House,2,"Amendment H-1026 filed. H.J. 451."
1968487,2025-03-10,House,3,"Amendments H-1043 and H-1055 filed. H.J. 591."
1968487,2025-03-14,House,4,"Amendment H-1092 filed. H.J. 660."
1968487,2025-04-03,House,5,"Referred to Natural Resources. H.J. 894."
1968492,2025-02-13,House,1,"Introduced, placed on calendar. H.J. 317."
1968492,2025-02-24,House,2,"Amendment H-1022 filed. H.J. 421."
1968492,2025-04-03,House,3,"Referred to Natural Resources. H.J. 895."
1968511,2025-02-13,House,1,"Introduced, placed on calendar. H.J. 318."
1968511,2025-04-03,House,2,"Referred to Natural Resources. H.J. 895."
1968527,2025-02-13,House,1,"Introduced, placed on calendar. H.J. 319."
1968527,2025-04-03,House,2,"Placed on calendar under unfinished business. H.J. 894."
1968527,2025-04-16,House,3,"Amendment H-1236 filed. H.J. 950."
1968527,2025-04-17,House,4,"Amendment H-1236 adopted. H.J. 977."
1968527,2025-04-17,House,5,"SF 175 substituted. H.J. 977."
1968527,2025-04-17,House,6,"Withdrawn. H.J. 985."
1968537,2025-02-13,House,1,"Introduced, placed on calendar. H.J. 320."
1968537,2025-03-11,House,2,"Amendment H-1060 filed. H.J. 608."
1968537,2025-03-24,House,3,"Amendment H-1060 withdrawn. H.J. 778."
1968537,2025-03-24,House,4,"Passed House, yeas 94, nays 1. H.J. 779."
1968537,2025-04-22,House,5,"Explanation of vote. H.J. 1034."
1968537,2025-03-25,House,6,"Explanations of votes. H.J. 812."
1968537,2025-03-24,House,7,"Immediate message. H.J. 788."
1968537,2025-03-25,Senate,8,"Message from House. S.J. 623."
1968537,2025-03-25,Senate,9,"Read first time, referred to Transportation. S.J. 623."
1968537,2025-03-27,Senate,10,"Subcommittee: Zumbach, Pike, and Zimmer. S.J. 660."
1968537,2025-03-31,Senate,11,"Subcommittee Meeting: 04/01/2025 8:30AM Senate Lounge."
1968537,2025-04-01,Senate,12,"Subcommittee recommends amendment and passage."
1968537,2025-04-01,Senate,13,"Committee report, recommending passage. S.J. 674."
1968537,2025-04-01,Senate,14,"Placed on calendar."
1968537,2025-04-08,Senate,15,"Amendment S-3078 filed. S.J. 740."
1968537,2025-04-10,Senate,16,"Placed on calendar under unfinished business. S.J. 757."
1968537,2025-04-21,Senate,17,"Amendment S-3114 to S-3078 filed. S.J. 845."
1968537,2025-04-28,Senate,18,"Amendment S-3114 adopted. S.J. 897."
1968537,2025-04-28,Senate,19,"Amendment S-3078 adopted, as amended. S.J. 897."
1968537,2025-04-28,Senate,20,"Passed Senate, yeas 50, nays 0. S.J. 898."
1968537,2025-04-28,Senate,21,"Immediate message. S.J. 902."
1968537,2025-04-29,House,22,"Message from Senate. H.J. 1074."
1968537,2025-04-29,House,23,"Senate amendment H-1286 filed. H.J. 1077."
1968537,2025-05-08,House,24,"House concurred in Senate amendment H-1286. H.J. 1105."
1968537,2025-05-08,House,25,"Passed House, yeas 64, nays 20. H.J. 1105."
1968537,2025-05-13,House,26,"Explanation of vote. H.J. 1176."
1968537,2025-05-08,House,27,"Immediate message. H.J. 1110."
1968537,2025-05-09,Senate,28,"Message from House. S.J. 948."
1968537,2025-05-19,House,29,"Reported correctly enrolled, signed by Speaker and President, and sent to Governor. H.J. 1224."
1968537,2025-06-06,House,30,"Signed by Governor. H.J. 1226."
1968544,2025-02-13,House,1,"Introduced, placed on calendar. H.J. 320."
1968544,2025-03-12,House,2,"SF 213 substituted. H.J. 626."
1968544,2025-03-12,House,3,"Withdrawn. H.J. 635."
1968560,2025-02-13,House,1,"Introduced, placed on calendar. H.J. 320."
1968560,2025-03-11,House,2,"SF 166 substituted. H.J. 601."
1968560,2025-03-11,House,3,"Withdrawn. H.J. 607."
1968572,2025-02-13,House,1,"Introduced, referred to Appropriations. H.J. 315."
1968572,2025-03-24,House,2,"Subcommittee: Harris, Bagniewski and Latham. H.J. 790."
1968572,2025-03-24,House,3,"Subcommittee Meeting: 03/26/2025 12:00PM RM 304.1."
1968572,2025-03-26,House,4,"Subcommittee recommends passage."
1968581,2025-02-13,House,1,"Introduced, placed on calendar. H.J. 318."
1968581,2025-03-14,House,2,"Amendment H-1091 filed. H.J. 660."
1968581,2025-03-17,House,3,"Fiscal note."
1968581,2025-03-18,House,4,"Amendment H-1128 filed. H.J. 721."
1968581,2025-03-19,House,5,"Amendment H-1091 withdrawn. H.J. 747."
1968581,2025-03-19,House,6,"Amendment H-1133 to amendment H-1128 filed, adopted. H.J. 747."
1968581,2025-03-19,House,7,"Amendment H-1128 adopted, as amended. H.J. 747."
1968581,2025-03-19,House,8,"Passed House, yeas 96, nays 0. H.J. 747."
1968581,2025-03-19,House,9,"Immediate message. H.J. 748."
1968581,2025-03-20,Senate,10,"Message from House. S.J. 602."
1968581,2025-03-20,Senate,11,"Read first time, attached to SF 517. S.J. 602."
1968581,2025-03-20,Senate,12,"Fiscal note."
1968581,2025-04-03,Senate,13,"Placed on calendar under unfinished business. S.J. 689."
1968581,2025-06-16,Senate,14,"Referred to Education. S.J. 1057."
1968592,2025-02-13,Senate,1,"By COMMITTEE ON LOCAL GOVERNMENT"
1968592,2025-02-13,Senate,2,"Introduced, referred to Local Government."
1968592,2025-02-13,Senate,3,"Subcommittee: Klimesh, Wahls, and Webster."
1968592,2025-02-17,Senate,4,"Subcommittee Meeting: 02/20/2025 11:30AM Senate Lounge."
1968592,2025-02-20,Senate,5,"Subcommittee recommends amendment and passage."
1968592,2025-03-06,Senate,6,"Committee report approving bill, renumbered as SF 601."
1968613,2025-02-13,House,1,"Introduced, referred to Judiciary. H.J. 316."
1968613,2025-02-17,House,2,"Rereferred to Health and Human Services. H.J. 339."
1968613,2025-02-19,House,3,"Subcommittee: Barker, Baeth and Weldon. H.J. 362."
1968613,2025-02-19,House,4,"Subcommittee Meeting: 02/20/2025 10:30AM RM 304.1."
1968613,2025-02-20,House,5,"Subcommittee recommends passage."
1968613,2025-02-25,House,6,"Committee report, recommending passage. H.J. 431."
1968613,2025-02-25,House,7,"Committee vote: Yeas, 19. Nays, 0. Excused, 2. H.J. 431."
1968613,2025-02-28,House,8,"Committee report approving bill, renumbered as HF 644."
1968613,2025-03-14,House,9,"Withdrawn. H.J. 660."
1968622,2025-02-13,House,1,"Introduced, referred to Agriculture. H.J. 315."
1968632,2025-02-13,House,1,"Introduced, referred to Labor and Workforce. H.J. 316."
1968641,2025-02-13,House,1,"Introduced, placed on calendar. H.J. 318."
1968641,2025-03-19,House,2,"Amendments H-1130 and H-1141 filed. H.J. 752."
1968641,2025-03-19,House,3,"Fiscal note."
1968641,2025-03-20,House,4,"Amendment H-1141 to amendment H-1130 adopted. H.J. 757."
1968641,2025-03-20,House,5,"Amendment H-1130 adopted, as amended. H.J. 757."
1968641,2025-03-20,House,6,"Passed House, yeas 89, nays 0. H.J. 757."
1968641,2025-03-25,House,7,"Explanation of vote. H.J. 811."
1968641,2025-03-25,House,8,"Explanations of votes. H.J. 812."
1968641,2025-03-20,House,9,"Immediate message. H.J. 767."
1968641,2025-03-24,Senate,10,"Message from House. S.J. 605."
1968641,2025-03-24,Senate,11,"Read first time, referred to Health and Human Services. S.J. 605."
1968641,2025-03-26,Senate,12,"Subcommittee: Klimesh, Guth, and Zimmer. S.J. 653."
1968641,2025-03-31,Senate,13,"Subcommittee Meeting: 04/01/2025 1:00PM Room 217 Conference Room."
1968641,2025-04-01,Senate,14,"Subcommittee recommends passage."
1968641,2025-04-02,Senate,15,"Fiscal note."
1968641,2025-04-03,Senate,16,"Placed on calendar."
1968641,2025-04-07,Senate,17,"Committee report, recommending amendment and passage. S.J. 717."
1968641,2025-04-07,Senate,18,"Amendment S-3072 filed. S.J. 717."
1968641,2025-04-07,Senate,19,"Placed on calendar."
1968653,2025-02-13,House,1,"Introduced, placed on calendar. H.J. 317."
1968653,2025-02-20,House,2,"Passed House, yeas 92, nays 0. H.J. 399."
1968653,2025-02-20,House,3,"Immediate message. H.J. 401."
1968653,2025-02-24,Senate,4,"Message from House. S.J. 337."
1968653,2025-02-24,Senate,5,"Read first time, referred to Health and Human Services. S.J. 337."
1968653,2025-03-03,Senate,6,"Subcommittee: Klimesh, Pike, and Wahls. S.J. 394."
1968653,2025-03-18,Senate,7,"Subcommittee Meeting: 03/20/2025 8:30AM Senate Lounge."
1968653,2025-03-20,Senate,8,"Subcommittee recommends passage."
1968653,2025-04-03,Senate,9,"Committee report, recommending passage. S.J. 691."
1968653,2025-04-03,Senate,10,"Placed on calendar."
1968653,2025-04-10,Senate,11,"Placed on calendar under unfinished business. S.J. 757."
1968653,2025-04-16,Senate,12,"Passed Senate, yeas 47, nays 0. S.J. 805."
1968653,2025-04-16,Senate,13,"Immediate message. S.J. 808."
1968653,2025-04-17,House,14,"Message from Senate. H.J. 951."
1968653,2025-05-19,House,15,"Reported correctly enrolled, signed by Speaker and President, and sent to Governor. H.J. 1224."
1968653,2025-06-11,House,16,"Vetoed by Governor. H.J. 1235."
1968669,2025-02-13,House,1,"Introduced, placed on calendar. H.J. 318."
1968669,2025-02-25,House,2,"Amendment H-1023 filed. H.J. 436."
1968669,2025-04-03,House,3,"Placed on calendar under unfinished business. H.J. 894."
1968669,2025-05-12,House,4,"Amendment H-1023 withdrawn. H.J. 1133."
1968669,2025-05-12,House,5,"Amendment H-1300 filed, adopted. H.J. 1133."
1968669,2025-05-12,House,6,"SF 253 substituted. H.J. 1133."
1968669,2025-05-12,House,7,"Withdrawn. H.J. 1140."
1968676,2025-02-13,House,1,"Introduced, placed on calendar. H.J. 320."
1968676,2025-03-11,House,2,"Passed House, yeas 91, nays 0. H.J. 602."
1968676,2025-03-19,House,3,"Explanation of vote. H.J. 751."
1968676,2025-03-11,House,4,"Immediate message. H.J. 607."
1968676,2025-03-12,Senate,5,"Message from House. S.J. 495."
1968676,2025-03-12,Senate,6,"Read first time, attached to SF 457. S.J. 495."
1968676,2025-04-03,Senate,7,"Placed on calendar under unfinished business. S.J. 689."
1968676,2025-04-21,Senate,8,"Substituted for SF 457. S.J. 837."
1968676,2025-04-21,Senate,9,"Passed Senate, yeas 45, nays 0. S.J. 837."
1968676,2025-04-21,Senate,10,"Immediate message. S.J. 839."
1968676,2025-04-21,House,11,"Message from Senate. H.J. 995."
1968676,2025-05-06,House,12,"Reported correctly enrolled, signed by Speaker and President, and sent to Governor. H.J. 1090."
1968676,2025-05-06,House,13,"Signed by Governor. H.J. 1091."
1968687,2025-02-13,House,1,"Introduced, placed on calendar. H.J. 317."
1968687,2025-03-11,House,2,"Passed House, yeas 91, nays 0. H.J. 599."
1968687,2025-03-12,House,3,"Explanation of vote. H.J. 638."
1968687,2025-03-19,House,4,"Explanation of vote. H.J. 751."
1968687,2025-03-11,House,5,"Immediate message. H.J. 607."
1968687,2025-03-12,Senate,6,"Message from House. S.J. 495."
1968687,2025-03-12,Senate,7,"Read first time, referred to Local Government. S.J. 495."
1968687,2025-03-18,Senate,8,"Subcommittee: Westrich, Knox, and Webster. S.J. 567."
1968702,2025-02-13,House,1,"Introduced, placed on calendar. H.J. 319."
1968702,2025-03-11,House,2,"Passed House, yeas 89, nays 2. H.J. 600."
1968702,2025-03-12,House,3,"Explanation of vote. H.J. 638."
1968702,2025-03-19,House,4,"Explanation of vote. H.J. 751."
1968702,2025-03-11,House,5,"Immediate message. H.J. 607."
1968702,2025-03-12,Senate,6,"Message from House. S.J. 495."
1968702,2025-03-12,Senate,7,"Read first time, referred to Education. S.J. 495."
1968702,2025-03-18,Senate,8,"Subcommittee: Campbell, Garrett, and Trone Garriott. S.J. 567."
1968702,2025-03-24,Senate,9,"Subcommittee Meeting: 03/25/2025 2:00PM Room 217 Conference Room."
1968702,2025-03-25,Senate,10,"Subcommittee recommends passage."
1968702,2025-03-31,Senate,11,"Committee report, recommending passage. S.J. 666."
1968702,2025-03-31,Senate,12,"Placed on calendar."
1968702,2025-04-10,Senate,13,"Placed on calendar under unfinished business. S.J. 757."
1968702,2025-04-15,Senate,14,"Passed Senate, yeas 47, nays 0. S.J. 789."
1968702,2025-04-15,Senate,15,"Immediate message. S.J. 793."
1968702,2025-04-16,House,16,"Message from Senate. H.J. 946."
1968702,2025-05-19,House,17,"Reported correctly enrolled, signed by Speaker and President, and sent to Governor. H.J. 1224."
1968702,2025-05-27,House,18,"Signed by Governor. H.J. 1226."
1968721,2025-02-13,House,1,"Introduced, placed on calendar. H.J. 318."
1968721,2025-03-12,House,2,"Passed House, yeas 91, nays 4. H.J. 619."
1968721,2025-03-19,House,3,"Explanation of vote. H.J. 751."
1968721,2025-03-12,House,4,"Immediate message. H.J. 635."
1968721,2025-03-13,Senate,5,"Message from House. S.J. 510."
1968721,2025-03-13,Senate,6,"Read first time, referred to Health and Human Services. S.J. 510."
1968721,2025-03-19,Senate,7,"Subcommittee: Rowley, Lofgren, and Zimmer. S.J. 588."
1968721,2025-03-24,Senate,8,"Subcommittee Meeting: 03/26/2025 8:30AM Room 217 Conference Room."
1968721,2025-03-26,Senate,9,"Subcommittee reassigned: Rowley, Klimesh, and Zimmer. S.J. 653."
1968721,2025-03-26,Senate,10,"Subcommittee recommends amendment and passage."
1968721,2025-04-03,Senate,11,"Committee report, recommending passage. S.J. 691."
1968721,2025-04-03,Senate,12,"Placed on calendar."
1968721,2025-04-10,Senate,13,"Placed on calendar under unfinished business. S.J. 757."
1968729,2025-02-13,Senate,1,"By COMMITTEE ON LOCAL GOVERNMENT"
1968729,2025-02-13,Senate,2,"Introduced, referred to Local Government."
1968729,2025-02-13,Senate,3,"Subcommittee: De Witt, Guth, and Knox."
1968729,2025-02-19,Senate,4,"Subcommittee reassigned: Sires, Knox, and Webster."
1968729,2025-02-26,Senate,5,"Subcommittee Meeting: 02/27/2025 12:30PM Senate Lounge."
1968729,2025-03-03,Senate,6,"Subcommittee recommends amendment and passage."
1968729,2025-03-06,Senate,7,"Committee report approving bill, renumbered as SF 588."
1968741,2025-02-13,Senate,1,"By COMMITTEE ON LOCAL GOVERNMENT"
1968741,2025-02-13,Senate,2,"Introduced, referred to Local Government."
1968741,2025-02-13,Senate,3,"Subcommittee: Klimesh, Lofgren, and Weiner."
1968741,2025-02-26,Senate,4,"Subcommittee Meeting: 02/26/2025 12:30PM Room 315."
1968752,2025-02-13,House,1,"Introduced, referred to Commerce. H.J. 316."
1968768,2025-02-13,House,1,"Introduced, placed on calendar. H.J. 318."
1968768,2025-03-11,House,2,"Amendment H-1061 filed. H.J. 608."
1968768,2025-03-12,House,3,"Amendment H-1061 adopted. H.J. 619."
1968768,2025-03-12,House,4,"Passed House, yeas 67, nays 28. H.J. 620."
1968768,2025-03-19,House,5,"Explanation of vote. H.J. 751."
1968768,2025-03-12,House,6,"Immediate message. H.J. 635."
1968768,2025-03-06,Senate,7,"Message from House. S.J. 510."
1968768,2025-03-13,Senate,8,"Read first time, referred to Health and Human Services. S.J. 510."
1968768,2025-03-19,Senate,9,"Subcommittee: Salmon, Alons, and Petersen. S.J. 589."
1968768,2025-03-20,Senate,10,"Subcommittee Meeting: 03/26/2025 8:30AM Senate Lounge."
1968768,2025-03-26,Senate,11,"Subcommittee recommends passage."
1968768,2025-04-03,Senate,12,"Committee report, recommending passage. S.J. 691."
1968768,2025-04-03,Senate,13,"Placed on calendar."
1968768,2025-04-10,Senate,14,"Placed on calendar under unfinished business. S.J. 757."
1968768,2025-04-15,Senate,15,"Passed Senate, yeas 32, nays 15. S.J. 788."
1968768,2025-04-15,Senate,16,"Immediate message. S.J. 789."
1968768,2025-04-16,House,17,"Message from Senate. H.J. 946."
1968768,2025-05-19,House,18,"Reported correctly enrolled, signed by Speaker and President, and sent to Governor. H.J. 1224."
1968768,2025-05-19,House,19,"Signed by Governor. H.J. 1225."
1968776,2025-02-13,Senate,1,"By COMMITTEE ON LOCAL GOVERNMENT"
1968776,2025-02-13,Senate,2,"Introduced, referred to Local Government."
1968776,2025-02-13,Senate,3,"Subcommittee: Webster, Lofgren, and Quirmbach."
1968776,2025-02-17,Senate,4,"Subcommittee Meeting: 02/19/2025 12:00PM Senate Lounge."
1968776,2025-02-19,Senate,5,"Subcommittee recommends amendment and passage."
1968776,2025-03-06,Senate,6,"Committee report approving bill, renumbered as SF 595."
1968794,2025-02-13,House,1,"Introduced, referred to Judiciary. H.J. 316."
1968794,2025-03-03,House,2,"Subcommittee: Lohse, Lawler and Meyer, B. H.J. 487."
1968794,2025-03-04,House,3,"Subcommittee Meeting: 03/04/2025 3:00PM House Lounge."
1968794,2025-03-04,House,4,"Subcommittee recommends passage."
1968794,2025-03-06,House,5,"Committee report, recommending passage. H.J. 548."
1968794,2025-03-06,House,6,"Committee vote: Yeas, 21. Nays, 0. H.J. 548."
1968794,2025-03-12,House,7,"Committee report approving bill, renumbered as HF 953."
1968794,2025-03-31,House,8,"Withdrawn. H.J. 871."
1968803,2025-02-13,House,1,"Introduced, referred to Appropriations. H.J. 319."
1968803,2025-04-08,House,2,"Subcommittee: Bossman, Bagniewski and Gehlbach. H.J. 917."
1968803,2025-04-08,House,3,"Subcommittee Meeting: 04/09/2025 8:30AM House Lounge."
1968803,2025-04-09,House,4,"Subcommittee recommends passage."
1968803,2025-04-16,House,5,"Committee report, recommending amendment and passage. H.J. 949."
1968803,2025-04-16,House,6,"Committee vote: Yeas 24. Nays, 0. Excused, 1. H.J. 949."
1968803,2025-04-17,House,7,"Committee report approving bill, renumbered as HF 1025."
1968803,2025-04-28,House,8,"Withdrawn. H.J. 1073."
1968819,2025-02-13,House,1,"Introduced, placed on calendar. H.J. 321."
1968819,2025-04-03,House,2,"Referred to Higher Education. H.J. 895."
1968832,2025-02-13,House,1,"Introduced, referred to State Government. H.J. 317."
1968832,2025-02-13,House,2,"Subcommittee: Wilz, H., Hora and Turek. H.J. 331."
1968832,2025-02-17,House,3,"Subcommittee Meeting: 02/19/2025 12:00PM RM 103."
1968832,2025-02-19,House,4,"Subcommittee recommends passage."
1968832,2025-02-26,House,5,"Committee report, recommending passage. H.J. 446."
1968832,2025-02-26,House,6,"Committee vote: Yeas, 22. Nays, 1. H.J. 446."
1968832,2025-02-28,House,7,"Committee report approving bill, renumbered as HF 700."
1968842,2025-02-13,House,1,"Introduced, placed on calendar. H.J. 320."
1968842,2025-03-13,House,2,"Amendment H-1085 filed. H.J. 659."
1968842,2025-03-17,House,3,"Amendment H-1110 filed. H.J. 677."
1968842,2025-03-18,House,4,"Amendment H-1110 adopted. H.J. 702."
1968842,2025-03-18,House,5,"Amendment H-1085 out of order. H.J. 702."
1968842,2025-03-18,House,6,"Passed House, yeas 61, nays 36. H.J. 703."
1968842,2025-03-18,House,7,"Immediate message. H.J. 717."
1968842,2025-03-19,Senate,8,"Message from House. S.J. 570."
1968842,2025-03-19,Senate,9,"Read first time, referred to Education. S.J. 570."
1968842,2025-03-26,Senate,10,"Subcommittee: Taylor, Garrett, and Quirmbach. S.J. 654."
1968842,2025-04-01,Senate,11,"Subcommittee Meeting: []."
1968842,2025-04-02,Senate,12,"Subcommittee recommends passage."
1968842,2025-04-07,Senate,13,"Committee report, recommending passage. S.J. 715."
1968842,2025-04-07,Senate,14,"Placed on calendar."
1968842,2025-04-10,Senate,15,"Placed on calendar under unfinished business. S.J. 757."
1968851,2025-02-13,House,1,"Introduced, referred to State Government. H.J. 316."
1968859,2025-02-13,House,1,"Introduced, placed on calendar. H.J. 317."
1968859,2025-04-03,House,2,"Referred to Health and Human Services. H.J. 895."
1968894,2025-02-13,House,1,"Introduced, referred to Health and Human Services. H.J. 328."
1968913,2025-02-13,Senate,1,"By COMMITTEE ON HEALTH AND HUMAN SERVICES"
1968913,2025-02-13,Senate,2,"Introduced, referred to Health and Human Services."
1968913,2025-02-13,Senate,3,"Subcommittee: Klimesh, Petersen, and Warme."
1968913,2025-02-13,Senate,4,"Subcommittee Meeting: 02/18/2025 11:00AM Senate Lounge."
1968913,2025-02-18,Senate,5,"Subcommittee recommends amendment and passage."
1968913,2025-02-26,Senate,6,"Committee report approving bill, renumbered as SF 474."
1968935,2025-02-13,House,1,"By COMMITTEE ON TRANSPORTATION"
1968935,2025-02-13,House,2,"Introduced, referred to Transportation. H.J. 330."
1968935,2025-02-13,House,3,"Subcommittee: Young, Scholten and Wood. H.J. 332."
1968935,2025-02-13,House,4,"Subcommittee Meeting: 02/18/2025 2:30PM House Lounge."
1968935,2025-02-18,House,5,"Tabled until future meeting."
1968954,2025-02-13,Senate,1,"By COMMITTEE ON JUDICIARY"
1968954,2025-02-13,Senate,2,"Introduced, referred to Judiciary."
1968954,2025-02-13,Senate,3,"Subcommittee: Taylor, Bisignano, and Green."
1968954,2025-02-20,Senate,4,"Subcommittee Meeting: 02/26/2025 2:00PM Room 217 Conference Room."
1968954,2025-03-03,Senate,5,"Subcommittee recommends amendment and passage."
1968954,2025-03-04,Senate,6,"Committee report approving bill, renumbered as SF 542."
1968978,2025-02-13,Senate,1,"Introduced, placed on calendar. S.J. 265."
1968978,2025-02-13,Senate,2,"Committee report, approving bill. S.J. 271."
1968978,2025-02-24,Senate,3,"Attached to HF 182. S.J. 336."
1968978,2025-03-12,Senate,4,"HF 182 substituted. S.J. 498."
1968978,2025-03-12,Senate,5,"Withdrawn. S.J. 499."
1968998,2025-02-13,House,1,"Introduced, referred to Health and Human Services. H.J. 327."
1968998,2025-02-19,House,2,"Subcommittee: Gehlbach, Andrews and Johnson, R. H.J. 362."
1968998,2025-02-19,House,3,"Subcommittee Meeting: 02/25/2025 8:30AM House Lounge."
1968998,2025-02-25,House,4,"Subcommittee recommends passage."
1969018,2025-02-13,House,1,"Introduced, referred to Education. H.J. 327."
1969018,2025-02-25,House,2,"Subcommittee: Ingels, Kurth and Weldon. H.J. 427."
1969038,2025-02-13,House,1,"Introduced, referred to Economic Growth and Technology. H.J. 327."
1969038,2025-03-04,House,2,"Subcommittee: Barker, Andrews and Wichtendahl. H.J. 502."
1969038,2025-03-04,House,3,"Subcommittee Meeting: 03/05/2025 12:15PM RM 102."
1969038,2025-03-05,House,4,"Subcommittee recommends passage."
1969057,2025-02-13,House,1,"Introduced, referred to Judiciary. H.J. 328."
1969057,2025-02-19,House,2,"Subcommittee: Gustoff, Croken and Stone. H.J. 362."
1969057,2025-02-24,House,3,"Subcommittee Meeting: 02/25/2025 4:00PM RM 19."
1969057,2025-02-25,House,4,"Subcommittee Meeting: 02/26/2025 8:00AM RM 304."
1969057,2025-02-26,House,5,"Subcommittee recommends passage."
1969057,2025-03-04,House,6,"Committee report, recommending amendment and passage. H.J. 506."
1969057,2025-03-04,House,7,"Committee vote: Yeas, 20. Nays, 0. Excused, 1. H.J. 506."
1969057,2025-03-07,House,8,"Committee report approving bill, renumbered as HF 862."
1969057,2025-03-31,House,9,"Withdrawn. H.J. 871."
1969080,2025-02-13,Senate,1,"By COMMITTEE ON HEALTH AND HUMAN SERVICES"
1969080,2025-02-13,Senate,2,"Introduced, referred to Health and Human Services."
1969080,2025-02-13,Senate,3,"Subcommittee: Rowley, Celsi, and Pike."
1969080,2025-02-19,Senate,4,"Subcommittee Meeting: 02/20/2025 1:00PM Senate Lounge."
1969080,2025-02-20,Senate,5,"Subcommittee recommends passage."
1969080,2025-02-26,Senate,6,"Committee report approving bill, renumbered as SF 469."
1969100,2025-02-13,House,1,"Introduced, referred to Local Government. H.J. 329."
1969100,2025-02-17,House,2,"Subcommittee: Bloomingdale, Blom and Wichtendahl. H.J. 341."
1969100,2025-02-18,House,3,"Subcommittee Meeting: 02/24/2025 12:30PM House Lounge 2."
1969100,2025-02-24,House,4,"Subcommittee recommends passage."
1969100,2025-02-25,House,5,"Committee report, recommending passage. H.J. 435."
1969100,2025-02-25,House,6,"Committee vote: Yeas, 20. Nays, 0. Excused, 1. H.J. 435."
1969100,2025-02-28,House,7,"Committee report approving bill, renumbered as HF 652."
1969100,2025-03-14,House,8,"Withdrawn. H.J. 660."
1969122,2025-02-13,House,1,"By COMMITTEE ON STATE GOVERNMENT"
1969122,2025-02-13,House,2,"Introduced, referred to State Government. H.J. 331."
1969122,2025-02-13,House,3,"Subcommittee: Bloomingdale, Hora and Nielsen. H.J. 332."
1969122,2025-02-20,House,4,"Subcommittee Meeting: 02/25/2025 8:30AM RM 102."
1969122,2025-02-25,House,5,"Subcommittee recommends passage."
1969122,2025-03-05,House,6,"Committee report, recommending passage. H.J. 533."
1969122,2025-03-05,House,7,"Committee vote: Yeas, 21. Nays, 0. Excused, 2. H.J. 533."
1969122,2025-03-07,House,8,"Committee report approving bill, renumbered as HF 846."
1969142,2025-02-13,Senate,1,"Introduced, placed on calendar. S.J. 266."
1969142,2025-02-13,Senate,2,"Committee report, approving bill. S.J. 273."
1969142,2025-06-16,Senate,3,"Referred to Local Government. S.J. 1057."
1969164,2025-02-13,House,1,"By COMMITTEE ON PUBLIC SAFETY"
1969164,2025-02-13,House,2,"Introduced, referred to Public Safety. H.J. 330."
1969164,2025-02-13,House,3,"Subcommittee: Wengryn, Hermanson and Kressig. H.J. 332."
1969164,2025-02-17,House,4,"Subcommittee Meeting: 02/20/2025 12:00PM House Lounge."
1969164,2025-02-20,House,5,"Subcommittee recommends passage."
1969164,2025-03-05,House,6,"Committee report, recommending amendment and passage. H.J. 532."
1969164,2025-03-05,House,7,"Committee vote: Yeas, 13. Nays, 8. Excused, 2. H.J. 532."
1969164,2025-03-11,House,8,"Committee report approving bill, renumbered as HF 918."
1969186,2025-02-13,House,1,"Introduced, referred to Ways and Means. H.J. 329."
1969186,2025-02-26,House,2,"Subcommittee: Johnson, C., Hermanson and Wichtendahl. H.J. 441."
1969186,2025-03-11,House,3,"Subcommittee Meeting: 03/11/2025 12:00PM House Lounge."
1969186,2025-03-11,House,4,"Subcommittee recommends passage."
1969207,2025-02-13,House,1,"Introduced, referred to Judiciary. H.J. 321."
1969228,2025-02-13,House,1,"Introduced, placed on calendar. H.J. 321."
1969228,2025-03-17,House,2,"Amendment H-1095 filed. H.J. 677."
1969228,2025-03-20,House,3,"Amendment H-1146 filed. H.J. 770."
1969228,2025-04-03,House,4,"Referred to Commerce. H.J. 895."
1969252,2025-02-13,Senate,1,"Introduced, placed on calendar. S.J. 266."
1969252,2025-02-13,Senate,2,"Committee report, approving bill. S.J. 271."
1969252,2025-06-16,Senate,3,"Referred to Health and Human Services. S.J. 1057."
1969267,2025-02-13,Senate,1,"By COMMITTEE ON JUDICIARY"
1969267,2025-02-13,Senate,2,"Introduced, referred to Judiciary."
1969267,2025-02-13,Senate,3,"Subcommittee: Lofgren, Blake, and Green."
1969267,2025-02-17,Senate,4,"Subcommittee Meeting: 02/19/2025 9:30AM Room 217 Conference Room."
1969267,2025-02-19,Senate,5,"Subcommittee recommends passage."
1969267,2025-02-19,Senate,6,"Committee report approving bill, renumbered as SF 396."
1969292,2025-02-13,Senate,1,"By COMMITTEE ON JUDICIARY"
1969292,2025-02-13,Senate,2,"Introduced, referred to Judiciary."
1969292,2025-02-13,Senate,3,"Subcommittee: Taylor, Bisignano, and Green."
1969292,2025-02-20,Senate,4,"Subcommittee Meeting: 02/26/2025 3:00PM Room 217 Conference Room."
1969292,2025-03-03,Senate,5,"Subcommittee recommends amendment and passage."
1969292,2025-03-04,Senate,6,"Committee report approving bill, renumbered as SF 523."
1969313,2025-02-13,Senate,1,"By COMMITTEE ON JUDICIARY"
1969313,2025-02-13,Senate,2,"Introduced, referred to Judiciary."
1969313,2025-02-13,Senate,3,"Subcommittee: Schultz, Dickey, and Knox."
1969313,2025-02-17,Senate,4,"Subcommittee Meeting: 02/18/2025 1:30PM Room 217 Conference Room."
1969313,2025-02-18,Senate,5,"Subcommittee recommends passage."
1969313,2025-02-26,Senate,6,"Committee report approving bill, renumbered as SF 462."
1969333,2025-02-13,Senate,1,"Introduced, placed on calendar. S.J. 265."
1969333,2025-02-13,Senate,2,"Committee report, approving bill. S.J. 271."
1969333,2025-04-03,Senate,3,"Placed on calendar under unfinished business. S.J. 688."
1969333,2025-04-07,Senate,4,"Passed Senate, yeas 33, nays 14. S.J. 706."
1969333,2025-04-07,Senate,5,"Immediate message. S.J. 706."
1969333,2025-04-08,House,6,"Message from Senate. H.J. 905."
1969333,2025-04-08,House,7,"Read first time, passed on file. H.J. 906."
1969333,2025-05-15,House,8,"Rereferred to Health and Human Services. H.J. 1221."
1969355,2025-02-13,Senate,1,"Introduced, referred to State Government. S.J. 265."
1969355,2025-02-18,Senate,2,"Subcommittee: Rozenboom, Schultz, and Winckler. S.J. 303."
1969374,2025-02-13,House,1,"Introduced, referred to Commerce. H.J. 327."
1969396,2025-02-13,Senate,1,"Introduced, referred to Commerce. S.J. 264."
1969396,2025-02-18,Senate,2,"Subcommittee: Bousselot, Blake, and Driscoll. S.J. 303."
1969418,2025-02-13,House,1,"Introduced, referred to Ways and Means. H.J. 329."
1969443,2025-02-13,House,1,"By COMMITTEE ON PUBLIC SAFETY"
1969443,2025-02-13,House,2,"Introduced, referred to Public Safety. H.J. 330."
1969443,2025-02-13,House,3,"Subcommittee: Wengryn, Hermanson and Wessel-Kroeschell. H.J. 332."
1969443,2025-02-24,House,4,"Subcommittee Meeting: 02/26/2025 12:30PM RM 102."
1969443,2025-02-26,House,5,"Subcommittee reassigned: Wengryn, Hermanson and Levin. H.J. 442."
1969443,2025-02-26,House,6,"Subcommittee recommends passage."
1969443,2025-03-06,House,7,"Committee report, recommending amendment and passage. H.J. 554."
1969443,2025-03-06,House,8,"Committee vote: Yeas, 23. Nays, 0. H.J. 554."
1969443,2025-03-12,House,9,"Committee report approving bill, renumbered as HF 935."
1969464,2025-02-13,Senate,1,"Introduced, placed on calendar. S.J. 265."
1969464,2025-02-13,Senate,2,"Committee report, approving bill. S.J. 273."
1969464,2025-02-24,Senate,3,"Attached to HF 260. S.J. 336."
1969464,2025-02-25,Senate,4,"HF 260 substituted. S.J. 348."
1969464,2025-02-25,Senate,5,"Withdrawn. S.J. 349."
1969485,2025-02-13,House,1,"Introduced, referred to Health and Human Services. H.J. 328."
1969506,2025-02-13,Senate,1,"By COMMITTEE ON JUDICIARY"
1969506,2025-02-13,Senate,2,"Introduced, referred to Judiciary."
1969506,2025-02-13,Senate,3,"Subcommittee: Rowley, Quirmbach, and Reichman."
1969506,2025-02-20,Senate,4,"Subcommittee Meeting: 02/25/2025 9:30AM Room 217 Conference Room."
1969506,2025-02-25,Senate,5,"Subcommittee recommends amendment and passage."
1969528,2025-02-13,House,1,"Introduced, referred to Judiciary. H.J. 328."
1969547,2025-02-13,Senate,1,"Introduced, placed on calendar. S.J. 266."
1969547,2025-02-13,Senate,2,"Committee report, approving bill. S.J. 271."
1969547,2025-03-10,Senate,3,"Attached to HF 300. S.J. 457."
1969547,2025-03-26,Senate,4,"HF 300 substituted. S.J. 648."
1969547,2025-03-26,Senate,5,"Withdrawn. S.J. 649."
1969571,2025-02-13,Senate,1,"Introduced, placed on calendar. S.J. 266."
1969571,2025-02-13,Senate,2,"Committee report, approving bill. S.J. 274."
1969571,2025-03-10,Senate,3,"Passed Senate, yeas 47, nays 0. S.J. 450."
1969571,2025-03-10,Senate,4,"Immediate message. S.J. 451."
1969571,2025-03-10,House,5,"Message from Senate. H.J. 589."
1969571,2025-03-20,House,6,"Read first time, referred to Labor and Workforce. H.J. 753."
1969571,2025-04-01,House,7,"Subcommittee: Ingels, Cooling and Hayes. H.J. 877."
1969571,2025-04-01,House,8,"Subcommittee Meeting: 04/02/2025 8:30AM House Lounge 2."
1969571,2025-04-02,House,9,"Tabled until future meeting."
1969595,2025-02-13,Senate,1,"Introduced, referred to Education. S.J. 266."
1969595,2025-02-17,Senate,2,"Subcommittee: Shipley, Salmon, and Winckler."
1969595,2025-02-19,Senate,3,"Subcommittee Meeting: 02/20/2025 8:00AM Room 217 Conference Room."
1969595,2025-02-20,Senate,4,"Subcommittee recommends passage."
1969614,2025-02-13,House,1,"By COMMITTEE ON JUDICIARY"
1969614,2025-02-13,House,2,"Introduced, referred to Judiciary. H.J. 331."
1969614,2025-02-13,House,3,"Subcommittee: Lohse, Holt and Olson. H.J. 332."
1969614,2025-02-17,House,4,"Subcommittee Meeting: 02/20/2025 12:30PM RM 19."
1969614,2025-02-20,House,5,"Subcommittee recommends passage."
1969639,2025-02-13,Senate,1,"Introduced, placed on calendar. S.J. 267."
1969639,2025-02-13,Senate,2,"Committee report, approving bill. S.J. 272."
1969639,2025-03-17,Senate,3,"Fiscal note."
1969639,2025-03-17,Senate,4,"Passed Senate, yeas 46, nays 0. S.J. 545."
1969639,2025-03-17,Senate,5,"Immediate message. S.J. 545."
1969639,2025-03-17,House,6,"Message from Senate. H.J. 663."
1969639,2025-03-18,House,7,"Read first time, referred to Commerce. H.J. 679."
1969639,2025-03-19,House,8,"Subcommittee: Lundgren, Barker and Wilson. H.J. 752."
1969639,2025-03-19,House,9,"Subcommittee Meeting: 03/25/2025 12:30PM RM 102."
1969639,2025-03-20,House,10,"Fiscal note."
1969639,2025-03-25,House,11,"Subcommittee recommends passage."
1969639,2025-04-01,House,12,"Committee report, recommending amendment and passage. H.J. 882."
1969639,2025-04-01,House,13,"Committee vote: Yeas, 20. Nays, 0. Excused, 2. Rule 76, 1. H.J. 882."
1969639,2025-04-02,House,14,"Placed on calendar. H.J. 882."
1969639,2025-04-02,House,15,"Committee amendment H-1216 filed. H.J. 892."
1969639,2025-04-10,House,16,"Placed on calendar under unfinished business. H.J. 928."
1969639,2025-05-15,House,17,"Rereferred to Commerce. H.J. 1222."
1969661,2025-02-13,Senate,1,"By COMMITTEE ON JUDICIARY"
1969661,2025-02-13,Senate,2,"Introduced, referred to Judiciary."
1969661,2025-02-13,Senate,3,"Subcommittee: Schultz, Blake, and Rowley."
1969683,2025-02-13,Senate,1,"Introduced, placed on calendar. S.J. 266."
1969683,2025-02-13,Senate,2,"Committee report, approving bill. S.J. 273."
1969683,2025-02-25,Senate,3,"Amendment S-3008 filed. S.J. 360."
1969683,2025-03-17,Senate,4,"Amendment S-3022 filed, adopted. S.J. 550."
1969683,2025-03-17,Senate,5,"Amendment S-3008 adopted. S.J. 550."
1969683,2025-03-17,Senate,6,"Passed Senate, yeas 37, nays 9. S.J. 550."
1969683,2025-03-17,Senate,7,"Immediate message. S.J. 551."
1969683,2025-03-17,House,8,"Message from Senate. H.J. 663."
1969683,2025-03-18,House,9,"Read first time, passed on file. H.J. 678."
1969683,2025-04-03,House,10,"Placed on calendar under unfinished business. H.J. 8794."
1969683,2025-04-17,House,11,"Substituted for HF 641. H.J. 967."
1969683,2025-04-17,House,12,"Amendment H-1246, yeas 31, nays 61, filed, lost. H.J. 968."
1969683,2025-04-17,House,13,"Passed House, yeas 81, nays 12. H.J. 969."
1969683,2025-04-24,House,14,"Explanation of vote. H.J. 1070."
1969683,2025-04-17,House,15,"Immediate message. H.J. 985."
1969683,2025-04-21,Senate,16,"Message from House. S.J. 830."
1969683,2025-05-19,Senate,17,"Reported correctly enrolled, signed by President and Speaker, and sent to Governor. S.J. 1050."
1969683,2025-05-19,Senate,18,"Signed by Governor. S.J. 1051."
1969706,2025-02-13,Senate,1,"Introduced, placed on calendar. S.J. 265."
1969706,2025-02-13,Senate,2,"Committee report, approving bill. S.J. 274."
1969706,2025-02-19,Senate,3,"Referred to Appropriations. S.J. 307."
1969706,2025-02-19,Senate,4,"Subcommittee: Bousselot, Kraayenbrink, and Petersen. S.J. 314."
1969706,2025-03-11,Senate,5,"Subcommittee Meeting: 03/12/2025 11:30AM Senate Lounge."
1969706,2025-03-12,Senate,6,"Subcommittee recommends passage."
1969706,2025-04-17,Senate,7,"Committee report approving bill, renumbered as SF 630. S.J. 828."
1969728,2025-02-13,Senate,1,"Introduced, placed on calendar. S.J. 266."
1969728,2025-02-13,Senate,2,"Committee report, approving bill. S.J. 274."
1969728,2025-03-11,Senate,3,"Passed Senate, yeas 47, nays 0. S.J. 487."
1969728,2025-03-11,Senate,4,"Immediate message. S.J. 488."
1969728,2025-03-12,House,5,"Message from Senate. H.J. 609."
1969728,2025-03-12,House,6,"Read first time, referred to State Government. H.J. 615."
1969728,2025-03-24,House,7,"Subcommittee: Hora, Jeneary and Turek. H.J. 791."
1969728,2025-03-26,House,8,"Subcommittee Meeting: 03/27/2025 12:00PM RM 103."
1969728,2025-03-27,House,9,"Subcommittee recommends passage."
1969728,2025-03-31,House,10,"Committee report, recommending passage. H.J. 879."
1969728,2025-03-31,House,11,"Committee vote: Yeas, 18. Nays, 0. Excused, 5. H.J. 879."
1969728,2025-04-01,House,12,"Placed on calendar. H.J. 879."
1969728,2025-04-10,House,13,"Placed on calendar under unfinished business. H.J. 928."
1969728,2025-05-08,House,14,"Passed House, yeas 84, nays 0. H.J. 1101."
1969728,2025-05-13,House,15,"Explanation of vote. H.J. 1176."
1969728,2025-05-08,House,16,"Immediate message. H.J. 1110."
1969728,2025-05-09,Senate,17,"Message from House. S.J. 947."
1969728,2025-05-19,Senate,18,"Reported correctly enrolled, signed by President and Speaker, and sent to Governor. S.J. 1050."
1969728,2025-05-19,Senate,19,"Signed by Governor. S.J. 1052."
1969751,2025-02-13,House,1,"By COMMITTEE ON STATE GOVERNMENT"
1969751,2025-02-13,House,2,"Introduced, referred to State Government. H.J. 331."
1969751,2025-02-13,House,3,"Subcommittee: Bossman, Nielsen and Siegrist. H.J. 332."
1969751,2025-02-19,House,4,"Subcommittee Meeting: 02/25/2025 12:15PM RM 304."
1969751,2025-02-25,House,5,"Subcommittee recommends passage."
1969751,2025-02-26,House,6,"Committee report, recommending passage. H.J. 448."
1969751,2025-02-26,House,7,"Committee vote: Yeas, 22. Nays, 0. Excused, 1. H.J. 448."
1969751,2025-03-05,House,8,"Committee report approving bill, renumbered as HF 778."
1969773,2025-02-13,House,1,"By COMMITTEE ON STATE GOVERNMENT"
1969773,2025-02-13,House,2,"Introduced, referred to State Government. H.J. 331."
1969773,2025-02-13,House,3,"Subcommittee: Johnson, C., Bergan and Cooling. H.J. 332."
1969773,2025-02-17,House,4,"Subcommittee Meeting: 02/18/2025 8:30AM House Lounge 2."
1969773,2025-02-18,House,5,"Subcommittee recommends passage."
1969773,2025-02-26,House,6,"Committee report, recommending passage. H.J. 447."
1969773,2025-02-26,House,7,"Committee vote: Yeas, 16. Nays, 7. H.J. 447."
1969773,2025-03-05,House,8,"Committee report approving bill, renumbered as HF 776."
1969794,2025-02-13,House,1,"By COMMITTEE ON TRANSPORTATION"
1969794,2025-02-13,House,2,"Introduced, referred to Transportation. H.J. 331."
1969794,2025-02-13,House,3,"Subcommittee: Golding, Jeneary and Wilson. H.J. 332."
1969794,2025-02-20,House,4,"Subcommittee Meeting: 02/26/2025 8:30AM House Lounge."
1969794,2025-02-26,House,5,"Subcommittee recommends passage."
1969794,2025-02-26,House,6,"Committee report, recommending amendment and passage. H.J. 449."
1969794,2025-02-26,House,7,"Committee vote: Yeas, 20. Nays, 0. Excused, 1. H.J. 449."
1969794,2025-03-05,House,8,"Committee report approving bill, renumbered as HF 777."
1969817,2025-02-13,House,1,"Introduced, placed on calendar. H.J. 329."
1969817,2025-02-25,House,2,"Amendment H-1024 filed. H.J. 436."
1969817,2025-04-03,House,3,"Referred to Higher Education. H.J. 895."
1969839,2025-02-13,Senate,1,"Introduced, referred to Health and Human Services. S.J. 264."
1969839,2025-02-18,Senate,2,"Subcommittee: Rowley, Pike, and Trone Garriott. S.J. 303."
1969839,2025-02-18,Senate,3,"Subcommittee Meeting: 02/20/2025 11:30AM Room 217 Conference Room."
1969839,2025-02-20,Senate,4,"Subcommittee recommends passage."
1969839,2025-02-27,Senate,5,"Committee report, recommending passage. S.J. 383."
1969839,2025-02-27,Senate,6,"Placed on calendar."
1969839,2025-04-03,Senate,7,"Placed on calendar under unfinished business. S.J. 688."
1969839,2025-04-21,Senate,8,"Passed Senate, yeas 45, nays 0. S.J. 836."
1969839,2025-04-21,Senate,9,"Immediate message. S.J. 839."
1969839,2025-04-21,House,10,"Message from Senate. H.J. 995."
1969839,2025-04-21,House,11,"Read first time, passed on file. H.J. 1011."
1969839,2025-05-15,House,12,"Rereferred to Health and Human Services. H.J. 1221."
1969859,2025-02-13,House,1,"Introduced, referred to State Government. H.J. 329."
1969859,2025-02-18,House,2,"Subcommittee: Siegrist, Smith and Wilburn. H.J. 349."
1969859,2025-02-18,House,3,"Subcommittee Meeting: 02/19/2025 8:00AM RM 304."
1969859,2025-02-19,House,4,"Subcommittee recommends passage."
1969859,2025-02-26,House,5,"Committee report, recommending passage. H.J. 447."
1969859,2025-02-26,House,6,"Committee vote: Yeas, 23. Nays, 0. H.J. 447."
1969859,2025-02-28,House,7,"Committee report approving bill, renumbered as HF 706."
1969859,2025-03-31,House,8,"Withdrawn. H.J. 871."
1969879,2025-02-13,House,1,"Introduced, referred to Health and Human Services. H.J. 327."
1969903,2025-02-13,House,1,"By COMMITTEE ON STATE GOVERNMENT"
1969903,2025-02-13,House,2,"Introduced, referred to State Government. H.J. 330."
1969903,2025-02-13,House,3,"Subcommittee: Wulf, Bossman and Scheetz. H.J. 332."
1969903,2025-02-18,House,4,"Subcommittee Meeting: 02/19/2025 2:30PM House Lounge (Cancelled)."
1969903,2025-02-26,House,5,"Subcommittee Meeting: 02/26/2025 11:45AM RM 102."
1969903,2025-02-26,House,6,"Subcommittee recommends passage."
1969903,2025-03-05,House,7,"Committee report, recommending amendment and passage. H.J. 533."
1969903,2025-03-05,House,8,"Committee vote: Yeas, 15. Nays, 6. Excused, 2. H.J. 533."
1969903,2025-03-07,House,9,"Committee report approving bill, renumbered as HF 851."
1969927,2025-02-13,House,1,"By COMMITTEE ON STATE GOVERNMENT"
1969927,2025-02-13,House,2,"Introduced, referred to State Government. H.J. 331."
1969927,2025-02-13,House,3,"Subcommittee: Hora, Srinivas and Wulf. H.J. 332."
1969927,2025-02-17,House,4,"Subcommittee Meeting: 02/18/2025 2:30PM House Lounge 2."
1969927,2025-02-18,House,5,"Subcommittee recommends passage."
1969927,2025-02-26,House,6,"Committee report, recommending passage. H.J. 448."
1969927,2025-02-26,House,7,"Committee vote: Yeas, 17. Nays, 6. H.J. 448."
1969927,2025-02-28,House,8,"Committee report approving bill, renumbered as HF 704."
1969946,2025-02-13,Senate,1,"Introduced, placed on calendar. S.J. 265."
1969946,2025-02-13,Senate,2,"Committee report, approving bill. S.J. 272."
1969946,2025-02-25,Senate,3,"Amendment S-3009 filed. S.J. 360."
1969946,2025-03-04,Senate,4,"Amendment S-3016 filed. S.J. 412."
1969946,2025-03-11,Senate,5,"Point of order raised on S-3016. S.J. 487."
1969946,2025-03-11,Senate,6,"Deferred. S.J. 487."
1969946,2025-04-07,Senate,7,"Amendments S-3009 and S-3016 withdrawn. S.J. 701."
1969946,2025-04-07,Senate,8,"Passed Senate, yeas 31, nays 16. S.J. 702."
1969946,2025-04-07,Senate,9,"Immediate message. S.J. 702."
1969946,2025-04-08,House,10,"Message from Senate. H.J. 905."
1969946,2025-04-09,House,11,"Read first time, passed on file. H.J. 920."
1969946,2025-05-12,House,12,"Substituted for HF 702. H.J. 1135."
1969946,2025-05-12,House,13,"Amendment H-1313 filed. H.J. 1135."
1969946,2025-05-12,House,14,"Point of order raised on amendment H-1313, ruled not germane. H.J. 1136."
1969946,2025-05-12,House,15,"Motion to suspend rules for immediate consideration of amendment H-1313, yeas 25, nays 65. H.J. 1136."
1969946,2025-05-12,House,16,"Motion to suspend rules failed. H.J. 1137."
1969946,2025-05-12,House,17,"Passed House, yeas 51, nays 39. H.J. 1138."
1969946,2025-05-20,House,18,"Explanation of vote. H.J. 1223."
1969946,2025-05-12,House,19,"Immediate message. H.J. 1140."
1969946,2025-05-12,Senate,20,"Message from House. S.J. 967."
1969946,2025-05-19,Senate,21,"Reported correctly enrolled, signed by President and Speaker, and sent to Governor. S.J. 1050."
1969946,2025-05-19,Senate,22,"Signed by Governor. S.J. 1051."
1969969,2025-02-13,House,1,"Introduced, referred to Ways and Means. H.J. 329."
1969988,2025-02-13,House,1,"Introduced, referred to Health and Human Services. H.J. 328."
1970004,2025-02-13,Senate,1,"Introduced, referred to Transportation. S.J. 264."
1970004,2025-02-18,Senate,2,"Subcommittee: Lofgren, Dickey, and Zimmer. S.J. 303."
1970004,2025-02-18,Senate,3,"Subcommittee Meeting: 02/19/2025 8:30AM Senate Lounge."
1970004,2025-02-19,Senate,4,"Subcommittee recommends passage."
1970004,2025-02-26,Senate,5,"Committee report approving bill, renumbered as SF 447. S.J. 372."
1970021,2025-02-13,Senate,1,"Introduced, referred to Ways and Means. S.J. 267."
1970021,2025-02-18,Senate,2,"Subcommittee: Reichman, Gruenhagen, and Petersen. S.J. 303."
1970021,2025-03-31,Senate,3,"Subcommittee Meeting: 04/01/2025 1:00PM Room 315."
1970021,2025-04-01,Senate,4,"Subcommittee recommends passage."
1970021,2025-04-21,Senate,5,"Committee report approving bill, renumbered as SF 634. S.J. 844."
1970073,2025-02-13,Senate,1,"Introduced, referred to State Government. S.J. 264."
1970073,2025-02-18,Senate,2,"Subcommittee: Rozenboom, Celsi, and Schultz. S.J. 303."
1970133,2025-02-13,Senate,1,"Introduced, referred to Judiciary. S.J. 267."
1970133,2025-02-20,Senate,2,"Subcommittee: Schultz, Bousselot, and Knox. S.J. 326."
1970191,2025-02-13,Senate,1,"Introduced, referred to State Government. S.J. 267."
1970191,2025-02-20,Senate,2,"Subcommittee: Reichman, Campbell, and Celsi. S.J. 326."
1970191,2025-02-25,Senate,3,"Subcommittee reassigned: Reichman, Blake, and Campbell. S.J. 356."
1970191,2025-02-26,Senate,4,"Subcommittee Meeting: 03/03/2025 2:30PM Room 217 Conference Room."
1970191,2025-03-04,Senate,5,"Subcommittee recommends passage."
1970191,2025-03-05,Senate,6,"Committee report approving bill, renumbered as SF 551. S.J. 442."
1970249,2025-02-13,Senate,1,"Introduced, placed on calendar. S.J. 267."
1970249,2025-02-13,Senate,2,"Committee report, approving bill. S.J. 272."
1970249,2025-03-11,Senate,3,"Passed Senate, yeas 47, nays 0. S.J. 488."
1970249,2025-03-11,Senate,4,"Immediate message. S.J. 490."
1970249,2025-03-12,House,5,"Message from Senate. H.J. 609."
1970249,2025-03-12,House,6,"Read first time, referred to Commerce. H.J. 615."
1970249,2025-03-13,House,7,"Subcommittee: Lundgren, Srinivas and Wilz, H. H.J. 657."
1970249,2025-03-17,House,8,"Subcommittee Meeting: 03/19/2025 8:00AM RM 103."
1970249,2025-03-19,House,9,"Subcommittee recommends passage."
1971851,2025-02-17,Senate,1,"Introduced, referred to Judiciary. S.J. 277."
1971851,2025-02-20,Senate,2,"Subcommittee: Webster, Bisignano, and Rowley. S.J. 326."
1971851,2025-02-24,Senate,3,"Subcommittee reassigned: Webster, Rowley, and Weiner. S.J. 341."
1971851,2025-02-25,Senate,4,"Subcommittee Meeting: 02/26/2025 4:30PM Room 217 Conference Room."
1971851,2025-03-03,Senate,5,"Subcommittee recommends amendment and passage."
1971963,2025-02-17,House,1,"Introduced, referred to Labor and Workforce. H.J. 335."
1972101,2025-02-17,House,1,"Introduced, referred to Natural Resources. H.J. 337."
1972101,2025-02-25,House,2,"Subcommittee: Wengryn, Barker and Judge. H.J. 427."
1972101,2025-03-03,House,3,"Subcommittee Meeting: 03/04/2025 7:45AM House Lounge 2."
1972101,2025-03-04,House,4,"Subcommittee recommends passage."
1972101,2025-03-04,House,5,"Committee report, recommending passage. H.J. 508."
1972101,2025-03-04,House,6,"Committee vote: Yeas, 21. Nays, 0. H.J. 508."
1972101,2025-03-05,House,7,"Committee report approving bill, renumbered as HF 797."
1972114,2025-02-17,House,1,"Introduced, referred to Ways and Means. H.J. 337."
1972114,2025-02-26,House,2,"Subcommittee: Young, Jones and Judge. H.J. 441."
1972114,2025-03-04,House,3,"Subcommittee Meeting: 03/11/2025 12:00PM House Lounge 2."
1972114,2025-03-11,House,4,"Subcommittee recommends passage."
1972129,2025-02-17,House,1,"Introduced, referred to Health and Human Services. H.J. 335."
1972140,2025-02-17,House,1,"Introduced, referred to Education. H.J. 335."
1972155,2025-02-17,Senate,1,"By COMMITTEE ON STATE GOVERNMENT"
1972155,2025-02-17,Senate,2,"Introduced, referred to State Government."
1972155,2025-02-17,Senate,3,"Subcommittee: Rozenboom, Alons, and Winckler."
1972155,2025-02-18,Senate,4,"Subcommittee Meeting: 02/19/2025 3:30PM Senate Lounge."
1972155,2025-02-20,Senate,5,"Subcommittee recommends passage."
1972155,2025-03-05,Senate,6,"Committee report approving bill, renumbered as SF 541."
1972169,2025-02-17,House,1,"By COMMITTEE ON JUDICIARY"
1972169,2025-02-17,House,2,"Introduced, referred to Judiciary. H.J. 340."
1972169,2025-02-17,House,3,"Subcommittee: Thompson, M., Fett and Wilburn. H.J. 342."
1972169,2025-02-18,House,4,"Subcommittee Meeting: 02/20/2025 10:30AM House Lounge 2."
1972169,2025-02-20,House,5,"Subcommittee recommends passage."
1972169,2025-02-25,House,6,"Committee report, recommending passage. H.J. 434."
1972169,2025-02-25,House,7,"Committee vote: Yeas, 21. Nays, 0. H.J. 434."
1972169,2025-02-28,House,8,"Committee report approving bill, renumbered as HF 649."
1972183,2025-02-17,House,1,"Introduced, referred to Judiciary. H.J. 336."
1972196,2025-02-17,House,1,"Introduced, referred to Labor and Workforce. H.J. 337."
1972210,2025-02-17,House,1,"Introduced, referred to Health and Human Services. H.J. 336."
1972222,2025-02-17,House,1,"By COMMITTEE ON JUDICIARY"
1972222,2025-02-17,House,2,"Introduced, referred to Judiciary. H.J. 340."
1972222,2025-02-17,House,3,"Subcommittee: Holt, Lawler and Srinivas. H.J. 342."
1972222,2025-02-19,House,4,"Subcommittee Meeting: 02/20/2025 8:30AM House Lounge 2 (Cancelled)."
1972237,2025-02-17,House,1,"Introduced, referred to Health and Human Services. H.J. 336."
1972250,2025-02-17,House,1,"Introduced, referred to Judiciary. H.J. 337."
1972264,2025-02-17,House,1,"Introduced, referred to State Government. H.J. 338."
1972264,2025-02-26,House,2,"Subcommittee: Jeneary, Collins and Turek. H.J. 441."
1972264,2025-03-03,House,3,"Subcommittee Meeting: 03/05/2025 8:30AM RM 102."
1972264,2025-03-05,House,4,"Subcommittee recommends passage."
1972264,2025-03-05,House,5,"Committee report, recommending passage. H.J. 532."
1972264,2025-03-05,House,6,"Committee vote: Yeas, 21. Nays, 0. Excused, 2. H.J. 532."
1972264,2025-03-07,House,7,"Committee report approving bill, renumbered as HF 876."
1972264,2025-04-17,House,8,"Withdrawn. H.J. 988."
1972278,2025-02-17,House,1,"Introduced, referred to State Government. H.J. 338."
1972278,2025-02-17,House,2,"Subcommittee: Jones, Lundgren and Zabner. H.J. 341."
1972278,2025-02-17,House,3,"Subcommittee Meeting: 02/18/2025 7:45AM House Lounge."
1972278,2025-02-18,House,4,"Subcommittee recommends passage."
1972278,2025-02-26,House,5,"Committee report, recommending passage. H.J. 447."
1972278,2025-02-26,House,6,"Committee vote: Yeas, 13. Nays, 10. H.J. 447."
1972278,2025-02-28,House,7,"Committee report approving bill, renumbered as HF 654."
1972291,2025-02-17,Senate,1,"By COMMITTEE ON STATE GOVERNMENT"
1972291,2025-02-17,Senate,2,"Introduced, referred to State Government."
1972291,2025-02-17,Senate,3,"Subcommittee: Rozenboom, Alons, and Winckler."
1972291,2025-02-18,Senate,4,"Subcommittee Meeting: 02/19/2025 4:00PM Senate Lounge."
1972291,2025-02-20,Senate,5,"Subcommittee recommends passage."
1972291,2025-02-26,Senate,6,"Committee report approving bill, renumbered as SF 459."
1972305,2025-02-17,House,1,"By COMMITTEE ON JUDICIARY"
1972305,2025-02-17,House,2,"Introduced, referred to Judiciary. H.J. 339."
1972305,2025-02-17,House,3,"Subcommittee: Holt, Olson and Wheeler. H.J. 342."
1972305,2025-02-20,House,4,"Subcommittee Meeting: 02/20/2025 12:00PM RM 103."
1972305,2025-02-20,House,5,"Subcommittee recommends passage."
1972318,2025-02-17,House,1,"Introduced, placed on calendar. H.J. 338."
1972318,2025-04-03,House,2,"Referred to Judiciary. H.J. 895."
1972333,2025-02-17,House,1,"Introduced, referred to Health and Human Services. H.J. 336."
1972351,2025-02-17,House,1,"Resolution filed, laid over under Rule 25. H.J. 343."
1972351,2025-03-18,House,2,"Resolution adopted. H.J. 679."
1972366,2025-02-17,Senate,1,"By COMMITTEE ON WAYS AND MEANS"
1972366,2025-02-17,Senate,2,"Introduced, referred to Ways and Means."
1972366,2025-02-18,Senate,3,"Subcommittee: Gruenhagen, Driscoll, and Townsend."
1972366,2025-02-19,Senate,4,"Subcommittee Meeting: 02/24/2025 2:00PM Senate Lounge."
1972366,2025-02-24,Senate,5,"Subcommittee recommends passage."
1972366,2025-03-11,Senate,6,"Committee report approving bill, renumbered as SF 608."
1972377,2025-02-17,House,1,"By COMMITTEE ON COMMERCE"
1972377,2025-02-17,House,2,"Introduced, referred to Commerce. H.J. 340."
1972377,2025-02-17,House,3,"Subcommittee: Lawler, Mohr, G. and Srinivas. H.J. 342."
1972377,2025-02-18,House,4,"Subcommittee Meeting: 02/20/2025 11:00AM House Lounge 2."
1972377,2025-02-20,House,5,"Subcommittee recommends passage."
1972377,2025-02-25,House,6,"Committee report, recommending amendment and passage. H.J. 430."
1972377,2025-02-25,House,7,"Committee vote: Yeas, 22. Nays, 0. Excused, 1. H.J. 430."
1972377,2025-02-28,House,8,"Committee report approving bill, renumbered as HF 637."
1972391,2025-02-17,House,1,"By COMMITTEE ON HEALTH AND HUMAN SERVICES"
1972391,2025-02-17,House,2,"Introduced, referred to Health and Human Services. H.J. 339."
1972391,2025-02-17,House,3,"Subcommittee: Lundgren, Matson and Wood. H.J. 342."
1972391,2025-02-19,House,4,"Subcommittee Meeting: 02/25/2025 12:00PM RM 19."
1972391,2025-02-25,House,5,"Subcommittee recommends passage."
1972391,2025-02-26,House,6,"Committee report, recommending passage. H.J. 467."
1972391,2025-02-26,House,7,"Committee vote: Yeas, 13. Nays, 6. Excused, 2. H.J. 467."
1972391,2025-03-05,House,8,"Committee report approving bill, renumbered as HF 775."
1972405,2025-02-17,Senate,1,"By COMMITTEE ON STATE GOVERNMENT"
1972405,2025-02-17,Senate,2,"Introduced, referred to State Government."
1972405,2025-02-17,Senate,3,"Subcommittee: Rozenboom, Alons, and Bisignano."
1972405,2025-02-18,Senate,4,"Subcommittee Meeting: 02/20/2025 11:00AM Room 315."
1972405,2025-02-20,Senate,5,"Subcommittee recommends passage."
1972405,2025-02-26,Senate,6,"Committee report approving bill, renumbered as SF 457."
1972420,2025-02-17,House,1,"Introduced, referred to Judiciary. H.J. 336."
1972435,2025-02-17,House,1,"By COMMITTEE ON COMMERCE"
1972435,2025-02-17,House,2,"Introduced, referred to Commerce. H.J. 339."
1972435,2025-02-17,House,3,"Subcommittee: Bossman, Blom and James. H.J. 342."
1972435,2025-02-19,House,4,"Subcommittee Meeting: 02/25/2025 12:00PM RM 304."
1972435,2025-02-25,House,5,"Subcommittee recommends passage."
1972435,2025-03-04,House,6,"Committee report, recommending amendment and passage. H.J. 525."
1972435,2025-03-04,House,7,"Committee vote: Yeas, 23. Nays, 0. H.J. 525."
1972435,2025-03-07,House,8,"Committee report approving bill, renumbered as HF 874."
1972449,2025-02-17,House,1,"Introduced, referred to Natural Resources. H.J. 337."
1972464,2025-02-17,House,1,"Introduced, placed on calendar. H.J. 338."
1972464,2025-03-04,House,2,"Fiscal note."
1972464,2025-03-13,House,3,"Amendment H-1075 filed. H.J. 659."
1972464,2025-03-17,House,4,"Amendment H-1098 filed. H.J. 677."
1972464,2025-03-17,House,5,"Amendment H-1109 filed. H.J. 677."
1972464,2025-03-18,House,6,"Point of order raised on amendment H-1098 to amendment H-1075, ruled not germane. H.J. 707."
1972464,2025-03-18,House,7,"Motion to suspend rules for immediate consideration of amendment H-1098 to amendment H-1075, yeas 32, nays 65. H.J. 707."
1972464,2025-03-18,House,8,"Motion to suspend rules failed. H.J. 708."
1972464,2025-03-18,House,9,"Amendment H-1109 to amendment H-1075, yeas 32, nays 65, lost. H.J. 709."
1972464,2025-03-18,House,10,"Point of order raised on amendment H-1075, ruled not germane. H.J. 709."
1972464,2025-03-18,House,11,"Motion to suspend rules for immediate consideration of amendment H-1075. H.J. 710."
1972464,2025-03-18,House,12,"Motion to suspend rules prevailed. H.J. 710."
1972464,2025-03-18,House,13,"Amendment H-1075 adopted. H.J. 710."
1972464,2025-03-18,House,14,"Passed House, yeas 60, nays 37. H.J. 710."
1972464,2025-03-18,House,15,"Immediate message. H.J. 717."
1972464,2025-03-19,Senate,16,"Message from House. S.J. 570."
1972464,2025-03-19,Senate,17,"Read first time, attached to SF 519. S.J. 570."
1972464,2025-03-19,Senate,18,"Fiscal note."
1972464,2025-04-03,Senate,19,"Placed on calendar under unfinished business. S.J. 689."
1972464,2025-04-15,Senate,20,"Substituted for SF 519. S.J. 786."
1972464,2025-04-15,Senate,21,"Passed Senate, yeas 32, nays 15. S.J. 786."
1972464,2025-04-15,Senate,22,"Immediate message. S.J. 789."
1972464,2025-04-16,House,23,"Message from Senate. H.J. 947."
1972464,2025-05-19,House,24,"Reported correctly enrolled, signed by Speaker and President, and sent to Governor. H.J. 1224."
1972464,2025-06-11,House,25,"Signed by Governor. H.J. 1226."
1972477,2025-02-17,House,1,"Introduced, referred to Judiciary. H.J. 336."
1972493,2025-02-17,House,1,"Introduced, placed on calendar. H.J. 338."
1972493,2025-03-13,House,2,"Passed House, yeas 96, nays 0. H.J. 652."
1972493,2025-03-17,House,3,"Explanation of vote. H.J. 676."
1972493,2025-03-13,House,4,"Immediate message. H.J. 656."
1972493,2025-03-17,Senate,5,"Message from House. S.J. 540."
1972493,2025-03-17,Senate,6,"Read first time, referred to Workforce. S.J. 540."
1972493,2025-03-20,Senate,7,"Subcommittee: Schultz, Dickey, and Wahls."
1972493,2025-03-25,Senate,8,"Subcommittee Meeting: 03/26/2025 8:30AM Room 315."
1972493,2025-03-26,Senate,9,"Subcommittee recommends passage."
1972493,2025-04-02,Senate,10,"Committee report, recommending passage. S.J. 683."
1972493,2025-04-02,Senate,11,"Placed on calendar."
1972493,2025-04-10,Senate,12,"Placed on calendar under unfinished business. S.J. 757."
1972493,2025-04-14,Senate,13,"Passed Senate, yeas 45, nays 0. S.J. 770."
1972493,2025-04-14,Senate,14,"Immediate message. S.J. 772."
1972493,2025-04-15,House,15,"Message from Senate. H.J. 933."
1972493,2025-05-19,House,16,"Reported correctly enrolled, signed by Speaker and President, and sent to Governor. H.J. 1224."
1972493,2025-05-19,House,17,"Signed by Governor. H.J. 1226."
1972506,2025-02-17,House,1,"By COMMITTEE ON COMMERCE"
1972506,2025-02-17,House,2,"Introduced, referred to Commerce. H.J. 339."
1972506,2025-02-17,House,3,"Subcommittee: Lawler, James and Vondran. H.J. 342."
1972506,2025-02-18,House,4,"Subcommittee Meeting: 02/24/2025 12:30PM House Lounge."
1972506,2025-02-24,House,5,"Subcommittee recommends passage."
1972506,2025-02-25,House,6,"Committee report, recommending amendment and passage. H.J. 429."
1972506,2025-02-25,House,7,"Committee vote: Yeas, 22. Nays, 0. Excused, 1. H.J. 429."
1972506,2025-02-28,House,8,"Committee report approving bill, renumbered as HF 636."
1972521,2025-02-17,House,1,"By COMMITTEE ON COMMERCE"
1972521,2025-02-17,House,2,"Introduced, referred to Commerce. H.J. 339."
1972521,2025-02-17,House,3,"Subcommittee: Thomson, C., Blom and Wilson. H.J. 342."
1972521,2025-02-17,House,4,"Subcommittee Meeting: 02/20/2025 12:00PM RM 304."
1972521,2025-02-20,House,5,"Subcommittee recommends passage."
1972521,2025-02-25,House,6,"Committee report, recommending amendment and passage. H.J. 430."
1972521,2025-02-25,House,7,"Committee vote: Yeas, 22. Nays, 0. Excused, 1. H.J. 430."
1972521,2025-02-28,House,8,"Committee report approving bill, renumbered as HF 640."
1972536,2025-02-17,House,1,"Introduced, referred to Health and Human Services. H.J. 335."
1972550,2025-02-17,House,1,"By COMMITTEE ON JUDICIARY"
1972550,2025-02-17,House,2,"Introduced, referred to Judiciary. H.J. 339."
1972550,2025-02-17,House,3,"Subcommittee: Thomson, C., Croken and Stone. H.J. 342."
1972550,2025-02-17,House,4,"Subcommittee Meeting: 02/20/2025 12:15PM RM 304."
1972550,2025-02-20,House,5,"Subcommittee recommends passage."
1972550,2025-03-04,House,6,"Committee report, recommending passage. H.J. 508."
1972550,2025-03-04,House,7,"Committee vote: Yeas, 20. Nays, 0. Excused, 1. H.J. 508."
1972550,2025-03-07,House,8,"Committee report approving bill, renumbered as HF 842."
1972562,2025-02-17,House,1,"Introduced, placed on calendar. H.J. 338."
1972562,2025-03-13,House,2,"Amendment H-1084 filed. H.J. 659."
1972562,2025-03-17,House,3,"Amendment H-1099 filed. H.J. 677."
1972562,2025-03-17,House,4,"Fiscal note."
1972562,2025-03-18,House,5,"Point of order raised on amendment H-1099, ruled not germane. H.J. 711."
1972562,2025-03-18,House,6,"Motion to suspend rules for immediate consideration of amendment H-1099, yeas 33, nays 64. H.J. 711."
1972562,2025-03-18,House,7,"Motion to suspend rules failed. H.J. 712."
1972562,2025-03-18,House,8,"Amendment H-1113 to amendment H-1084 filed, withdrawn. H.J. 712."
1972562,2025-03-18,House,9,"Amendment H-1112 to amendment H-1084 filed, withdrawn. H.J. 712."
1972562,2025-03-18,House,10,"Amendment H-1084, yeas 63, nays 34, adopted. H.J. 713."
1972562,2025-03-18,House,11,"Passed House, yeas 64, nays 33. H.J. 714."
1972562,2025-03-18,House,12,"Immediate message. H.J. 717."
1972562,2025-03-19,Senate,13,"Message from House. S.J. 570."
1972562,2025-03-19,Senate,14,"Read first time, referred to Education. S.J. 570."
1972562,2025-03-26,Senate,15,"Subcommittee: Green, Campbell, and Quirmbach. S.J. 654."
1972562,2025-03-26,Senate,16,"Subcommittee Meeting: []."
1972562,2025-03-27,Senate,17,"Subcommittee recommends passage."
1972562,2025-04-03,Senate,18,"Fiscal note."
1972562,2025-04-07,Senate,19,"Committee report, recommending passage. S.J. 716."
1972562,2025-04-07,Senate,20,"Placed on calendar."
1972562,2025-04-10,Senate,21,"Placed on calendar under unfinished business. S.J. 757."
1972562,2025-04-23,Senate,22,"Passed Senate, yeas 48, nays 0. S.J. 865."
1972562,2025-04-23,Senate,23,"Immediate message. S.J. 868."
1972562,2025-04-23,House,24,"Message from Senate. H.J. 1038."
1972562,2025-05-06,House,25,"Reported correctly enrolled, signed by Speaker and President, and sent to Governor. H.J. 1090."
1972562,2025-05-06,House,26,"Signed by Governor. H.J. 1091."
1972577,2025-02-17,House,1,"Introduced, referred to Ways and Means. H.J. 337."
1972590,2025-02-17,House,1,"By COMMITTEE ON HEALTH AND HUMAN SERVICES"
1972590,2025-02-17,House,2,"Introduced, referred to Health and Human Services. H.J. 340."
1972590,2025-02-17,House,3,"Subcommittee: Nordman, Brown-Powers and Meyer, A. H.J. 342."
1972590,2025-02-18,House,4,"Subcommittee Meeting: 02/19/2025 4:00PM RM 102."
1972590,2025-02-19,House,5,"Subcommittee recommends passage."
1972590,2025-02-25,House,6,"Committee report, recommending amendment and passage. H.J. 432."
1972590,2025-02-25,House,7,"Committee vote: Yeas, 19. Nays, 0. Excused, 2. H.J. 432."
1972590,2025-03-05,House,8,"Committee report approving bill, renumbered as HF 754."
1972600,2025-02-17,House,1,"By COMMITTEE ON ECONOMIC GROWTH AND TECHNOLOGY"
1972600,2025-02-17,House,2,"Introduced, referred to Economic Growth and Technology. H.J. 339."
1972600,2025-02-17,House,3,"Subcommittee: Latham, Croken and Wood. H.J. 342."
1972600,2025-02-20,House,4,"Subcommittee Meeting: 02/25/2025 12:15PM House Lounge 2."
1972600,2025-02-25,House,5,"Subcommittee recommends amendment and passage."
1972616,2025-02-17,Senate,1,"Introduced, referred to Education. S.J. 279."
1972616,2025-02-19,Senate,2,"Subcommittee: Evans, Kraayenbrink, and Zimmer. S.J. 314."
1972628,2025-02-17,Senate,1,"Introduced, referred to State Government. S.J. 276."
1972628,2025-02-18,Senate,2,"Subcommittee: Bousselot, Green, and Staed. S.J. 303."
1972628,2025-02-18,Senate,3,"Subcommittee Meeting: 02/19/2025 11:30AM Room G15."
1972628,2025-02-19,Senate,4,"Subcommittee recommends passage."
1972644,2025-02-17,Senate,1,"Introduced, referred to Health and Human Services. S.J. 278."
1972644,2025-02-20,Senate,2,"Subcommittee: Klimesh, Costello, and Trone Garriott. S.J. 327."
1972659,2025-02-17,Senate,1,"Introduced, referred to Natural Resources and Environment. S.J. 279."
1972659,2025-02-18,Senate,2,"Subcommittee: Costello, Sires, and Staed. S.J. 303."
1972659,2025-02-18,Senate,3,"Subcommittee Meeting: 02/19/2025 4:00PM Room 217 Conference Room."
1972659,2025-02-20,Senate,4,"Subcommittee recommends passage."
1972659,2025-02-25,Senate,5,"Committee report approving bill, renumbered as SF 423. S.J. 358."
1972677,2025-02-17,Senate,1,"By COMMITTEE ON NATURAL RESOURCES AND ENVIRONMENT"
1972677,2025-02-17,Senate,2,"Introduced, referred to Natural Resources and Environment."
1972677,2025-02-17,Senate,3,"Subcommittee: Sweeney, Evans, and Zimmer."
1972677,2025-02-18,Senate,4,"Subcommittee Meeting: 02/19/2025 3:00PM Room 315."
1972677,2025-02-19,Senate,5,"Subcommittee recommends amendment and passage."
1972677,2025-02-24,Senate,6,"Committee report approving bill, renumbered as SF 427."
1972692,2025-02-17,Senate,1,"Introduced, referred to Judiciary. S.J. 279."
1972692,2025-02-20,Senate,2,"Subcommittee: Schultz, Blake, and Bousselot. S.J. 327."
1972711,2025-02-17,Senate,1,"Introduced, referred to Judiciary. S.J. 278."
1972711,2025-02-20,Senate,2,"Subcommittee: Green, Blake, and Shipley. S.J. 327."
1972729,2025-02-17,Senate,1,"Introduced, referred to Judiciary. S.J. 280."
1972729,2025-02-20,Senate,2,"Subcommittee: Schultz, Bousselot, and Petersen. S.J. 327."
1972744,2025-02-17,Senate,1,"Introduced, referred to Judiciary. S.J. 278."
1972744,2025-02-20,Senate,2,"Subcommittee: Webster, Blake, and Schultz. S.J. 327."
1972744,2025-02-24,Senate,3,"Subcommittee Meeting: 02/26/2025 2:30PM Room 315."
1972744,2025-03-03,Senate,4,"Subcommittee recommends amendment and passage."
1972759,2025-02-17,Senate,1,"Introduced, referred to Judiciary. S.J. 278."
1972759,2025-02-19,Senate,2,"Rereferred to Health and Human Services. S.J. 307."
1972759,2025-02-24,Senate,3,"Subcommittee: Salmon, Campbell, and Celsi. S.J. 341."
1972759,2025-02-25,Senate,4,"Subcommittee reassigned: Salmon, Campbell, and Trone Garriott. S.J. 356."
1972759,2025-02-25,Senate,5,"Subcommittee Meeting: 02/26/2025 11:00AM Room 217 Conference Room."
1972759,2025-03-03,Senate,6,"Subcommittee recommends amendment and passage."
1972759,2025-03-06,Senate,7,"Committee report approving bill, renumbered as SF 554. S.J. 436."
1972777,2025-02-17,Senate,1,"Introduced, referred to Health and Human Services. S.J. 278."
1972777,2025-02-20,Senate,2,"Subcommittee: Klimesh, Costello, and Trone Garriott. S.J. 327."
1972793,2025-02-17,Senate,1,"Introduced, referred to Judiciary. S.J. 278."
1972793,2025-02-20,Senate,2,"Subcommittee: Lofgren, Bisignano, and Bousselot. S.J. 327."
1972793,2025-02-20,Senate,3,"Subcommittee Meeting: 02/25/2025 8:30AM Room 217 Conference Room."
1972793,2025-02-25,Senate,4,"Subcommittee recommends passage."
1972810,2025-02-17,Senate,1,"By COMMITTEE ON NATURAL RESOURCES AND ENVIRONMENT"
1972810,2025-02-17,Senate,2,"Introduced, referred to Natural Resources and Environment."
1972810,2025-02-17,Senate,3,"Subcommittee: Sweeney, Trone Garriott, and Zumbach."
1972810,2025-02-18,Senate,4,"Subcommittee Meeting: 02/19/2025 12:00PM Room 315."
1972810,2025-02-19,Senate,5,"Subcommittee recommends amendment and passage."
1972810,2025-02-24,Senate,6,"Committee report approving bill, renumbered as SJR 7."
1972826,2025-02-17,Senate,1,"By COMMITTEE ON NATURAL RESOURCES AND ENVIRONMENT"
1972826,2025-02-17,Senate,2,"Introduced, referred to Natural Resources and Environment."
1972826,2025-02-17,Senate,3,"Subcommittee: Shipley, Celsi, and De Witt."
1972826,2025-02-24,Senate,4,"Subcommittee Meeting: 02/25/2025 11:00AM Senate Lounge."
1972826,2025-02-25,Senate,5,"Subcommittee recommends passage."
1972841,2025-02-17,Senate,1,"Introduced, referred to Education. S.J. 279."
1972841,2025-02-19,Senate,2,"Subcommittee: Salmon, Pike, and Quirmbach. S.J. 314."
1972841,2025-02-20,Senate,3,"Subcommittee Meeting: 02/25/2025 10:30AM Senate Lounge."
1972841,2025-02-25,Senate,4,"Subcommittee recommends passage."
1972858,2025-02-17,Senate,1,"Introduced, referred to Appropriations. S.J. 278."
1972858,2025-02-18,Senate,2,"Subcommittee: Costello, Donahue, and Kraayenbrink. S.J. 303."
1972878,2025-02-17,Senate,1,"Introduced, referred to Education. S.J. 277."
1972878,2025-02-20,Senate,2,"Subcommittee: Rozenboom, Kraayenbrink, and Quirmbach. S.J. 326."
1972891,2025-02-17,Senate,1,"Introduced, referred to Education. S.J. 277."
1972891,2025-02-19,Senate,2,"Subcommittee: Shipley, Pike, and Zimmer. S.J. 314."
